Id,DateAware,DateSubmitted,DataBreachCause,DateStart,DateEnd,Name,CyberattackType,WashingtoniansAffected,IndustryType,BusinessType,InformationType,Year,WashingtoniansAffectedRange,BreachLifecycleRange
9561,03/28/2018 12:00:00 AM,04/11/2018 12:00:00 AM,Cyberattack,2017-09-26T00:00:00,2017-10-12T00:00:00,Delta Airlines,Malware,24563,Business,Software,Name,2018,"10,000-49,999",100-199
9561,03/28/2018 12:00:00 AM,04/11/2018 12:00:00 AM,Cyberattack,2017-09-26T00:00:00,2017-10-12T00:00:00,Delta Airlines,Malware,24563,Business,Software,Financial & Banking Information,2018,"10,000-49,999",100-199
9561,03/28/2018 12:00:00 AM,04/11/2018 12:00:00 AM,Cyberattack,2017-09-26T00:00:00,2017-10-12T00:00:00,Delta Airlines,Malware,24563,Business,Software,Other,2018,"10,000-49,999",100-199
9562,03/28/2018 12:00:00 AM,04/13/2018 12:00:00 AM,Cyberattack,2017-09-26T00:00:00,2017-10-12T00:00:00,"Best Buy Co, Inc.",Malware,8390,Business,Retail,Name,2018,"1,000-9,999",100-199
9562,03/28/2018 12:00:00 AM,04/13/2018 12:00:00 AM,Cyberattack,2017-09-26T00:00:00,2017-10-12T00:00:00,"Best Buy Co, Inc.",Malware,8390,Business,Retail,Financial & Banking Information,2018,"1,000-9,999",100-199
9562,03/28/2018 12:00:00 AM,04/13/2018 12:00:00 AM,Cyberattack,2017-09-26T00:00:00,2017-10-12T00:00:00,"Best Buy Co, Inc.",Malware,8390,Business,Retail,Other,2018,"1,000-9,999",100-199
9563,03/14/2018 12:00:00 AM,04/13/2018 12:00:00 AM,Unauthorized Access,,,Inogen Inc.,,518,Health,,Name,2018,500-999,Unknown
9563,03/14/2018 12:00:00 AM,04/13/2018 12:00:00 AM,Unauthorized Access,,,Inogen Inc.,,518,Health,,Health Insurance Policy or ID Number,2018,500-999,Unknown
9563,03/14/2018 12:00:00 AM,04/13/2018 12:00:00 AM,Unauthorized Access,,,Inogen Inc.,,518,Health,,Medical Information,2018,500-999,Unknown
9563,03/14/2018 12:00:00 AM,04/13/2018 12:00:00 AM,Unauthorized Access,,,Inogen Inc.,,518,Health,,Other,2018,500-999,Unknown
9565,03/15/2018 12:00:00 AM,04/24/2018 12:00:00 AM,Cyberattack,2017-09-27T00:00:00,2017-10-12T00:00:00,Sears Holdings,Malware,2373,Business,Retail,Name,2018,"1,000-9,999",100-199
9565,03/15/2018 12:00:00 AM,04/24/2018 12:00:00 AM,Cyberattack,2017-09-27T00:00:00,2017-10-12T00:00:00,Sears Holdings,Malware,2373,Business,Retail,Financial & Banking Information,2018,"1,000-9,999",100-199
9565,03/15/2018 12:00:00 AM,04/24/2018 12:00:00 AM,Cyberattack,2017-09-27T00:00:00,2017-10-12T00:00:00,Sears Holdings,Malware,2373,Business,Retail,Other,2018,"1,000-9,999",100-199
9566,03/29/2018 12:00:00 AM,04/26/2018 12:00:00 AM,Cyberattack,2017-07-01T00:00:00,2018-03-31T00:00:00,Hudson's Bay Company,Malware,,Business,Retail,Name,2018,Unknown,200-299
9566,03/29/2018 12:00:00 AM,04/26/2018 12:00:00 AM,Cyberattack,2017-07-01T00:00:00,2018-03-31T00:00:00,Hudson's Bay Company,Malware,,Business,Retail,Financial & Banking Information,2018,Unknown,200-299
9567,02/16/2018 12:00:00 AM,04/30/2018 12:00:00 AM,Cyberattack,2017-11-29T00:00:00,2018-02-16T00:00:00,Rail Europe North America,,687,Business,Transportation,Name,2018,500-999,1-99
9567,02/16/2018 12:00:00 AM,04/30/2018 12:00:00 AM,Cyberattack,2017-11-29T00:00:00,2018-02-16T00:00:00,Rail Europe North America,,687,Business,Transportation,Financial & Banking Information,2018,500-999,1-99
9567,02/16/2018 12:00:00 AM,04/30/2018 12:00:00 AM,Cyberattack,2017-11-29T00:00:00,2018-02-16T00:00:00,Rail Europe North America,,687,Business,Transportation,Username and Password/Security Question Answers,2018,500-999,1-99
9567,02/16/2018 12:00:00 AM,04/30/2018 12:00:00 AM,Cyberattack,2017-11-29T00:00:00,2018-02-16T00:00:00,Rail Europe North America,,687,Business,Transportation,Other,2018,500-999,1-99
9569,03/19/2018 12:00:00 AM,05/03/2018 12:00:00 AM,Cyberattack,2017-10-01T00:00:00,2017-12-22T00:00:00,Alaska Airlines,,1442,Business,Transportation,Name,2018,"1,000-9,999",100-199
9569,03/19/2018 12:00:00 AM,05/03/2018 12:00:00 AM,Cyberattack,2017-10-01T00:00:00,2017-12-22T00:00:00,Alaska Airlines,,1442,Business,Transportation,Financial & Banking Information,2018,"1,000-9,999",100-199
9569,03/19/2018 12:00:00 AM,05/03/2018 12:00:00 AM,Cyberattack,2017-10-01T00:00:00,2017-12-22T00:00:00,Alaska Airlines,,1442,Business,Transportation,Full Date of Birth,2018,"1,000-9,999",100-199
9569,03/19/2018 12:00:00 AM,05/03/2018 12:00:00 AM,Cyberattack,2017-10-01T00:00:00,2017-12-22T00:00:00,Alaska Airlines,,1442,Business,Transportation,Other,2018,"1,000-9,999",100-199
9570,02/01/2018 12:00:00 AM,05/08/2018 12:00:00 AM,Theft or Mistake,2017-12-31T00:00:00,2018-01-31T00:00:00,Global University,,5679,Education,,Name,2018,"1,000-9,999",1-99
9570,02/01/2018 12:00:00 AM,05/08/2018 12:00:00 AM,Theft or Mistake,2017-12-31T00:00:00,2018-01-31T00:00:00,Global University,,5679,Education,,Social Security Number,2018,"1,000-9,999",1-99
9571,04/21/2018 12:00:00 AM,05/09/2018 12:00:00 AM,Theft or Mistake,,,H&R Block,,2655,Finance,,Name,2018,"1,000-9,999",Unknown
9571,04/21/2018 12:00:00 AM,05/09/2018 12:00:00 AM,Theft or Mistake,,,H&R Block,,2655,Finance,,Social Security Number,2018,"1,000-9,999",Unknown
9571,04/21/2018 12:00:00 AM,05/09/2018 12:00:00 AM,Theft or Mistake,,,H&R Block,,2655,Finance,,Financial & Banking Information,2018,"1,000-9,999",Unknown
9571,04/21/2018 12:00:00 AM,05/09/2018 12:00:00 AM,Theft or Mistake,,,H&R Block,,2655,Finance,,Other,2018,"1,000-9,999",Unknown
9572,04/12/2018 12:00:00 AM,05/09/2018 12:00:00 AM,Unauthorized Access,,,"TaskRabbit, Inc.",,77618,Business,Home,Name,2018,"50,000-999,999",Unknown
9572,04/12/2018 12:00:00 AM,05/09/2018 12:00:00 AM,Unauthorized Access,,,"TaskRabbit, Inc.",,77618,Business,Home,Social Security Number,2018,"50,000-999,999",Unknown
9572,04/12/2018 12:00:00 AM,05/09/2018 12:00:00 AM,Unauthorized Access,,,"TaskRabbit, Inc.",,77618,Business,Home,Financial & Banking Information,2018,"50,000-999,999",Unknown
9572,04/12/2018 12:00:00 AM,05/09/2018 12:00:00 AM,Unauthorized Access,,,"TaskRabbit, Inc.",,77618,Business,Home,Username and Password/Security Question Answers,2018,"50,000-999,999",Unknown
9573,04/05/2018 12:00:00 AM,05/17/2018 12:00:00 AM,Cyberattack,2017-11-25T00:00:00,2017-11-25T00:00:00,Corporation Service Company,,4631,Business,Legal,Name,2018,"1,000-9,999",100-199
9573,04/05/2018 12:00:00 AM,05/17/2018 12:00:00 AM,Cyberattack,2017-11-25T00:00:00,2017-11-25T00:00:00,Corporation Service Company,,4631,Business,Legal,Social Security Number,2018,"1,000-9,999",100-199
9574,05/11/2018 12:00:00 AM,05/18/2018 12:00:00 AM,Cyberattack,2018-03-01T00:00:00,2018-04-01T00:00:00,Brinker International (Chilis),Malware,,Business,Hospitality,Name,2018,Unknown,1-99
9574,05/11/2018 12:00:00 AM,05/18/2018 12:00:00 AM,Cyberattack,2018-03-01T00:00:00,2018-04-01T00:00:00,Brinker International (Chilis),Malware,,Business,Hospitality,Financial & Banking Information,2018,Unknown,1-99
9576,05/01/2018 12:00:00 AM,06/23/2018 12:00:00 AM,Cyberattack,2018-05-01T00:00:00,2018-05-01T00:00:00,"Terteling Company, Inc.",Phishing,941,Business,Construction,Name,2018,500-999,0
9576,05/01/2018 12:00:00 AM,06/23/2018 12:00:00 AM,Cyberattack,2018-05-01T00:00:00,2018-05-01T00:00:00,"Terteling Company, Inc.",Phishing,941,Business,Construction,Social Security Number,2018,500-999,0
9576,05/01/2018 12:00:00 AM,06/23/2018 12:00:00 AM,Cyberattack,2018-05-01T00:00:00,2018-05-01T00:00:00,"Terteling Company, Inc.",Phishing,941,Business,Construction,Driver's License or Washington ID Card Number,2018,500-999,0
9576,05/01/2018 12:00:00 AM,06/23/2018 12:00:00 AM,Cyberattack,2018-05-01T00:00:00,2018-05-01T00:00:00,"Terteling Company, Inc.",Phishing,941,Business,Construction,Financial & Banking Information,2018,500-999,0
9576,05/01/2018 12:00:00 AM,06/23/2018 12:00:00 AM,Cyberattack,2018-05-01T00:00:00,2018-05-01T00:00:00,"Terteling Company, Inc.",Phishing,941,Business,Construction,Medical Information,2018,500-999,0
9576,05/01/2018 12:00:00 AM,06/23/2018 12:00:00 AM,Cyberattack,2018-05-01T00:00:00,2018-05-01T00:00:00,"Terteling Company, Inc.",Phishing,941,Business,Construction,Other,2018,500-999,0
9577,06/20/2018 12:00:00 AM,06/29/2018 12:00:00 AM,Unauthorized Access,,,Northwest University,,1434,Education,,Name,2018,"1,000-9,999",Unknown
9577,06/20/2018 12:00:00 AM,06/29/2018 12:00:00 AM,Unauthorized Access,,,Northwest University,,1434,Education,,Social Security Number,2018,"1,000-9,999",Unknown
9577,06/20/2018 12:00:00 AM,06/29/2018 12:00:00 AM,Unauthorized Access,,,Northwest University,,1434,Education,,Medical Information,2018,"1,000-9,999",Unknown
9577,06/20/2018 12:00:00 AM,06/29/2018 12:00:00 AM,Unauthorized Access,,,Northwest University,,1434,Education,,Other,2018,"1,000-9,999",Unknown
9578,06/11/2018 12:00:00 AM,07/01/2018 12:00:00 AM,Cyberattack,2018-04-26T00:00:00,2018-06-12T00:00:00,"Macy's, Inc.",,3564,Business,Retail,Name,2018,"1,000-9,999",1-99
9578,06/11/2018 12:00:00 AM,07/01/2018 12:00:00 AM,Cyberattack,2018-04-26T00:00:00,2018-06-12T00:00:00,"Macy's, Inc.",,3564,Business,Retail,Financial & Banking Information,2018,"1,000-9,999",1-99
9578,06/11/2018 12:00:00 AM,07/01/2018 12:00:00 AM,Cyberattack,2018-04-26T00:00:00,2018-06-12T00:00:00,"Macy's, Inc.",,3564,Business,Retail,Other,2018,"1,000-9,999",1-99
9579,04/11/2018 12:00:00 AM,07/06/2018 12:00:00 AM,Cyberattack,,,International Mission Board,,992,Non-Profit/Charity,,Name,2018,500-999,Unknown
9579,04/11/2018 12:00:00 AM,07/06/2018 12:00:00 AM,Cyberattack,,,International Mission Board,,992,Non-Profit/Charity,,Social Security Number,2018,500-999,Unknown
9579,04/11/2018 12:00:00 AM,07/06/2018 12:00:00 AM,Cyberattack,,,International Mission Board,,992,Non-Profit/Charity,,Full Date of Birth,2018,500-999,Unknown
9579,04/11/2018 12:00:00 AM,07/06/2018 12:00:00 AM,Cyberattack,,,International Mission Board,,992,Non-Profit/Charity,,Medical Information,2018,500-999,Unknown
9579,04/11/2018 12:00:00 AM,07/06/2018 12:00:00 AM,Cyberattack,,,International Mission Board,,992,Non-Profit/Charity,,Other,2018,500-999,Unknown
9581,05/11/2018 12:00:00 AM,07/12/2018 12:00:00 AM,Cyberattack,2018-05-11T00:00:00,,Overlake Arthritis and Osteoporosis Center,Malware,627,Health,,Name,2018,500-999,Unknown
9581,05/11/2018 12:00:00 AM,07/12/2018 12:00:00 AM,Cyberattack,2018-05-11T00:00:00,,Overlake Arthritis and Osteoporosis Center,Malware,627,Health,,Social Security Number,2018,500-999,Unknown
9581,05/11/2018 12:00:00 AM,07/12/2018 12:00:00 AM,Cyberattack,2018-05-11T00:00:00,,Overlake Arthritis and Osteoporosis Center,Malware,627,Health,,Medical Information,2018,500-999,Unknown
9581,05/11/2018 12:00:00 AM,07/12/2018 12:00:00 AM,Cyberattack,2018-05-11T00:00:00,,Overlake Arthritis and Osteoporosis Center,Malware,627,Health,,Other,2018,500-999,Unknown
9582,05/30/2015 12:00:00 AM,08/11/2015 12:00:00 AM,Theft or Mistake,2015-05-29T00:00:00,2015-05-29T00:00:00,Sterling BackCheck,,1419,Business,Human Resources,Name,2016,"1,000-9,999",1-99
9582,05/30/2015 12:00:00 AM,08/11/2015 12:00:00 AM,Theft or Mistake,2015-05-29T00:00:00,2015-05-29T00:00:00,Sterling BackCheck,,1419,Business,Human Resources,Social Security Number,2016,"1,000-9,999",1-99
9582,05/30/2015 12:00:00 AM,08/11/2015 12:00:00 AM,Theft or Mistake,2015-05-29T00:00:00,2015-05-29T00:00:00,Sterling BackCheck,,1419,Business,Human Resources,Full Date of Birth,2016,"1,000-9,999",1-99
9583,08/13/2015 12:00:00 AM,08/18/2015 12:00:00 AM,Cyberattack,,,Web.com Group,,1595,Business,Web Services,Name,2016,"1,000-9,999",Unknown
9583,08/13/2015 12:00:00 AM,08/18/2015 12:00:00 AM,Cyberattack,,,Web.com Group,,1595,Business,Web Services,Financial & Banking Information,2016,"1,000-9,999",Unknown
9583,08/13/2015 12:00:00 AM,08/18/2015 12:00:00 AM,Cyberattack,,,Web.com Group,,1595,Business,Web Services,Other,2016,"1,000-9,999",Unknown
9587,07/17/2015 12:00:00 AM,09/22/2015 12:00:00 AM,Unauthorized Access,2014-06-19T00:00:00,2015-07-15T00:00:00,Costco,,29425,Business,Retail,Name,2016,"10,000-49,999",300-399
9587,07/17/2015 12:00:00 AM,09/22/2015 12:00:00 AM,Unauthorized Access,2014-06-19T00:00:00,2015-07-15T00:00:00,Costco,,29425,Business,Retail,Username and Password/Security Question Answers,2016,"10,000-49,999",300-399
9587,07/17/2015 12:00:00 AM,09/22/2015 12:00:00 AM,Unauthorized Access,2014-06-19T00:00:00,2015-07-15T00:00:00,Costco,,29425,Business,Retail,Email Address and Password/Security Question Answers,2016,"10,000-49,999",300-399
9588,08/23/2015 12:00:00 AM,09/26/2015 12:00:00 AM,Theft or Mistake,2015-08-23T00:00:00,,"Sterbick & Associates, P.S.",,500,Business,Legal,Name,2016,500-999,Unknown
9588,08/23/2015 12:00:00 AM,09/26/2015 12:00:00 AM,Theft or Mistake,2015-08-23T00:00:00,,"Sterbick & Associates, P.S.",,500,Business,Legal,Social Security Number,2016,500-999,Unknown
9589,,09/29/2015 12:00:00 AM,Unauthorized Access,2014-08-20T00:00:00,2015-07-14T00:00:00,Rite Aid Corporation,,2721,Business,Retail,Name,2016,"1,000-9,999",Unknown
9589,,09/29/2015 12:00:00 AM,Unauthorized Access,2014-08-20T00:00:00,2015-07-14T00:00:00,Rite Aid Corporation,,2721,Business,Retail,Financial & Banking Information,2016,"1,000-9,999",Unknown
9589,,09/29/2015 12:00:00 AM,Unauthorized Access,2014-08-20T00:00:00,2015-07-14T00:00:00,Rite Aid Corporation,,2721,Business,Retail,Email Address and Password/Security Question Answers,2016,"1,000-9,999",Unknown
9589,,09/29/2015 12:00:00 AM,Unauthorized Access,2014-08-20T00:00:00,2015-07-14T00:00:00,Rite Aid Corporation,,2721,Business,Retail,Other,2016,"1,000-9,999",Unknown
9591,09/21/2015 12:00:00 AM,10/01/2015 12:00:00 AM,Unauthorized Access,2015-09-15T00:00:00,,T-Mobile USA/Experian,,328889,Business,Telecommunications,Name,2016,"50,000-999,999",Unknown
9591,09/21/2015 12:00:00 AM,10/01/2015 12:00:00 AM,Unauthorized Access,2015-09-15T00:00:00,,T-Mobile USA/Experian,,328889,Business,Telecommunications,Social Security Number,2016,"50,000-999,999",Unknown
9591,09/21/2015 12:00:00 AM,10/01/2015 12:00:00 AM,Unauthorized Access,2015-09-15T00:00:00,,T-Mobile USA/Experian,,328889,Business,Telecommunications,Driver's License or Washington ID Card Number,2016,"50,000-999,999",Unknown
9591,09/21/2015 12:00:00 AM,10/01/2015 12:00:00 AM,Unauthorized Access,2015-09-15T00:00:00,,T-Mobile USA/Experian,,328889,Business,Telecommunications,Full Date of Birth,2016,"50,000-999,999",Unknown
9591,09/21/2015 12:00:00 AM,10/01/2015 12:00:00 AM,Unauthorized Access,2015-09-15T00:00:00,,T-Mobile USA/Experian,,328889,Business,Telecommunications,Military ID Number,2016,"50,000-999,999",Unknown
9591,09/21/2015 12:00:00 AM,10/01/2015 12:00:00 AM,Unauthorized Access,2015-09-15T00:00:00,,T-Mobile USA/Experian,,328889,Business,Telecommunications,Passport Number,2016,"50,000-999,999",Unknown
9591,09/21/2015 12:00:00 AM,10/01/2015 12:00:00 AM,Unauthorized Access,2015-09-15T00:00:00,,T-Mobile USA/Experian,,328889,Business,Telecommunications,Other,2016,"50,000-999,999",Unknown
9653,03/17/2016 12:00:00 AM,11/11/2016 12:00:00 AM,Cyberattack,,,Charles Schwab,Other,975,Finance,,Name,2017,500-999,Unknown
9653,03/17/2016 12:00:00 AM,11/11/2016 12:00:00 AM,Cyberattack,,,Charles Schwab,Other,975,Finance,,Financial & Banking Information,2017,500-999,Unknown
9653,03/17/2016 12:00:00 AM,11/11/2016 12:00:00 AM,Cyberattack,,,Charles Schwab,Other,975,Finance,,Other,2017,500-999,Unknown
9594,06/18/2015 12:00:00 AM,10/13/2015 12:00:00 AM,Cyberattack,2015-03-24T00:00:00,2015-05-20T00:00:00,"Service Systems Associates, Inc.",Malware,,Business,Hospitality,Name,2016,Unknown,1-99
9594,06/18/2015 12:00:00 AM,10/13/2015 12:00:00 AM,Cyberattack,2015-03-24T00:00:00,2015-05-20T00:00:00,"Service Systems Associates, Inc.",Malware,,Business,Hospitality,Financial & Banking Information,2016,Unknown,1-99
9595,10/09/2015 12:00:00 AM,10/28/2015 12:00:00 AM,Cyberattack,2015-04-19T00:00:00,2015-09-30T00:00:00,"Digital Theatre, LLC",Malware,3230,Business,Entertainment,Name,2016,"1,000-9,999",100-199
9595,10/09/2015 12:00:00 AM,10/28/2015 12:00:00 AM,Cyberattack,2015-04-19T00:00:00,2015-09-30T00:00:00,"Digital Theatre, LLC",Malware,3230,Business,Entertainment,Financial & Banking Information,2016,"1,000-9,999",100-199
9595,10/09/2015 12:00:00 AM,10/28/2015 12:00:00 AM,Cyberattack,2015-04-19T00:00:00,2015-09-30T00:00:00,"Digital Theatre, LLC",Malware,3230,Business,Entertainment,Other,2016,"1,000-9,999",100-199
9597,,11/13/2015 12:00:00 AM,Cyberattack,2014-12-29T00:00:00,2015-08-11T00:00:00,Noble House Hotels and Resorts,Malware,4555,Business,Hospitality,Name,2016,"1,000-9,999",Unknown
9597,,11/13/2015 12:00:00 AM,Cyberattack,2014-12-29T00:00:00,2015-08-11T00:00:00,Noble House Hotels and Resorts,Malware,4555,Business,Hospitality,Financial & Banking Information,2016,"1,000-9,999",Unknown
9598,02/10/2015 12:00:00 AM,11/24/2015 12:00:00 AM,Cyberattack,,,"Hilton Worldwide, Inc.",Malware,,Business,Hospitality,Name,2016,Unknown,Unknown
9598,02/10/2015 12:00:00 AM,11/24/2015 12:00:00 AM,Cyberattack,,,"Hilton Worldwide, Inc.",Malware,,Business,Hospitality,Financial & Banking Information,2016,Unknown,Unknown
9598,02/10/2015 12:00:00 AM,11/24/2015 12:00:00 AM,Cyberattack,,,"Hilton Worldwide, Inc.",Malware,,Business,Hospitality,Other,2016,Unknown,Unknown
9599,,11/30/2015 12:00:00 AM,Cyberattack,2015-01-22T00:00:00,2015-07-20T00:00:00,Muji,Malware,664,Business,Retail,Name,2016,500-999,Unknown
9599,,11/30/2015 12:00:00 AM,Cyberattack,2015-01-22T00:00:00,2015-07-20T00:00:00,Muji,Malware,664,Business,Retail,Financial & Banking Information,2016,500-999,Unknown
9599,,11/30/2015 12:00:00 AM,Cyberattack,2015-01-22T00:00:00,2015-07-20T00:00:00,Muji,Malware,664,Business,Retail,Other,2016,500-999,Unknown
9601,08/04/2015 12:00:00 AM,12/18/2015 12:00:00 AM,Unauthorized Access,2014-07-15T00:00:00,2014-08-05T00:00:00,"Yapstone, Inc.",,5264,Business,Web Services,Name,2016,"1,000-9,999",300-399
9601,08/04/2015 12:00:00 AM,12/18/2015 12:00:00 AM,Unauthorized Access,2014-07-15T00:00:00,2014-08-05T00:00:00,"Yapstone, Inc.",,5264,Business,Web Services,Social Security Number,2016,"1,000-9,999",300-399
9601,08/04/2015 12:00:00 AM,12/18/2015 12:00:00 AM,Unauthorized Access,2014-07-15T00:00:00,2014-08-05T00:00:00,"Yapstone, Inc.",,5264,Business,Web Services,Driver's License or Washington ID Card Number,2016,"1,000-9,999",300-399
9601,08/04/2015 12:00:00 AM,12/18/2015 12:00:00 AM,Unauthorized Access,2014-07-15T00:00:00,2014-08-05T00:00:00,"Yapstone, Inc.",,5264,Business,Web Services,Financial & Banking Information,2016,"1,000-9,999",300-399
9602,12/07/2015 12:00:00 AM,12/23/2015 12:00:00 AM,Theft or Mistake,2015-11-09T00:00:00,,"Matson Navigation Company, Inc. and Horizon Lines",,2185,Business,Shipping,Name,2016,"1,000-9,999",Unknown
9602,12/07/2015 12:00:00 AM,12/23/2015 12:00:00 AM,Theft or Mistake,2015-11-09T00:00:00,,"Matson Navigation Company, Inc. and Horizon Lines",,2185,Business,Shipping,Social Security Number,2016,"1,000-9,999",Unknown
9602,12/07/2015 12:00:00 AM,12/23/2015 12:00:00 AM,Theft or Mistake,2015-11-09T00:00:00,,"Matson Navigation Company, Inc. and Horizon Lines",,2185,Business,Shipping,Financial & Banking Information,2016,"1,000-9,999",Unknown
9602,12/07/2015 12:00:00 AM,12/23/2015 12:00:00 AM,Theft or Mistake,2015-11-09T00:00:00,,"Matson Navigation Company, Inc. and Horizon Lines",,2185,Business,Shipping,Full Date of Birth,2016,"1,000-9,999",Unknown
9602,12/07/2015 12:00:00 AM,12/23/2015 12:00:00 AM,Theft or Mistake,2015-11-09T00:00:00,,"Matson Navigation Company, Inc. and Horizon Lines",,2185,Business,Shipping,Passport Number,2016,"1,000-9,999",Unknown
9602,12/07/2015 12:00:00 AM,12/23/2015 12:00:00 AM,Theft or Mistake,2015-11-09T00:00:00,,"Matson Navigation Company, Inc. and Horizon Lines",,2185,Business,Shipping,Medical Information,2016,"1,000-9,999",Unknown
9602,12/07/2015 12:00:00 AM,12/23/2015 12:00:00 AM,Theft or Mistake,2015-11-09T00:00:00,,"Matson Navigation Company, Inc. and Horizon Lines",,2185,Business,Shipping,Other,2016,"1,000-9,999",Unknown
9604,12/10/2015 12:00:00 AM,01/13/2016 12:00:00 AM,Unauthorized Access,2015-12-07T00:00:00,2015-12-08T00:00:00,HSBC Bank USA,,5270,Finance,,Name,2016,"1,000-9,999",1-99
9604,12/10/2015 12:00:00 AM,01/13/2016 12:00:00 AM,Unauthorized Access,2015-12-07T00:00:00,2015-12-08T00:00:00,HSBC Bank USA,,5270,Finance,,Social Security Number,2016,"1,000-9,999",1-99
9604,12/10/2015 12:00:00 AM,01/13/2016 12:00:00 AM,Unauthorized Access,2015-12-07T00:00:00,2015-12-08T00:00:00,HSBC Bank USA,,5270,Finance,,Financial & Banking Information,2016,"1,000-9,999",1-99
9604,12/10/2015 12:00:00 AM,01/13/2016 12:00:00 AM,Unauthorized Access,2015-12-07T00:00:00,2015-12-08T00:00:00,HSBC Bank USA,,5270,Finance,,Other,2016,"1,000-9,999",1-99
9605,11/24/2015 12:00:00 AM,01/14/2016 12:00:00 AM,Cyberattack,2015-08-13T00:00:00,2015-12-08T00:00:00,Hyatt Hotels Corporation,Malware,15,Business,Hospitality,Name,2016,< 500,100-199
9605,11/24/2015 12:00:00 AM,01/14/2016 12:00:00 AM,Cyberattack,2015-08-13T00:00:00,2015-12-08T00:00:00,Hyatt Hotels Corporation,Malware,15,Business,Hospitality,Financial & Banking Information,2016,< 500,100-199
10499,07/07/2017 12:00:00 AM,10/12/2017 12:00:00 AM,Cyberattack,2017-03-18T00:00:00,2017-07-02T00:00:00,Hyatt Hotels Corporation,Skimmers,640,Business,Hospitality,Name,2018,500-999,100-199
10499,07/07/2017 12:00:00 AM,10/12/2017 12:00:00 AM,Cyberattack,2017-03-18T00:00:00,2017-07-02T00:00:00,Hyatt Hotels Corporation,Skimmers,640,Business,Hospitality,Financial & Banking Information,2018,500-999,100-199
9607,,01/22/2016 12:00:00 AM,Cyberattack,,,Starwood Hotels and Resorts,Malware,,Business,Hospitality,Name,2016,Unknown,Unknown
9607,,01/22/2016 12:00:00 AM,Cyberattack,,,Starwood Hotels and Resorts,Malware,,Business,Hospitality,Financial & Banking Information,2016,Unknown,Unknown
9608,12/03/2015 12:00:00 AM,01/29/2016 12:00:00 AM,Cyberattack,2014-05-04T00:00:00,2015-12-03T00:00:00,"Landry's, Inc.",Skimmers,,Business,Hospitality,Name,2016,Unknown,500+
9608,12/03/2015 12:00:00 AM,01/29/2016 12:00:00 AM,Cyberattack,2014-05-04T00:00:00,2015-12-03T00:00:00,"Landry's, Inc.",Skimmers,,Business,Hospitality,Financial & Banking Information,2016,Unknown,500+
9609,,02/04/2016 12:00:00 AM,Unauthorized Access,2015-10-03T00:00:00,2015-12-18T00:00:00,"Gyft, Inc.",,9042,Business,Retail,Name,2016,"1,000-9,999",Unknown
9609,,02/04/2016 12:00:00 AM,Unauthorized Access,2015-10-03T00:00:00,2015-12-18T00:00:00,"Gyft, Inc.",,9042,Business,Retail,Full Date of Birth,2016,"1,000-9,999",Unknown
9609,,02/04/2016 12:00:00 AM,Unauthorized Access,2015-10-03T00:00:00,2015-12-18T00:00:00,"Gyft, Inc.",,9042,Business,Retail,Email Address and Password/Security Question Answers,2016,"1,000-9,999",Unknown
9609,,02/04/2016 12:00:00 AM,Unauthorized Access,2015-10-03T00:00:00,2015-12-18T00:00:00,"Gyft, Inc.",,9042,Business,Retail,Other,2016,"1,000-9,999",Unknown
9610,12/16/2015 12:00:00 AM,02/09/2016 12:00:00 AM,Unauthorized Access,2013-11-15T00:00:00,2015-12-24T00:00:00,Health Care Authority,,91187,Government,,Name,2016,"50,000-999,999",500+
9610,12/16/2015 12:00:00 AM,02/09/2016 12:00:00 AM,Unauthorized Access,2013-11-15T00:00:00,2015-12-24T00:00:00,Health Care Authority,,91187,Government,,Social Security Number,2016,"50,000-999,999",500+
9610,12/16/2015 12:00:00 AM,02/09/2016 12:00:00 AM,Unauthorized Access,2013-11-15T00:00:00,2015-12-24T00:00:00,Health Care Authority,,91187,Government,,Full Date of Birth,2016,"50,000-999,999",500+
9610,12/16/2015 12:00:00 AM,02/09/2016 12:00:00 AM,Unauthorized Access,2013-11-15T00:00:00,2015-12-24T00:00:00,Health Care Authority,,91187,Government,,Medical Information,2016,"50,000-999,999",500+
9610,12/16/2015 12:00:00 AM,02/09/2016 12:00:00 AM,Unauthorized Access,2013-11-15T00:00:00,2015-12-24T00:00:00,Health Care Authority,,91187,Government,,Other,2016,"50,000-999,999",500+
9611,11/13/2015 12:00:00 AM,03/04/2016 12:00:00 AM,Unauthorized Access,2015-10-03T00:00:00,,21st Century Oncology,,2802,Health,,Name,2016,"1,000-9,999",Unknown
9611,11/13/2015 12:00:00 AM,03/04/2016 12:00:00 AM,Unauthorized Access,2015-10-03T00:00:00,,21st Century Oncology,,2802,Health,,Social Security Number,2016,"1,000-9,999",Unknown
9611,11/13/2015 12:00:00 AM,03/04/2016 12:00:00 AM,Unauthorized Access,2015-10-03T00:00:00,,21st Century Oncology,,2802,Health,,Health Insurance Policy or ID Number,2016,"1,000-9,999",Unknown
9611,11/13/2015 12:00:00 AM,03/04/2016 12:00:00 AM,Unauthorized Access,2015-10-03T00:00:00,,21st Century Oncology,,2802,Health,,Medical Information,2016,"1,000-9,999",Unknown
9612,03/02/2016 12:00:00 AM,03/07/2016 12:00:00 AM,Unauthorized Access,2016-03-02T00:00:00,,Turner Construction Company,,566,Business,Construction,Name,2016,500-999,Unknown
9612,03/02/2016 12:00:00 AM,03/07/2016 12:00:00 AM,Unauthorized Access,2016-03-02T00:00:00,,Turner Construction Company,,566,Business,Construction,Social Security Number,2016,500-999,Unknown
9612,03/02/2016 12:00:00 AM,03/07/2016 12:00:00 AM,Unauthorized Access,2016-03-02T00:00:00,,Turner Construction Company,,566,Business,Construction,Financial & Banking Information,2016,500-999,Unknown
9612,03/02/2016 12:00:00 AM,03/07/2016 12:00:00 AM,Unauthorized Access,2016-03-02T00:00:00,,Turner Construction Company,,566,Business,Construction,Other,2016,500-999,Unknown
9613,,03/14/2016 12:00:00 AM,Cyberattack,2011-12-01T00:00:00,2016-01-26T00:00:00,"Bailey's, Inc.",Malware,8844,Business,Retail,Name,2016,"1,000-9,999",Unknown
9613,,03/14/2016 12:00:00 AM,Cyberattack,2011-12-01T00:00:00,2016-01-26T00:00:00,"Bailey's, Inc.",Malware,8844,Business,Retail,Financial & Banking Information,2016,"1,000-9,999",Unknown
9613,,03/14/2016 12:00:00 AM,Cyberattack,2011-12-01T00:00:00,2016-01-26T00:00:00,"Bailey's, Inc.",Malware,8844,Business,Retail,Username and Password/Security Question Answers,2016,"1,000-9,999",Unknown
9613,,03/14/2016 12:00:00 AM,Cyberattack,2011-12-01T00:00:00,2016-01-26T00:00:00,"Bailey's, Inc.",Malware,8844,Business,Retail,Email Address and Password/Security Question Answers,2016,"1,000-9,999",Unknown
9613,,03/14/2016 12:00:00 AM,Cyberattack,2011-12-01T00:00:00,2016-01-26T00:00:00,"Bailey's, Inc.",Malware,8844,Business,Retail,Other,2016,"1,000-9,999",Unknown
9614,03/07/2016 12:00:00 AM,03/15/2016 12:00:00 AM,Cyberattack,2016-03-07T00:00:00,2016-03-07T00:00:00,Advance Auto Parts,Phishing,544,Business,Retail,Name,2016,500-999,0
9614,03/07/2016 12:00:00 AM,03/15/2016 12:00:00 AM,Cyberattack,2016-03-07T00:00:00,2016-03-07T00:00:00,Advance Auto Parts,Phishing,544,Business,Retail,Social Security Number,2016,500-999,0
9614,03/07/2016 12:00:00 AM,03/15/2016 12:00:00 AM,Cyberattack,2016-03-07T00:00:00,2016-03-07T00:00:00,Advance Auto Parts,Phishing,544,Business,Retail,Financial & Banking Information,2016,500-999,0
9614,03/07/2016 12:00:00 AM,03/15/2016 12:00:00 AM,Cyberattack,2016-03-07T00:00:00,2016-03-07T00:00:00,Advance Auto Parts,Phishing,544,Business,Retail,Other,2016,500-999,0
9615,,04/11/2016 12:00:00 AM,Cyberattack,2014-01-22T00:00:00,2016-02-08T00:00:00,"Schwaab, Inc.",Malware,2162,Business,Retail,Name,2016,"1,000-9,999",Unknown
9615,,04/11/2016 12:00:00 AM,Cyberattack,2014-01-22T00:00:00,2016-02-08T00:00:00,"Schwaab, Inc.",Malware,2162,Business,Retail,Financial & Banking Information,2016,"1,000-9,999",Unknown
9616,,04/18/2016 12:00:00 AM,Unauthorized Access,2016-03-01T00:00:00,,doTERRA International LLC,,41485,Business,Consumable,Name,2016,"10,000-49,999",Unknown
9616,,04/18/2016 12:00:00 AM,Unauthorized Access,2016-03-01T00:00:00,,doTERRA International LLC,,41485,Business,Consumable,Social Security Number,2016,"10,000-49,999",Unknown
9616,,04/18/2016 12:00:00 AM,Unauthorized Access,2016-03-01T00:00:00,,doTERRA International LLC,,41485,Business,Consumable,Driver's License or Washington ID Card Number,2016,"10,000-49,999",Unknown
9616,,04/18/2016 12:00:00 AM,Unauthorized Access,2016-03-01T00:00:00,,doTERRA International LLC,,41485,Business,Consumable,Financial & Banking Information,2016,"10,000-49,999",Unknown
9616,,04/18/2016 12:00:00 AM,Unauthorized Access,2016-03-01T00:00:00,,doTERRA International LLC,,41485,Business,Consumable,Full Date of Birth,2016,"10,000-49,999",Unknown
9616,,04/18/2016 12:00:00 AM,Unauthorized Access,2016-03-01T00:00:00,,doTERRA International LLC,,41485,Business,Consumable,Username and Password/Security Question Answers,2016,"10,000-49,999",Unknown
9616,,04/18/2016 12:00:00 AM,Unauthorized Access,2016-03-01T00:00:00,,doTERRA International LLC,,41485,Business,Consumable,Email Address and Password/Security Question Answers,2016,"10,000-49,999",Unknown
9616,,04/18/2016 12:00:00 AM,Unauthorized Access,2016-03-01T00:00:00,,doTERRA International LLC,,41485,Business,Consumable,Other,2016,"10,000-49,999",Unknown
9617,04/04/2016 12:00:00 AM,04/27/2016 12:00:00 AM,Unauthorized Access,,,AIM Inc.,,1639,Business,Retail,Name,2016,"1,000-9,999",Unknown
9617,04/04/2016 12:00:00 AM,04/27/2016 12:00:00 AM,Unauthorized Access,,,AIM Inc.,,1639,Business,Retail,Social Security Number,2016,"1,000-9,999",Unknown
9617,04/04/2016 12:00:00 AM,04/27/2016 12:00:00 AM,Unauthorized Access,,,AIM Inc.,,1639,Business,Retail,Driver's License or Washington ID Card Number,2016,"1,000-9,999",Unknown
9617,04/04/2016 12:00:00 AM,04/27/2016 12:00:00 AM,Unauthorized Access,,,AIM Inc.,,1639,Business,Retail,Financial & Banking Information,2016,"1,000-9,999",Unknown
9617,04/04/2016 12:00:00 AM,04/27/2016 12:00:00 AM,Unauthorized Access,,,AIM Inc.,,1639,Business,Retail,Military ID Number,2016,"1,000-9,999",Unknown
9617,04/04/2016 12:00:00 AM,04/27/2016 12:00:00 AM,Unauthorized Access,,,AIM Inc.,,1639,Business,Retail,Passport Number,2016,"1,000-9,999",Unknown
9621,,05/10/2016 12:00:00 AM,Unauthorized Access,,,LendUp Processing Center,,708,Finance,,Name,2016,500-999,Unknown
9621,,05/10/2016 12:00:00 AM,Unauthorized Access,,,LendUp Processing Center,,708,Finance,,Social Security Number,2016,500-999,Unknown
9621,,05/10/2016 12:00:00 AM,Unauthorized Access,,,LendUp Processing Center,,708,Finance,,Full Date of Birth,2016,500-999,Unknown
9621,,05/10/2016 12:00:00 AM,Unauthorized Access,,,LendUp Processing Center,,708,Finance,,Email Address and Password/Security Question Answers,2016,500-999,Unknown
9621,,05/10/2016 12:00:00 AM,Unauthorized Access,,,LendUp Processing Center,,708,Finance,,Other,2016,500-999,Unknown
9622,,05/11/2016 12:00:00 AM,Unauthorized Access,2016-04-12T00:00:00,,Olympia School District,,2145,Government,,Name,2016,"1,000-9,999",Unknown
9622,,05/11/2016 12:00:00 AM,Unauthorized Access,2016-04-12T00:00:00,,Olympia School District,,2145,Government,,Social Security Number,2016,"1,000-9,999",Unknown
9622,,05/11/2016 12:00:00 AM,Unauthorized Access,2016-04-12T00:00:00,,Olympia School District,,2145,Government,,Financial & Banking Information,2016,"1,000-9,999",Unknown
9622,,05/11/2016 12:00:00 AM,Unauthorized Access,2016-04-12T00:00:00,,Olympia School District,,2145,Government,,Other,2016,"1,000-9,999",Unknown
9623,01/30/2016 12:00:00 AM,06/06/2016 12:00:00 AM,Cyberattack,,2016-01-30T00:00:00,"Empathia, Inc.",Malware,602,Business,Professional Services,Name,2016,500-999,Unknown
9623,01/30/2016 12:00:00 AM,06/06/2016 12:00:00 AM,Cyberattack,,2016-01-30T00:00:00,"Empathia, Inc.",Malware,602,Business,Professional Services,Social Security Number,2016,500-999,Unknown
9623,01/30/2016 12:00:00 AM,06/06/2016 12:00:00 AM,Cyberattack,,2016-01-30T00:00:00,"Empathia, Inc.",Malware,602,Business,Professional Services,Full Date of Birth,2016,500-999,Unknown
9623,01/30/2016 12:00:00 AM,06/06/2016 12:00:00 AM,Cyberattack,,2016-01-30T00:00:00,"Empathia, Inc.",Malware,602,Business,Professional Services,Other,2016,500-999,Unknown
9625,09/29/2015 12:00:00 AM,06/10/2016 12:00:00 AM,Unauthorized Access,2014-02-19T00:00:00,2015-08-06T00:00:00,Grand Sierra Resort,,1061,Business,Hospitality,Name,2016,"1,000-9,999",500+
9625,09/29/2015 12:00:00 AM,06/10/2016 12:00:00 AM,Unauthorized Access,2014-02-19T00:00:00,2015-08-06T00:00:00,Grand Sierra Resort,,1061,Business,Hospitality,Financial & Banking Information,2016,"1,000-9,999",500+
9626,06/01/2016 12:00:00 AM,06/13/2016 12:00:00 AM,Theft or Mistake,2016-05-27T00:00:00,2016-06-01T00:00:00,The Tax Shack,,1000,Finance,,Name,2016,"1,000-9,999",1-99
9626,06/01/2016 12:00:00 AM,06/13/2016 12:00:00 AM,Theft or Mistake,2016-05-27T00:00:00,2016-06-01T00:00:00,The Tax Shack,,1000,Finance,,Social Security Number,2016,"1,000-9,999",1-99
9626,06/01/2016 12:00:00 AM,06/13/2016 12:00:00 AM,Theft or Mistake,2016-05-27T00:00:00,2016-06-01T00:00:00,The Tax Shack,,1000,Finance,,Financial & Banking Information,2016,"1,000-9,999",1-99
9626,06/01/2016 12:00:00 AM,06/13/2016 12:00:00 AM,Theft or Mistake,2016-05-27T00:00:00,2016-06-01T00:00:00,The Tax Shack,,1000,Finance,,Full Date of Birth,2016,"1,000-9,999",1-99
9627,09/17/2014 12:00:00 AM,06/16/2016 12:00:00 AM,Unauthorized Access,2014-05-13T00:00:00,2014-05-13T00:00:00,Uber Technologies,,1355,Business,Transportation,Name,2016,"1,000-9,999",100-199
9627,09/17/2014 12:00:00 AM,06/16/2016 12:00:00 AM,Unauthorized Access,2014-05-13T00:00:00,2014-05-13T00:00:00,Uber Technologies,,1355,Business,Transportation,Driver's License or Washington ID Card Number,2016,"1,000-9,999",100-199
9628,05/13/2016 12:00:00 AM,06/27/2016 12:00:00 AM,Cyberattack,2015-10-27T00:00:00,2016-03-21T00:00:00,Hard Rock Hotel & Casino Las Vegas,Malware,,Business,Hospitality,Financial & Banking Information,2016,Unknown,100-199
9629,05/17/2016 12:00:00 AM,06/28/2016 12:00:00 AM,Cyberattack,2016-01-31T00:00:00,2016-06-02T00:00:00,Noodles & Company,Malware,,Business,Hospitality,Financial & Banking Information,2016,Unknown,100-199
9630,05/01/2016 12:00:00 AM,07/06/2016 12:00:00 AM,Cyberattack,2015-12-02T00:00:00,2016-06-08T00:00:00,Wendy's,Malware,,Business,Hospitality,Financial & Banking Information,2016,Unknown,100-199
9632,06/08/2016 12:00:00 AM,07/16/2016 12:00:00 AM,Unauthorized Access,2015-04-01T00:00:00,,"NLU Products, LLC",,2527,Business,Retail,Name,2016,"1,000-9,999",Unknown
9632,06/08/2016 12:00:00 AM,07/16/2016 12:00:00 AM,Unauthorized Access,2015-04-01T00:00:00,,"NLU Products, LLC",,2527,Business,Retail,Financial & Banking Information,2016,"1,000-9,999",Unknown
9632,06/08/2016 12:00:00 AM,07/16/2016 12:00:00 AM,Unauthorized Access,2015-04-01T00:00:00,,"NLU Products, LLC",,2527,Business,Retail,Other,2016,"1,000-9,999",Unknown
9633,07/19/2016 12:00:00 AM,07/19/2016 12:00:00 AM,Cyberattack,2016-03-01T00:00:00,2016-07-31T00:00:00,CiCi Enterprises,Malware,,Business,Hospitality,Financial & Banking Information,2016,Unknown,100-199
9634,06/08/2016 12:00:00 AM,07/19/2016 12:00:00 AM,Cyberattack,2016-04-21T00:00:00,2016-06-13T00:00:00,San Antonio Shoemakers,Malware,511,Business,Retail,Name,2016,500-999,1-99
9634,06/08/2016 12:00:00 AM,07/19/2016 12:00:00 AM,Cyberattack,2016-04-21T00:00:00,2016-06-13T00:00:00,San Antonio Shoemakers,Malware,511,Business,Retail,Financial & Banking Information,2016,500-999,1-99
9635,07/13/2016 12:00:00 AM,08/03/2016 12:00:00 AM,Cyberattack,2016-06-17T00:00:00,,Banner Health,Malware,7916,Health,,Name,2017,"1,000-9,999",Unknown
9635,07/13/2016 12:00:00 AM,08/03/2016 12:00:00 AM,Cyberattack,2016-06-17T00:00:00,,Banner Health,Malware,7916,Health,,Social Security Number,2017,"1,000-9,999",Unknown
9635,07/13/2016 12:00:00 AM,08/03/2016 12:00:00 AM,Cyberattack,2016-06-17T00:00:00,,Banner Health,Malware,7916,Health,,Full Date of Birth,2017,"1,000-9,999",Unknown
9635,07/13/2016 12:00:00 AM,08/03/2016 12:00:00 AM,Cyberattack,2016-06-17T00:00:00,,Banner Health,Malware,7916,Health,,Medical Information,2017,"1,000-9,999",Unknown
9635,07/13/2016 12:00:00 AM,08/03/2016 12:00:00 AM,Cyberattack,2016-06-17T00:00:00,,Banner Health,Malware,7916,Health,,Other,2017,"1,000-9,999",Unknown
9637,06/13/2016 12:00:00 AM,08/12/2016 12:00:00 AM,Unauthorized Access,2016-03-30T00:00:00,,"Valley Anesthesiology Consultants, Inc.",,611,Health,,Name,2017,500-999,Unknown
9637,06/13/2016 12:00:00 AM,08/12/2016 12:00:00 AM,Unauthorized Access,2016-03-30T00:00:00,,"Valley Anesthesiology Consultants, Inc.",,611,Health,,Social Security Number,2017,500-999,Unknown
9637,06/13/2016 12:00:00 AM,08/12/2016 12:00:00 AM,Unauthorized Access,2016-03-30T00:00:00,,"Valley Anesthesiology Consultants, Inc.",,611,Health,,Health Insurance Policy or ID Number,2017,500-999,Unknown
9637,06/13/2016 12:00:00 AM,08/12/2016 12:00:00 AM,Unauthorized Access,2016-03-30T00:00:00,,"Valley Anesthesiology Consultants, Inc.",,611,Health,,Medical Information,2017,500-999,Unknown
9638,07/15/2016 12:00:00 AM,08/18/2016 12:00:00 AM,Cyberattack,2016-01-02T00:00:00,2016-07-17T00:00:00,Eddie Bauer,Malware,73508,Business,Clothing,Name,2017,"50,000-999,999",100-199
9638,07/15/2016 12:00:00 AM,08/18/2016 12:00:00 AM,Cyberattack,2016-01-02T00:00:00,2016-07-17T00:00:00,Eddie Bauer,Malware,73508,Business,Clothing,Financial & Banking Information,2017,"50,000-999,999",100-199
9639,06/30/2016 12:00:00 AM,08/22/2016 12:00:00 AM,Cyberattack,2015-10-21T00:00:00,2016-04-07T00:00:00,KontrolFreek,Malware,625,Business,Other,Name,2017,500-999,200-299
9639,06/30/2016 12:00:00 AM,08/22/2016 12:00:00 AM,Cyberattack,2015-10-21T00:00:00,2016-04-07T00:00:00,KontrolFreek,Malware,625,Business,Other,Financial & Banking Information,2017,500-999,200-299
9640,08/18/2016 12:00:00 AM,08/30/2016 12:00:00 AM,Unauthorized Access,2016-07-16T00:00:00,2016-08-18T00:00:00,"Presnell Gage, PLLC",,2613,Finance,,Name,2017,"1,000-9,999",1-99
9640,08/18/2016 12:00:00 AM,08/30/2016 12:00:00 AM,Unauthorized Access,2016-07-16T00:00:00,2016-08-18T00:00:00,"Presnell Gage, PLLC",,2613,Finance,,Social Security Number,2017,"1,000-9,999",1-99
9640,08/18/2016 12:00:00 AM,08/30/2016 12:00:00 AM,Unauthorized Access,2016-07-16T00:00:00,2016-08-18T00:00:00,"Presnell Gage, PLLC",,2613,Finance,,Financial & Banking Information,2017,"1,000-9,999",1-99
9641,07/15/2016 12:00:00 AM,08/31/2016 12:00:00 AM,Cyberattack,2016-02-16T00:00:00,2016-07-07T00:00:00,Kimpton Hotels & Restaurants,Malware,5428,Business,Hospitality,Name,2017,"1,000-9,999",100-199
9641,07/15/2016 12:00:00 AM,08/31/2016 12:00:00 AM,Cyberattack,2016-02-16T00:00:00,2016-07-07T00:00:00,Kimpton Hotels & Restaurants,Malware,5428,Business,Hospitality,Financial & Banking Information,2017,"1,000-9,999",100-199
9642,07/22/2016 12:00:00 AM,08/31/2016 12:00:00 AM,Theft or Mistake,2016-04-21T00:00:00,2016-06-13T00:00:00,Highline Medical Center,,12724,Health,,Name,2017,"10,000-49,999",1-99
9642,07/22/2016 12:00:00 AM,08/31/2016 12:00:00 AM,Theft or Mistake,2016-04-21T00:00:00,2016-06-13T00:00:00,Highline Medical Center,,12724,Health,,Social Security Number,2017,"10,000-49,999",1-99
9642,07/22/2016 12:00:00 AM,08/31/2016 12:00:00 AM,Theft or Mistake,2016-04-21T00:00:00,2016-06-13T00:00:00,Highline Medical Center,,12724,Health,,Health Insurance Policy or ID Number,2017,"10,000-49,999",1-99
9642,07/22/2016 12:00:00 AM,08/31/2016 12:00:00 AM,Theft or Mistake,2016-04-21T00:00:00,2016-06-13T00:00:00,Highline Medical Center,,12724,Health,,Other,2017,"10,000-49,999",1-99
9643,08/19/2016 12:00:00 AM,09/02/2016 12:00:00 AM,Cyberattack,2016-04-25T00:00:00,,Noble House Hotels,Skimmers,1463,Business,Hospitality,Name,2017,"1,000-9,999",Unknown
9643,08/19/2016 12:00:00 AM,09/02/2016 12:00:00 AM,Cyberattack,2016-04-25T00:00:00,,Noble House Hotels,Skimmers,1463,Business,Hospitality,Financial & Banking Information,2017,"1,000-9,999",Unknown
9644,08/22/2016 12:00:00 AM,09/19/2016 12:00:00 AM,Unauthorized Access,,,ACTIVEOutdoors,,1449645,Government,,Name,2017,"1,000,000+",Unknown
9644,08/22/2016 12:00:00 AM,09/19/2016 12:00:00 AM,Unauthorized Access,,,ACTIVEOutdoors,,1449645,Government,,Social Security Number,2017,"1,000,000+",Unknown
9644,08/22/2016 12:00:00 AM,09/19/2016 12:00:00 AM,Unauthorized Access,,,ACTIVEOutdoors,,1449645,Government,,Driver's License or Washington ID Card Number,2017,"1,000,000+",Unknown
9644,08/22/2016 12:00:00 AM,09/19/2016 12:00:00 AM,Unauthorized Access,,,ACTIVEOutdoors,,1449645,Government,,Full Date of Birth,2017,"1,000,000+",Unknown
9644,08/22/2016 12:00:00 AM,09/19/2016 12:00:00 AM,Unauthorized Access,,,ACTIVEOutdoors,,1449645,Government,,Other,2017,"1,000,000+",Unknown
9645,08/23/2016 12:00:00 AM,09/19/2016 12:00:00 AM,Theft or Mistake,,,"Ascensus, Inc.",,1505,Finance,,Name,2017,"1,000-9,999",Unknown
9645,08/23/2016 12:00:00 AM,09/19/2016 12:00:00 AM,Theft or Mistake,,,"Ascensus, Inc.",,1505,Finance,,Social Security Number,2017,"1,000-9,999",Unknown
9645,08/23/2016 12:00:00 AM,09/19/2016 12:00:00 AM,Theft or Mistake,,,"Ascensus, Inc.",,1505,Finance,,Full Date of Birth,2017,"1,000-9,999",Unknown
9645,08/23/2016 12:00:00 AM,09/19/2016 12:00:00 AM,Theft or Mistake,,,"Ascensus, Inc.",,1505,Finance,,Other,2017,"1,000-9,999",Unknown
9647,09/12/2016 12:00:00 AM,09/30/2016 12:00:00 AM,Unauthorized Access,2016-09-12T00:00:00,2016-09-12T00:00:00,Vaupell,,1198,Business,Manufacturing,Name,2017,"1,000-9,999",0
9647,09/12/2016 12:00:00 AM,09/30/2016 12:00:00 AM,Unauthorized Access,2016-09-12T00:00:00,2016-09-12T00:00:00,Vaupell,,1198,Business,Manufacturing,Social Security Number,2017,"1,000-9,999",0
9647,09/12/2016 12:00:00 AM,09/30/2016 12:00:00 AM,Unauthorized Access,2016-09-12T00:00:00,2016-09-12T00:00:00,Vaupell,,1198,Business,Manufacturing,Full Date of Birth,2017,"1,000-9,999",0
9647,09/12/2016 12:00:00 AM,09/30/2016 12:00:00 AM,Unauthorized Access,2016-09-12T00:00:00,2016-09-12T00:00:00,Vaupell,,1198,Business,Manufacturing,Other,2017,"1,000-9,999",0
9649,09/30/2016 12:00:00 AM,10/19/2016 12:00:00 AM,Cyberattack,2016-05-29T00:00:00,2016-07-22T00:00:00,Eastwood Company,Malware,633,Business,Other,Name,2017,500-999,100-199
9649,09/30/2016 12:00:00 AM,10/19/2016 12:00:00 AM,Cyberattack,2016-05-29T00:00:00,2016-07-22T00:00:00,Eastwood Company,Malware,633,Business,Other,Financial & Banking Information,2017,500-999,100-199
9649,09/30/2016 12:00:00 AM,10/19/2016 12:00:00 AM,Cyberattack,2016-05-29T00:00:00,2016-07-22T00:00:00,Eastwood Company,Malware,633,Business,Other,Other,2017,500-999,100-199
9650,10/07/2016 12:00:00 AM,11/04/2016 12:00:00 AM,Cyberattack,,,Rebecca Minkoff LLC,,549,Business,Retail,Name,2017,500-999,Unknown
9650,10/07/2016 12:00:00 AM,11/04/2016 12:00:00 AM,Cyberattack,,,Rebecca Minkoff LLC,,549,Business,Retail,Financial & Banking Information,2017,500-999,Unknown
9650,10/07/2016 12:00:00 AM,11/04/2016 12:00:00 AM,Cyberattack,,,Rebecca Minkoff LLC,,549,Business,Retail,Username and Password/Security Question Answers,2017,500-999,Unknown
9651,,11/09/2016 12:00:00 AM,Cyberattack,2016-09-07T00:00:00,2016-10-24T00:00:00,Eileen Fisher Inc.,Malware,755,Business,Clothing,Name,2017,500-999,Unknown
9651,,11/09/2016 12:00:00 AM,Cyberattack,2016-09-07T00:00:00,2016-10-24T00:00:00,Eileen Fisher Inc.,Malware,755,Business,Clothing,Financial & Banking Information,2017,500-999,Unknown
9651,,11/09/2016 12:00:00 AM,Cyberattack,2016-09-07T00:00:00,2016-10-24T00:00:00,Eileen Fisher Inc.,Malware,755,Business,Clothing,Other,2017,500-999,Unknown
9652,07/14/2016 12:00:00 AM,11/09/2016 12:00:00 AM,Cyberattack,,,UFCW Local 655 Food Employers Pension Plan,Ransomware,556,Finance,,Name,2017,500-999,Unknown
9652,07/14/2016 12:00:00 AM,11/09/2016 12:00:00 AM,Cyberattack,,,UFCW Local 655 Food Employers Pension Plan,Ransomware,556,Finance,,Social Security Number,2017,500-999,Unknown
9652,07/14/2016 12:00:00 AM,11/09/2016 12:00:00 AM,Cyberattack,,,UFCW Local 655 Food Employers Pension Plan,Ransomware,556,Finance,,Financial & Banking Information,2017,500-999,Unknown
9652,07/14/2016 12:00:00 AM,11/09/2016 12:00:00 AM,Cyberattack,,,UFCW Local 655 Food Employers Pension Plan,Ransomware,556,Finance,,Full Date of Birth,2017,500-999,Unknown
9654,11/04/2016 12:00:00 AM,11/18/2016 12:00:00 AM,Cyberattack,2015-10-03T00:00:00,2016-10-09T00:00:00,Springfield Armory,Malware,512,Business,Other,Name,2017,500-999,300-399
9654,11/04/2016 12:00:00 AM,11/18/2016 12:00:00 AM,Cyberattack,2015-10-03T00:00:00,2016-10-09T00:00:00,Springfield Armory,Malware,512,Business,Other,Financial & Banking Information,2017,500-999,300-399
9654,11/04/2016 12:00:00 AM,11/18/2016 12:00:00 AM,Cyberattack,2015-10-03T00:00:00,2016-10-09T00:00:00,Springfield Armory,Malware,512,Business,Other,Other,2017,500-999,300-399
9655,,11/18/2016 12:00:00 AM,Unauthorized Access,2016-11-13T00:00:00,,Michigan State University,,,Education,,Name,2017,Unknown,Unknown
9655,,11/18/2016 12:00:00 AM,Unauthorized Access,2016-11-13T00:00:00,,Michigan State University,,,Education,,Social Security Number,2017,Unknown,Unknown
9655,,11/18/2016 12:00:00 AM,Unauthorized Access,2016-11-13T00:00:00,,Michigan State University,,,Education,,Full Date of Birth,2017,Unknown,Unknown
9655,,11/18/2016 12:00:00 AM,Unauthorized Access,2016-11-13T00:00:00,,Michigan State University,,,Education,,Student ID Number,2017,Unknown,Unknown
9655,,11/18/2016 12:00:00 AM,Unauthorized Access,2016-11-13T00:00:00,,Michigan State University,,,Education,,Other,2017,Unknown,Unknown
9656,10/21/2016 12:00:00 AM,11/21/2016 12:00:00 AM,Cyberattack,2016-03-09T00:00:00,2016-10-22T00:00:00,Island Hotel Company Limited,Malware,,Business,Hospitality,Name,2017,Unknown,200-299
9656,10/21/2016 12:00:00 AM,11/21/2016 12:00:00 AM,Cyberattack,2016-03-09T00:00:00,2016-10-22T00:00:00,Island Hotel Company Limited,Malware,,Business,Hospitality,Financial & Banking Information,2017,Unknown,200-299
9657,10/27/2016 12:00:00 AM,11/22/2016 12:00:00 AM,Cyberattack,2015-11-09T00:00:00,2016-10-24T00:00:00,The Madison Square Garden Company,Malware,,Business,Entertainment,Name,2017,Unknown,300-399
9657,10/27/2016 12:00:00 AM,11/22/2016 12:00:00 AM,Cyberattack,2015-11-09T00:00:00,2016-10-24T00:00:00,The Madison Square Garden Company,Malware,,Business,Entertainment,Financial & Banking Information,2017,Unknown,300-399
9658,10/18/2016 12:00:00 AM,11/30/2016 12:00:00 AM,Theft or Mistake,2016-10-18T00:00:00,2016-10-18T00:00:00,CHI Franciscan Health- Hospice Tacoma,,1223,Health,,Name,2017,"1,000-9,999",0
9658,10/18/2016 12:00:00 AM,11/30/2016 12:00:00 AM,Theft or Mistake,2016-10-18T00:00:00,2016-10-18T00:00:00,CHI Franciscan Health- Hospice Tacoma,,1223,Health,,Social Security Number,2017,"1,000-9,999",0
9658,10/18/2016 12:00:00 AM,11/30/2016 12:00:00 AM,Theft or Mistake,2016-10-18T00:00:00,2016-10-18T00:00:00,CHI Franciscan Health- Hospice Tacoma,,1223,Health,,Health Insurance Policy or ID Number,2017,"1,000-9,999",0
9658,10/18/2016 12:00:00 AM,11/30/2016 12:00:00 AM,Theft or Mistake,2016-10-18T00:00:00,2016-10-18T00:00:00,CHI Franciscan Health- Hospice Tacoma,,1223,Health,,Medical Information,2017,"1,000-9,999",0
9658,10/18/2016 12:00:00 AM,11/30/2016 12:00:00 AM,Theft or Mistake,2016-10-18T00:00:00,2016-10-18T00:00:00,CHI Franciscan Health- Hospice Tacoma,,1223,Health,,Other,2017,"1,000-9,999",0
9659,,12/20/2016 12:00:00 AM,Unauthorized Access,,,Western Union Financial Services,,2470,Finance,,Name,2017,"1,000-9,999",Unknown
9659,,12/20/2016 12:00:00 AM,Unauthorized Access,,,Western Union Financial Services,,2470,Finance,,Social Security Number,2017,"1,000-9,999",Unknown
9659,,12/20/2016 12:00:00 AM,Unauthorized Access,,,Western Union Financial Services,,2470,Finance,,Driver's License or Washington ID Card Number,2017,"1,000-9,999",Unknown
9659,,12/20/2016 12:00:00 AM,Unauthorized Access,,,Western Union Financial Services,,2470,Finance,,Full Date of Birth,2017,"1,000-9,999",Unknown
9660,11/30/2016 12:00:00 AM,12/21/2016 12:00:00 AM,Unauthorized Access,2016-01-16T00:00:00,,Community Health Plan of Washington,,353388,Health,,Name,2017,"50,000-999,999",Unknown
9660,11/30/2016 12:00:00 AM,12/21/2016 12:00:00 AM,Unauthorized Access,2016-01-16T00:00:00,,Community Health Plan of Washington,,353388,Health,,Social Security Number,2017,"50,000-999,999",Unknown
9660,11/30/2016 12:00:00 AM,12/21/2016 12:00:00 AM,Unauthorized Access,2016-01-16T00:00:00,,Community Health Plan of Washington,,353388,Health,,Health Insurance Policy or ID Number,2017,"50,000-999,999",Unknown
9660,11/30/2016 12:00:00 AM,12/21/2016 12:00:00 AM,Unauthorized Access,2016-01-16T00:00:00,,Community Health Plan of Washington,,353388,Health,,Other,2017,"50,000-999,999",Unknown
9661,11/28/2016 12:00:00 AM,01/12/2017 12:00:00 AM,Cyberattack,2016-05-02T00:00:00,2016-11-22T00:00:00,"Spiraledge, Inc.",Malware,9700,Business,Retail,Name,2017,"1,000-9,999",200-299
9661,11/28/2016 12:00:00 AM,01/12/2017 12:00:00 AM,Cyberattack,2016-05-02T00:00:00,2016-11-22T00:00:00,"Spiraledge, Inc.",Malware,9700,Business,Retail,Financial & Banking Information,2017,"1,000-9,999",200-299
9661,11/28/2016 12:00:00 AM,01/12/2017 12:00:00 AM,Cyberattack,2016-05-02T00:00:00,2016-11-22T00:00:00,"Spiraledge, Inc.",Malware,9700,Business,Retail,Other,2017,"1,000-9,999",200-299
9662,12/23/2015 12:00:00 AM,01/18/2017 12:00:00 AM,Cyberattack,,,"CoPilot Provider Support Services, Inc.",Other,1522,Health,,Name,2017,"1,000-9,999",Unknown
9662,12/23/2015 12:00:00 AM,01/18/2017 12:00:00 AM,Cyberattack,,,"CoPilot Provider Support Services, Inc.",Other,1522,Health,,Social Security Number,2017,"1,000-9,999",Unknown
9662,12/23/2015 12:00:00 AM,01/18/2017 12:00:00 AM,Cyberattack,,,"CoPilot Provider Support Services, Inc.",Other,1522,Health,,Full Date of Birth,2017,"1,000-9,999",Unknown
9662,12/23/2015 12:00:00 AM,01/18/2017 12:00:00 AM,Cyberattack,,,"CoPilot Provider Support Services, Inc.",Other,1522,Health,,Health Insurance Policy or ID Number,2017,"1,000-9,999",Unknown
9662,12/23/2015 12:00:00 AM,01/18/2017 12:00:00 AM,Cyberattack,,,"CoPilot Provider Support Services, Inc.",Other,1522,Health,,Other,2017,"1,000-9,999",Unknown
9664,12/23/2016 12:00:00 AM,02/03/2017 12:00:00 AM,Unauthorized Access,2016-11-16T00:00:00,2016-11-16T00:00:00,"Conover Capital Management, LLC and Conover Securities Corporation",,1197,Finance,,Name,2017,"1,000-9,999",1-99
9664,12/23/2016 12:00:00 AM,02/03/2017 12:00:00 AM,Unauthorized Access,2016-11-16T00:00:00,2016-11-16T00:00:00,"Conover Capital Management, LLC and Conover Securities Corporation",,1197,Finance,,Social Security Number,2017,"1,000-9,999",1-99
9664,12/23/2016 12:00:00 AM,02/03/2017 12:00:00 AM,Unauthorized Access,2016-11-16T00:00:00,2016-11-16T00:00:00,"Conover Capital Management, LLC and Conover Securities Corporation",,1197,Finance,,Driver's License or Washington ID Card Number,2017,"1,000-9,999",1-99
9664,12/23/2016 12:00:00 AM,02/03/2017 12:00:00 AM,Unauthorized Access,2016-11-16T00:00:00,2016-11-16T00:00:00,"Conover Capital Management, LLC and Conover Securities Corporation",,1197,Finance,,Other,2017,"1,000-9,999",1-99
9665,01/09/2017 12:00:00 AM,02/08/2017 12:00:00 AM,Unauthorized Access,2016-11-21T00:00:00,2016-11-21T00:00:00,The Boeing Company,,7288,Business,Manufacturing,Name,2017,"1,000-9,999",1-99
9665,01/09/2017 12:00:00 AM,02/08/2017 12:00:00 AM,Unauthorized Access,2016-11-21T00:00:00,2016-11-21T00:00:00,The Boeing Company,,7288,Business,Manufacturing,Social Security Number,2017,"1,000-9,999",1-99
9665,01/09/2017 12:00:00 AM,02/08/2017 12:00:00 AM,Unauthorized Access,2016-11-21T00:00:00,2016-11-21T00:00:00,The Boeing Company,,7288,Business,Manufacturing,Full Date of Birth,2017,"1,000-9,999",1-99
9665,01/09/2017 12:00:00 AM,02/08/2017 12:00:00 AM,Unauthorized Access,2016-11-21T00:00:00,2016-11-21T00:00:00,The Boeing Company,,7288,Business,Manufacturing,Other,2017,"1,000-9,999",1-99
9666,02/06/2017 12:00:00 AM,02/22/2017 12:00:00 AM,Unauthorized Access,2017-02-03T00:00:00,2017-02-06T00:00:00,"InterMountain Management, LLC",,558,Business,Hospitality,Name,2017,500-999,1-99
9666,02/06/2017 12:00:00 AM,02/22/2017 12:00:00 AM,Unauthorized Access,2017-02-03T00:00:00,2017-02-06T00:00:00,"InterMountain Management, LLC",,558,Business,Hospitality,Social Security Number,2017,500-999,1-99
9666,02/06/2017 12:00:00 AM,02/22/2017 12:00:00 AM,Unauthorized Access,2017-02-03T00:00:00,2017-02-06T00:00:00,"InterMountain Management, LLC",,558,Business,Hospitality,Other,2017,500-999,1-99
9667,11/16/2016 12:00:00 AM,02/22/2017 12:00:00 AM,Cyberattack,2016-04-24T00:00:00,2016-12-14T00:00:00,Intex Recreation Corp.,Malware,1547,Business,Manufacturing,Name,2017,"1,000-9,999",200-299
9667,11/16/2016 12:00:00 AM,02/22/2017 12:00:00 AM,Cyberattack,2016-04-24T00:00:00,2016-12-14T00:00:00,Intex Recreation Corp.,Malware,1547,Business,Manufacturing,Financial & Banking Information,2017,"1,000-9,999",200-299
9667,11/16/2016 12:00:00 AM,02/22/2017 12:00:00 AM,Cyberattack,2016-04-24T00:00:00,2016-12-14T00:00:00,Intex Recreation Corp.,Malware,1547,Business,Manufacturing,Other,2017,"1,000-9,999",200-299
9668,02/06/2017 12:00:00 AM,02/23/2017 12:00:00 AM,Cyberattack,2013-06-01T00:00:00,2016-12-31T00:00:00,Abbott Nutrition,Malware,1819,Business,Consumable,Name,2017,"1,000-9,999",500+
9668,02/06/2017 12:00:00 AM,02/23/2017 12:00:00 AM,Cyberattack,2013-06-01T00:00:00,2016-12-31T00:00:00,Abbott Nutrition,Malware,1819,Business,Consumable,Financial & Banking Information,2017,"1,000-9,999",500+
9668,02/06/2017 12:00:00 AM,02/23/2017 12:00:00 AM,Cyberattack,2013-06-01T00:00:00,2016-12-31T00:00:00,Abbott Nutrition,Malware,1819,Business,Consumable,Other,2017,"1,000-9,999",500+
9669,02/06/2017 12:00:00 AM,02/24/2017 12:00:00 AM,Cyberattack,2016-02-26T00:00:00,2016-12-05T00:00:00,Mrs Prindables,Malware,784,Business,Consumable,Name,2017,500-999,300-399
9669,02/06/2017 12:00:00 AM,02/24/2017 12:00:00 AM,Cyberattack,2016-02-26T00:00:00,2016-12-05T00:00:00,Mrs Prindables,Malware,784,Business,Consumable,Financial & Banking Information,2017,500-999,300-399
9669,02/06/2017 12:00:00 AM,02/24/2017 12:00:00 AM,Cyberattack,2016-02-26T00:00:00,2016-12-05T00:00:00,Mrs Prindables,Malware,784,Business,Consumable,Other,2017,500-999,300-399
9671,01/05/2017 12:00:00 AM,02/24/2017 12:00:00 AM,Cyberattack,2015-07-30T00:00:00,2016-12-14T00:00:00,Roberts Hawaii,Malware,1178,Business,Transportation,Name,2017,"1,000-9,999",500+
9671,01/05/2017 12:00:00 AM,02/24/2017 12:00:00 AM,Cyberattack,2015-07-30T00:00:00,2016-12-14T00:00:00,Roberts Hawaii,Malware,1178,Business,Transportation,Financial & Banking Information,2017,"1,000-9,999",500+
9671,01/05/2017 12:00:00 AM,02/24/2017 12:00:00 AM,Cyberattack,2015-07-30T00:00:00,2016-12-14T00:00:00,Roberts Hawaii,Malware,1178,Business,Transportation,Other,2017,"1,000-9,999",500+
9672,01/12/2017 12:00:00 AM,02/24/2017 12:00:00 AM,Theft or Mistake,2017-01-12T00:00:00,,"Pasco Rentals, Inc.",,6300,Business,Other,Name,2017,"1,000-9,999",Unknown
9672,01/12/2017 12:00:00 AM,02/24/2017 12:00:00 AM,Theft or Mistake,2017-01-12T00:00:00,,"Pasco Rentals, Inc.",,6300,Business,Other,Driver's License or Washington ID Card Number,2017,"1,000-9,999",Unknown
9672,01/12/2017 12:00:00 AM,02/24/2017 12:00:00 AM,Theft or Mistake,2017-01-12T00:00:00,,"Pasco Rentals, Inc.",,6300,Business,Other,Other,2017,"1,000-9,999",Unknown
9674,02/06/2017 12:00:00 AM,02/25/2017 12:00:00 AM,Cyberattack,2016-02-26T00:00:00,2016-12-05T00:00:00,"New England Biolabs, Inc.",Malware,746,Business,Biotech,Name,2017,500-999,300-399
9674,02/06/2017 12:00:00 AM,02/25/2017 12:00:00 AM,Cyberattack,2016-02-26T00:00:00,2016-12-05T00:00:00,"New England Biolabs, Inc.",Malware,746,Business,Biotech,Financial & Banking Information,2017,500-999,300-399
9674,02/06/2017 12:00:00 AM,02/25/2017 12:00:00 AM,Cyberattack,2016-02-26T00:00:00,2016-12-05T00:00:00,"New England Biolabs, Inc.",Malware,746,Business,Biotech,Other,2017,500-999,300-399
9675,02/06/2017 12:00:00 AM,02/25/2017 12:00:00 AM,Cyberattack,2016-02-26T00:00:00,2016-12-05T00:00:00,Alpha Industries,Malware,1013,Business,Clothing,Name,2017,"1,000-9,999",300-399
9675,02/06/2017 12:00:00 AM,02/25/2017 12:00:00 AM,Cyberattack,2016-02-26T00:00:00,2016-12-05T00:00:00,Alpha Industries,Malware,1013,Business,Clothing,Financial & Banking Information,2017,"1,000-9,999",300-399
9675,02/06/2017 12:00:00 AM,02/25/2017 12:00:00 AM,Cyberattack,2016-02-26T00:00:00,2016-12-05T00:00:00,Alpha Industries,Malware,1013,Business,Clothing,Other,2017,"1,000-9,999",300-399
9676,02/06/2017 12:00:00 AM,02/25/2017 12:00:00 AM,Cyberattack,2016-02-26T00:00:00,2016-12-05T00:00:00,"Nutrex Hawaii, Inc.",Malware,725,Business,Consumable,Name,2017,500-999,300-399
9676,02/06/2017 12:00:00 AM,02/25/2017 12:00:00 AM,Cyberattack,2016-02-26T00:00:00,2016-12-05T00:00:00,"Nutrex Hawaii, Inc.",Malware,725,Business,Consumable,Financial & Banking Information,2017,500-999,300-399
9676,02/06/2017 12:00:00 AM,02/25/2017 12:00:00 AM,Cyberattack,2016-02-26T00:00:00,2016-12-05T00:00:00,"Nutrex Hawaii, Inc.",Malware,725,Business,Consumable,Other,2017,500-999,300-399
9677,02/06/2017 12:00:00 AM,02/25/2017 12:00:00 AM,Cyberattack,2016-02-26T00:00:00,2016-12-05T00:00:00,"Blue Mercury, Inc.",Malware,778,Business,Cosmetic,Name,2017,500-999,300-399
9677,02/06/2017 12:00:00 AM,02/25/2017 12:00:00 AM,Cyberattack,2016-02-26T00:00:00,2016-12-05T00:00:00,"Blue Mercury, Inc.",Malware,778,Business,Cosmetic,Financial & Banking Information,2017,500-999,300-399
9677,02/06/2017 12:00:00 AM,02/25/2017 12:00:00 AM,Cyberattack,2016-02-26T00:00:00,2016-12-05T00:00:00,"Blue Mercury, Inc.",Malware,778,Business,Cosmetic,Other,2017,500-999,300-399
9678,02/06/2017 12:00:00 AM,02/25/2017 12:00:00 AM,Cyberattack,2016-02-26T00:00:00,2016-12-05T00:00:00,"Vapour Organic Beauty, LLC",Malware,847,Business,Cosmetic,Name,2017,500-999,300-399
9678,02/06/2017 12:00:00 AM,02/25/2017 12:00:00 AM,Cyberattack,2016-02-26T00:00:00,2016-12-05T00:00:00,"Vapour Organic Beauty, LLC",Malware,847,Business,Cosmetic,Financial & Banking Information,2017,500-999,300-399
9678,02/06/2017 12:00:00 AM,02/25/2017 12:00:00 AM,Cyberattack,2016-02-26T00:00:00,2016-12-05T00:00:00,"Vapour Organic Beauty, LLC",Malware,847,Business,Cosmetic,Other,2017,500-999,300-399
9679,02/06/2017 12:00:00 AM,02/25/2017 12:00:00 AM,Cyberattack,2016-02-26T00:00:00,2016-12-05T00:00:00,"Plow and Hearth, LLC",Malware,1274,Business,Home,Name,2017,"1,000-9,999",300-399
9679,02/06/2017 12:00:00 AM,02/25/2017 12:00:00 AM,Cyberattack,2016-02-26T00:00:00,2016-12-05T00:00:00,"Plow and Hearth, LLC",Malware,1274,Business,Home,Financial & Banking Information,2017,"1,000-9,999",300-399
9679,02/06/2017 12:00:00 AM,02/25/2017 12:00:00 AM,Cyberattack,2016-02-26T00:00:00,2016-12-05T00:00:00,"Plow and Hearth, LLC",Malware,1274,Business,Home,Other,2017,"1,000-9,999",300-399
9680,02/06/2017 12:00:00 AM,02/25/2017 12:00:00 AM,Cyberattack,2016-02-26T00:00:00,2016-12-05T00:00:00,"Century, LCC",Malware,639,Business,Retail,Name,2017,500-999,300-399
9680,02/06/2017 12:00:00 AM,02/25/2017 12:00:00 AM,Cyberattack,2016-02-26T00:00:00,2016-12-05T00:00:00,"Century, LCC",Malware,639,Business,Retail,Financial & Banking Information,2017,500-999,300-399
9680,02/06/2017 12:00:00 AM,02/25/2017 12:00:00 AM,Cyberattack,2016-02-26T00:00:00,2016-12-05T00:00:00,"Century, LCC",Malware,639,Business,Retail,Other,2017,500-999,300-399
9681,02/06/2017 12:00:00 AM,02/25/2017 12:00:00 AM,Cyberattack,2016-02-26T00:00:00,2016-12-05T00:00:00,"Movie Mars, Inc.",Malware,524,Business,Retail,Name,2017,500-999,300-399
9681,02/06/2017 12:00:00 AM,02/25/2017 12:00:00 AM,Cyberattack,2016-02-26T00:00:00,2016-12-05T00:00:00,"Movie Mars, Inc.",Malware,524,Business,Retail,Financial & Banking Information,2017,500-999,300-399
9681,02/06/2017 12:00:00 AM,02/25/2017 12:00:00 AM,Cyberattack,2016-02-26T00:00:00,2016-12-05T00:00:00,"Movie Mars, Inc.",Malware,524,Business,Retail,Other,2017,500-999,300-399
9682,02/06/2017 12:00:00 AM,03/06/2017 12:00:00 AM,Cyberattack,2016-02-26T00:00:00,2016-12-05T00:00:00,West Music Company,Malware,1495,Business,Retail,Name,2017,"1,000-9,999",300-399
9682,02/06/2017 12:00:00 AM,03/06/2017 12:00:00 AM,Cyberattack,2016-02-26T00:00:00,2016-12-05T00:00:00,West Music Company,Malware,1495,Business,Retail,Financial & Banking Information,2017,"1,000-9,999",300-399
9682,02/06/2017 12:00:00 AM,03/06/2017 12:00:00 AM,Cyberattack,2016-02-26T00:00:00,2016-12-05T00:00:00,West Music Company,Malware,1495,Business,Retail,Other,2017,"1,000-9,999",300-399
9683,02/22/2017 12:00:00 AM,03/07/2017 12:00:00 AM,Unauthorized Access,2017-02-22T00:00:00,2017-02-22T00:00:00,Russell Investments,,1291,Finance,,Name,2017,"1,000-9,999",0
9683,02/22/2017 12:00:00 AM,03/07/2017 12:00:00 AM,Unauthorized Access,2017-02-22T00:00:00,2017-02-22T00:00:00,Russell Investments,,1291,Finance,,Social Security Number,2017,"1,000-9,999",0
9683,02/22/2017 12:00:00 AM,03/07/2017 12:00:00 AM,Unauthorized Access,2017-02-22T00:00:00,2017-02-22T00:00:00,Russell Investments,,1291,Finance,,Full Date of Birth,2017,"1,000-9,999",0
9683,02/22/2017 12:00:00 AM,03/07/2017 12:00:00 AM,Unauthorized Access,2017-02-22T00:00:00,2017-02-22T00:00:00,Russell Investments,,1291,Finance,,Health Insurance Policy or ID Number,2017,"1,000-9,999",0
9683,02/22/2017 12:00:00 AM,03/07/2017 12:00:00 AM,Unauthorized Access,2017-02-22T00:00:00,2017-02-22T00:00:00,Russell Investments,,1291,Finance,,Other,2017,"1,000-9,999",0
9684,02/06/2017 12:00:00 AM,03/08/2017 12:00:00 AM,Cyberattack,2016-12-14T00:00:00,2017-02-06T00:00:00,prAna,Malware,18172,Business,Clothing,Name,2017,"10,000-49,999",1-99
9684,02/06/2017 12:00:00 AM,03/08/2017 12:00:00 AM,Cyberattack,2016-12-14T00:00:00,2017-02-06T00:00:00,prAna,Malware,18172,Business,Clothing,Financial & Banking Information,2017,"10,000-49,999",1-99
9684,02/06/2017 12:00:00 AM,03/08/2017 12:00:00 AM,Cyberattack,2016-12-14T00:00:00,2017-02-06T00:00:00,prAna,Malware,18172,Business,Clothing,Username and Password/Security Question Answers,2017,"10,000-49,999",1-99
9684,02/06/2017 12:00:00 AM,03/08/2017 12:00:00 AM,Cyberattack,2016-12-14T00:00:00,2017-02-06T00:00:00,prAna,Malware,18172,Business,Clothing,Other,2017,"10,000-49,999",1-99
9685,02/06/2017 12:00:00 AM,03/08/2017 12:00:00 AM,Cyberattack,2016-02-26T00:00:00,2016-12-05T00:00:00,Atlantic Cigar,Malware,803,Business,Retail,Name,2017,500-999,300-399
9685,02/06/2017 12:00:00 AM,03/08/2017 12:00:00 AM,Cyberattack,2016-02-26T00:00:00,2016-12-05T00:00:00,Atlantic Cigar,Malware,803,Business,Retail,Financial & Banking Information,2017,500-999,300-399
9685,02/06/2017 12:00:00 AM,03/08/2017 12:00:00 AM,Cyberattack,2016-02-26T00:00:00,2016-12-05T00:00:00,Atlantic Cigar,Malware,803,Business,Retail,Other,2017,500-999,300-399
9686,02/06/2017 12:00:00 AM,03/10/2017 12:00:00 AM,Unauthorized Access,2016-02-26T00:00:00,2016-12-05T00:00:00,Bambeco Inc.,,2176,Business,Home,Name,2017,"1,000-9,999",300-399
9686,02/06/2017 12:00:00 AM,03/10/2017 12:00:00 AM,Unauthorized Access,2016-02-26T00:00:00,2016-12-05T00:00:00,Bambeco Inc.,,2176,Business,Home,Financial & Banking Information,2017,"1,000-9,999",300-399
9686,02/06/2017 12:00:00 AM,03/10/2017 12:00:00 AM,Unauthorized Access,2016-02-26T00:00:00,2016-12-05T00:00:00,Bambeco Inc.,,2176,Business,Home,Other,2017,"1,000-9,999",300-399
9687,02/13/2017 12:00:00 AM,03/16/2017 12:00:00 AM,Unauthorized Access,2017-02-11T00:00:00,2017-02-13T00:00:00,"Northwest Christian Schools, Inc.",,526,Education,,Name,2017,500-999,1-99
9687,02/13/2017 12:00:00 AM,03/16/2017 12:00:00 AM,Unauthorized Access,2017-02-11T00:00:00,2017-02-13T00:00:00,"Northwest Christian Schools, Inc.",,526,Education,,Social Security Number,2017,500-999,1-99
9687,02/13/2017 12:00:00 AM,03/16/2017 12:00:00 AM,Unauthorized Access,2017-02-11T00:00:00,2017-02-13T00:00:00,"Northwest Christian Schools, Inc.",,526,Education,,Financial & Banking Information,2017,500-999,1-99
9687,02/13/2017 12:00:00 AM,03/16/2017 12:00:00 AM,Unauthorized Access,2017-02-11T00:00:00,2017-02-13T00:00:00,"Northwest Christian Schools, Inc.",,526,Education,,Full Date of Birth,2017,500-999,1-99
9687,02/13/2017 12:00:00 AM,03/16/2017 12:00:00 AM,Unauthorized Access,2017-02-11T00:00:00,2017-02-13T00:00:00,"Northwest Christian Schools, Inc.",,526,Education,,Other,2017,500-999,1-99
9688,02/03/2017 12:00:00 AM,03/17/2017 12:00:00 AM,Cyberattack,2016-10-20T00:00:00,2016-10-20T00:00:00,People for People,Other,821,Non-Profit/Charity,,Name,2017,500-999,100-199
9688,02/03/2017 12:00:00 AM,03/17/2017 12:00:00 AM,Cyberattack,2016-10-20T00:00:00,2016-10-20T00:00:00,People for People,Other,821,Non-Profit/Charity,,Social Security Number,2017,500-999,100-199
9688,02/03/2017 12:00:00 AM,03/17/2017 12:00:00 AM,Cyberattack,2016-10-20T00:00:00,2016-10-20T00:00:00,People for People,Other,821,Non-Profit/Charity,,Driver's License or Washington ID Card Number,2017,500-999,100-199
9688,02/03/2017 12:00:00 AM,03/17/2017 12:00:00 AM,Cyberattack,2016-10-20T00:00:00,2016-10-20T00:00:00,People for People,Other,821,Non-Profit/Charity,,Financial & Banking Information,2017,500-999,100-199
9688,02/03/2017 12:00:00 AM,03/17/2017 12:00:00 AM,Cyberattack,2016-10-20T00:00:00,2016-10-20T00:00:00,People for People,Other,821,Non-Profit/Charity,,Full Date of Birth,2017,500-999,100-199
9688,02/03/2017 12:00:00 AM,03/17/2017 12:00:00 AM,Cyberattack,2016-10-20T00:00:00,2016-10-20T00:00:00,People for People,Other,821,Non-Profit/Charity,,Medical Information,2017,500-999,100-199
9688,02/03/2017 12:00:00 AM,03/17/2017 12:00:00 AM,Cyberattack,2016-10-20T00:00:00,2016-10-20T00:00:00,People for People,Other,821,Non-Profit/Charity,,Other,2017,500-999,100-199
9689,02/10/2017 12:00:00 AM,03/27/2017 12:00:00 AM,Cyberattack,,,"Easy Breathe, Inc.",,2034,Business,Other,Name,2017,"1,000-9,999",Unknown
9689,02/10/2017 12:00:00 AM,03/27/2017 12:00:00 AM,Cyberattack,,,"Easy Breathe, Inc.",,2034,Business,Other,Financial & Banking Information,2017,"1,000-9,999",Unknown
9689,02/10/2017 12:00:00 AM,03/27/2017 12:00:00 AM,Cyberattack,,,"Easy Breathe, Inc.",,2034,Business,Other,Other,2017,"1,000-9,999",Unknown
9690,02/06/2017 12:00:00 AM,04/04/2017 12:00:00 AM,Cyberattack,2016-02-26T00:00:00,2016-12-05T00:00:00,Tempur-Pedic,Malware,7366,Business,Manufacturing,Name,2017,"1,000-9,999",300-399
9690,02/06/2017 12:00:00 AM,04/04/2017 12:00:00 AM,Cyberattack,2016-02-26T00:00:00,2016-12-05T00:00:00,Tempur-Pedic,Malware,7366,Business,Manufacturing,Financial & Banking Information,2017,"1,000-9,999",300-399
9690,02/06/2017 12:00:00 AM,04/04/2017 12:00:00 AM,Cyberattack,2016-02-26T00:00:00,2016-12-05T00:00:00,Tempur-Pedic,Malware,7366,Business,Manufacturing,Other,2017,"1,000-9,999",300-399
9691,02/11/2017 12:00:00 AM,04/09/2017 12:00:00 AM,Cyberattack,2017-01-30T00:00:00,2017-01-30T00:00:00,Lake Kennedy McCulluch CPAs PS,Other,1688,Finance,,Name,2017,"1,000-9,999",1-99
9691,02/11/2017 12:00:00 AM,04/09/2017 12:00:00 AM,Cyberattack,2017-01-30T00:00:00,2017-01-30T00:00:00,Lake Kennedy McCulluch CPAs PS,Other,1688,Finance,,Social Security Number,2017,"1,000-9,999",1-99
9691,02/11/2017 12:00:00 AM,04/09/2017 12:00:00 AM,Cyberattack,2017-01-30T00:00:00,2017-01-30T00:00:00,Lake Kennedy McCulluch CPAs PS,Other,1688,Finance,,Financial & Banking Information,2017,"1,000-9,999",1-99
9691,02/11/2017 12:00:00 AM,04/09/2017 12:00:00 AM,Cyberattack,2017-01-30T00:00:00,2017-01-30T00:00:00,Lake Kennedy McCulluch CPAs PS,Other,1688,Finance,,Full Date of Birth,2017,"1,000-9,999",1-99
9691,02/11/2017 12:00:00 AM,04/09/2017 12:00:00 AM,Cyberattack,2017-01-30T00:00:00,2017-01-30T00:00:00,Lake Kennedy McCulluch CPAs PS,Other,1688,Finance,,Other,2017,"1,000-9,999",1-99
9692,03/24/2017 12:00:00 AM,04/12/2017 12:00:00 AM,Cyberattack,2016-10-01T00:00:00,2017-01-01T00:00:00,"ILKB, LLC",Other,1140,Business,Fitness,Name,2017,"1,000-9,999",100-199
9692,03/24/2017 12:00:00 AM,04/12/2017 12:00:00 AM,Cyberattack,2016-10-01T00:00:00,2017-01-01T00:00:00,"ILKB, LLC",Other,1140,Business,Fitness,Financial & Banking Information,2017,"1,000-9,999",100-199
9692,03/24/2017 12:00:00 AM,04/12/2017 12:00:00 AM,Cyberattack,2016-10-01T00:00:00,2017-01-01T00:00:00,"ILKB, LLC",Other,1140,Business,Fitness,Other,2017,"1,000-9,999",100-199
9693,,04/14/2017 12:00:00 AM,Cyberattack,2016-09-29T00:00:00,2016-12-29T00:00:00,Six Continents Hotels,Malware,13825,Business,Hospitality,Name,2017,"10,000-49,999",Unknown
9693,,04/14/2017 12:00:00 AM,Cyberattack,2016-09-29T00:00:00,2016-12-29T00:00:00,Six Continents Hotels,Malware,13825,Business,Hospitality,Financial & Banking Information,2017,"10,000-49,999",Unknown
9694,01/26/2017 12:00:00 AM,04/18/2017 12:00:00 AM,Cyberattack,2017-01-23T00:00:00,2017-02-22T00:00:00,Pacific Lutheran University,Phishing,813,Education,,Name,2017,500-999,1-99
9694,01/26/2017 12:00:00 AM,04/18/2017 12:00:00 AM,Cyberattack,2017-01-23T00:00:00,2017-02-22T00:00:00,Pacific Lutheran University,Phishing,813,Education,,Social Security Number,2017,500-999,1-99
9694,01/26/2017 12:00:00 AM,04/18/2017 12:00:00 AM,Cyberattack,2017-01-23T00:00:00,2017-02-22T00:00:00,Pacific Lutheran University,Phishing,813,Education,,Driver's License or Washington ID Card Number,2017,500-999,1-99
9694,01/26/2017 12:00:00 AM,04/18/2017 12:00:00 AM,Cyberattack,2017-01-23T00:00:00,2017-02-22T00:00:00,Pacific Lutheran University,Phishing,813,Education,,Financial & Banking Information,2017,500-999,1-99
9694,01/26/2017 12:00:00 AM,04/18/2017 12:00:00 AM,Cyberattack,2017-01-23T00:00:00,2017-02-22T00:00:00,Pacific Lutheran University,Phishing,813,Education,,Full Date of Birth,2017,500-999,1-99
9694,01/26/2017 12:00:00 AM,04/18/2017 12:00:00 AM,Cyberattack,2017-01-23T00:00:00,2017-02-22T00:00:00,Pacific Lutheran University,Phishing,813,Education,,Other,2017,500-999,1-99
10616,01/07/2019 12:00:00 AM,02/22/2019 12:00:00 AM,Theft or Mistake,2019-01-07T00:00:00,2019-01-07T00:00:00,Seattle Housing Authority,,720,Non-Profit/Charity,,Name,2019,500-999,0
10616,01/07/2019 12:00:00 AM,02/22/2019 12:00:00 AM,Theft or Mistake,2019-01-07T00:00:00,2019-01-07T00:00:00,Seattle Housing Authority,,720,Non-Profit/Charity,,Financial & Banking Information,2019,500-999,0
9700,04/24/2017 12:00:00 AM,05/12/2017 12:00:00 AM,Cyberattack,2016-04-04T00:00:00,2017-03-01T00:00:00,Brooks Brothers,Skimmers,,Business,Clothing,Name,2017,Unknown,300-399
9700,04/24/2017 12:00:00 AM,05/12/2017 12:00:00 AM,Cyberattack,2016-04-04T00:00:00,2017-03-01T00:00:00,Brooks Brothers,Skimmers,,Business,Clothing,Financial & Banking Information,2017,Unknown,300-399
9701,04/17/2017 12:00:00 AM,05/12/2017 12:00:00 AM,Cyberattack,2016-11-14T00:00:00,2017-04-17T00:00:00,Indigo Wild,Malware,501,Business,Retail,Name,2017,500-999,100-199
9701,04/17/2017 12:00:00 AM,05/12/2017 12:00:00 AM,Cyberattack,2016-11-14T00:00:00,2017-04-17T00:00:00,Indigo Wild,Malware,501,Business,Retail,Financial & Banking Information,2017,500-999,100-199
9701,04/17/2017 12:00:00 AM,05/12/2017 12:00:00 AM,Cyberattack,2016-11-14T00:00:00,2017-04-17T00:00:00,Indigo Wild,Malware,501,Business,Retail,Other,2017,500-999,100-199
9702,02/23/2017 12:00:00 AM,05/15/2017 12:00:00 AM,Cyberattack,2016-12-20T00:00:00,2017-03-03T00:00:00,Kuru Footwear,Malware,513,Business,Clothing,Name,2017,500-999,1-99
9702,02/23/2017 12:00:00 AM,05/15/2017 12:00:00 AM,Cyberattack,2016-12-20T00:00:00,2017-03-03T00:00:00,Kuru Footwear,Malware,513,Business,Clothing,Financial & Banking Information,2017,500-999,1-99
9702,02/23/2017 12:00:00 AM,05/15/2017 12:00:00 AM,Cyberattack,2016-12-20T00:00:00,2017-03-03T00:00:00,Kuru Footwear,Malware,513,Business,Clothing,Other,2017,500-999,1-99
9703,04/24/2017 12:00:00 AM,05/15/2017 12:00:00 AM,Cyberattack,2016-01-04T00:00:00,2017-03-29T00:00:00,TALX Corporation,Other,1467,Finance,,Name,2017,"1,000-9,999",400-499
9703,04/24/2017 12:00:00 AM,05/15/2017 12:00:00 AM,Cyberattack,2016-01-04T00:00:00,2017-03-29T00:00:00,TALX Corporation,Other,1467,Finance,,Social Security Number,2017,"1,000-9,999",400-499
9703,04/24/2017 12:00:00 AM,05/15/2017 12:00:00 AM,Cyberattack,2016-01-04T00:00:00,2017-03-29T00:00:00,TALX Corporation,Other,1467,Finance,,Financial & Banking Information,2017,"1,000-9,999",400-499
9703,04/24/2017 12:00:00 AM,05/15/2017 12:00:00 AM,Cyberattack,2016-01-04T00:00:00,2017-03-29T00:00:00,TALX Corporation,Other,1467,Finance,,Full Date of Birth,2017,"1,000-9,999",400-499
9703,04/24/2017 12:00:00 AM,05/15/2017 12:00:00 AM,Cyberattack,2016-01-04T00:00:00,2017-03-29T00:00:00,TALX Corporation,Other,1467,Finance,,Other,2017,"1,000-9,999",400-499
9704,04/03/2017 12:00:00 AM,05/16/2017 12:00:00 AM,Cyberattack,,,"Nicopure Labs, LLC",Malware,541,Business,Consumable,Name,2017,500-999,Unknown
9704,04/03/2017 12:00:00 AM,05/16/2017 12:00:00 AM,Cyberattack,,,"Nicopure Labs, LLC",Malware,541,Business,Consumable,Financial & Banking Information,2017,500-999,Unknown
9704,04/03/2017 12:00:00 AM,05/16/2017 12:00:00 AM,Cyberattack,,,"Nicopure Labs, LLC",Malware,541,Business,Consumable,Other,2017,500-999,Unknown
9705,,05/17/2017 12:00:00 AM,Cyberattack,2017-01-30T00:00:00,2017-04-11T00:00:00,"Rite Aid Online Store, Inc.",Malware,657,Business,Retail,Name,2017,500-999,Unknown
9705,,05/17/2017 12:00:00 AM,Cyberattack,2017-01-30T00:00:00,2017-04-11T00:00:00,"Rite Aid Online Store, Inc.",Malware,657,Business,Retail,Financial & Banking Information,2017,500-999,Unknown
9705,,05/17/2017 12:00:00 AM,Cyberattack,2017-01-30T00:00:00,2017-04-11T00:00:00,"Rite Aid Online Store, Inc.",Malware,657,Business,Retail,Other,2017,500-999,Unknown
9706,05/09/2017 12:00:00 AM,05/19/2017 12:00:00 AM,Theft or Mistake,2017-05-09T00:00:00,2017-05-09T00:00:00,Zillow,,1086,Business,Real Estate,Name,2017,"1,000-9,999",0
9706,05/09/2017 12:00:00 AM,05/19/2017 12:00:00 AM,Theft or Mistake,2017-05-09T00:00:00,2017-05-09T00:00:00,Zillow,,1086,Business,Real Estate,Social Security Number,2017,"1,000-9,999",0
9706,05/09/2017 12:00:00 AM,05/19/2017 12:00:00 AM,Theft or Mistake,2017-05-09T00:00:00,2017-05-09T00:00:00,Zillow,,1086,Business,Real Estate,Other,2017,"1,000-9,999",0
9707,02/06/2017 12:00:00 AM,05/24/2017 12:00:00 AM,Cyberattack,2016-02-26T00:00:00,2016-12-05T00:00:00,"Incipio, LLC",,1650,Business,Accessories,Name,2017,"1,000-9,999",300-399
9707,02/06/2017 12:00:00 AM,05/24/2017 12:00:00 AM,Cyberattack,2016-02-26T00:00:00,2016-12-05T00:00:00,"Incipio, LLC",,1650,Business,Accessories,Financial & Banking Information,2017,"1,000-9,999",300-399
9707,02/06/2017 12:00:00 AM,05/24/2017 12:00:00 AM,Cyberattack,2016-02-26T00:00:00,2016-12-05T00:00:00,"Incipio, LLC",,1650,Business,Accessories,Other,2017,"1,000-9,999",300-399
9708,05/26/2017 12:00:00 AM,05/26/2017 12:00:00 AM,Unauthorized Access,2013-10-23T00:00:00,2017-03-31T00:00:00,"Kennewick Public Hospital District, dba Trios Health",,942,Health,,Name,2017,500-999,500+
9708,05/26/2017 12:00:00 AM,05/26/2017 12:00:00 AM,Unauthorized Access,2013-10-23T00:00:00,2017-03-31T00:00:00,"Kennewick Public Hospital District, dba Trios Health",,942,Health,,Medical Information,2017,500-999,500+
9710,04/18/2017 12:00:00 AM,06/05/2017 12:00:00 AM,Unauthorized Access,2016-08-10T00:00:00,2017-02-09T00:00:00,"GameStop, Inc.",,27956,Business,Retail,Name,2017,"10,000-49,999",200-299
9710,04/18/2017 12:00:00 AM,06/05/2017 12:00:00 AM,Unauthorized Access,2016-08-10T00:00:00,2017-02-09T00:00:00,"GameStop, Inc.",,27956,Business,Retail,Financial & Banking Information,2017,"10,000-49,999",200-299
9710,04/18/2017 12:00:00 AM,06/05/2017 12:00:00 AM,Unauthorized Access,2016-08-10T00:00:00,2017-02-09T00:00:00,"GameStop, Inc.",,27956,Business,Retail,Other,2017,"10,000-49,999",200-299
9712,04/26/2017 12:00:00 AM,06/08/2017 12:00:00 AM,Theft or Mistake,,,Washington State University,,769088,Education,,Name,2017,"50,000-999,999",Unknown
9712,04/26/2017 12:00:00 AM,06/08/2017 12:00:00 AM,Theft or Mistake,,,Washington State University,,769088,Education,,Social Security Number,2017,"50,000-999,999",Unknown
9712,04/26/2017 12:00:00 AM,06/08/2017 12:00:00 AM,Theft or Mistake,,,Washington State University,,769088,Education,,Medical Information,2017,"50,000-999,999",Unknown
9712,04/26/2017 12:00:00 AM,06/08/2017 12:00:00 AM,Theft or Mistake,,,Washington State University,,769088,Education,,Other,2017,"50,000-999,999",Unknown
9714,05/17/2017 12:00:00 AM,06/20/2017 12:00:00 AM,Cyberattack,2016-11-01T00:00:00,2017-03-30T00:00:00,Home Point Financial Corporation,Phishing,815,Finance,,Name,2017,500-999,100-199
9714,05/17/2017 12:00:00 AM,06/20/2017 12:00:00 AM,Cyberattack,2016-11-01T00:00:00,2017-03-30T00:00:00,Home Point Financial Corporation,Phishing,815,Finance,,Social Security Number,2017,500-999,100-199
9714,05/17/2017 12:00:00 AM,06/20/2017 12:00:00 AM,Cyberattack,2016-11-01T00:00:00,2017-03-30T00:00:00,Home Point Financial Corporation,Phishing,815,Finance,,Driver's License or Washington ID Card Number,2017,500-999,100-199
9714,05/17/2017 12:00:00 AM,06/20/2017 12:00:00 AM,Cyberattack,2016-11-01T00:00:00,2017-03-30T00:00:00,Home Point Financial Corporation,Phishing,815,Finance,,Financial & Banking Information,2017,500-999,100-199
9714,05/17/2017 12:00:00 AM,06/20/2017 12:00:00 AM,Cyberattack,2016-11-01T00:00:00,2017-03-30T00:00:00,Home Point Financial Corporation,Phishing,815,Finance,,Full Date of Birth,2017,500-999,100-199
9714,05/17/2017 12:00:00 AM,06/20/2017 12:00:00 AM,Cyberattack,2016-11-01T00:00:00,2017-03-30T00:00:00,Home Point Financial Corporation,Phishing,815,Finance,,Other,2017,500-999,100-199
9716,03/14/2017 12:00:00 AM,06/22/2017 12:00:00 AM,Unauthorized Access,,,Caliber Home Loans,,20437,Finance,,Name,2017,"10,000-49,999",Unknown
9716,03/14/2017 12:00:00 AM,06/22/2017 12:00:00 AM,Unauthorized Access,,,Caliber Home Loans,,20437,Finance,,Social Security Number,2017,"10,000-49,999",Unknown
9716,03/14/2017 12:00:00 AM,06/22/2017 12:00:00 AM,Unauthorized Access,,,Caliber Home Loans,,20437,Finance,,Driver's License or Washington ID Card Number,2017,"10,000-49,999",Unknown
9716,03/14/2017 12:00:00 AM,06/22/2017 12:00:00 AM,Unauthorized Access,,,Caliber Home Loans,,20437,Finance,,Financial & Banking Information,2017,"10,000-49,999",Unknown
9716,03/14/2017 12:00:00 AM,06/22/2017 12:00:00 AM,Unauthorized Access,,,Caliber Home Loans,,20437,Finance,,Full Date of Birth,2017,"10,000-49,999",Unknown
9716,03/14/2017 12:00:00 AM,06/22/2017 12:00:00 AM,Unauthorized Access,,,Caliber Home Loans,,20437,Finance,,Unique Private Key (e.g. used to authenticate or sign an electronic record),2017,"10,000-49,999",Unknown
9716,03/14/2017 12:00:00 AM,06/22/2017 12:00:00 AM,Unauthorized Access,,,Caliber Home Loans,,20437,Finance,,Military ID Number,2017,"10,000-49,999",Unknown
9717,06/06/2017 12:00:00 AM,06/30/2017 12:00:00 AM,Unauthorized Access,2016-08-10T00:00:00,2017-03-09T00:00:00,Preferred Hotel Group,,2370,Business,Hospitality,Name,2017,"1,000-9,999",300-399
9717,06/06/2017 12:00:00 AM,06/30/2017 12:00:00 AM,Unauthorized Access,2016-08-10T00:00:00,2017-03-09T00:00:00,Preferred Hotel Group,,2370,Business,Hospitality,Financial & Banking Information,2017,"1,000-9,999",300-399
9718,06/06/2017 12:00:00 AM,07/05/2017 12:00:00 AM,Cyberattack,2016-08-29T00:00:00,2017-03-09T00:00:00,Loews Hotels & Co. ,Malware,912,Business,Hospitality,Name,2017,500-999,200-299
9718,06/06/2017 12:00:00 AM,07/05/2017 12:00:00 AM,Cyberattack,2016-08-29T00:00:00,2017-03-09T00:00:00,Loews Hotels & Co. ,Malware,912,Business,Hospitality,Financial & Banking Information,2017,500-999,200-299
9718,06/06/2017 12:00:00 AM,07/05/2017 12:00:00 AM,Cyberattack,2016-08-29T00:00:00,2017-03-09T00:00:00,Loews Hotels & Co. ,Malware,912,Business,Hospitality,Other,2017,500-999,200-299
9719,06/06/2017 12:00:00 AM,07/06/2017 12:00:00 AM,Cyberattack,2016-08-10T00:00:00,2017-03-09T00:00:00,Four Seasons Hotels Limited,,636,Business,Hospitality,Name,2017,500-999,300-399
9719,06/06/2017 12:00:00 AM,07/06/2017 12:00:00 AM,Cyberattack,2016-08-10T00:00:00,2017-03-09T00:00:00,Four Seasons Hotels Limited,,636,Business,Hospitality,Financial & Banking Information,2017,500-999,300-399
9719,06/06/2017 12:00:00 AM,07/06/2017 12:00:00 AM,Cyberattack,2016-08-10T00:00:00,2017-03-09T00:00:00,Four Seasons Hotels Limited,,636,Business,Hospitality,Other,2017,500-999,300-399
9720,06/13/2017 12:00:00 AM,07/10/2017 12:00:00 AM,Cyberattack,2017-06-13T00:00:00,2017-06-21T00:00:00,Pacific Science Center,Phishing,605,Business,Entertainment,Name,2017,500-999,1-99
9720,06/13/2017 12:00:00 AM,07/10/2017 12:00:00 AM,Cyberattack,2017-06-13T00:00:00,2017-06-21T00:00:00,Pacific Science Center,Phishing,605,Business,Entertainment,Social Security Number,2017,500-999,1-99
9720,06/13/2017 12:00:00 AM,07/10/2017 12:00:00 AM,Cyberattack,2017-06-13T00:00:00,2017-06-21T00:00:00,Pacific Science Center,Phishing,605,Business,Entertainment,Other,2017,500-999,1-99
9723,06/06/2017 12:00:00 AM,08/03/2017 12:00:00 AM,Cyberattack,2016-08-10T00:00:00,2017-03-09T00:00:00,"Two Roads Hospitality, LLC",Malware,5401,Business,Hospitality,Name,2018,"1,000-9,999",300-399
9723,06/06/2017 12:00:00 AM,08/03/2017 12:00:00 AM,Cyberattack,2016-08-10T00:00:00,2017-03-09T00:00:00,"Two Roads Hospitality, LLC",Malware,5401,Business,Hospitality,Financial & Banking Information,2018,"1,000-9,999",300-399
9723,06/06/2017 12:00:00 AM,08/03/2017 12:00:00 AM,Cyberattack,2016-08-10T00:00:00,2017-03-09T00:00:00,"Two Roads Hospitality, LLC",Malware,5401,Business,Hospitality,Other,2018,"1,000-9,999",300-399
9724,06/08/2017 12:00:00 AM,07/21/2017 12:00:00 AM,Cyberattack,,,Value Eyecare Network,Malware,2696,Business,Accessories,Name,2017,"1,000-9,999",Unknown
9724,06/08/2017 12:00:00 AM,07/21/2017 12:00:00 AM,Cyberattack,,,Value Eyecare Network,Malware,2696,Business,Accessories,Financial & Banking Information,2017,"1,000-9,999",Unknown
9724,06/08/2017 12:00:00 AM,07/21/2017 12:00:00 AM,Cyberattack,,,Value Eyecare Network,Malware,2696,Business,Accessories,Other,2017,"1,000-9,999",Unknown
9725,06/25/2017 12:00:00 AM,07/18/2017 12:00:00 AM,Unauthorized Access,2017-05-06T00:00:00,2017-05-10T00:00:00,"Keller Williams Realty, Inc.",,9425,Business,Real Estate,Name,2017,"1,000-9,999",1-99
9725,06/25/2017 12:00:00 AM,07/18/2017 12:00:00 AM,Unauthorized Access,2017-05-06T00:00:00,2017-05-10T00:00:00,"Keller Williams Realty, Inc.",,9425,Business,Real Estate,Social Security Number,2017,"1,000-9,999",1-99
9725,06/25/2017 12:00:00 AM,07/18/2017 12:00:00 AM,Unauthorized Access,2017-05-06T00:00:00,2017-05-10T00:00:00,"Keller Williams Realty, Inc.",,9425,Business,Real Estate,Username and Password/Security Question Answers,2017,"1,000-9,999",1-99
9725,06/25/2017 12:00:00 AM,07/18/2017 12:00:00 AM,Unauthorized Access,2017-05-06T00:00:00,2017-05-10T00:00:00,"Keller Williams Realty, Inc.",,9425,Business,Real Estate,Other,2017,"1,000-9,999",1-99
9728,06/26/2017 12:00:00 AM,07/26/2017 12:00:00 AM,Cyberattack,2016-12-21T00:00:00,2017-04-11T00:00:00,Al J. Schneider Company (Galt House Hotel),Skimmers,791,Business,Hospitality,Name,2018,500-999,100-199
9728,06/26/2017 12:00:00 AM,07/26/2017 12:00:00 AM,Cyberattack,2016-12-21T00:00:00,2017-04-11T00:00:00,Al J. Schneider Company (Galt House Hotel),Skimmers,791,Business,Hospitality,Financial & Banking Information,2018,500-999,100-199
9729,05/02/2017 12:00:00 AM,07/26/2017 12:00:00 AM,Cyberattack,,,Steel Technologies LLC (Hydro Flask Brand),Other,1780,Business,Manufacturing,Name,2018,"1,000-9,999",Unknown
9729,05/02/2017 12:00:00 AM,07/26/2017 12:00:00 AM,Cyberattack,,,Steel Technologies LLC (Hydro Flask Brand),Other,1780,Business,Manufacturing,Financial & Banking Information,2018,"1,000-9,999",Unknown
9729,05/02/2017 12:00:00 AM,07/26/2017 12:00:00 AM,Cyberattack,,,Steel Technologies LLC (Hydro Flask Brand),Other,1780,Business,Manufacturing,Other,2018,"1,000-9,999",Unknown
9730,06/06/2017 12:00:00 AM,07/28/2017 12:00:00 AM,Unauthorized Access,2016-08-10T00:00:00,2017-03-09T00:00:00,Noble House Hotels & Resorts,,523,Business,Hospitality,Name,2018,500-999,300-399
9730,06/06/2017 12:00:00 AM,07/28/2017 12:00:00 AM,Unauthorized Access,2016-08-10T00:00:00,2017-03-09T00:00:00,Noble House Hotels & Resorts,,523,Business,Hospitality,Financial & Banking Information,2018,500-999,300-399
9730,06/06/2017 12:00:00 AM,07/28/2017 12:00:00 AM,Unauthorized Access,2016-08-10T00:00:00,2017-03-09T00:00:00,Noble House Hotels & Resorts,,523,Business,Hospitality,Other,2018,500-999,300-399
9731,06/06/2017 12:00:00 AM,08/03/2017 12:00:00 AM,Unauthorized Access,2016-08-10T00:00:00,2017-03-09T00:00:00,Silver Cloud Inns & Hotels,,1382,Business,Hospitality,Name,2018,"1,000-9,999",300-399
9731,06/06/2017 12:00:00 AM,08/03/2017 12:00:00 AM,Unauthorized Access,2016-08-10T00:00:00,2017-03-09T00:00:00,Silver Cloud Inns & Hotels,,1382,Business,Hospitality,Financial & Banking Information,2018,"1,000-9,999",300-399
9732,06/26/2017 12:00:00 AM,08/14/2017 12:00:00 AM,Cyberattack,,,TRUEbenefits LLC,Phishing,12327,Business,Human Resources,Name,2018,"10,000-49,999",Unknown
9732,06/26/2017 12:00:00 AM,08/14/2017 12:00:00 AM,Cyberattack,,,TRUEbenefits LLC,Phishing,12327,Business,Human Resources,Social Security Number,2018,"10,000-49,999",Unknown
9732,06/26/2017 12:00:00 AM,08/14/2017 12:00:00 AM,Cyberattack,,,TRUEbenefits LLC,Phishing,12327,Business,Human Resources,Health Insurance Policy or ID Number,2018,"10,000-49,999",Unknown
9732,06/26/2017 12:00:00 AM,08/14/2017 12:00:00 AM,Cyberattack,,,TRUEbenefits LLC,Phishing,12327,Business,Human Resources,Medical Information,2018,"10,000-49,999",Unknown
9733,08/15/2017 12:00:00 AM,08/24/2017 12:00:00 AM,Theft or Mistake,2016-12-01T00:00:00,2016-12-01T00:00:00,Green River Community College,,3399,Education,,Name,2018,"1,000-9,999",200-299
9733,08/15/2017 12:00:00 AM,08/24/2017 12:00:00 AM,Theft or Mistake,2016-12-01T00:00:00,2016-12-01T00:00:00,Green River Community College,,3399,Education,,Social Security Number,2018,"1,000-9,999",200-299
9734,07/18/2017 12:00:00 AM,08/31/2017 12:00:00 AM,Theft or Mistake,,,Timberland Bank,,5688,Finance,,Name,2018,"1,000-9,999",Unknown
9734,07/18/2017 12:00:00 AM,08/31/2017 12:00:00 AM,Theft or Mistake,,,Timberland Bank,,5688,Finance,,Social Security Number,2018,"1,000-9,999",Unknown
9734,07/18/2017 12:00:00 AM,08/31/2017 12:00:00 AM,Theft or Mistake,,,Timberland Bank,,5688,Finance,,Driver's License or Washington ID Card Number,2018,"1,000-9,999",Unknown
9734,07/18/2017 12:00:00 AM,08/31/2017 12:00:00 AM,Theft or Mistake,,,Timberland Bank,,5688,Finance,,Financial & Banking Information,2018,"1,000-9,999",Unknown
9734,07/18/2017 12:00:00 AM,08/31/2017 12:00:00 AM,Theft or Mistake,,,Timberland Bank,,5688,Finance,,Other,2018,"1,000-9,999",Unknown
9737,08/23/2017 12:00:00 AM,09/18/2017 12:00:00 AM,Theft or Mistake,2017-08-23T00:00:00,2017-08-23T00:00:00,"W.W. Grainger, Inc.",,725,Business,Manufacturing,Name,2018,500-999,0
9737,08/23/2017 12:00:00 AM,09/18/2017 12:00:00 AM,Theft or Mistake,2017-08-23T00:00:00,2017-08-23T00:00:00,"W.W. Grainger, Inc.",,725,Business,Manufacturing,Social Security Number,2018,500-999,0
9737,08/23/2017 12:00:00 AM,09/18/2017 12:00:00 AM,Theft or Mistake,2017-08-23T00:00:00,2017-08-23T00:00:00,"W.W. Grainger, Inc.",,725,Business,Manufacturing,Other,2018,500-999,0
9740,08/30/2017 12:00:00 AM,10/03/2017 12:00:00 AM,Unauthorized Access,,,"FlexShopper, LLC",,2396,Business,Retail,Name,2018,"1,000-9,999",Unknown
9740,08/30/2017 12:00:00 AM,10/03/2017 12:00:00 AM,Unauthorized Access,,,"FlexShopper, LLC",,2396,Business,Retail,Social Security Number,2018,"1,000-9,999",Unknown
9740,08/30/2017 12:00:00 AM,10/03/2017 12:00:00 AM,Unauthorized Access,,,"FlexShopper, LLC",,2396,Business,Retail,Financial & Banking Information,2018,"1,000-9,999",Unknown
9740,08/30/2017 12:00:00 AM,10/03/2017 12:00:00 AM,Unauthorized Access,,,"FlexShopper, LLC",,2396,Business,Retail,Email Address and Password/Security Question Answers,2018,"1,000-9,999",Unknown
9740,08/30/2017 12:00:00 AM,10/03/2017 12:00:00 AM,Unauthorized Access,,,"FlexShopper, LLC",,2396,Business,Retail,Other,2018,"1,000-9,999",Unknown
9742,09/06/2017 12:00:00 AM,10/06/2017 12:00:00 AM,Cyberattack,2017-07-31T00:00:00,2017-08-28T00:00:00,Catholic United Financial,Malware,704,Finance,,Name,2018,500-999,1-99
9742,09/06/2017 12:00:00 AM,10/06/2017 12:00:00 AM,Cyberattack,2017-07-31T00:00:00,2017-08-28T00:00:00,Catholic United Financial,Malware,704,Finance,,Social Security Number,2018,500-999,1-99
9742,09/06/2017 12:00:00 AM,10/06/2017 12:00:00 AM,Cyberattack,2017-07-31T00:00:00,2017-08-28T00:00:00,Catholic United Financial,Malware,704,Finance,,Financial & Banking Information,2018,500-999,1-99
9742,09/06/2017 12:00:00 AM,10/06/2017 12:00:00 AM,Cyberattack,2017-07-31T00:00:00,2017-08-28T00:00:00,Catholic United Financial,Malware,704,Finance,,Other,2018,500-999,1-99
9743,09/13/2017 12:00:00 AM,10/06/2017 12:00:00 AM,Cyberattack,2017-05-27T00:00:00,2017-07-12T00:00:00,"Provo Craft & Novelty, Inc.",,773,Business,Manufacturing,Name,2018,500-999,100-199
9743,09/13/2017 12:00:00 AM,10/06/2017 12:00:00 AM,Cyberattack,2017-05-27T00:00:00,2017-07-12T00:00:00,"Provo Craft & Novelty, Inc.",,773,Business,Manufacturing,Financial & Banking Information,2018,500-999,100-199
9743,09/13/2017 12:00:00 AM,10/06/2017 12:00:00 AM,Cyberattack,2017-05-27T00:00:00,2017-07-12T00:00:00,"Provo Craft & Novelty, Inc.",,773,Business,Manufacturing,Other,2018,500-999,100-199
9744,08/11/2017 12:00:00 AM,10/06/2017 12:00:00 AM,Cyberattack,2017-04-25T00:00:00,2017-08-29T00:00:00,Tommie Copper Inc.,Malware,695,Business,Clothing,Name,2018,500-999,100-199
9744,08/11/2017 12:00:00 AM,10/06/2017 12:00:00 AM,Cyberattack,2017-04-25T00:00:00,2017-08-29T00:00:00,Tommie Copper Inc.,Malware,695,Business,Clothing,Financial & Banking Information,2018,500-999,100-199
9745,10/05/2017 12:00:00 AM,10/16/2017 12:00:00 AM,Unauthorized Access,2017-10-01T00:00:00,2017-10-02T00:00:00,"Pizza Hut, LLC",,1896,Business,Hospitality,Name,2018,"1,000-9,999",1-99
9745,10/05/2017 12:00:00 AM,10/16/2017 12:00:00 AM,Unauthorized Access,2017-10-01T00:00:00,2017-10-02T00:00:00,"Pizza Hut, LLC",,1896,Business,Hospitality,Financial & Banking Information,2018,"1,000-9,999",1-99
9745,10/05/2017 12:00:00 AM,10/16/2017 12:00:00 AM,Unauthorized Access,2017-10-01T00:00:00,2017-10-02T00:00:00,"Pizza Hut, LLC",,1896,Business,Hospitality,Other,2018,"1,000-9,999",1-99
9746,09/23/2017 12:00:00 AM,10/20/2017 12:00:00 AM,Cyberattack,2017-03-10T00:00:00,2017-09-28T00:00:00,"Whole Foods Market Services, Inc.",Malware,,Business,Retail,Name,2018,Unknown,200-299
9746,09/23/2017 12:00:00 AM,10/20/2017 12:00:00 AM,Cyberattack,2017-03-10T00:00:00,2017-09-28T00:00:00,"Whole Foods Market Services, Inc.",Malware,,Business,Retail,Financial & Banking Information,2018,Unknown,200-299
9747,09/27/2017 12:00:00 AM,10/30/2017 12:00:00 AM,Unauthorized Access,2017-09-27T00:00:00,2017-09-27T00:00:00,HumanGood,,642,Non-Profit/Charity,,Name,2018,500-999,0
9747,09/27/2017 12:00:00 AM,10/30/2017 12:00:00 AM,Unauthorized Access,2017-09-27T00:00:00,2017-09-27T00:00:00,HumanGood,,642,Non-Profit/Charity,,Medical Information,2018,500-999,0
9747,09/27/2017 12:00:00 AM,10/30/2017 12:00:00 AM,Unauthorized Access,2017-09-27T00:00:00,2017-09-27T00:00:00,HumanGood,,642,Non-Profit/Charity,,Other,2018,500-999,0
9748,09/07/2017 12:00:00 AM,11/03/2017 12:00:00 AM,Cyberattack,2017-09-07T00:00:00,2017-09-07T00:00:00,"Tween Brands, Inc.",Other,2477,Business,Clothing,Name,2018,"1,000-9,999",0
9748,09/07/2017 12:00:00 AM,11/03/2017 12:00:00 AM,Cyberattack,2017-09-07T00:00:00,2017-09-07T00:00:00,"Tween Brands, Inc.",Other,2477,Business,Clothing,Social Security Number,2018,"1,000-9,999",0
9750,09/20/2017 12:00:00 AM,11/15/2017 12:00:00 AM,Theft or Mistake,2017-09-20T00:00:00,2017-09-20T00:00:00,Western State Hospital,,515,Health,,Name,2018,500-999,0
9750,09/20/2017 12:00:00 AM,11/15/2017 12:00:00 AM,Theft or Mistake,2017-09-20T00:00:00,2017-09-20T00:00:00,Western State Hospital,,515,Health,,Medical Information,2018,500-999,0
9752,11/15/2016 12:00:00 AM,11/21/2017 12:00:00 AM,Cyberattack,2016-10-13T00:00:00,2016-11-15T00:00:00,"Uber Technologies, Inc.",,10888,Business,Transportation,Name,2018,"10,000-49,999",1-99
9752,11/15/2016 12:00:00 AM,11/21/2017 12:00:00 AM,Cyberattack,2016-10-13T00:00:00,2016-11-15T00:00:00,"Uber Technologies, Inc.",,10888,Business,Transportation,Driver's License or Washington ID Card Number,2018,"10,000-49,999",1-99
9753,,11/27/2017 12:00:00 AM,Cyberattack,2016-10-26T00:00:00,2017-10-19T00:00:00,"Bulletproof 360, Inc.",Malware,4077,Business,Consumable,Name,2018,"1,000-9,999",Unknown
9753,,11/27/2017 12:00:00 AM,Cyberattack,2016-10-26T00:00:00,2017-10-19T00:00:00,"Bulletproof 360, Inc.",Malware,4077,Business,Consumable,Financial & Banking Information,2018,"1,000-9,999",Unknown
9753,,11/27/2017 12:00:00 AM,Cyberattack,2016-10-26T00:00:00,2017-10-19T00:00:00,"Bulletproof 360, Inc.",Malware,4077,Business,Consumable,Other,2018,"1,000-9,999",Unknown
9754,09/06/2017 12:00:00 AM,12/01/2017 12:00:00 AM,Unauthorized Access,2016-06-15T00:00:00,2017-11-06T00:00:00,JAM Paper & Envelope,,590,Business,Manufacturing,Name,2018,500-999,500+
9754,09/06/2017 12:00:00 AM,12/01/2017 12:00:00 AM,Unauthorized Access,2016-06-15T00:00:00,2017-11-06T00:00:00,JAM Paper & Envelope,,590,Business,Manufacturing,Financial & Banking Information,2018,500-999,500+
9754,09/06/2017 12:00:00 AM,12/01/2017 12:00:00 AM,Unauthorized Access,2016-06-15T00:00:00,2017-11-06T00:00:00,JAM Paper & Envelope,,590,Business,Manufacturing,Other,2018,500-999,500+
9755,10/06/2017 12:00:00 AM,12/11/2017 12:00:00 AM,Cyberattack,2015-07-01T00:00:00,2017-10-06T00:00:00,"Combat Brands, LLC",Malware,956,Business,Fitness,Name,2018,500-999,500+
9755,10/06/2017 12:00:00 AM,12/11/2017 12:00:00 AM,Cyberattack,2015-07-01T00:00:00,2017-10-06T00:00:00,"Combat Brands, LLC",Malware,956,Business,Fitness,Financial & Banking Information,2018,500-999,500+
9756,12/11/2017 12:00:00 AM,12/22/2017 12:00:00 AM,Unauthorized Access,2017-04-25T00:00:00,,"LiveGlam, Inc.",,600,Business,Cosmetic,Name,2018,500-999,Unknown
9756,12/11/2017 12:00:00 AM,12/22/2017 12:00:00 AM,Unauthorized Access,2017-04-25T00:00:00,,"LiveGlam, Inc.",,600,Business,Cosmetic,Financial & Banking Information,2018,500-999,Unknown
9756,12/11/2017 12:00:00 AM,12/22/2017 12:00:00 AM,Unauthorized Access,2017-04-25T00:00:00,,"LiveGlam, Inc.",,600,Business,Cosmetic,Other,2018,500-999,Unknown
9757,11/10/2017 12:00:00 AM,12/22/2017 12:00:00 AM,Unauthorized Access,,,"TIO Networks USA, Inc.",,1962,Finance,,Name,2018,"1,000-9,999",Unknown
9757,11/10/2017 12:00:00 AM,12/22/2017 12:00:00 AM,Unauthorized Access,,,"TIO Networks USA, Inc.",,1962,Finance,,Social Security Number,2018,"1,000-9,999",Unknown
9757,11/10/2017 12:00:00 AM,12/22/2017 12:00:00 AM,Unauthorized Access,,,"TIO Networks USA, Inc.",,1962,Finance,,Driver's License or Washington ID Card Number,2018,"1,000-9,999",Unknown
9757,11/10/2017 12:00:00 AM,12/22/2017 12:00:00 AM,Unauthorized Access,,,"TIO Networks USA, Inc.",,1962,Finance,,Financial & Banking Information,2018,"1,000-9,999",Unknown
9757,11/10/2017 12:00:00 AM,12/22/2017 12:00:00 AM,Unauthorized Access,,,"TIO Networks USA, Inc.",,1962,Finance,,Username and Password/Security Question Answers,2018,"1,000-9,999",Unknown
9757,11/10/2017 12:00:00 AM,12/22/2017 12:00:00 AM,Unauthorized Access,,,"TIO Networks USA, Inc.",,1962,Finance,,Other,2018,"1,000-9,999",Unknown
9759,12/05/2017 12:00:00 AM,01/02/2018 12:00:00 AM,Unauthorized Access,2017-12-02T00:00:00,2017-12-02T00:00:00,Multnomah Athletic Club,,661,Business,Fitness,Name,2018,500-999,1-99
9759,12/05/2017 12:00:00 AM,01/02/2018 12:00:00 AM,Unauthorized Access,2017-12-02T00:00:00,2017-12-02T00:00:00,Multnomah Athletic Club,,661,Business,Fitness,Social Security Number,2018,500-999,1-99
9759,12/05/2017 12:00:00 AM,01/02/2018 12:00:00 AM,Unauthorized Access,2017-12-02T00:00:00,2017-12-02T00:00:00,Multnomah Athletic Club,,661,Business,Fitness,Driver's License or Washington ID Card Number,2018,500-999,1-99
9759,12/05/2017 12:00:00 AM,01/02/2018 12:00:00 AM,Unauthorized Access,2017-12-02T00:00:00,2017-12-02T00:00:00,Multnomah Athletic Club,,661,Business,Fitness,Financial & Banking Information,2018,500-999,1-99
9759,12/05/2017 12:00:00 AM,01/02/2018 12:00:00 AM,Unauthorized Access,2017-12-02T00:00:00,2017-12-02T00:00:00,Multnomah Athletic Club,,661,Business,Fitness,Passport Number,2018,500-999,1-99
9759,12/05/2017 12:00:00 AM,01/02/2018 12:00:00 AM,Unauthorized Access,2017-12-02T00:00:00,2017-12-02T00:00:00,Multnomah Athletic Club,,661,Business,Fitness,Other,2018,500-999,1-99
9760,11/29/2017 12:00:00 AM,01/10/2018 12:00:00 AM,Unauthorized Access,,,"talentReef, Inc.",,604,Business,Human Resources,Name,2018,500-999,Unknown
9760,11/29/2017 12:00:00 AM,01/10/2018 12:00:00 AM,Unauthorized Access,,,"talentReef, Inc.",,604,Business,Human Resources,Social Security Number,2018,500-999,Unknown
9760,11/29/2017 12:00:00 AM,01/10/2018 12:00:00 AM,Unauthorized Access,,,"talentReef, Inc.",,604,Business,Human Resources,Driver's License or Washington ID Card Number,2018,500-999,Unknown
9760,11/29/2017 12:00:00 AM,01/10/2018 12:00:00 AM,Unauthorized Access,,,"talentReef, Inc.",,604,Business,Human Resources,Financial & Banking Information,2018,500-999,Unknown
9760,11/29/2017 12:00:00 AM,01/10/2018 12:00:00 AM,Unauthorized Access,,,"talentReef, Inc.",,604,Business,Human Resources,Other,2018,500-999,Unknown
9761,12/22/2017 12:00:00 AM,01/11/2018 12:00:00 AM,Cyberattack,2017-06-08T00:00:00,2017-12-22T00:00:00,"Deli Management, Inc. (Jason's Deli)",Malware,,Business,Hospitality,Name,2018,Unknown,100-199
9761,12/22/2017 12:00:00 AM,01/11/2018 12:00:00 AM,Cyberattack,2017-06-08T00:00:00,2017-12-22T00:00:00,"Deli Management, Inc. (Jason's Deli)",Malware,,Business,Hospitality,Financial & Banking Information,2018,Unknown,100-199
9762,09/13/2017 12:00:00 AM,01/12/2018 12:00:00 AM,Cyberattack,2017-06-09T00:00:00,2017-10-02T00:00:00,"Guarenteed Rate, Inc.",Phishing,2545,Finance,,Name,2018,"1,000-9,999",100-199
9762,09/13/2017 12:00:00 AM,01/12/2018 12:00:00 AM,Cyberattack,2017-06-09T00:00:00,2017-10-02T00:00:00,"Guarenteed Rate, Inc.",Phishing,2545,Finance,,Social Security Number,2018,"1,000-9,999",100-199
9762,09/13/2017 12:00:00 AM,01/12/2018 12:00:00 AM,Cyberattack,2017-06-09T00:00:00,2017-10-02T00:00:00,"Guarenteed Rate, Inc.",Phishing,2545,Finance,,Financial & Banking Information,2018,"1,000-9,999",100-199
9764,11/30/2017 12:00:00 AM,01/25/2018 12:00:00 AM,Theft or Mistake,2017-11-30T00:00:00,2017-11-30T00:00:00,Zachary E. Adkins DDS,,,Health,,Name,2018,Unknown,0
9764,11/30/2017 12:00:00 AM,01/25/2018 12:00:00 AM,Theft or Mistake,2017-11-30T00:00:00,2017-11-30T00:00:00,Zachary E. Adkins DDS,,,Health,,Social Security Number,2018,Unknown,0
9764,11/30/2017 12:00:00 AM,01/25/2018 12:00:00 AM,Theft or Mistake,2017-11-30T00:00:00,2017-11-30T00:00:00,Zachary E. Adkins DDS,,,Health,,Medical Information,2018,Unknown,0
9764,11/30/2017 12:00:00 AM,01/25/2018 12:00:00 AM,Theft or Mistake,2017-11-30T00:00:00,2017-11-30T00:00:00,Zachary E. Adkins DDS,,,Health,,Other,2018,Unknown,0
9765,01/31/2018 12:00:00 AM,02/01/2018 12:00:00 AM,Cyberattack,2018-01-30T00:00:00,2018-01-30T00:00:00,North Beach School District,Phishing,,Education,,Name,2018,Unknown,1-99
9765,01/31/2018 12:00:00 AM,02/01/2018 12:00:00 AM,Cyberattack,2018-01-30T00:00:00,2018-01-30T00:00:00,North Beach School District,Phishing,,Education,,Social Security Number,2018,Unknown,1-99
9765,01/31/2018 12:00:00 AM,02/01/2018 12:00:00 AM,Cyberattack,2018-01-30T00:00:00,2018-01-30T00:00:00,North Beach School District,Phishing,,Education,,Other,2018,Unknown,1-99
9766,12/22/2017 12:00:00 AM,02/05/2018 12:00:00 AM,Theft or Mistake,2017-12-22T00:00:00,2017-12-22T00:00:00,"PAR Electrical Contractors, Inc.",,768,Business,Construction,Name,2018,500-999,0
9766,12/22/2017 12:00:00 AM,02/05/2018 12:00:00 AM,Theft or Mistake,2017-12-22T00:00:00,2017-12-22T00:00:00,"PAR Electrical Contractors, Inc.",,768,Business,Construction,Social Security Number,2018,500-999,0
9766,12/22/2017 12:00:00 AM,02/05/2018 12:00:00 AM,Theft or Mistake,2017-12-22T00:00:00,2017-12-22T00:00:00,"PAR Electrical Contractors, Inc.",,768,Business,Construction,Driver's License or Washington ID Card Number,2018,500-999,0
9766,12/22/2017 12:00:00 AM,02/05/2018 12:00:00 AM,Theft or Mistake,2017-12-22T00:00:00,2017-12-22T00:00:00,"PAR Electrical Contractors, Inc.",,768,Business,Construction,Financial & Banking Information,2018,500-999,0
9766,12/22/2017 12:00:00 AM,02/05/2018 12:00:00 AM,Theft or Mistake,2017-12-22T00:00:00,2017-12-22T00:00:00,"PAR Electrical Contractors, Inc.",,768,Business,Construction,Passport Number,2018,500-999,0
9766,12/22/2017 12:00:00 AM,02/05/2018 12:00:00 AM,Theft or Mistake,2017-12-22T00:00:00,2017-12-22T00:00:00,"PAR Electrical Contractors, Inc.",,768,Business,Construction,Medical Information,2018,500-999,0
9766,12/22/2017 12:00:00 AM,02/05/2018 12:00:00 AM,Theft or Mistake,2017-12-22T00:00:00,2017-12-22T00:00:00,"PAR Electrical Contractors, Inc.",,768,Business,Construction,Other,2018,500-999,0
9767,01/10/2018 12:00:00 AM,02/23/2018 12:00:00 AM,Unauthorized Access,2017-01-20T00:00:00,2018-01-29T00:00:00,North 40 Outfitters,,2671,Business,Retail,Name,2018,"1,000-9,999",300-399
9767,01/10/2018 12:00:00 AM,02/23/2018 12:00:00 AM,Unauthorized Access,2017-01-20T00:00:00,2018-01-29T00:00:00,North 40 Outfitters,,2671,Business,Retail,Financial & Banking Information,2018,"1,000-9,999",300-399
9767,01/10/2018 12:00:00 AM,02/23/2018 12:00:00 AM,Unauthorized Access,2017-01-20T00:00:00,2018-01-29T00:00:00,North 40 Outfitters,,2671,Business,Retail,Username and Password/Security Question Answers,2018,"1,000-9,999",300-399
10614,12/14/2018 12:00:00 AM,02/14/2019 12:00:00 AM,Cyberattack,2018-02-02T00:00:00,2018-11-20T00:00:00,North 40 Outfitters,,2632,Business,Retail,Name,2019,"1,000-9,999",300-399
10614,12/14/2018 12:00:00 AM,02/14/2019 12:00:00 AM,Cyberattack,2018-02-02T00:00:00,2018-11-20T00:00:00,North 40 Outfitters,,2632,Business,Retail,Financial & Banking Information,2019,"1,000-9,999",300-399
10614,12/14/2018 12:00:00 AM,02/14/2019 12:00:00 AM,Cyberattack,2018-02-02T00:00:00,2018-11-20T00:00:00,North 40 Outfitters,,2632,Business,Retail,Username and Password/Security Question Answers,2019,"1,000-9,999",300-399
9768,11/02/2017 12:00:00 AM,02/27/2018 12:00:00 AM,Unauthorized Access,2017-08-14T00:00:00,2017-08-18T00:00:00,FastHealth Corporation,,2876,Health,,Name,2018,"1,000-9,999",1-99
9768,11/02/2017 12:00:00 AM,02/27/2018 12:00:00 AM,Unauthorized Access,2017-08-14T00:00:00,2017-08-18T00:00:00,FastHealth Corporation,,2876,Health,,Social Security Number,2018,"1,000-9,999",1-99
9768,11/02/2017 12:00:00 AM,02/27/2018 12:00:00 AM,Unauthorized Access,2017-08-14T00:00:00,2017-08-18T00:00:00,FastHealth Corporation,,2876,Health,,Driver's License or Washington ID Card Number,2018,"1,000-9,999",1-99
9768,11/02/2017 12:00:00 AM,02/27/2018 12:00:00 AM,Unauthorized Access,2017-08-14T00:00:00,2017-08-18T00:00:00,FastHealth Corporation,,2876,Health,,Financial & Banking Information,2018,"1,000-9,999",1-99
9769,02/14/2018 12:00:00 AM,03/02/2018 12:00:00 AM,Cyberattack,2016-06-01T00:00:00,2017-11-30T00:00:00,Preferred Hotels & Resorts,Malware,21687,Business,Hospitality,Name,2018,"10,000-49,999",500+
9769,02/14/2018 12:00:00 AM,03/02/2018 12:00:00 AM,Cyberattack,2016-06-01T00:00:00,2017-11-30T00:00:00,Preferred Hotels & Resorts,Malware,21687,Business,Hospitality,Financial & Banking Information,2018,"10,000-49,999",500+
9770,08/01/2017 12:00:00 AM,03/08/2018 12:00:00 AM,Cyberattack,,,ABM Industries Incorporated,Phishing,1100,Business,Professional Services,Name,2018,"1,000-9,999",Unknown
9770,08/01/2017 12:00:00 AM,03/08/2018 12:00:00 AM,Cyberattack,,,ABM Industries Incorporated,Phishing,1100,Business,Professional Services,Social Security Number,2018,"1,000-9,999",Unknown
9770,08/01/2017 12:00:00 AM,03/08/2018 12:00:00 AM,Cyberattack,,,ABM Industries Incorporated,Phishing,1100,Business,Professional Services,Financial & Banking Information,2018,"1,000-9,999",Unknown
9770,08/01/2017 12:00:00 AM,03/08/2018 12:00:00 AM,Cyberattack,,,ABM Industries Incorporated,Phishing,1100,Business,Professional Services,Medical Information,2018,"1,000-9,999",Unknown
9770,08/01/2017 12:00:00 AM,03/08/2018 12:00:00 AM,Cyberattack,,,ABM Industries Incorporated,Phishing,1100,Business,Professional Services,Other,2018,"1,000-9,999",Unknown
10618,06/14/2018 12:00:00 AM,03/12/2019 12:00:00 AM,Cyberattack,2018-01-08T00:00:00,2018-08-07T00:00:00,ABM Industries Incorporated,Phishing,846,Business,Other,Name,2019,500-999,200-299
10618,06/14/2018 12:00:00 AM,03/12/2019 12:00:00 AM,Cyberattack,2018-01-08T00:00:00,2018-08-07T00:00:00,ABM Industries Incorporated,Phishing,846,Business,Other,Social Security Number,2019,500-999,200-299
10618,06/14/2018 12:00:00 AM,03/12/2019 12:00:00 AM,Cyberattack,2018-01-08T00:00:00,2018-08-07T00:00:00,ABM Industries Incorporated,Phishing,846,Business,Other,Driver's License or Washington ID Card Number,2019,500-999,200-299
10618,06/14/2018 12:00:00 AM,03/12/2019 12:00:00 AM,Cyberattack,2018-01-08T00:00:00,2018-08-07T00:00:00,ABM Industries Incorporated,Phishing,846,Business,Other,Financial & Banking Information,2019,500-999,200-299
10618,06/14/2018 12:00:00 AM,03/12/2019 12:00:00 AM,Cyberattack,2018-01-08T00:00:00,2018-08-07T00:00:00,ABM Industries Incorporated,Phishing,846,Business,Other,Medical Information,2019,500-999,200-299
9771,02/15/2018 12:00:00 AM,03/15/2018 12:00:00 AM,Theft or Mistake,,,"Parker Staffing Services, LLC",,,Business,Human Resources,Name,2018,Unknown,Unknown
9771,02/15/2018 12:00:00 AM,03/15/2018 12:00:00 AM,Theft or Mistake,,,"Parker Staffing Services, LLC",,,Business,Human Resources,Social Security Number,2018,Unknown,Unknown
9771,02/15/2018 12:00:00 AM,03/15/2018 12:00:00 AM,Theft or Mistake,,,"Parker Staffing Services, LLC",,,Business,Human Resources,Other,2018,Unknown,Unknown
9772,,03/19/2018 12:00:00 AM,Cyberattack,2017-05-15T00:00:00,2018-01-30T00:00:00,"Bronson Nutritionals, LLC",Malware,774,Business,Consumable,Name,2018,500-999,Unknown
9772,,03/19/2018 12:00:00 AM,Cyberattack,2017-05-15T00:00:00,2018-01-30T00:00:00,"Bronson Nutritionals, LLC",Malware,774,Business,Consumable,Financial & Banking Information,2018,500-999,Unknown
9772,,03/19/2018 12:00:00 AM,Cyberattack,2017-05-15T00:00:00,2018-01-30T00:00:00,"Bronson Nutritionals, LLC",Malware,774,Business,Consumable,Other,2018,500-999,Unknown
9773,03/01/2018 12:00:00 AM,03/20/2018 12:00:00 AM,Cyberattack,2017-10-01T00:00:00,2017-12-22T00:00:00,Orbitz,,5013,Business,Hospitality,Name,2018,"1,000-9,999",100-199
9773,03/01/2018 12:00:00 AM,03/20/2018 12:00:00 AM,Cyberattack,2017-10-01T00:00:00,2017-12-22T00:00:00,Orbitz,,5013,Business,Hospitality,Financial & Banking Information,2018,"1,000-9,999",100-199
9773,03/01/2018 12:00:00 AM,03/20/2018 12:00:00 AM,Cyberattack,2017-10-01T00:00:00,2017-12-22T00:00:00,Orbitz,,5013,Business,Hospitality,Other,2018,"1,000-9,999",100-199
9775,02/25/2018 12:00:00 AM,03/27/2018 12:00:00 AM,Cyberattack,2018-02-25T00:00:00,2018-02-25T00:00:00,Manduka,Malware,1634,Business,Fitness,Name,2018,"1,000-9,999",0
9775,02/25/2018 12:00:00 AM,03/27/2018 12:00:00 AM,Cyberattack,2018-02-25T00:00:00,2018-02-25T00:00:00,Manduka,Malware,1634,Business,Fitness,Financial & Banking Information,2018,"1,000-9,999",0
10172,10/08/2020 12:00:00 AM,07/23/2021 12:00:00 AM,Cyberattack,2018-04-05T00:00:00,2021-03-27T00:00:00,Savory Spice,Malware,2785,Business,Retail,Name,2021,"1,000-9,999",500+
10172,10/08/2020 12:00:00 AM,07/23/2021 12:00:00 AM,Cyberattack,2018-04-05T00:00:00,2021-03-27T00:00:00,Savory Spice,Malware,2785,Business,Retail,Financial & Banking Information,2021,"1,000-9,999",500+
10455,03/10/2021 12:00:00 AM,05/03/2021 12:00:00 AM,Cyberattack,2020-12-01T00:00:00,2021-03-08T00:00:00,"Divvy Up, Inc.",Malware,1137,Business,Software,Name,2021,"1,000-9,999",1-99
10455,03/10/2021 12:00:00 AM,05/03/2021 12:00:00 AM,Cyberattack,2020-12-01T00:00:00,2021-03-08T00:00:00,"Divvy Up, Inc.",Malware,1137,Business,Software,Financial & Banking Information,2021,"1,000-9,999",1-99
10455,03/10/2021 12:00:00 AM,05/03/2021 12:00:00 AM,Cyberattack,2020-12-01T00:00:00,2021-03-08T00:00:00,"Divvy Up, Inc.",Malware,1137,Business,Software,Other,2021,"1,000-9,999",1-99
10174,03/10/2021 12:00:00 AM,05/03/2021 12:00:00 AM,Cyberattack,2020-12-01T00:00:00,2021-03-08T00:00:00,"Divvy Up, Inc.",Malware,1012,Business,Retail,Name,2021,"1,000-9,999",1-99
10174,03/10/2021 12:00:00 AM,05/03/2021 12:00:00 AM,Cyberattack,2020-12-01T00:00:00,2021-03-08T00:00:00,"Divvy Up, Inc.",Malware,1012,Business,Retail,Financial & Banking Information,2021,"1,000-9,999",1-99
10176,08/15/2020 12:00:00 AM,01/14/2021 12:00:00 AM,Cyberattack,,,National Western Life Insurance Company,Malware,15556,Finance,,Name,2021,"10,000-49,999",Unknown
10176,08/15/2020 12:00:00 AM,01/14/2021 12:00:00 AM,Cyberattack,,,National Western Life Insurance Company,Malware,15556,Finance,,Social Security Number,2021,"10,000-49,999",Unknown
10176,08/15/2020 12:00:00 AM,01/14/2021 12:00:00 AM,Cyberattack,,,National Western Life Insurance Company,Malware,15556,Finance,,Financial & Banking Information,2021,"10,000-49,999",Unknown
10176,08/15/2020 12:00:00 AM,01/14/2021 12:00:00 AM,Cyberattack,,,National Western Life Insurance Company,Malware,15556,Finance,,Full Date of Birth,2021,"10,000-49,999",Unknown
10176,08/15/2020 12:00:00 AM,01/14/2021 12:00:00 AM,Cyberattack,,,National Western Life Insurance Company,Malware,15556,Finance,,Other,2021,"10,000-49,999",Unknown
10192,07/16/2020 12:00:00 AM,09/14/2020 12:00:00 AM,Cyberattack,2019-09-24T00:00:00,2019-11-14T00:00:00,Baylor Genetics,Phishing,804,Health,,Name,2021,500-999,200-299
10192,07/16/2020 12:00:00 AM,09/14/2020 12:00:00 AM,Cyberattack,2019-09-24T00:00:00,2019-11-14T00:00:00,Baylor Genetics,Phishing,804,Health,,Financial & Banking Information,2021,500-999,200-299
10192,07/16/2020 12:00:00 AM,09/14/2020 12:00:00 AM,Cyberattack,2019-09-24T00:00:00,2019-11-14T00:00:00,Baylor Genetics,Phishing,804,Health,,Full Date of Birth,2021,500-999,200-299
10192,07/16/2020 12:00:00 AM,09/14/2020 12:00:00 AM,Cyberattack,2019-09-24T00:00:00,2019-11-14T00:00:00,Baylor Genetics,Phishing,804,Health,,Medical Information,2021,500-999,200-299
10193,06/29/2020 12:00:00 AM,12/30/2020 12:00:00 AM,Cyberattack,2020-06-04T00:00:00,2020-07-10T00:00:00,International Union of Bricklayers and Allied Craftworkers,Phishing,1053,Non-Profit/Charity,,Name,2021,"1,000-9,999",1-99
10193,06/29/2020 12:00:00 AM,12/30/2020 12:00:00 AM,Cyberattack,2020-06-04T00:00:00,2020-07-10T00:00:00,International Union of Bricklayers and Allied Craftworkers,Phishing,1053,Non-Profit/Charity,,Social Security Number,2021,"1,000-9,999",1-99
10193,06/29/2020 12:00:00 AM,12/30/2020 12:00:00 AM,Cyberattack,2020-06-04T00:00:00,2020-07-10T00:00:00,International Union of Bricklayers and Allied Craftworkers,Phishing,1053,Non-Profit/Charity,,Financial & Banking Information,2021,"1,000-9,999",1-99
10193,06/29/2020 12:00:00 AM,12/30/2020 12:00:00 AM,Cyberattack,2020-06-04T00:00:00,2020-07-10T00:00:00,International Union of Bricklayers and Allied Craftworkers,Phishing,1053,Non-Profit/Charity,,Full Date of Birth,2021,"1,000-9,999",1-99
10193,06/29/2020 12:00:00 AM,12/30/2020 12:00:00 AM,Cyberattack,2020-06-04T00:00:00,2020-07-10T00:00:00,International Union of Bricklayers and Allied Craftworkers,Phishing,1053,Non-Profit/Charity,,Other,2021,"1,000-9,999",1-99
10195,09/07/2020 12:00:00 AM,12/30/2020 12:00:00 AM,Cyberattack,2018-07-01T00:00:00,,Zoetop Business Co. Ltd.,Unclear/unknown,148785,Business,Clothing,Name,2021,"50,000-999,999",Unknown
10195,09/07/2020 12:00:00 AM,12/30/2020 12:00:00 AM,Cyberattack,2018-07-01T00:00:00,,Zoetop Business Co. Ltd.,Unclear/unknown,148785,Business,Clothing,Username and Password/Security Question Answers,2021,"50,000-999,999",Unknown
10195,09/07/2020 12:00:00 AM,12/30/2020 12:00:00 AM,Cyberattack,2018-07-01T00:00:00,,Zoetop Business Co. Ltd.,Unclear/unknown,148785,Business,Clothing,Other,2021,"50,000-999,999",Unknown
10199,08/10/2020 12:00:00 AM,08/24/2020 12:00:00 AM,Unauthorized Access,,,Arbiter Sports,,16465,Business,Software,Name,2021,"10,000-49,999",Unknown
10199,08/10/2020 12:00:00 AM,08/24/2020 12:00:00 AM,Unauthorized Access,,,Arbiter Sports,,16465,Business,Software,Social Security Number,2021,"10,000-49,999",Unknown
10199,08/10/2020 12:00:00 AM,08/24/2020 12:00:00 AM,Unauthorized Access,,,Arbiter Sports,,16465,Business,Software,Full Date of Birth,2021,"10,000-49,999",Unknown
10199,08/10/2020 12:00:00 AM,08/24/2020 12:00:00 AM,Unauthorized Access,,,Arbiter Sports,,16465,Business,Software,Username and Password/Security Question Answers,2021,"10,000-49,999",Unknown
10199,08/10/2020 12:00:00 AM,08/24/2020 12:00:00 AM,Unauthorized Access,,,Arbiter Sports,,16465,Business,Software,Email Address and Password/Security Question Answers,2021,"10,000-49,999",Unknown
10200,06/26/2020 12:00:00 AM,07/24/2020 12:00:00 AM,Cyberattack,,,City of Redmond,,2851,Government,,Name,2021,"1,000-9,999",Unknown
10200,06/26/2020 12:00:00 AM,07/24/2020 12:00:00 AM,Cyberattack,,,City of Redmond,,2851,Government,,Social Security Number,2021,"1,000-9,999",Unknown
10200,06/26/2020 12:00:00 AM,07/24/2020 12:00:00 AM,Cyberattack,,,City of Redmond,,2851,Government,,Driver's License or Washington ID Card Number,2021,"1,000-9,999",Unknown
10200,06/26/2020 12:00:00 AM,07/24/2020 12:00:00 AM,Cyberattack,,,City of Redmond,,2851,Government,,Full Date of Birth,2021,"1,000-9,999",Unknown
10200,06/26/2020 12:00:00 AM,07/24/2020 12:00:00 AM,Cyberattack,,,City of Redmond,,2851,Government,,Username and Password/Security Question Answers,2021,"1,000-9,999",Unknown
10200,06/26/2020 12:00:00 AM,07/24/2020 12:00:00 AM,Cyberattack,,,City of Redmond,,2851,Government,,Email Address and Password/Security Question Answers,2021,"1,000-9,999",Unknown
10200,06/26/2020 12:00:00 AM,07/24/2020 12:00:00 AM,Cyberattack,,,City of Redmond,,2851,Government,,Other,2021,"1,000-9,999",Unknown
10201,09/18/2019 12:00:00 AM,07/24/2020 12:00:00 AM,Theft or Mistake,2019-09-18T00:00:00,2019-09-18T00:00:00,Entercom Communications Corp.,,2730,Business,Entertainment,Name,2021,"1,000-9,999",0
10201,09/18/2019 12:00:00 AM,07/24/2020 12:00:00 AM,Theft or Mistake,2019-09-18T00:00:00,2019-09-18T00:00:00,Entercom Communications Corp.,,2730,Business,Entertainment,Social Security Number,2021,"1,000-9,999",0
10201,09/18/2019 12:00:00 AM,07/24/2020 12:00:00 AM,Theft or Mistake,2019-09-18T00:00:00,2019-09-18T00:00:00,Entercom Communications Corp.,,2730,Business,Entertainment,Driver's License or Washington ID Card Number,2021,"1,000-9,999",0
10201,09/18/2019 12:00:00 AM,07/24/2020 12:00:00 AM,Theft or Mistake,2019-09-18T00:00:00,2019-09-18T00:00:00,Entercom Communications Corp.,,2730,Business,Entertainment,Financial & Banking Information,2021,"1,000-9,999",0
10201,09/18/2019 12:00:00 AM,07/24/2020 12:00:00 AM,Theft or Mistake,2019-09-18T00:00:00,2019-09-18T00:00:00,Entercom Communications Corp.,,2730,Business,Entertainment,Other,2021,"1,000-9,999",0
10202,06/25/2020 12:00:00 AM,07/24/2020 12:00:00 AM,Unauthorized Access,2019-07-26T00:00:00,2019-11-18T00:00:00,Ply Gem Residential Solutions,,2841,Business,Home,Name,2021,"1,000-9,999",300-399
10202,06/25/2020 12:00:00 AM,07/24/2020 12:00:00 AM,Unauthorized Access,2019-07-26T00:00:00,2019-11-18T00:00:00,Ply Gem Residential Solutions,,2841,Business,Home,Social Security Number,2021,"1,000-9,999",300-399
10202,06/25/2020 12:00:00 AM,07/24/2020 12:00:00 AM,Unauthorized Access,2019-07-26T00:00:00,2019-11-18T00:00:00,Ply Gem Residential Solutions,,2841,Business,Home,Driver's License or Washington ID Card Number,2021,"1,000-9,999",300-399
10202,06/25/2020 12:00:00 AM,07/24/2020 12:00:00 AM,Unauthorized Access,2019-07-26T00:00:00,2019-11-18T00:00:00,Ply Gem Residential Solutions,,2841,Business,Home,Financial & Banking Information,2021,"1,000-9,999",300-399
10202,06/25/2020 12:00:00 AM,07/24/2020 12:00:00 AM,Unauthorized Access,2019-07-26T00:00:00,2019-11-18T00:00:00,Ply Gem Residential Solutions,,2841,Business,Home,Full Date of Birth,2021,"1,000-9,999",300-399
10202,06/25/2020 12:00:00 AM,07/24/2020 12:00:00 AM,Unauthorized Access,2019-07-26T00:00:00,2019-11-18T00:00:00,Ply Gem Residential Solutions,,2841,Business,Home,Medical Information,2021,"1,000-9,999",300-399
10203,06/01/2020 12:00:00 AM,07/27/2020 12:00:00 AM,Cyberattack,,,CK-12 Foundation,,5017,Non-Profit/Charity,,Username and Password/Security Question Answers,2021,"1,000-9,999",Unknown
10203,06/01/2020 12:00:00 AM,07/27/2020 12:00:00 AM,Cyberattack,,,CK-12 Foundation,,5017,Non-Profit/Charity,,Email Address and Password/Security Question Answers,2021,"1,000-9,999",Unknown
10204,07/16/2020 12:00:00 AM,07/28/2020 12:00:00 AM,Cyberattack,2020-02-07T00:00:00,2020-05-20T00:00:00,French American School of Puget Sound,Ransomware,3172,Education,,Name,2021,"1,000-9,999",100-199
10204,07/16/2020 12:00:00 AM,07/28/2020 12:00:00 AM,Cyberattack,2020-02-07T00:00:00,2020-05-20T00:00:00,French American School of Puget Sound,Ransomware,3172,Education,,Full Date of Birth,2021,"1,000-9,999",100-199
10204,07/16/2020 12:00:00 AM,07/28/2020 12:00:00 AM,Cyberattack,2020-02-07T00:00:00,2020-05-20T00:00:00,French American School of Puget Sound,Ransomware,3172,Education,,Other,2021,"1,000-9,999",100-199
10205,01/05/2020 12:00:00 AM,07/28/2020 12:00:00 AM,Theft or Mistake,2016-01-18T00:00:00,2020-01-08T00:00:00,"Front Rush, LLC",,1982,Business,Other,Social Security Number,2021,"1,000-9,999",500+
10205,01/05/2020 12:00:00 AM,07/28/2020 12:00:00 AM,Theft or Mistake,2016-01-18T00:00:00,2020-01-08T00:00:00,"Front Rush, LLC",,1982,Business,Other,Driver's License or Washington ID Card Number,2021,"1,000-9,999",500+
10205,01/05/2020 12:00:00 AM,07/28/2020 12:00:00 AM,Theft or Mistake,2016-01-18T00:00:00,2020-01-08T00:00:00,"Front Rush, LLC",,1982,Business,Other,Full Date of Birth,2021,"1,000-9,999",500+
10205,01/05/2020 12:00:00 AM,07/28/2020 12:00:00 AM,Theft or Mistake,2016-01-18T00:00:00,2020-01-08T00:00:00,"Front Rush, LLC",,1982,Business,Other,Unique Private Key (e.g. used to authenticate or sign an electronic record),2021,"1,000-9,999",500+
10205,01/05/2020 12:00:00 AM,07/28/2020 12:00:00 AM,Theft or Mistake,2016-01-18T00:00:00,2020-01-08T00:00:00,"Front Rush, LLC",,1982,Business,Other,Student ID Number,2021,"1,000-9,999",500+
10205,01/05/2020 12:00:00 AM,07/28/2020 12:00:00 AM,Theft or Mistake,2016-01-18T00:00:00,2020-01-08T00:00:00,"Front Rush, LLC",,1982,Business,Other,Health Insurance Policy or ID Number,2021,"1,000-9,999",500+
10205,01/05/2020 12:00:00 AM,07/28/2020 12:00:00 AM,Theft or Mistake,2016-01-18T00:00:00,2020-01-08T00:00:00,"Front Rush, LLC",,1982,Business,Other,Medical Information,2021,"1,000-9,999",500+
10205,01/05/2020 12:00:00 AM,07/28/2020 12:00:00 AM,Theft or Mistake,2016-01-18T00:00:00,2020-01-08T00:00:00,"Front Rush, LLC",,1982,Business,Other,Username and Password/Security Question Answers,2021,"1,000-9,999",500+
10205,01/05/2020 12:00:00 AM,07/28/2020 12:00:00 AM,Theft or Mistake,2016-01-18T00:00:00,2020-01-08T00:00:00,"Front Rush, LLC",,1982,Business,Other,Email Address and Password/Security Question Answers,2021,"1,000-9,999",500+
10206,07/16/2020 12:00:00 AM,07/31/2020 12:00:00 AM,Cyberattack,2020-02-07T00:00:00,2020-05-20T00:00:00,Auburn University,Ransomware,1294,Education,,Name,2021,"1,000-9,999",100-199
10206,07/16/2020 12:00:00 AM,07/31/2020 12:00:00 AM,Cyberattack,2020-02-07T00:00:00,2020-05-20T00:00:00,Auburn University,Ransomware,1294,Education,,Full Date of Birth,2021,"1,000-9,999",100-199
10207,07/16/2020 12:00:00 AM,07/31/2020 12:00:00 AM,Cyberattack,2020-02-07T00:00:00,2020-05-20T00:00:00,George W. Bush Presidential Center,Ransomware,6797,Non-Profit/Charity,,Name,2021,"1,000-9,999",100-199
10207,07/16/2020 12:00:00 AM,07/31/2020 12:00:00 AM,Cyberattack,2020-02-07T00:00:00,2020-05-20T00:00:00,George W. Bush Presidential Center,Ransomware,6797,Non-Profit/Charity,,Social Security Number,2021,"1,000-9,999",100-199
10207,07/16/2020 12:00:00 AM,07/31/2020 12:00:00 AM,Cyberattack,2020-02-07T00:00:00,2020-05-20T00:00:00,George W. Bush Presidential Center,Ransomware,6797,Non-Profit/Charity,,Financial & Banking Information,2021,"1,000-9,999",100-199
10207,07/16/2020 12:00:00 AM,07/31/2020 12:00:00 AM,Cyberattack,2020-02-07T00:00:00,2020-05-20T00:00:00,George W. Bush Presidential Center,Ransomware,6797,Non-Profit/Charity,,Full Date of Birth,2021,"1,000-9,999",100-199
10207,07/16/2020 12:00:00 AM,07/31/2020 12:00:00 AM,Cyberattack,2020-02-07T00:00:00,2020-05-20T00:00:00,George W. Bush Presidential Center,Ransomware,6797,Non-Profit/Charity,,Other,2021,"1,000-9,999",100-199
10208,07/16/2020 12:00:00 AM,08/03/2020 12:00:00 AM,Cyberattack,2020-02-07T00:00:00,2020-05-20T00:00:00,"Americares Foundation, Inc.",Ransomware,2444,Non-Profit/Charity,,Name,2021,"1,000-9,999",100-199
10208,07/16/2020 12:00:00 AM,08/03/2020 12:00:00 AM,Cyberattack,2020-02-07T00:00:00,2020-05-20T00:00:00,"Americares Foundation, Inc.",Ransomware,2444,Non-Profit/Charity,,Full Date of Birth,2021,"1,000-9,999",100-199
10208,07/16/2020 12:00:00 AM,08/03/2020 12:00:00 AM,Cyberattack,2020-02-07T00:00:00,2020-05-20T00:00:00,"Americares Foundation, Inc.",Ransomware,2444,Non-Profit/Charity,,Other,2021,"1,000-9,999",100-199
10209,07/02/2020 12:00:00 AM,08/03/2020 12:00:00 AM,Cyberattack,2019-11-22T00:00:00,2020-02-12T00:00:00,"Wrkforce, Inc.",,527,Business,Other,Name,2021,500-999,200-299
10209,07/02/2020 12:00:00 AM,08/03/2020 12:00:00 AM,Cyberattack,2019-11-22T00:00:00,2020-02-12T00:00:00,"Wrkforce, Inc.",,527,Business,Other,Social Security Number,2021,500-999,200-299
10209,07/02/2020 12:00:00 AM,08/03/2020 12:00:00 AM,Cyberattack,2019-11-22T00:00:00,2020-02-12T00:00:00,"Wrkforce, Inc.",,527,Business,Other,Driver's License or Washington ID Card Number,2021,500-999,200-299
10209,07/02/2020 12:00:00 AM,08/03/2020 12:00:00 AM,Cyberattack,2019-11-22T00:00:00,2020-02-12T00:00:00,"Wrkforce, Inc.",,527,Business,Other,Financial & Banking Information,2021,500-999,200-299
10209,07/02/2020 12:00:00 AM,08/03/2020 12:00:00 AM,Cyberattack,2019-11-22T00:00:00,2020-02-12T00:00:00,"Wrkforce, Inc.",,527,Business,Other,Full Date of Birth,2021,500-999,200-299
10209,07/02/2020 12:00:00 AM,08/03/2020 12:00:00 AM,Cyberattack,2019-11-22T00:00:00,2020-02-12T00:00:00,"Wrkforce, Inc.",,527,Business,Other,Health Insurance Policy or ID Number,2021,500-999,200-299
10209,07/02/2020 12:00:00 AM,08/03/2020 12:00:00 AM,Cyberattack,2019-11-22T00:00:00,2020-02-12T00:00:00,"Wrkforce, Inc.",,527,Business,Other,Other,2021,500-999,200-299
10210,04/28/2020 12:00:00 AM,08/04/2020 12:00:00 AM,Unauthorized Access,,,"Scholarship America, Inc.",,2620,Non-Profit/Charity,,Name,2021,"1,000-9,999",Unknown
10210,04/28/2020 12:00:00 AM,08/04/2020 12:00:00 AM,Unauthorized Access,,,"Scholarship America, Inc.",,2620,Non-Profit/Charity,,Full Date of Birth,2021,"1,000-9,999",Unknown
10210,04/28/2020 12:00:00 AM,08/04/2020 12:00:00 AM,Unauthorized Access,,,"Scholarship America, Inc.",,2620,Non-Profit/Charity,,Student ID Number,2021,"1,000-9,999",Unknown
10211,07/16/2020 12:00:00 AM,08/05/2020 12:00:00 AM,Cyberattack,2020-02-07T00:00:00,2020-05-20T00:00:00,Cancer Research Institute,Ransomware,1312,Non-Profit/Charity,,Name,2021,"1,000-9,999",100-199
10211,07/16/2020 12:00:00 AM,08/05/2020 12:00:00 AM,Cyberattack,2020-02-07T00:00:00,2020-05-20T00:00:00,Cancer Research Institute,Ransomware,1312,Non-Profit/Charity,,Full Date of Birth,2021,"1,000-9,999",100-199
10211,07/16/2020 12:00:00 AM,08/05/2020 12:00:00 AM,Cyberattack,2020-02-07T00:00:00,2020-05-20T00:00:00,Cancer Research Institute,Ransomware,1312,Non-Profit/Charity,,Other,2021,"1,000-9,999",100-199
10212,07/16/2020 12:00:00 AM,08/07/2020 12:00:00 AM,Cyberattack,2020-02-07T00:00:00,2020-05-20T00:00:00,Pacific Northwest University of Health Sciences,Ransomware,1122,Education,,Name,2021,"1,000-9,999",100-199
10212,07/16/2020 12:00:00 AM,08/07/2020 12:00:00 AM,Cyberattack,2020-02-07T00:00:00,2020-05-20T00:00:00,Pacific Northwest University of Health Sciences,Ransomware,1122,Education,,Full Date of Birth,2021,"1,000-9,999",100-199
10212,07/16/2020 12:00:00 AM,08/07/2020 12:00:00 AM,Cyberattack,2020-02-07T00:00:00,2020-05-20T00:00:00,Pacific Northwest University of Health Sciences,Ransomware,1122,Education,,Student ID Number,2021,"1,000-9,999",100-199
10213,07/16/2020 12:00:00 AM,08/09/2020 12:00:00 AM,Cyberattack,2020-02-07T00:00:00,2020-05-20T00:00:00,Planned Parenthood of the Rocky Mountains,Ransomware,526,Health,,Name,2021,500-999,100-199
10213,07/16/2020 12:00:00 AM,08/09/2020 12:00:00 AM,Cyberattack,2020-02-07T00:00:00,2020-05-20T00:00:00,Planned Parenthood of the Rocky Mountains,Ransomware,526,Health,,Full Date of Birth,2021,500-999,100-199
10213,07/16/2020 12:00:00 AM,08/09/2020 12:00:00 AM,Cyberattack,2020-02-07T00:00:00,2020-05-20T00:00:00,Planned Parenthood of the Rocky Mountains,Ransomware,526,Health,,Other,2021,500-999,100-199
10214,05/16/2020 12:00:00 AM,08/10/2020 12:00:00 AM,Cyberattack,2020-05-16T00:00:00,2020-05-16T00:00:00,"Dynasplint Systems, Inc.",Ransomware,1364,Business,Manufacturing,Name,2021,"1,000-9,999",0
10214,05/16/2020 12:00:00 AM,08/10/2020 12:00:00 AM,Cyberattack,2020-05-16T00:00:00,2020-05-16T00:00:00,"Dynasplint Systems, Inc.",Ransomware,1364,Business,Manufacturing,Full Date of Birth,2021,"1,000-9,999",0
10214,05/16/2020 12:00:00 AM,08/10/2020 12:00:00 AM,Cyberattack,2020-05-16T00:00:00,2020-05-16T00:00:00,"Dynasplint Systems, Inc.",Ransomware,1364,Business,Manufacturing,Medical Information,2021,"1,000-9,999",0
10214,05/16/2020 12:00:00 AM,08/10/2020 12:00:00 AM,Cyberattack,2020-05-16T00:00:00,2020-05-16T00:00:00,"Dynasplint Systems, Inc.",Ransomware,1364,Business,Manufacturing,Other,2021,"1,000-9,999",0
10215,07/16/2020 12:00:00 AM,08/10/2020 12:00:00 AM,Cyberattack,2020-02-07T00:00:00,2020-05-20T00:00:00,Heritage University,Ransomware,7803,Education,,Name,2021,"1,000-9,999",100-199
10215,07/16/2020 12:00:00 AM,08/10/2020 12:00:00 AM,Cyberattack,2020-02-07T00:00:00,2020-05-20T00:00:00,Heritage University,Ransomware,7803,Education,,Full Date of Birth,2021,"1,000-9,999",100-199
10216,07/16/2020 12:00:00 AM,08/10/2020 12:00:00 AM,Cyberattack,2020-02-07T00:00:00,2020-05-20T00:00:00,Wisconsin Evangelical Lutheran Synod,Ransomware,867,Non-Profit/Charity,,Name,2021,500-999,100-199
10216,07/16/2020 12:00:00 AM,08/10/2020 12:00:00 AM,Cyberattack,2020-02-07T00:00:00,2020-05-20T00:00:00,Wisconsin Evangelical Lutheran Synod,Ransomware,867,Non-Profit/Charity,,Social Security Number,2021,500-999,100-199
10216,07/16/2020 12:00:00 AM,08/10/2020 12:00:00 AM,Cyberattack,2020-02-07T00:00:00,2020-05-20T00:00:00,Wisconsin Evangelical Lutheran Synod,Ransomware,867,Non-Profit/Charity,,Full Date of Birth,2021,500-999,100-199
10216,07/16/2020 12:00:00 AM,08/10/2020 12:00:00 AM,Cyberattack,2020-02-07T00:00:00,2020-05-20T00:00:00,Wisconsin Evangelical Lutheran Synod,Ransomware,867,Non-Profit/Charity,,Other,2021,500-999,100-199
10218,07/16/2020 12:00:00 AM,08/12/2020 12:00:00 AM,Cyberattack,2020-02-07T00:00:00,2020-05-20T00:00:00,Mt. Baker Planned Parenthood,Ransomware,2367,Non-Profit/Charity,,Name,2021,"1,000-9,999",100-199
10218,07/16/2020 12:00:00 AM,08/12/2020 12:00:00 AM,Cyberattack,2020-02-07T00:00:00,2020-05-20T00:00:00,Mt. Baker Planned Parenthood,Ransomware,2367,Non-Profit/Charity,,Full Date of Birth,2021,"1,000-9,999",100-199
10218,07/16/2020 12:00:00 AM,08/12/2020 12:00:00 AM,Cyberattack,2020-02-07T00:00:00,2020-05-20T00:00:00,Mt. Baker Planned Parenthood,Ransomware,2367,Non-Profit/Charity,,Other,2021,"1,000-9,999",100-199
10219,07/16/2020 12:00:00 AM,08/12/2020 12:00:00 AM,Cyberattack,2020-02-07T00:00:00,2020-05-20T00:00:00,Northeastern University,Ransomware,2602,Education,,Name,2021,"1,000-9,999",100-199
10219,07/16/2020 12:00:00 AM,08/12/2020 12:00:00 AM,Cyberattack,2020-02-07T00:00:00,2020-05-20T00:00:00,Northeastern University,Ransomware,2602,Education,,Full Date of Birth,2021,"1,000-9,999",100-199
10219,07/16/2020 12:00:00 AM,08/12/2020 12:00:00 AM,Cyberattack,2020-02-07T00:00:00,2020-05-20T00:00:00,Northeastern University,Ransomware,2602,Education,,Other,2021,"1,000-9,999",100-199
10222,07/16/2020 12:00:00 AM,08/11/2020 12:00:00 AM,Cyberattack,2020-02-07T00:00:00,2020-05-20T00:00:00,The Evergreen State College Foundation,Ransomware,40549,Non-Profit/Charity,,Name,2021,"10,000-49,999",100-199
10222,07/16/2020 12:00:00 AM,08/11/2020 12:00:00 AM,Cyberattack,2020-02-07T00:00:00,2020-05-20T00:00:00,The Evergreen State College Foundation,Ransomware,40549,Non-Profit/Charity,,Full Date of Birth,2021,"10,000-49,999",100-199
10222,07/16/2020 12:00:00 AM,08/11/2020 12:00:00 AM,Cyberattack,2020-02-07T00:00:00,2020-05-20T00:00:00,The Evergreen State College Foundation,Ransomware,40549,Non-Profit/Charity,,Student ID Number,2021,"10,000-49,999",100-199
10222,07/16/2020 12:00:00 AM,08/11/2020 12:00:00 AM,Cyberattack,2020-02-07T00:00:00,2020-05-20T00:00:00,The Evergreen State College Foundation,Ransomware,40549,Non-Profit/Charity,,Other,2021,"10,000-49,999",100-199
10223,07/16/2020 12:00:00 AM,08/12/2020 12:00:00 AM,Cyberattack,2020-02-07T00:00:00,2020-05-20T00:00:00,The University of Florida,Ransomware,5075,Education,,Name,2021,"1,000-9,999",100-199
10223,07/16/2020 12:00:00 AM,08/12/2020 12:00:00 AM,Cyberattack,2020-02-07T00:00:00,2020-05-20T00:00:00,The University of Florida,Ransomware,5075,Education,,Full Date of Birth,2021,"1,000-9,999",100-199
10223,07/16/2020 12:00:00 AM,08/12/2020 12:00:00 AM,Cyberattack,2020-02-07T00:00:00,2020-05-20T00:00:00,The University of Florida,Ransomware,5075,Education,,Medical Information,2021,"1,000-9,999",100-199
10223,07/16/2020 12:00:00 AM,08/12/2020 12:00:00 AM,Cyberattack,2020-02-07T00:00:00,2020-05-20T00:00:00,The University of Florida,Ransomware,5075,Education,,Other,2021,"1,000-9,999",100-199
10224,07/16/2020 12:00:00 AM,08/13/2020 12:00:00 AM,Cyberattack,2020-02-07T00:00:00,2020-05-20T00:00:00,"Hearing, Speech & Deaf Center",Ransomware,8441,Non-Profit/Charity,,Name,2021,"1,000-9,999",100-199
10224,07/16/2020 12:00:00 AM,08/13/2020 12:00:00 AM,Cyberattack,2020-02-07T00:00:00,2020-05-20T00:00:00,"Hearing, Speech & Deaf Center",Ransomware,8441,Non-Profit/Charity,,Full Date of Birth,2021,"1,000-9,999",100-199
10225,07/16/2020 12:00:00 AM,08/14/2020 12:00:00 AM,Cyberattack,2020-02-07T00:00:00,2020-05-20T00:00:00,"American Civil Liberties Union, Inc.",Ransomware,86269,Non-Profit/Charity,,Name,2021,"50,000-999,999",100-199
10225,07/16/2020 12:00:00 AM,08/14/2020 12:00:00 AM,Cyberattack,2020-02-07T00:00:00,2020-05-20T00:00:00,"American Civil Liberties Union, Inc.",Ransomware,86269,Non-Profit/Charity,,Full Date of Birth,2021,"50,000-999,999",100-199
10226,07/16/2020 12:00:00 AM,08/14/2020 12:00:00 AM,Cyberattack,2020-02-07T00:00:00,2020-05-20T00:00:00,Assumption St. Bridget School,Ransomware,769,Education,,Name,2021,500-999,100-199
10226,07/16/2020 12:00:00 AM,08/14/2020 12:00:00 AM,Cyberattack,2020-02-07T00:00:00,2020-05-20T00:00:00,Assumption St. Bridget School,Ransomware,769,Education,,Full Date of Birth,2021,500-999,100-199
10226,07/16/2020 12:00:00 AM,08/14/2020 12:00:00 AM,Cyberattack,2020-02-07T00:00:00,2020-05-20T00:00:00,Assumption St. Bridget School,Ransomware,769,Education,,Other,2021,500-999,100-199
10227,07/16/2020 12:00:00 AM,08/14/2020 12:00:00 AM,Cyberattack,2020-02-07T00:00:00,2020-05-20T00:00:00,Bishop Blanchet High School,Ransomware,3162,Education,,Name,2021,"1,000-9,999",100-199
10227,07/16/2020 12:00:00 AM,08/14/2020 12:00:00 AM,Cyberattack,2020-02-07T00:00:00,2020-05-20T00:00:00,Bishop Blanchet High School,Ransomware,3162,Education,,Full Date of Birth,2021,"1,000-9,999",100-199
10227,07/16/2020 12:00:00 AM,08/14/2020 12:00:00 AM,Cyberattack,2020-02-07T00:00:00,2020-05-20T00:00:00,Bishop Blanchet High School,Ransomware,3162,Education,,Other,2021,"1,000-9,999",100-199
10228,07/16/2020 12:00:00 AM,08/14/2020 12:00:00 AM,Cyberattack,2020-02-07T00:00:00,2020-05-20T00:00:00,Boston University,Ransomware,7067,Education,,Name,2021,"1,000-9,999",100-199
10228,07/16/2020 12:00:00 AM,08/14/2020 12:00:00 AM,Cyberattack,2020-02-07T00:00:00,2020-05-20T00:00:00,Boston University,Ransomware,7067,Education,,Full Date of Birth,2021,"1,000-9,999",100-199
10229,07/16/2020 12:00:00 AM,08/14/2020 12:00:00 AM,Cyberattack,2020-02-07T00:00:00,2020-05-20T00:00:00,Confluence Health Foundation,Ransomware,1132,Health,,Name,2021,"1,000-9,999",100-199
10229,07/16/2020 12:00:00 AM,08/14/2020 12:00:00 AM,Cyberattack,2020-02-07T00:00:00,2020-05-20T00:00:00,Confluence Health Foundation,Ransomware,1132,Health,,Full Date of Birth,2021,"1,000-9,999",100-199
10230,07/16/2020 12:00:00 AM,08/14/2020 12:00:00 AM,Cyberattack,2020-02-07T00:00:00,2020-05-20T00:00:00,Denver Dumb Friends League,Ransomware,655,Non-Profit/Charity,,Name,2021,500-999,100-199
10230,07/16/2020 12:00:00 AM,08/14/2020 12:00:00 AM,Cyberattack,2020-02-07T00:00:00,2020-05-20T00:00:00,Denver Dumb Friends League,Ransomware,655,Non-Profit/Charity,,Social Security Number,2021,500-999,100-199
10230,07/16/2020 12:00:00 AM,08/14/2020 12:00:00 AM,Cyberattack,2020-02-07T00:00:00,2020-05-20T00:00:00,Denver Dumb Friends League,Ransomware,655,Non-Profit/Charity,,Driver's License or Washington ID Card Number,2021,500-999,100-199
10230,07/16/2020 12:00:00 AM,08/14/2020 12:00:00 AM,Cyberattack,2020-02-07T00:00:00,2020-05-20T00:00:00,Denver Dumb Friends League,Ransomware,655,Non-Profit/Charity,,Financial & Banking Information,2021,500-999,100-199
10230,07/16/2020 12:00:00 AM,08/14/2020 12:00:00 AM,Cyberattack,2020-02-07T00:00:00,2020-05-20T00:00:00,Denver Dumb Friends League,Ransomware,655,Non-Profit/Charity,,Full Date of Birth,2021,500-999,100-199
10230,07/16/2020 12:00:00 AM,08/14/2020 12:00:00 AM,Cyberattack,2020-02-07T00:00:00,2020-05-20T00:00:00,Denver Dumb Friends League,Ransomware,655,Non-Profit/Charity,,Passport Number,2021,500-999,100-199
10230,07/16/2020 12:00:00 AM,08/14/2020 12:00:00 AM,Cyberattack,2020-02-07T00:00:00,2020-05-20T00:00:00,Denver Dumb Friends League,Ransomware,655,Non-Profit/Charity,,Medical Information,2021,500-999,100-199
10230,07/16/2020 12:00:00 AM,08/14/2020 12:00:00 AM,Cyberattack,2020-02-07T00:00:00,2020-05-20T00:00:00,Denver Dumb Friends League,Ransomware,655,Non-Profit/Charity,,Biometric Data,2021,500-999,100-199
10230,07/16/2020 12:00:00 AM,08/14/2020 12:00:00 AM,Cyberattack,2020-02-07T00:00:00,2020-05-20T00:00:00,Denver Dumb Friends League,Ransomware,655,Non-Profit/Charity,,Username and Password/Security Question Answers,2021,500-999,100-199
10231,07/16/2020 12:00:00 AM,08/14/2020 12:00:00 AM,Cyberattack,2020-02-07T00:00:00,2020-05-20T00:00:00,EMILY's List,Ransomware,9325,Business,Other,Name,2021,"1,000-9,999",100-199
10231,07/16/2020 12:00:00 AM,08/14/2020 12:00:00 AM,Cyberattack,2020-02-07T00:00:00,2020-05-20T00:00:00,EMILY's List,Ransomware,9325,Business,Other,Financial & Banking Information,2021,"1,000-9,999",100-199
10231,07/16/2020 12:00:00 AM,08/14/2020 12:00:00 AM,Cyberattack,2020-02-07T00:00:00,2020-05-20T00:00:00,EMILY's List,Ransomware,9325,Business,Other,Full Date of Birth,2021,"1,000-9,999",100-199
10231,07/16/2020 12:00:00 AM,08/14/2020 12:00:00 AM,Cyberattack,2020-02-07T00:00:00,2020-05-20T00:00:00,EMILY's List,Ransomware,9325,Business,Other,Other,2021,"1,000-9,999",100-199
10232,07/20/2020 12:00:00 AM,08/14/2020 12:00:00 AM,Cyberattack,2019-07-15T00:00:00,2020-07-10T00:00:00,"Filters Fast, LLC",Malware,6584,Business,Retail,Name,2021,"1,000-9,999",300-399
10232,07/20/2020 12:00:00 AM,08/14/2020 12:00:00 AM,Cyberattack,2019-07-15T00:00:00,2020-07-10T00:00:00,"Filters Fast, LLC",Malware,6584,Business,Retail,Financial & Banking Information,2021,"1,000-9,999",300-399
10232,07/20/2020 12:00:00 AM,08/14/2020 12:00:00 AM,Cyberattack,2019-07-15T00:00:00,2020-07-10T00:00:00,"Filters Fast, LLC",Malware,6584,Business,Retail,Other,2021,"1,000-9,999",300-399
10233,07/16/2020 12:00:00 AM,08/14/2020 12:00:00 AM,Cyberattack,2020-02-07T00:00:00,2020-05-20T00:00:00,March of Dimes,Ransomware,446097,Non-Profit/Charity,,Name,2021,"50,000-999,999",100-199
10233,07/16/2020 12:00:00 AM,08/14/2020 12:00:00 AM,Cyberattack,2020-02-07T00:00:00,2020-05-20T00:00:00,March of Dimes,Ransomware,446097,Non-Profit/Charity,,Full Date of Birth,2021,"50,000-999,999",100-199
10233,07/16/2020 12:00:00 AM,08/14/2020 12:00:00 AM,Cyberattack,2020-02-07T00:00:00,2020-05-20T00:00:00,March of Dimes,Ransomware,446097,Non-Profit/Charity,,Medical Information,2021,"50,000-999,999",100-199
10233,07/16/2020 12:00:00 AM,08/14/2020 12:00:00 AM,Cyberattack,2020-02-07T00:00:00,2020-05-20T00:00:00,March of Dimes,Ransomware,446097,Non-Profit/Charity,,Other,2021,"50,000-999,999",100-199
10234,07/16/2020 12:00:00 AM,08/14/2020 12:00:00 AM,Cyberattack,2020-02-07T00:00:00,2020-05-20T00:00:00,Metropolitan State University Denver Foundation,Ransomware,1235,Non-Profit/Charity,,Name,2021,"1,000-9,999",100-199
10234,07/16/2020 12:00:00 AM,08/14/2020 12:00:00 AM,Cyberattack,2020-02-07T00:00:00,2020-05-20T00:00:00,Metropolitan State University Denver Foundation,Ransomware,1235,Non-Profit/Charity,,Full Date of Birth,2021,"1,000-9,999",100-199
10235,07/16/2020 12:00:00 AM,08/14/2020 12:00:00 AM,Cyberattack,2020-02-07T00:00:00,2020-05-20T00:00:00,"Planned Parenthood of the Columbia Willamette, Inc.",Ransomware,2866,Non-Profit/Charity,,Name,2021,"1,000-9,999",100-199
10235,07/16/2020 12:00:00 AM,08/14/2020 12:00:00 AM,Cyberattack,2020-02-07T00:00:00,2020-05-20T00:00:00,"Planned Parenthood of the Columbia Willamette, Inc.",Ransomware,2866,Non-Profit/Charity,,Full Date of Birth,2021,"1,000-9,999",100-199
10235,07/16/2020 12:00:00 AM,08/14/2020 12:00:00 AM,Cyberattack,2020-02-07T00:00:00,2020-05-20T00:00:00,"Planned Parenthood of the Columbia Willamette, Inc.",Ransomware,2866,Non-Profit/Charity,,Other,2021,"1,000-9,999",100-199
10236,07/16/2020 12:00:00 AM,08/14/2020 12:00:00 AM,Cyberattack,2020-02-07T00:00:00,2020-05-20T00:00:00,Portland Community College Foundation,Ransomware,17908,Non-Profit/Charity,,Name,2021,"10,000-49,999",100-199
10236,07/16/2020 12:00:00 AM,08/14/2020 12:00:00 AM,Cyberattack,2020-02-07T00:00:00,2020-05-20T00:00:00,Portland Community College Foundation,Ransomware,17908,Non-Profit/Charity,,Financial & Banking Information,2021,"10,000-49,999",100-199
10236,07/16/2020 12:00:00 AM,08/14/2020 12:00:00 AM,Cyberattack,2020-02-07T00:00:00,2020-05-20T00:00:00,Portland Community College Foundation,Ransomware,17908,Non-Profit/Charity,,Full Date of Birth,2021,"10,000-49,999",100-199
10236,07/16/2020 12:00:00 AM,08/14/2020 12:00:00 AM,Cyberattack,2020-02-07T00:00:00,2020-05-20T00:00:00,Portland Community College Foundation,Ransomware,17908,Non-Profit/Charity,,Other,2021,"10,000-49,999",100-199
10237,07/16/2020 12:00:00 AM,08/14/2020 12:00:00 AM,Cyberattack,2020-02-07T00:00:00,2020-05-20T00:00:00,Save the Children,Ransomware,47465,Non-Profit/Charity,,Name,2021,"10,000-49,999",100-199
10237,07/16/2020 12:00:00 AM,08/14/2020 12:00:00 AM,Cyberattack,2020-02-07T00:00:00,2020-05-20T00:00:00,Save the Children,Ransomware,47465,Non-Profit/Charity,,Financial & Banking Information,2021,"10,000-49,999",100-199
10237,07/16/2020 12:00:00 AM,08/14/2020 12:00:00 AM,Cyberattack,2020-02-07T00:00:00,2020-05-20T00:00:00,Save the Children,Ransomware,47465,Non-Profit/Charity,,Full Date of Birth,2021,"10,000-49,999",100-199
10237,07/16/2020 12:00:00 AM,08/14/2020 12:00:00 AM,Cyberattack,2020-02-07T00:00:00,2020-05-20T00:00:00,Save the Children,Ransomware,47465,Non-Profit/Charity,,Other,2021,"10,000-49,999",100-199
10238,07/16/2020 12:00:00 AM,08/14/2020 12:00:00 AM,Cyberattack,2020-02-07T00:00:00,2020-05-20T00:00:00,ShelterBox USA,Ransomware,778,Non-Profit/Charity,,Name,2021,500-999,100-199
10238,07/16/2020 12:00:00 AM,08/14/2020 12:00:00 AM,Cyberattack,2020-02-07T00:00:00,2020-05-20T00:00:00,ShelterBox USA,Ransomware,778,Non-Profit/Charity,,Full Date of Birth,2021,500-999,100-199
10238,07/16/2020 12:00:00 AM,08/14/2020 12:00:00 AM,Cyberattack,2020-02-07T00:00:00,2020-05-20T00:00:00,ShelterBox USA,Ransomware,778,Non-Profit/Charity,,Other,2021,500-999,100-199
10239,07/16/2020 12:00:00 AM,08/14/2020 12:00:00 AM,Cyberattack,2020-02-07T00:00:00,2020-05-20T00:00:00,St. Joseph School,Ransomware,5142,Education,,Name,2021,"1,000-9,999",100-199
10239,07/16/2020 12:00:00 AM,08/14/2020 12:00:00 AM,Cyberattack,2020-02-07T00:00:00,2020-05-20T00:00:00,St. Joseph School,Ransomware,5142,Education,,Full Date of Birth,2021,"1,000-9,999",100-199
10239,07/16/2020 12:00:00 AM,08/14/2020 12:00:00 AM,Cyberattack,2020-02-07T00:00:00,2020-05-20T00:00:00,St. Joseph School,Ransomware,5142,Education,,Other,2021,"1,000-9,999",100-199
10241,07/16/2020 12:00:00 AM,08/14/2020 12:00:00 AM,Cyberattack,2020-02-07T00:00:00,2020-05-20T00:00:00,University of Minnesota Foundation,Ransomware,6460,Non-Profit/Charity,,Name,2021,"1,000-9,999",100-199
10241,07/16/2020 12:00:00 AM,08/14/2020 12:00:00 AM,Cyberattack,2020-02-07T00:00:00,2020-05-20T00:00:00,University of Minnesota Foundation,Ransomware,6460,Non-Profit/Charity,,Full Date of Birth,2021,"1,000-9,999",100-199
10241,07/16/2020 12:00:00 AM,08/14/2020 12:00:00 AM,Cyberattack,2020-02-07T00:00:00,2020-05-20T00:00:00,University of Minnesota Foundation,Ransomware,6460,Non-Profit/Charity,,Other,2021,"1,000-9,999",100-199
10243,07/16/2020 12:00:00 AM,08/16/2020 12:00:00 AM,Cyberattack,2020-02-07T00:00:00,2020-05-20T00:00:00,Excelsior College,Ransomware,4069,Education,,Name,2021,"1,000-9,999",100-199
10243,07/16/2020 12:00:00 AM,08/16/2020 12:00:00 AM,Cyberattack,2020-02-07T00:00:00,2020-05-20T00:00:00,Excelsior College,Ransomware,4069,Education,,Full Date of Birth,2021,"1,000-9,999",100-199
10243,07/16/2020 12:00:00 AM,08/16/2020 12:00:00 AM,Cyberattack,2020-02-07T00:00:00,2020-05-20T00:00:00,Excelsior College,Ransomware,4069,Education,,Student ID Number,2021,"1,000-9,999",100-199
10243,07/16/2020 12:00:00 AM,08/16/2020 12:00:00 AM,Cyberattack,2020-02-07T00:00:00,2020-05-20T00:00:00,Excelsior College,Ransomware,4069,Education,,Other,2021,"1,000-9,999",100-199
10244,07/16/2020 12:00:00 AM,08/17/2020 12:00:00 AM,Cyberattack,2020-02-07T00:00:00,2020-05-20T00:00:00,Colby College,Ransomware,606,Education,,Name,2021,500-999,100-199
10244,07/16/2020 12:00:00 AM,08/17/2020 12:00:00 AM,Cyberattack,2020-02-07T00:00:00,2020-05-20T00:00:00,Colby College,Ransomware,606,Education,,Full Date of Birth,2021,500-999,100-199
10244,07/16/2020 12:00:00 AM,08/17/2020 12:00:00 AM,Cyberattack,2020-02-07T00:00:00,2020-05-20T00:00:00,Colby College,Ransomware,606,Education,,Other,2021,500-999,100-199
10245,07/16/2020 12:00:00 AM,08/17/2020 12:00:00 AM,Cyberattack,2020-02-07T00:00:00,2020-05-20T00:00:00,Gonzaga Preparatory School,Ransomware,5000,Education,,Name,2021,"1,000-9,999",100-199
10245,07/16/2020 12:00:00 AM,08/17/2020 12:00:00 AM,Cyberattack,2020-02-07T00:00:00,2020-05-20T00:00:00,Gonzaga Preparatory School,Ransomware,5000,Education,,Full Date of Birth,2021,"1,000-9,999",100-199
10245,07/16/2020 12:00:00 AM,08/17/2020 12:00:00 AM,Cyberattack,2020-02-07T00:00:00,2020-05-20T00:00:00,Gonzaga Preparatory School,Ransomware,5000,Education,,Other,2021,"1,000-9,999",100-199
10246,05/20/2020 12:00:00 AM,08/17/2020 12:00:00 AM,Cyberattack,2020-01-27T00:00:00,,"Mammoth Media, Inc.",,,Business,Software,Name,2021,Unknown,Unknown
10246,05/20/2020 12:00:00 AM,08/17/2020 12:00:00 AM,Cyberattack,2020-01-27T00:00:00,,"Mammoth Media, Inc.",,,Business,Software,Full Date of Birth,2021,Unknown,Unknown
10246,05/20/2020 12:00:00 AM,08/17/2020 12:00:00 AM,Cyberattack,2020-01-27T00:00:00,,"Mammoth Media, Inc.",,,Business,Software,Email Address and Password/Security Question Answers,2021,Unknown,Unknown
10246,05/20/2020 12:00:00 AM,08/17/2020 12:00:00 AM,Cyberattack,2020-01-27T00:00:00,,"Mammoth Media, Inc.",,,Business,Software,Other,2021,Unknown,Unknown
10247,07/17/2020 12:00:00 AM,08/17/2020 12:00:00 AM,Cyberattack,2020-02-07T00:00:00,2020-05-20T00:00:00,Phi Kappa Psi Fraternity,Ransomware,677,Finance,,Name,2021,500-999,100-199
10247,07/17/2020 12:00:00 AM,08/17/2020 12:00:00 AM,Cyberattack,2020-02-07T00:00:00,2020-05-20T00:00:00,Phi Kappa Psi Fraternity,Ransomware,677,Finance,,Full Date of Birth,2021,500-999,100-199
10247,07/17/2020 12:00:00 AM,08/17/2020 12:00:00 AM,Cyberattack,2020-02-07T00:00:00,2020-05-20T00:00:00,Phi Kappa Psi Fraternity,Ransomware,677,Finance,,Other,2021,500-999,100-199
10248,07/16/2020 12:00:00 AM,08/17/2020 12:00:00 AM,Cyberattack,2020-02-07T00:00:00,2020-05-20T00:00:00,Washington State University Foundation,Ransomware,334219,Non-Profit/Charity,,Name,2021,"50,000-999,999",100-199
10248,07/16/2020 12:00:00 AM,08/17/2020 12:00:00 AM,Cyberattack,2020-02-07T00:00:00,2020-05-20T00:00:00,Washington State University Foundation,Ransomware,334219,Non-Profit/Charity,,Full Date of Birth,2021,"50,000-999,999",100-199
10249,07/16/2020 12:00:00 AM,08/18/2020 12:00:00 AM,Cyberattack,2020-02-07T00:00:00,2020-05-20T00:00:00,University of South Carolina,Ransomware,1165,Education,,Name,2021,"1,000-9,999",100-199
10249,07/16/2020 12:00:00 AM,08/18/2020 12:00:00 AM,Cyberattack,2020-02-07T00:00:00,2020-05-20T00:00:00,University of South Carolina,Ransomware,1165,Education,,Full Date of Birth,2021,"1,000-9,999",100-199
10249,07/16/2020 12:00:00 AM,08/18/2020 12:00:00 AM,Cyberattack,2020-02-07T00:00:00,2020-05-20T00:00:00,University of South Carolina,Ransomware,1165,Education,,Other,2021,"1,000-9,999",100-199
10250,07/13/2020 12:00:00 AM,08/19/2020 12:00:00 AM,Cyberattack,2020-05-13T00:00:00,2020-07-13T00:00:00,American Payroll Association,Malware,548,Business,Other,Name,2021,500-999,1-99
10250,07/13/2020 12:00:00 AM,08/19/2020 12:00:00 AM,Cyberattack,2020-05-13T00:00:00,2020-07-13T00:00:00,American Payroll Association,Malware,548,Business,Other,Financial & Banking Information,2021,500-999,1-99
10250,07/13/2020 12:00:00 AM,08/19/2020 12:00:00 AM,Cyberattack,2020-05-13T00:00:00,2020-07-13T00:00:00,American Payroll Association,Malware,548,Business,Other,Full Date of Birth,2021,500-999,1-99
10250,07/13/2020 12:00:00 AM,08/19/2020 12:00:00 AM,Cyberattack,2020-05-13T00:00:00,2020-07-13T00:00:00,American Payroll Association,Malware,548,Business,Other,Username and Password/Security Question Answers,2021,500-999,1-99
10250,07/13/2020 12:00:00 AM,08/19/2020 12:00:00 AM,Cyberattack,2020-05-13T00:00:00,2020-07-13T00:00:00,American Payroll Association,Malware,548,Business,Other,Other,2021,500-999,1-99
10251,07/16/2020 12:00:00 AM,08/19/2020 12:00:00 AM,Cyberattack,2020-02-07T00:00:00,2020-05-20T00:00:00,California Lutheran University,Ransomware,3549,Education,,Name,2021,"1,000-9,999",100-199
10251,07/16/2020 12:00:00 AM,08/19/2020 12:00:00 AM,Cyberattack,2020-02-07T00:00:00,2020-05-20T00:00:00,California Lutheran University,Ransomware,3549,Education,,Full Date of Birth,2021,"1,000-9,999",100-199
10251,07/16/2020 12:00:00 AM,08/19/2020 12:00:00 AM,Cyberattack,2020-02-07T00:00:00,2020-05-20T00:00:00,California Lutheran University,Ransomware,3549,Education,,Other,2021,"1,000-9,999",100-199
10252,07/16/2020 12:00:00 AM,08/19/2020 12:00:00 AM,Cyberattack,2020-02-07T00:00:00,2020-05-20T00:00:00,Ronald McDonald House Charities,Ransomware,911,Non-Profit/Charity,,Name,2021,500-999,100-199
10252,07/16/2020 12:00:00 AM,08/19/2020 12:00:00 AM,Cyberattack,2020-02-07T00:00:00,2020-05-20T00:00:00,Ronald McDonald House Charities,Ransomware,911,Non-Profit/Charity,,Full Date of Birth,2021,500-999,100-199
10252,07/16/2020 12:00:00 AM,08/19/2020 12:00:00 AM,Cyberattack,2020-02-07T00:00:00,2020-05-20T00:00:00,Ronald McDonald House Charities,Ransomware,911,Non-Profit/Charity,,Other,2021,500-999,100-199
10253,07/01/2020 12:00:00 AM,08/20/2020 12:00:00 AM,Unauthorized Access,2020-06-23T00:00:00,2020-07-01T00:00:00,"Dave, Inc.",,40998,Business,Software,Name,2021,"10,000-49,999",1-99
10253,07/01/2020 12:00:00 AM,08/20/2020 12:00:00 AM,Unauthorized Access,2020-06-23T00:00:00,2020-07-01T00:00:00,"Dave, Inc.",,40998,Business,Software,Social Security Number,2021,"10,000-49,999",1-99
10253,07/01/2020 12:00:00 AM,08/20/2020 12:00:00 AM,Unauthorized Access,2020-06-23T00:00:00,2020-07-01T00:00:00,"Dave, Inc.",,40998,Business,Software,Full Date of Birth,2021,"10,000-49,999",1-99
10253,07/01/2020 12:00:00 AM,08/20/2020 12:00:00 AM,Unauthorized Access,2020-06-23T00:00:00,2020-07-01T00:00:00,"Dave, Inc.",,40998,Business,Software,Email Address and Password/Security Question Answers,2021,"10,000-49,999",1-99
10253,07/01/2020 12:00:00 AM,08/20/2020 12:00:00 AM,Unauthorized Access,2020-06-23T00:00:00,2020-07-01T00:00:00,"Dave, Inc.",,40998,Business,Software,Other,2021,"10,000-49,999",1-99
10254,07/16/2020 12:00:00 AM,08/20/2020 12:00:00 AM,Cyberattack,2020-02-07T00:00:00,2020-05-20T00:00:00,UWM-Foundation,Ransomware,1357,Non-Profit/Charity,,Name,2021,"1,000-9,999",100-199
10254,07/16/2020 12:00:00 AM,08/20/2020 12:00:00 AM,Cyberattack,2020-02-07T00:00:00,2020-05-20T00:00:00,UWM-Foundation,Ransomware,1357,Non-Profit/Charity,,Full Date of Birth,2021,"1,000-9,999",100-199
10254,07/16/2020 12:00:00 AM,08/20/2020 12:00:00 AM,Cyberattack,2020-02-07T00:00:00,2020-05-20T00:00:00,UWM-Foundation,Ransomware,1357,Non-Profit/Charity,,Other,2021,"1,000-9,999",100-199
10255,07/16/2020 12:00:00 AM,08/21/2020 12:00:00 AM,Cyberattack,2020-02-07T00:00:00,2020-05-20T00:00:00,Boy Scouts of America,Ransomware,981068,Non-Profit/Charity,,Name,2021,"50,000-999,999",100-199
10255,07/16/2020 12:00:00 AM,08/21/2020 12:00:00 AM,Cyberattack,2020-02-07T00:00:00,2020-05-20T00:00:00,Boy Scouts of America,Ransomware,981068,Non-Profit/Charity,,Full Date of Birth,2021,"50,000-999,999",100-199
10255,07/16/2020 12:00:00 AM,08/21/2020 12:00:00 AM,Cyberattack,2020-02-07T00:00:00,2020-05-20T00:00:00,Boy Scouts of America,Ransomware,981068,Non-Profit/Charity,,Other,2021,"50,000-999,999",100-199
10256,04/06/2020 12:00:00 AM,08/21/2020 12:00:00 AM,Cyberattack,2020-04-06T00:00:00,2020-04-06T00:00:00,"Cetera Financial Group, Inc.",,2760,Finance,,Name,2021,"1,000-9,999",0
10256,04/06/2020 12:00:00 AM,08/21/2020 12:00:00 AM,Cyberattack,2020-04-06T00:00:00,2020-04-06T00:00:00,"Cetera Financial Group, Inc.",,2760,Finance,,Social Security Number,2021,"1,000-9,999",0
10256,04/06/2020 12:00:00 AM,08/21/2020 12:00:00 AM,Cyberattack,2020-04-06T00:00:00,2020-04-06T00:00:00,"Cetera Financial Group, Inc.",,2760,Finance,,Driver's License or Washington ID Card Number,2021,"1,000-9,999",0
10256,04/06/2020 12:00:00 AM,08/21/2020 12:00:00 AM,Cyberattack,2020-04-06T00:00:00,2020-04-06T00:00:00,"Cetera Financial Group, Inc.",,2760,Finance,,Financial & Banking Information,2021,"1,000-9,999",0
10257,07/16/2020 12:00:00 AM,08/21/2020 12:00:00 AM,Cyberattack,2020-02-07T00:00:00,2020-05-20T00:00:00,Heifer Project International,Ransomware,120041,Non-Profit/Charity,,Name,2021,"50,000-999,999",100-199
10257,07/16/2020 12:00:00 AM,08/21/2020 12:00:00 AM,Cyberattack,2020-02-07T00:00:00,2020-05-20T00:00:00,Heifer Project International,Ransomware,120041,Non-Profit/Charity,,Driver's License or Washington ID Card Number,2021,"50,000-999,999",100-199
10257,07/16/2020 12:00:00 AM,08/21/2020 12:00:00 AM,Cyberattack,2020-02-07T00:00:00,2020-05-20T00:00:00,Heifer Project International,Ransomware,120041,Non-Profit/Charity,,Full Date of Birth,2021,"50,000-999,999",100-199
10257,07/16/2020 12:00:00 AM,08/21/2020 12:00:00 AM,Cyberattack,2020-02-07T00:00:00,2020-05-20T00:00:00,Heifer Project International,Ransomware,120041,Non-Profit/Charity,,Passport Number,2021,"50,000-999,999",100-199
10257,07/16/2020 12:00:00 AM,08/21/2020 12:00:00 AM,Cyberattack,2020-02-07T00:00:00,2020-05-20T00:00:00,Heifer Project International,Ransomware,120041,Non-Profit/Charity,,Other,2021,"50,000-999,999",100-199
10259,07/16/2020 12:00:00 AM,08/21/2020 12:00:00 AM,Cyberattack,2020-02-07T00:00:00,2020-05-20T00:00:00,MultiCare Health System,Ransomware,302769,Health,,Name,2021,"50,000-999,999",100-199
10259,07/16/2020 12:00:00 AM,08/21/2020 12:00:00 AM,Cyberattack,2020-02-07T00:00:00,2020-05-20T00:00:00,MultiCare Health System,Ransomware,302769,Health,,Full Date of Birth,2021,"50,000-999,999",100-199
10259,07/16/2020 12:00:00 AM,08/21/2020 12:00:00 AM,Cyberattack,2020-02-07T00:00:00,2020-05-20T00:00:00,MultiCare Health System,Ransomware,302769,Health,,Medical Information,2021,"50,000-999,999",100-199
10259,07/16/2020 12:00:00 AM,08/21/2020 12:00:00 AM,Cyberattack,2020-02-07T00:00:00,2020-05-20T00:00:00,MultiCare Health System,Ransomware,302769,Health,,Other,2021,"50,000-999,999",100-199
10260,07/16/2020 12:00:00 AM,08/21/2020 12:00:00 AM,Cyberattack,2020-02-07T00:00:00,2020-05-20T00:00:00,National Parks Conservation Association,Ransomware,12640,Non-Profit/Charity,,Name,2021,"10,000-49,999",100-199
10260,07/16/2020 12:00:00 AM,08/21/2020 12:00:00 AM,Cyberattack,2020-02-07T00:00:00,2020-05-20T00:00:00,National Parks Conservation Association,Ransomware,12640,Non-Profit/Charity,,Full Date of Birth,2021,"10,000-49,999",100-199
10260,07/16/2020 12:00:00 AM,08/21/2020 12:00:00 AM,Cyberattack,2020-02-07T00:00:00,2020-05-20T00:00:00,National Parks Conservation Association,Ransomware,12640,Non-Profit/Charity,,Other,2021,"10,000-49,999",100-199
10261,07/16/2020 12:00:00 AM,08/21/2020 12:00:00 AM,Cyberattack,2020-02-07T00:00:00,2020-05-20T00:00:00,West Virginia University Foundation,Ransomware,1015,Non-Profit/Charity,,Name,2021,"1,000-9,999",100-199
10261,07/16/2020 12:00:00 AM,08/21/2020 12:00:00 AM,Cyberattack,2020-02-07T00:00:00,2020-05-20T00:00:00,West Virginia University Foundation,Ransomware,1015,Non-Profit/Charity,,Full Date of Birth,2021,"1,000-9,999",100-199
10261,07/16/2020 12:00:00 AM,08/21/2020 12:00:00 AM,Cyberattack,2020-02-07T00:00:00,2020-05-20T00:00:00,West Virginia University Foundation,Ransomware,1015,Non-Profit/Charity,,Other,2021,"1,000-9,999",100-199
10262,07/16/2020 12:00:00 AM,08/24/2020 12:00:00 AM,Cyberattack,2020-02-07T00:00:00,2020-05-20T00:00:00,Planned Parenthood of the Great Northwest and the Hawaiian Islands,Ransomware,60813,Non-Profit/Charity,,Name,2021,"50,000-999,999",100-199
10262,07/16/2020 12:00:00 AM,08/24/2020 12:00:00 AM,Cyberattack,2020-02-07T00:00:00,2020-05-20T00:00:00,Planned Parenthood of the Great Northwest and the Hawaiian Islands,Ransomware,60813,Non-Profit/Charity,,Full Date of Birth,2021,"50,000-999,999",100-199
10262,07/16/2020 12:00:00 AM,08/24/2020 12:00:00 AM,Cyberattack,2020-02-07T00:00:00,2020-05-20T00:00:00,Planned Parenthood of the Great Northwest and the Hawaiian Islands,Ransomware,60813,Non-Profit/Charity,,Other,2021,"50,000-999,999",100-199
10263,07/16/2020 12:00:00 AM,08/24/2020 12:00:00 AM,Cyberattack,2020-02-07T00:00:00,2020-05-20T00:00:00,Southern New Hampshire University,Ransomware,1826,Education,,Name,2021,"1,000-9,999",100-199
10263,07/16/2020 12:00:00 AM,08/24/2020 12:00:00 AM,Cyberattack,2020-02-07T00:00:00,2020-05-20T00:00:00,Southern New Hampshire University,Ransomware,1826,Education,,Full Date of Birth,2021,"1,000-9,999",100-199
10263,07/16/2020 12:00:00 AM,08/24/2020 12:00:00 AM,Cyberattack,2020-02-07T00:00:00,2020-05-20T00:00:00,Southern New Hampshire University,Ransomware,1826,Education,,Other,2021,"1,000-9,999",100-199
10264,01/12/2020 12:00:00 AM,08/25/2020 12:00:00 AM,Cyberattack,,,Westcor Land Title Insurance Company,Malware,979,Finance,,Name,2021,500-999,Unknown
10264,01/12/2020 12:00:00 AM,08/25/2020 12:00:00 AM,Cyberattack,,,Westcor Land Title Insurance Company,Malware,979,Finance,,Social Security Number,2021,500-999,Unknown
10264,01/12/2020 12:00:00 AM,08/25/2020 12:00:00 AM,Cyberattack,,,Westcor Land Title Insurance Company,Malware,979,Finance,,Username and Password/Security Question Answers,2021,500-999,Unknown
10265,07/27/2020 12:00:00 AM,08/26/2020 12:00:00 AM,Cyberattack,2019-10-01T00:00:00,2020-04-08T00:00:00,"Stericycle, Inc.",Malware,1284,Business,Professional Services,Name,2021,"1,000-9,999",300-399
10265,07/27/2020 12:00:00 AM,08/26/2020 12:00:00 AM,Cyberattack,2019-10-01T00:00:00,2020-04-08T00:00:00,"Stericycle, Inc.",Malware,1284,Business,Professional Services,Social Security Number,2021,"1,000-9,999",300-399
10265,07/27/2020 12:00:00 AM,08/26/2020 12:00:00 AM,Cyberattack,2019-10-01T00:00:00,2020-04-08T00:00:00,"Stericycle, Inc.",Malware,1284,Business,Professional Services,Driver's License or Washington ID Card Number,2021,"1,000-9,999",300-399
10265,07/27/2020 12:00:00 AM,08/26/2020 12:00:00 AM,Cyberattack,2019-10-01T00:00:00,2020-04-08T00:00:00,"Stericycle, Inc.",Malware,1284,Business,Professional Services,Financial & Banking Information,2021,"1,000-9,999",300-399
10265,07/27/2020 12:00:00 AM,08/26/2020 12:00:00 AM,Cyberattack,2019-10-01T00:00:00,2020-04-08T00:00:00,"Stericycle, Inc.",Malware,1284,Business,Professional Services,Passport Number,2021,"1,000-9,999",300-399
10265,07/27/2020 12:00:00 AM,08/26/2020 12:00:00 AM,Cyberattack,2019-10-01T00:00:00,2020-04-08T00:00:00,"Stericycle, Inc.",Malware,1284,Business,Professional Services,Health Insurance Policy or ID Number,2021,"1,000-9,999",300-399
10265,07/27/2020 12:00:00 AM,08/26/2020 12:00:00 AM,Cyberattack,2019-10-01T00:00:00,2020-04-08T00:00:00,"Stericycle, Inc.",Malware,1284,Business,Professional Services,Medical Information,2021,"1,000-9,999",300-399
10266,07/16/2020 12:00:00 AM,08/27/2020 12:00:00 AM,Cyberattack,2020-02-07T00:00:00,2020-05-20T00:00:00,"The Omicron Delta Kappa Society and Educational Foundation, Inc.",Ransomware,1753,Non-Profit/Charity,,Name,2021,"1,000-9,999",100-199
10266,07/16/2020 12:00:00 AM,08/27/2020 12:00:00 AM,Cyberattack,2020-02-07T00:00:00,2020-05-20T00:00:00,"The Omicron Delta Kappa Society and Educational Foundation, Inc.",Ransomware,1753,Non-Profit/Charity,,Full Date of Birth,2021,"1,000-9,999",100-199
10266,07/16/2020 12:00:00 AM,08/27/2020 12:00:00 AM,Cyberattack,2020-02-07T00:00:00,2020-05-20T00:00:00,"The Omicron Delta Kappa Society and Educational Foundation, Inc.",Ransomware,1753,Non-Profit/Charity,,Other,2021,"1,000-9,999",100-199
10267,07/16/2020 12:00:00 AM,08/27/2020 12:00:00 AM,Cyberattack,2020-02-07T00:00:00,2020-05-20T00:00:00,University of Puget Sound,Ransomware,1429,Education,,Name,2021,"1,000-9,999",100-199
10267,07/16/2020 12:00:00 AM,08/27/2020 12:00:00 AM,Cyberattack,2020-02-07T00:00:00,2020-05-20T00:00:00,University of Puget Sound,Ransomware,1429,Education,,Full Date of Birth,2021,"1,000-9,999",100-199
10267,07/16/2020 12:00:00 AM,08/27/2020 12:00:00 AM,Cyberattack,2020-02-07T00:00:00,2020-05-20T00:00:00,University of Puget Sound,Ransomware,1429,Education,,Other,2021,"1,000-9,999",100-199
15130,05/11/2023 12:00:00 AM,05/19/2023 12:00:00 AM,Unauthorized Access,,,University of Puget Sound,,623,Education,,Other,2023,500-999,Unknown
15130,05/11/2023 12:00:00 AM,05/19/2023 12:00:00 AM,Unauthorized Access,,,University of Puget Sound,,623,Education,,Name,2023,500-999,Unknown
15130,05/11/2023 12:00:00 AM,05/19/2023 12:00:00 AM,Unauthorized Access,,,University of Puget Sound,,623,Education,,Email Address and Password/Security Question Answers,2023,500-999,Unknown
10268,07/27/2020 12:00:00 AM,08/28/2020 12:00:00 AM,Cyberattack,2019-06-01T00:00:00,2020-06-17T00:00:00,"AliMed, Inc.",Malware,672,Business,Manufacturing,Name,2021,500-999,400-499
10268,07/27/2020 12:00:00 AM,08/28/2020 12:00:00 AM,Cyberattack,2019-06-01T00:00:00,2020-06-17T00:00:00,"AliMed, Inc.",Malware,672,Business,Manufacturing,Financial & Banking Information,2021,500-999,400-499
10269,07/16/2020 12:00:00 AM,08/28/2020 12:00:00 AM,Cyberattack,2020-02-07T00:00:00,2020-05-20T00:00:00,University of Alaska Foundation,Ransomware,6586,Non-Profit/Charity,,Name,2021,"1,000-9,999",100-199
10269,07/16/2020 12:00:00 AM,08/28/2020 12:00:00 AM,Cyberattack,2020-02-07T00:00:00,2020-05-20T00:00:00,University of Alaska Foundation,Ransomware,6586,Non-Profit/Charity,,Full Date of Birth,2021,"1,000-9,999",100-199
10269,07/16/2020 12:00:00 AM,08/28/2020 12:00:00 AM,Cyberattack,2020-02-07T00:00:00,2020-05-20T00:00:00,University of Alaska Foundation,Ransomware,6586,Non-Profit/Charity,,Student ID Number,2021,"1,000-9,999",100-199
10271,05/19/2020 12:00:00 AM,08/31/2020 12:00:00 AM,Cyberattack,2020-05-15T00:00:00,2020-05-17T00:00:00,Assured Imaging,Ransomware,37702,Health,,Financial & Banking Information,2021,"10,000-49,999",1-99
10271,05/19/2020 12:00:00 AM,08/31/2020 12:00:00 AM,Cyberattack,2020-05-15T00:00:00,2020-05-17T00:00:00,Assured Imaging,Ransomware,37702,Health,,Full Date of Birth,2021,"10,000-49,999",1-99
10271,05/19/2020 12:00:00 AM,08/31/2020 12:00:00 AM,Cyberattack,2020-05-15T00:00:00,2020-05-17T00:00:00,Assured Imaging,Ransomware,37702,Health,,Medical Information,2021,"10,000-49,999",1-99
10271,05/19/2020 12:00:00 AM,08/31/2020 12:00:00 AM,Cyberattack,2020-05-15T00:00:00,2020-05-17T00:00:00,Assured Imaging,Ransomware,37702,Health,,Other,2021,"10,000-49,999",1-99
10271,05/19/2020 12:00:00 AM,08/31/2020 12:00:00 AM,Cyberattack,2020-05-15T00:00:00,2020-05-17T00:00:00,Assured Imaging,Ransomware,37702,Health,,Name,2021,"10,000-49,999",1-99
10271,05/19/2020 12:00:00 AM,08/31/2020 12:00:00 AM,Cyberattack,2020-05-15T00:00:00,2020-05-17T00:00:00,Assured Imaging,Ransomware,37702,Health,,Social Security Number,2021,"10,000-49,999",1-99
10271,05/19/2020 12:00:00 AM,08/31/2020 12:00:00 AM,Cyberattack,2020-05-15T00:00:00,2020-05-17T00:00:00,Assured Imaging,Ransomware,37702,Health,,Driver's License or Washington ID Card Number,2021,"10,000-49,999",1-99
10272,07/16/2020 12:00:00 AM,08/31/2020 12:00:00 AM,Cyberattack,2020-02-07T00:00:00,2020-05-20T00:00:00,Planned Parenthood Los Angeles,Ransomware,1027,Non-Profit/Charity,,Name,2021,"1,000-9,999",100-199
10272,07/16/2020 12:00:00 AM,08/31/2020 12:00:00 AM,Cyberattack,2020-02-07T00:00:00,2020-05-20T00:00:00,Planned Parenthood Los Angeles,Ransomware,1027,Non-Profit/Charity,,Full Date of Birth,2021,"1,000-9,999",100-199
10272,07/16/2020 12:00:00 AM,08/31/2020 12:00:00 AM,Cyberattack,2020-02-07T00:00:00,2020-05-20T00:00:00,Planned Parenthood Los Angeles,Ransomware,1027,Non-Profit/Charity,,Other,2021,"1,000-9,999",100-199
10273,08/06/2020 12:00:00 AM,08/31/2020 12:00:00 AM,Cyberattack,2020-02-07T00:00:00,2020-05-20T00:00:00,The Open Window School,Ransomware,1929,Education,,Name,2021,"1,000-9,999",100-199
10273,08/06/2020 12:00:00 AM,08/31/2020 12:00:00 AM,Cyberattack,2020-02-07T00:00:00,2020-05-20T00:00:00,The Open Window School,Ransomware,1929,Education,,Full Date of Birth,2021,"1,000-9,999",100-199
10273,08/06/2020 12:00:00 AM,08/31/2020 12:00:00 AM,Cyberattack,2020-02-07T00:00:00,2020-05-20T00:00:00,The Open Window School,Ransomware,1929,Education,,Medical Information,2021,"1,000-9,999",100-199
10274,07/16/2020 12:00:00 AM,09/01/2020 12:00:00 AM,Cyberattack,2020-02-07T00:00:00,2020-05-20T00:00:00,"Guide Dogs for the Blind, Inc.",Ransomware,8169,Non-Profit/Charity,,Name,2021,"1,000-9,999",100-199
10274,07/16/2020 12:00:00 AM,09/01/2020 12:00:00 AM,Cyberattack,2020-02-07T00:00:00,2020-05-20T00:00:00,"Guide Dogs for the Blind, Inc.",Ransomware,8169,Non-Profit/Charity,,Full Date of Birth,2021,"1,000-9,999",100-199
10274,07/16/2020 12:00:00 AM,09/01/2020 12:00:00 AM,Cyberattack,2020-02-07T00:00:00,2020-05-20T00:00:00,"Guide Dogs for the Blind, Inc.",Ransomware,8169,Non-Profit/Charity,,Other,2021,"1,000-9,999",100-199
10275,08/07/2020 12:00:00 AM,09/14/2020 12:00:00 AM,Cyberattack,2020-02-07T00:00:00,2020-05-20T00:00:00,Children's Cancer Association,Ransomware,1752,Non-Profit/Charity,,Name,2021,"1,000-9,999",100-199
10275,08/07/2020 12:00:00 AM,09/14/2020 12:00:00 AM,Cyberattack,2020-02-07T00:00:00,2020-05-20T00:00:00,Children's Cancer Association,Ransomware,1752,Non-Profit/Charity,,Full Date of Birth,2021,"1,000-9,999",100-199
10275,08/07/2020 12:00:00 AM,09/14/2020 12:00:00 AM,Cyberattack,2020-02-07T00:00:00,2020-05-20T00:00:00,Children's Cancer Association,Ransomware,1752,Non-Profit/Charity,,Medical Information,2021,"1,000-9,999",100-199
10276,07/16/2020 12:00:00 AM,09/14/2020 12:00:00 AM,Cyberattack,2020-02-07T00:00:00,2020-05-20T00:00:00,Jewish Family Service,Ransomware,3204,Non-Profit/Charity,,Name,2021,"1,000-9,999",100-199
10276,07/16/2020 12:00:00 AM,09/14/2020 12:00:00 AM,Cyberattack,2020-02-07T00:00:00,2020-05-20T00:00:00,Jewish Family Service,Ransomware,3204,Non-Profit/Charity,,Full Date of Birth,2021,"1,000-9,999",100-199
10276,07/16/2020 12:00:00 AM,09/14/2020 12:00:00 AM,Cyberattack,2020-02-07T00:00:00,2020-05-20T00:00:00,Jewish Family Service,Ransomware,3204,Non-Profit/Charity,,Other,2021,"1,000-9,999",100-199
10277,08/18/2020 12:00:00 AM,09/15/2020 12:00:00 AM,Cyberattack,2020-02-07T00:00:00,2020-05-20T00:00:00,American Heart Association,Ransomware,7658,Non-Profit/Charity,,Name,2021,"1,000-9,999",100-199
10277,08/18/2020 12:00:00 AM,09/15/2020 12:00:00 AM,Cyberattack,2020-02-07T00:00:00,2020-05-20T00:00:00,American Heart Association,Ransomware,7658,Non-Profit/Charity,,Full Date of Birth,2021,"1,000-9,999",100-199
10277,08/18/2020 12:00:00 AM,09/15/2020 12:00:00 AM,Cyberattack,2020-02-07T00:00:00,2020-05-20T00:00:00,American Heart Association,Ransomware,7658,Non-Profit/Charity,,Other,2021,"1,000-9,999",100-199
10278,07/16/2020 12:00:00 AM,09/02/2020 12:00:00 AM,Cyberattack,2020-02-07T00:00:00,2020-05-20T00:00:00,Hamline University,Ransomware,1066,Education,,Name,2021,"1,000-9,999",100-199
10278,07/16/2020 12:00:00 AM,09/02/2020 12:00:00 AM,Cyberattack,2020-02-07T00:00:00,2020-05-20T00:00:00,Hamline University,Ransomware,1066,Education,,Full Date of Birth,2021,"1,000-9,999",100-199
10278,07/16/2020 12:00:00 AM,09/02/2020 12:00:00 AM,Cyberattack,2020-02-07T00:00:00,2020-05-20T00:00:00,Hamline University,Ransomware,1066,Education,,Other,2021,"1,000-9,999",100-199
10279,08/03/2020 12:00:00 AM,09/02/2020 12:00:00 AM,Cyberattack,2020-05-27T00:00:00,2020-08-03T00:00:00,Nutranext,Malware,580,Business,Consumable,Name,2021,500-999,1-99
10279,08/03/2020 12:00:00 AM,09/02/2020 12:00:00 AM,Cyberattack,2020-05-27T00:00:00,2020-08-03T00:00:00,Nutranext,Malware,580,Business,Consumable,Financial & Banking Information,2021,500-999,1-99
10279,08/03/2020 12:00:00 AM,09/02/2020 12:00:00 AM,Cyberattack,2020-05-27T00:00:00,2020-08-03T00:00:00,Nutranext,Malware,580,Business,Consumable,Other,2021,500-999,1-99
10280,08/11/2020 12:00:00 AM,09/02/2020 12:00:00 AM,Cyberattack,2020-02-07T00:00:00,2020-05-20T00:00:00,University of North Dakota Alumni Association and Foundation,Ransomware,2687,Non-Profit/Charity,,Name,2021,"1,000-9,999",100-199
10280,08/11/2020 12:00:00 AM,09/02/2020 12:00:00 AM,Cyberattack,2020-02-07T00:00:00,2020-05-20T00:00:00,University of North Dakota Alumni Association and Foundation,Ransomware,2687,Non-Profit/Charity,,Full Date of Birth,2021,"1,000-9,999",100-199
10281,07/16/2020 12:00:00 AM,09/02/2020 12:00:00 AM,Cyberattack,2020-02-07T00:00:00,2020-05-20T00:00:00,University of Rhode Island Foundation,Ransomware,500,Non-Profit/Charity,,Name,2021,500-999,100-199
10281,07/16/2020 12:00:00 AM,09/02/2020 12:00:00 AM,Cyberattack,2020-02-07T00:00:00,2020-05-20T00:00:00,University of Rhode Island Foundation,Ransomware,500,Non-Profit/Charity,,Full Date of Birth,2021,500-999,100-199
10281,07/16/2020 12:00:00 AM,09/02/2020 12:00:00 AM,Cyberattack,2020-02-07T00:00:00,2020-05-20T00:00:00,University of Rhode Island Foundation,Ransomware,500,Non-Profit/Charity,,Other,2021,500-999,100-199
10282,08/05/2020 12:00:00 AM,09/02/2020 12:00:00 AM,Cyberattack,2020-04-25T00:00:00,2020-08-05T00:00:00,Warner Music Group,Malware,3368,Business,Entertainment,Name,2021,"1,000-9,999",100-199
10282,08/05/2020 12:00:00 AM,09/02/2020 12:00:00 AM,Cyberattack,2020-04-25T00:00:00,2020-08-05T00:00:00,Warner Music Group,Malware,3368,Business,Entertainment,Financial & Banking Information,2021,"1,000-9,999",100-199
10282,08/05/2020 12:00:00 AM,09/02/2020 12:00:00 AM,Cyberattack,2020-04-25T00:00:00,2020-08-05T00:00:00,Warner Music Group,Malware,3368,Business,Entertainment,Other,2021,"1,000-9,999",100-199
10283,07/11/2020 12:00:00 AM,09/03/2020 12:00:00 AM,Cyberattack,2020-06-19T00:00:00,2020-07-11T00:00:00,Live Auctioneers,Malware,38523,Business,Other,Name,2021,"10,000-49,999",1-99
10283,07/11/2020 12:00:00 AM,09/03/2020 12:00:00 AM,Cyberattack,2020-06-19T00:00:00,2020-07-11T00:00:00,Live Auctioneers,Malware,38523,Business,Other,Email Address and Password/Security Question Answers,2021,"10,000-49,999",1-99
10283,07/11/2020 12:00:00 AM,09/03/2020 12:00:00 AM,Cyberattack,2020-06-19T00:00:00,2020-07-11T00:00:00,Live Auctioneers,Malware,38523,Business,Other,Other,2021,"10,000-49,999",1-99
10284,08/19/2020 12:00:00 AM,09/03/2020 12:00:00 AM,Cyberattack,2020-02-07T00:00:00,2020-05-20T00:00:00,Olympic College Foundation,Ransomware,25583,Non-Profit/Charity,,Name,2021,"10,000-49,999",100-199
10284,08/19/2020 12:00:00 AM,09/03/2020 12:00:00 AM,Cyberattack,2020-02-07T00:00:00,2020-05-20T00:00:00,Olympic College Foundation,Ransomware,25583,Non-Profit/Charity,,Full Date of Birth,2021,"10,000-49,999",100-199
10284,08/19/2020 12:00:00 AM,09/03/2020 12:00:00 AM,Cyberattack,2020-02-07T00:00:00,2020-05-20T00:00:00,Olympic College Foundation,Ransomware,25583,Non-Profit/Charity,,Other,2021,"10,000-49,999",100-199
10285,08/21/2020 12:00:00 AM,09/03/2020 12:00:00 AM,Unauthorized Access,2020-07-10T00:00:00,2020-07-10T00:00:00,"Osmose Utilities Services, Inc.",,577,Business,Construction,Name,2021,500-999,1-99
10285,08/21/2020 12:00:00 AM,09/03/2020 12:00:00 AM,Unauthorized Access,2020-07-10T00:00:00,2020-07-10T00:00:00,"Osmose Utilities Services, Inc.",,577,Business,Construction,Social Security Number,2021,500-999,1-99
10285,08/21/2020 12:00:00 AM,09/03/2020 12:00:00 AM,Unauthorized Access,2020-07-10T00:00:00,2020-07-10T00:00:00,"Osmose Utilities Services, Inc.",,577,Business,Construction,Financial & Banking Information,2021,500-999,1-99
10285,08/21/2020 12:00:00 AM,09/03/2020 12:00:00 AM,Unauthorized Access,2020-07-10T00:00:00,2020-07-10T00:00:00,"Osmose Utilities Services, Inc.",,577,Business,Construction,Health Insurance Policy or ID Number,2021,500-999,1-99
10286,07/16/2020 12:00:00 AM,09/03/2020 12:00:00 AM,Cyberattack,2020-02-07T00:00:00,2020-05-20T00:00:00,Polycystic Kidney Disease Foundation,Ransomware,8052,Non-Profit/Charity,,Name,2021,"1,000-9,999",100-199
10286,07/16/2020 12:00:00 AM,09/03/2020 12:00:00 AM,Cyberattack,2020-02-07T00:00:00,2020-05-20T00:00:00,Polycystic Kidney Disease Foundation,Ransomware,8052,Non-Profit/Charity,,Full Date of Birth,2021,"1,000-9,999",100-199
10286,07/16/2020 12:00:00 AM,09/03/2020 12:00:00 AM,Cyberattack,2020-02-07T00:00:00,2020-05-20T00:00:00,Polycystic Kidney Disease Foundation,Ransomware,8052,Non-Profit/Charity,,Medical Information,2021,"1,000-9,999",100-199
10286,07/16/2020 12:00:00 AM,09/03/2020 12:00:00 AM,Cyberattack,2020-02-07T00:00:00,2020-05-20T00:00:00,Polycystic Kidney Disease Foundation,Ransomware,8052,Non-Profit/Charity,,Other,2021,"1,000-9,999",100-199
10287,01/15/2020 12:00:00 AM,09/04/2020 12:00:00 AM,Cyberattack,2020-01-05T00:00:00,2020-01-08T00:00:00,"Artech, L.L.C.",Ransomware,1664,Business,Human Resources,Name,2021,"1,000-9,999",1-99
10287,01/15/2020 12:00:00 AM,09/04/2020 12:00:00 AM,Cyberattack,2020-01-05T00:00:00,2020-01-08T00:00:00,"Artech, L.L.C.",Ransomware,1664,Business,Human Resources,Social Security Number,2021,"1,000-9,999",1-99
10287,01/15/2020 12:00:00 AM,09/04/2020 12:00:00 AM,Cyberattack,2020-01-05T00:00:00,2020-01-08T00:00:00,"Artech, L.L.C.",Ransomware,1664,Business,Human Resources,Driver's License or Washington ID Card Number,2021,"1,000-9,999",1-99
10287,01/15/2020 12:00:00 AM,09/04/2020 12:00:00 AM,Cyberattack,2020-01-05T00:00:00,2020-01-08T00:00:00,"Artech, L.L.C.",Ransomware,1664,Business,Human Resources,Financial & Banking Information,2021,"1,000-9,999",1-99
10287,01/15/2020 12:00:00 AM,09/04/2020 12:00:00 AM,Cyberattack,2020-01-05T00:00:00,2020-01-08T00:00:00,"Artech, L.L.C.",Ransomware,1664,Business,Human Resources,Full Date of Birth,2021,"1,000-9,999",1-99
10287,01/15/2020 12:00:00 AM,09/04/2020 12:00:00 AM,Cyberattack,2020-01-05T00:00:00,2020-01-08T00:00:00,"Artech, L.L.C.",Ransomware,1664,Business,Human Resources,Unique Private Key (e.g. used to authenticate or sign an electronic record),2021,"1,000-9,999",1-99
10287,01/15/2020 12:00:00 AM,09/04/2020 12:00:00 AM,Cyberattack,2020-01-05T00:00:00,2020-01-08T00:00:00,"Artech, L.L.C.",Ransomware,1664,Business,Human Resources,Passport Number,2021,"1,000-9,999",1-99
10287,01/15/2020 12:00:00 AM,09/04/2020 12:00:00 AM,Cyberattack,2020-01-05T00:00:00,2020-01-08T00:00:00,"Artech, L.L.C.",Ransomware,1664,Business,Human Resources,Health Insurance Policy or ID Number,2021,"1,000-9,999",1-99
10287,01/15/2020 12:00:00 AM,09/04/2020 12:00:00 AM,Cyberattack,2020-01-05T00:00:00,2020-01-08T00:00:00,"Artech, L.L.C.",Ransomware,1664,Business,Human Resources,Medical Information,2021,"1,000-9,999",1-99
10288,08/05/2020 12:00:00 AM,09/04/2020 12:00:00 AM,Cyberattack,2020-02-07T00:00:00,2020-05-20T00:00:00,Children's Home Society of Washington,Ransomware,564,Non-Profit/Charity,,Name,2021,500-999,100-199
10288,08/05/2020 12:00:00 AM,09/04/2020 12:00:00 AM,Cyberattack,2020-02-07T00:00:00,2020-05-20T00:00:00,Children's Home Society of Washington,Ransomware,564,Non-Profit/Charity,,Financial & Banking Information,2021,500-999,100-199
10288,08/05/2020 12:00:00 AM,09/04/2020 12:00:00 AM,Cyberattack,2020-02-07T00:00:00,2020-05-20T00:00:00,Children's Home Society of Washington,Ransomware,564,Non-Profit/Charity,,Other,2021,500-999,100-199
10289,08/05/2020 12:00:00 AM,09/04/2020 12:00:00 AM,Cyberattack,2020-02-07T00:00:00,2020-05-20T00:00:00,Drake University,Ransomware,1050,Education,,Name,2021,"1,000-9,999",100-199
10289,08/05/2020 12:00:00 AM,09/04/2020 12:00:00 AM,Cyberattack,2020-02-07T00:00:00,2020-05-20T00:00:00,Drake University,Ransomware,1050,Education,,Full Date of Birth,2021,"1,000-9,999",100-199
10290,08/14/2020 12:00:00 AM,09/04/2020 12:00:00 AM,Cyberattack,2020-02-07T00:00:00,2020-05-20T00:00:00,Hydrocephalus Association,Ransomware,835,Non-Profit/Charity,,Name,2021,500-999,100-199
10290,08/14/2020 12:00:00 AM,09/04/2020 12:00:00 AM,Cyberattack,2020-02-07T00:00:00,2020-05-20T00:00:00,Hydrocephalus Association,Ransomware,835,Non-Profit/Charity,,Full Date of Birth,2021,500-999,100-199
10290,08/14/2020 12:00:00 AM,09/04/2020 12:00:00 AM,Cyberattack,2020-02-07T00:00:00,2020-05-20T00:00:00,Hydrocephalus Association,Ransomware,835,Non-Profit/Charity,,Medical Information,2021,500-999,100-199
10290,08/14/2020 12:00:00 AM,09/04/2020 12:00:00 AM,Cyberattack,2020-02-07T00:00:00,2020-05-20T00:00:00,Hydrocephalus Association,Ransomware,835,Non-Profit/Charity,,Other,2021,500-999,100-199
10291,08/27/2020 12:00:00 AM,09/04/2020 12:00:00 AM,Cyberattack,2020-02-07T00:00:00,2020-05-20T00:00:00,Navy League of the United States,Ransomware,1398,Non-Profit/Charity,,Name,2021,"1,000-9,999",200-299
10291,08/27/2020 12:00:00 AM,09/04/2020 12:00:00 AM,Cyberattack,2020-02-07T00:00:00,2020-05-20T00:00:00,Navy League of the United States,Ransomware,1398,Non-Profit/Charity,,Full Date of Birth,2021,"1,000-9,999",200-299
10291,08/27/2020 12:00:00 AM,09/04/2020 12:00:00 AM,Cyberattack,2020-02-07T00:00:00,2020-05-20T00:00:00,Navy League of the United States,Ransomware,1398,Non-Profit/Charity,,Other,2021,"1,000-9,999",200-299
10292,08/05/2020 12:00:00 AM,09/04/2020 12:00:00 AM,Cyberattack,2020-02-07T00:00:00,2020-05-20T00:00:00,Southern Adventist University,Ransomware,1336,Education,,Name,2021,"1,000-9,999",100-199
10292,08/05/2020 12:00:00 AM,09/04/2020 12:00:00 AM,Cyberattack,2020-02-07T00:00:00,2020-05-20T00:00:00,Southern Adventist University,Ransomware,1336,Education,,Full Date of Birth,2021,"1,000-9,999",100-199
10292,08/05/2020 12:00:00 AM,09/04/2020 12:00:00 AM,Cyberattack,2020-02-07T00:00:00,2020-05-20T00:00:00,Southern Adventist University,Ransomware,1336,Education,,Student ID Number,2021,"1,000-9,999",100-199
10292,08/05/2020 12:00:00 AM,09/04/2020 12:00:00 AM,Cyberattack,2020-02-07T00:00:00,2020-05-20T00:00:00,Southern Adventist University,Ransomware,1336,Education,,Other,2021,"1,000-9,999",100-199
10293,07/16/2020 12:00:00 AM,09/07/2020 12:00:00 AM,Cyberattack,2020-02-07T00:00:00,2020-05-20T00:00:00,Operation Homefront,Ransomware,5272,Non-Profit/Charity,,Name,2021,"1,000-9,999",100-199
10293,07/16/2020 12:00:00 AM,09/07/2020 12:00:00 AM,Cyberattack,2020-02-07T00:00:00,2020-05-20T00:00:00,Operation Homefront,Ransomware,5272,Non-Profit/Charity,,Full Date of Birth,2021,"1,000-9,999",100-199
10293,07/16/2020 12:00:00 AM,09/07/2020 12:00:00 AM,Cyberattack,2020-02-07T00:00:00,2020-05-20T00:00:00,Operation Homefront,Ransomware,5272,Non-Profit/Charity,,Other,2021,"1,000-9,999",100-199
10294,08/11/2020 12:00:00 AM,09/08/2020 12:00:00 AM,Cyberattack,2020-02-07T00:00:00,2020-05-20T00:00:00,Florida International University Foundation,Ransomware,922,Education,,Name,2021,500-999,100-199
10294,08/11/2020 12:00:00 AM,09/08/2020 12:00:00 AM,Cyberattack,2020-02-07T00:00:00,2020-05-20T00:00:00,Florida International University Foundation,Ransomware,922,Education,,Full Date of Birth,2021,500-999,100-199
10295,08/11/2020 12:00:00 AM,09/08/2020 12:00:00 AM,Cyberattack,2020-02-07T00:00:00,2020-05-20T00:00:00,NOLS,Ransomware,3049,Non-Profit/Charity,,Name,2021,"1,000-9,999",100-199
10295,08/11/2020 12:00:00 AM,09/08/2020 12:00:00 AM,Cyberattack,2020-02-07T00:00:00,2020-05-20T00:00:00,NOLS,Ransomware,3049,Non-Profit/Charity,,Full Date of Birth,2021,"1,000-9,999",100-199
10295,08/11/2020 12:00:00 AM,09/08/2020 12:00:00 AM,Cyberattack,2020-02-07T00:00:00,2020-05-20T00:00:00,NOLS,Ransomware,3049,Non-Profit/Charity,,Other,2021,"1,000-9,999",100-199
10296,11/17/2019 12:00:00 AM,09/11/2020 12:00:00 AM,Unauthorized Access,2019-11-07T00:00:00,2020-02-03T00:00:00,"CorePower Yoga, LLC",,618,Business,Fitness,Name,2021,500-999,1-99
10296,11/17/2019 12:00:00 AM,09/11/2020 12:00:00 AM,Unauthorized Access,2019-11-07T00:00:00,2020-02-03T00:00:00,"CorePower Yoga, LLC",,618,Business,Fitness,Social Security Number,2021,500-999,1-99
10296,11/17/2019 12:00:00 AM,09/11/2020 12:00:00 AM,Unauthorized Access,2019-11-07T00:00:00,2020-02-03T00:00:00,"CorePower Yoga, LLC",,618,Business,Fitness,Driver's License or Washington ID Card Number,2021,500-999,1-99
10296,11/17/2019 12:00:00 AM,09/11/2020 12:00:00 AM,Unauthorized Access,2019-11-07T00:00:00,2020-02-03T00:00:00,"CorePower Yoga, LLC",,618,Business,Fitness,Financial & Banking Information,2021,500-999,1-99
10296,11/17/2019 12:00:00 AM,09/11/2020 12:00:00 AM,Unauthorized Access,2019-11-07T00:00:00,2020-02-03T00:00:00,"CorePower Yoga, LLC",,618,Business,Fitness,Full Date of Birth,2021,500-999,1-99
10296,11/17/2019 12:00:00 AM,09/11/2020 12:00:00 AM,Unauthorized Access,2019-11-07T00:00:00,2020-02-03T00:00:00,"CorePower Yoga, LLC",,618,Business,Fitness,Passport Number,2021,500-999,1-99
10296,11/17/2019 12:00:00 AM,09/11/2020 12:00:00 AM,Unauthorized Access,2019-11-07T00:00:00,2020-02-03T00:00:00,"CorePower Yoga, LLC",,618,Business,Fitness,Health Insurance Policy or ID Number,2021,500-999,1-99
10296,11/17/2019 12:00:00 AM,09/11/2020 12:00:00 AM,Unauthorized Access,2019-11-07T00:00:00,2020-02-03T00:00:00,"CorePower Yoga, LLC",,618,Business,Fitness,Medical Information,2021,500-999,1-99
10297,07/16/2020 12:00:00 AM,09/14/2020 12:00:00 AM,Cyberattack,2020-02-07T00:00:00,2020-05-20T00:00:00,"AARP, Inc. & AARP Foundation",Ransomware,248615,Non-Profit/Charity,,Name,2021,"50,000-999,999",100-199
10297,07/16/2020 12:00:00 AM,09/14/2020 12:00:00 AM,Cyberattack,2020-02-07T00:00:00,2020-05-20T00:00:00,"AARP, Inc. & AARP Foundation",Ransomware,248615,Non-Profit/Charity,,Full Date of Birth,2021,"50,000-999,999",100-199
10298,08/14/2020 12:00:00 AM,09/08/2020 12:00:00 AM,Cyberattack,2020-02-07T00:00:00,2020-05-20T00:00:00,Saybrook University,Ransomware,935,Education,,Name,2021,500-999,100-199
10298,08/14/2020 12:00:00 AM,09/08/2020 12:00:00 AM,Cyberattack,2020-02-07T00:00:00,2020-05-20T00:00:00,Saybrook University,Ransomware,935,Education,,Full Date of Birth,2021,500-999,100-199
10298,08/14/2020 12:00:00 AM,09/08/2020 12:00:00 AM,Cyberattack,2020-02-07T00:00:00,2020-05-20T00:00:00,Saybrook University,Ransomware,935,Education,,Other,2021,500-999,100-199
10299,08/11/2020 12:00:00 AM,09/08/2020 12:00:00 AM,Cyberattack,2020-02-07T00:00:00,2020-05-20T00:00:00,The University of Notre Dame,Ransomware,3209,Education,,Name,2021,"1,000-9,999",100-199
10299,08/11/2020 12:00:00 AM,09/08/2020 12:00:00 AM,Cyberattack,2020-02-07T00:00:00,2020-05-20T00:00:00,The University of Notre Dame,Ransomware,3209,Education,,Full Date of Birth,2021,"1,000-9,999",100-199
10299,08/11/2020 12:00:00 AM,09/08/2020 12:00:00 AM,Cyberattack,2020-02-07T00:00:00,2020-05-20T00:00:00,The University of Notre Dame,Ransomware,3209,Education,,Other,2021,"1,000-9,999",100-199
10300,07/16/2020 12:00:00 AM,09/08/2020 12:00:00 AM,Cyberattack,2020-02-07T00:00:00,2020-05-20T00:00:00,Virginia Mason Medical Center,Ransomware,227371,Health,,Name,2021,"50,000-999,999",100-199
10300,07/16/2020 12:00:00 AM,09/08/2020 12:00:00 AM,Cyberattack,2020-02-07T00:00:00,2020-05-20T00:00:00,Virginia Mason Medical Center,Ransomware,227371,Health,,Full Date of Birth,2021,"50,000-999,999",100-199
10300,07/16/2020 12:00:00 AM,09/08/2020 12:00:00 AM,Cyberattack,2020-02-07T00:00:00,2020-05-20T00:00:00,Virginia Mason Medical Center,Ransomware,227371,Health,,Other,2021,"50,000-999,999",100-199
10301,07/16/2020 12:00:00 AM,09/08/2020 12:00:00 AM,Cyberattack,2020-02-07T00:00:00,2020-05-20T00:00:00,Pacific University Oregon,Ransomware,9196,Education,,Name,2021,"1,000-9,999",100-199
10301,07/16/2020 12:00:00 AM,09/08/2020 12:00:00 AM,Cyberattack,2020-02-07T00:00:00,2020-05-20T00:00:00,Pacific University Oregon,Ransomware,9196,Education,,Full Date of Birth,2021,"1,000-9,999",100-199
10301,07/16/2020 12:00:00 AM,09/08/2020 12:00:00 AM,Cyberattack,2020-02-07T00:00:00,2020-05-20T00:00:00,Pacific University Oregon,Ransomware,9196,Education,,Other,2021,"1,000-9,999",100-199
10302,08/10/2020 12:00:00 AM,09/09/2020 12:00:00 AM,Cyberattack,2020-02-07T00:00:00,2020-05-20T00:00:00,Inova Health System,Ransomware,2470,Health,,Name,2021,"1,000-9,999",100-199
10302,08/10/2020 12:00:00 AM,09/09/2020 12:00:00 AM,Cyberattack,2020-02-07T00:00:00,2020-05-20T00:00:00,Inova Health System,Ransomware,2470,Health,,Full Date of Birth,2021,"1,000-9,999",100-199
10302,08/10/2020 12:00:00 AM,09/09/2020 12:00:00 AM,Cyberattack,2020-02-07T00:00:00,2020-05-20T00:00:00,Inova Health System,Ransomware,2470,Health,,Medical Information,2021,"1,000-9,999",100-199
10302,08/10/2020 12:00:00 AM,09/09/2020 12:00:00 AM,Cyberattack,2020-02-07T00:00:00,2020-05-20T00:00:00,Inova Health System,Ransomware,2470,Health,,Other,2021,"1,000-9,999",100-199
10303,07/16/2020 12:00:00 AM,09/09/2020 12:00:00 AM,Cyberattack,2020-02-07T00:00:00,2020-05-20T00:00:00,KidsQuest Children's Museum,Ransomware,57024,Non-Profit/Charity,,Name,2021,"50,000-999,999",100-199
10303,07/16/2020 12:00:00 AM,09/09/2020 12:00:00 AM,Cyberattack,2020-02-07T00:00:00,2020-05-20T00:00:00,KidsQuest Children's Museum,Ransomware,57024,Non-Profit/Charity,,Full Date of Birth,2021,"50,000-999,999",100-199
10303,07/16/2020 12:00:00 AM,09/09/2020 12:00:00 AM,Cyberattack,2020-02-07T00:00:00,2020-05-20T00:00:00,KidsQuest Children's Museum,Ransomware,57024,Non-Profit/Charity,,Other,2021,"50,000-999,999",100-199
10304,,09/11/2020 12:00:00 AM,Cyberattack,2020-02-07T00:00:00,2020-05-20T00:00:00,YouthCare,Ransomware,3410,Non-Profit/Charity,,Name,2021,"1,000-9,999",Unknown
10304,,09/11/2020 12:00:00 AM,Cyberattack,2020-02-07T00:00:00,2020-05-20T00:00:00,YouthCare,Ransomware,3410,Non-Profit/Charity,,Full Date of Birth,2021,"1,000-9,999",Unknown
10304,,09/11/2020 12:00:00 AM,Cyberattack,2020-02-07T00:00:00,2020-05-20T00:00:00,YouthCare,Ransomware,3410,Non-Profit/Charity,,Other,2021,"1,000-9,999",Unknown
10307,,09/15/2020 12:00:00 AM,Cyberattack,2020-02-07T00:00:00,2020-05-20T00:00:00,American Medical Association Foundation,Ransomware,1369,Non-Profit/Charity,,Name,2021,"1,000-9,999",Unknown
10307,,09/15/2020 12:00:00 AM,Cyberattack,2020-02-07T00:00:00,2020-05-20T00:00:00,American Medical Association Foundation,Ransomware,1369,Non-Profit/Charity,,Full Date of Birth,2021,"1,000-9,999",Unknown
10307,,09/15/2020 12:00:00 AM,Cyberattack,2020-02-07T00:00:00,2020-05-20T00:00:00,American Medical Association Foundation,Ransomware,1369,Non-Profit/Charity,,Other,2021,"1,000-9,999",Unknown
10308,08/14/2020 12:00:00 AM,09/17/2020 12:00:00 AM,Cyberattack,2019-07-14T00:00:00,2020-06-30T00:00:00,Greenworks Tools,Malware,679,Business,Retail,Name,2021,500-999,300-399
10308,08/14/2020 12:00:00 AM,09/17/2020 12:00:00 AM,Cyberattack,2019-07-14T00:00:00,2020-06-30T00:00:00,Greenworks Tools,Malware,679,Business,Retail,Financial & Banking Information,2021,500-999,300-399
10308,08/14/2020 12:00:00 AM,09/17/2020 12:00:00 AM,Cyberattack,2019-07-14T00:00:00,2020-06-30T00:00:00,Greenworks Tools,Malware,679,Business,Retail,Other,2021,500-999,300-399
10310,,09/17/2020 12:00:00 AM,Cyberattack,2020-02-07T00:00:00,2020-05-20T00:00:00,Tidewater Community College Education Foundation,Ransomware,1029,Non-Profit/Charity,,Name,2021,"1,000-9,999",Unknown
10310,,09/17/2020 12:00:00 AM,Cyberattack,2020-02-07T00:00:00,2020-05-20T00:00:00,Tidewater Community College Education Foundation,Ransomware,1029,Non-Profit/Charity,,Full Date of Birth,2021,"1,000-9,999",Unknown
10310,,09/17/2020 12:00:00 AM,Cyberattack,2020-02-07T00:00:00,2020-05-20T00:00:00,Tidewater Community College Education Foundation,Ransomware,1029,Non-Profit/Charity,,Other,2021,"1,000-9,999",Unknown
10311,09/09/2020 12:00:00 AM,09/17/2020 12:00:00 AM,Cyberattack,2020-02-07T00:00:00,2020-05-20T00:00:00,Western Washington University Foundation,Ransomware,165000,Education,,Name,2021,"50,000-999,999",200-299
10311,09/09/2020 12:00:00 AM,09/17/2020 12:00:00 AM,Cyberattack,2020-02-07T00:00:00,2020-05-20T00:00:00,Western Washington University Foundation,Ransomware,165000,Education,,Full Date of Birth,2021,"50,000-999,999",200-299
10311,09/09/2020 12:00:00 AM,09/17/2020 12:00:00 AM,Cyberattack,2020-02-07T00:00:00,2020-05-20T00:00:00,Western Washington University Foundation,Ransomware,165000,Education,,Student ID Number,2021,"50,000-999,999",200-299
10311,09/09/2020 12:00:00 AM,09/17/2020 12:00:00 AM,Cyberattack,2020-02-07T00:00:00,2020-05-20T00:00:00,Western Washington University Foundation,Ransomware,165000,Education,,Other,2021,"50,000-999,999",200-299
10312,07/16/2020 12:00:00 AM,09/18/2020 12:00:00 AM,Cyberattack,2020-02-07T00:00:00,2020-05-20T00:00:00,Ball State University Foundation,Ransomware,755,Non-Profit/Charity,,Name,2021,500-999,100-199
10312,07/16/2020 12:00:00 AM,09/18/2020 12:00:00 AM,Cyberattack,2020-02-07T00:00:00,2020-05-20T00:00:00,Ball State University Foundation,Ransomware,755,Non-Profit/Charity,,Social Security Number,2021,500-999,100-199
10312,07/16/2020 12:00:00 AM,09/18/2020 12:00:00 AM,Cyberattack,2020-02-07T00:00:00,2020-05-20T00:00:00,Ball State University Foundation,Ransomware,755,Non-Profit/Charity,,Other,2021,500-999,100-199
10313,08/21/2020 12:00:00 AM,09/18/2020 12:00:00 AM,Cyberattack,2020-04-26T00:00:00,2020-08-03T00:00:00,"FabFitFun, Inc.",Malware,11094,Business,Retail,Name,2021,"10,000-49,999",100-199
10313,08/21/2020 12:00:00 AM,09/18/2020 12:00:00 AM,Cyberattack,2020-04-26T00:00:00,2020-08-03T00:00:00,"FabFitFun, Inc.",Malware,11094,Business,Retail,Financial & Banking Information,2021,"10,000-49,999",100-199
10313,08/21/2020 12:00:00 AM,09/18/2020 12:00:00 AM,Cyberattack,2020-04-26T00:00:00,2020-08-03T00:00:00,"FabFitFun, Inc.",Malware,11094,Business,Retail,Email Address and Password/Security Question Answers,2021,"10,000-49,999",100-199
10313,08/21/2020 12:00:00 AM,09/18/2020 12:00:00 AM,Cyberattack,2020-04-26T00:00:00,2020-08-03T00:00:00,"FabFitFun, Inc.",Malware,11094,Business,Retail,Other,2021,"10,000-49,999",100-199
10314,12/21/2020 12:00:00 AM,02/10/2021 12:00:00 AM,Cyberattack,,,"City of Ellensburg, Washington",Ransomware,8523,Government,,Financial & Banking Information,2021,"1,000-9,999",Unknown
10314,12/21/2020 12:00:00 AM,02/10/2021 12:00:00 AM,Cyberattack,,,"City of Ellensburg, Washington",Ransomware,8523,Government,,Full Date of Birth,2021,"1,000-9,999",Unknown
10314,12/21/2020 12:00:00 AM,02/10/2021 12:00:00 AM,Cyberattack,,,"City of Ellensburg, Washington",Ransomware,8523,Government,,Passport Number,2021,"1,000-9,999",Unknown
10314,12/21/2020 12:00:00 AM,02/10/2021 12:00:00 AM,Cyberattack,,,"City of Ellensburg, Washington",Ransomware,8523,Government,,Health Insurance Policy or ID Number,2021,"1,000-9,999",Unknown
10314,12/21/2020 12:00:00 AM,02/10/2021 12:00:00 AM,Cyberattack,,,"City of Ellensburg, Washington",Ransomware,8523,Government,,Medical Information,2021,"1,000-9,999",Unknown
10314,12/21/2020 12:00:00 AM,02/10/2021 12:00:00 AM,Cyberattack,,,"City of Ellensburg, Washington",Ransomware,8523,Government,,Other,2021,"1,000-9,999",Unknown
10314,12/21/2020 12:00:00 AM,02/10/2021 12:00:00 AM,Cyberattack,,,"City of Ellensburg, Washington",Ransomware,8523,Government,,Name,2021,"1,000-9,999",Unknown
10314,12/21/2020 12:00:00 AM,02/10/2021 12:00:00 AM,Cyberattack,,,"City of Ellensburg, Washington",Ransomware,8523,Government,,Social Security Number,2021,"1,000-9,999",Unknown
10314,12/21/2020 12:00:00 AM,02/10/2021 12:00:00 AM,Cyberattack,,,"City of Ellensburg, Washington",Ransomware,8523,Government,,Driver's License or Washington ID Card Number,2021,"1,000-9,999",Unknown
10315,07/16/2020 12:00:00 AM,09/18/2020 12:00:00 AM,Cyberattack,2020-02-07T00:00:00,2020-05-20T00:00:00,Homeward Pet Adoption Center,Ransomware,36050,Non-Profit/Charity,,Name,2021,"10,000-49,999",100-199
10315,07/16/2020 12:00:00 AM,09/18/2020 12:00:00 AM,Cyberattack,2020-02-07T00:00:00,2020-05-20T00:00:00,Homeward Pet Adoption Center,Ransomware,36050,Non-Profit/Charity,,Full Date of Birth,2021,"10,000-49,999",100-199
10315,07/16/2020 12:00:00 AM,09/18/2020 12:00:00 AM,Cyberattack,2020-02-07T00:00:00,2020-05-20T00:00:00,Homeward Pet Adoption Center,Ransomware,36050,Non-Profit/Charity,,Other,2021,"10,000-49,999",100-199
10316,08/20/2020 12:00:00 AM,09/18/2020 12:00:00 AM,Cyberattack,2020-02-07T00:00:00,2020-05-20T00:00:00,Joslin Diabetes Center,Ransomware,1212,Health,,Name,2021,"1,000-9,999",100-199
10316,08/20/2020 12:00:00 AM,09/18/2020 12:00:00 AM,Cyberattack,2020-02-07T00:00:00,2020-05-20T00:00:00,Joslin Diabetes Center,Ransomware,1212,Health,,Full Date of Birth,2021,"1,000-9,999",100-199
10316,08/20/2020 12:00:00 AM,09/18/2020 12:00:00 AM,Cyberattack,2020-02-07T00:00:00,2020-05-20T00:00:00,Joslin Diabetes Center,Ransomware,1212,Health,,Medical Information,2021,"1,000-9,999",100-199
10317,07/16/2020 12:00:00 AM,09/18/2020 12:00:00 AM,Cyberattack,2020-02-07T00:00:00,2020-05-20T00:00:00,Minnesota State University Mankato Foundation,Ransomware,1134,Non-Profit/Charity,,Name,2021,"1,000-9,999",100-199
10317,07/16/2020 12:00:00 AM,09/18/2020 12:00:00 AM,Cyberattack,2020-02-07T00:00:00,2020-05-20T00:00:00,Minnesota State University Mankato Foundation,Ransomware,1134,Non-Profit/Charity,,Full Date of Birth,2021,"1,000-9,999",100-199
10317,07/16/2020 12:00:00 AM,09/18/2020 12:00:00 AM,Cyberattack,2020-02-07T00:00:00,2020-05-20T00:00:00,Minnesota State University Mankato Foundation,Ransomware,1134,Non-Profit/Charity,,Other,2021,"1,000-9,999",100-199
10318,08/20/2020 12:00:00 AM,09/18/2020 12:00:00 AM,Theft or Mistake,2020-08-20T00:00:00,,St. Hubert's Church,,657,Non-Profit/Charity,,Name,2021,500-999,Unknown
10318,08/20/2020 12:00:00 AM,09/18/2020 12:00:00 AM,Theft or Mistake,2020-08-20T00:00:00,,St. Hubert's Church,,657,Non-Profit/Charity,,Full Date of Birth,2021,500-999,Unknown
10318,08/20/2020 12:00:00 AM,09/18/2020 12:00:00 AM,Theft or Mistake,2020-08-20T00:00:00,,St. Hubert's Church,,657,Non-Profit/Charity,,Other,2021,500-999,Unknown
10319,07/30/2020 12:00:00 AM,09/18/2020 12:00:00 AM,Theft or Mistake,2020-07-30T00:00:00,,U.S. Bank,,1292,Finance,,Name,2021,"1,000-9,999",Unknown
10319,07/30/2020 12:00:00 AM,09/18/2020 12:00:00 AM,Theft or Mistake,2020-07-30T00:00:00,,U.S. Bank,,1292,Finance,,Social Security Number,2021,"1,000-9,999",Unknown
10319,07/30/2020 12:00:00 AM,09/18/2020 12:00:00 AM,Theft or Mistake,2020-07-30T00:00:00,,U.S. Bank,,1292,Finance,,Driver's License or Washington ID Card Number,2021,"1,000-9,999",Unknown
10319,07/30/2020 12:00:00 AM,09/18/2020 12:00:00 AM,Theft or Mistake,2020-07-30T00:00:00,,U.S. Bank,,1292,Finance,,Financial & Banking Information,2021,"1,000-9,999",Unknown
10319,07/30/2020 12:00:00 AM,09/18/2020 12:00:00 AM,Theft or Mistake,2020-07-30T00:00:00,,U.S. Bank,,1292,Finance,,Other,2021,"1,000-9,999",Unknown
10320,07/17/2020 12:00:00 AM,09/23/2020 12:00:00 AM,Cyberattack,2020-02-07T00:00:00,2020-05-20T00:00:00,Point Loma Nazarene University,Ransomware,1967,Education,,Name,2021,"1,000-9,999",100-199
10320,07/17/2020 12:00:00 AM,09/23/2020 12:00:00 AM,Cyberattack,2020-02-07T00:00:00,2020-05-20T00:00:00,Point Loma Nazarene University,Ransomware,1967,Education,,Full Date of Birth,2021,"1,000-9,999",100-199
10320,07/17/2020 12:00:00 AM,09/23/2020 12:00:00 AM,Cyberattack,2020-02-07T00:00:00,2020-05-20T00:00:00,Point Loma Nazarene University,Ransomware,1967,Education,,Student ID Number,2021,"1,000-9,999",100-199
10321,09/17/2020 12:00:00 AM,09/25/2020 12:00:00 AM,Cyberattack,2020-07-14T00:00:00,2020-07-19T00:00:00,Bayley Construction,Ransomware,938,Business,Construction,Name,2021,500-999,1-99
10321,09/17/2020 12:00:00 AM,09/25/2020 12:00:00 AM,Cyberattack,2020-07-14T00:00:00,2020-07-19T00:00:00,Bayley Construction,Ransomware,938,Business,Construction,Social Security Number,2021,500-999,1-99
10321,09/17/2020 12:00:00 AM,09/25/2020 12:00:00 AM,Cyberattack,2020-07-14T00:00:00,2020-07-19T00:00:00,Bayley Construction,Ransomware,938,Business,Construction,Driver's License or Washington ID Card Number,2021,500-999,1-99
10321,09/17/2020 12:00:00 AM,09/25/2020 12:00:00 AM,Cyberattack,2020-07-14T00:00:00,2020-07-19T00:00:00,Bayley Construction,Ransomware,938,Business,Construction,Financial & Banking Information,2021,500-999,1-99
10321,09/17/2020 12:00:00 AM,09/25/2020 12:00:00 AM,Cyberattack,2020-07-14T00:00:00,2020-07-19T00:00:00,Bayley Construction,Ransomware,938,Business,Construction,Full Date of Birth,2021,500-999,1-99
10321,09/17/2020 12:00:00 AM,09/25/2020 12:00:00 AM,Cyberattack,2020-07-14T00:00:00,2020-07-19T00:00:00,Bayley Construction,Ransomware,938,Business,Construction,Health Insurance Policy or ID Number,2021,500-999,1-99
10323,08/30/2020 12:00:00 AM,09/28/2020 12:00:00 AM,Theft or Mistake,2020-08-30T00:00:00,,5th Avenue Theatre Association,,3468,Non-Profit/Charity,,Name,2021,"1,000-9,999",Unknown
10323,08/30/2020 12:00:00 AM,09/28/2020 12:00:00 AM,Theft or Mistake,2020-08-30T00:00:00,,5th Avenue Theatre Association,,3468,Non-Profit/Charity,,Social Security Number,2021,"1,000-9,999",Unknown
10323,08/30/2020 12:00:00 AM,09/28/2020 12:00:00 AM,Theft or Mistake,2020-08-30T00:00:00,,5th Avenue Theatre Association,,3468,Non-Profit/Charity,,Full Date of Birth,2021,"1,000-9,999",Unknown
10324,07/16/2020 12:00:00 AM,09/28/2020 12:00:00 AM,Cyberattack,2020-02-07T00:00:00,2020-05-20T00:00:00,Mary's Place,Ransomware,10000,Non-Profit/Charity,,Name,2021,"10,000-49,999",100-199
10324,07/16/2020 12:00:00 AM,09/28/2020 12:00:00 AM,Cyberattack,2020-02-07T00:00:00,2020-05-20T00:00:00,Mary's Place,Ransomware,10000,Non-Profit/Charity,,Full Date of Birth,2021,"10,000-49,999",100-199
10324,07/16/2020 12:00:00 AM,09/28/2020 12:00:00 AM,Cyberattack,2020-02-07T00:00:00,2020-05-20T00:00:00,Mary's Place,Ransomware,10000,Non-Profit/Charity,,Other,2021,"10,000-49,999",100-199
10326,08/20/2020 12:00:00 AM,09/29/2020 12:00:00 AM,Cyberattack,2020-03-30T00:00:00,2020-05-14T00:00:00,"CBD Industries, LLC",Malware,1088,Business,Consumable,Name,2021,"1,000-9,999",100-199
10326,08/20/2020 12:00:00 AM,09/29/2020 12:00:00 AM,Cyberattack,2020-03-30T00:00:00,2020-05-14T00:00:00,"CBD Industries, LLC",Malware,1088,Business,Consumable,Financial & Banking Information,2021,"1,000-9,999",100-199
10326,08/20/2020 12:00:00 AM,09/29/2020 12:00:00 AM,Cyberattack,2020-03-30T00:00:00,2020-05-14T00:00:00,"CBD Industries, LLC",Malware,1088,Business,Consumable,Other,2021,"1,000-9,999",100-199
10327,07/10/2020 12:00:00 AM,09/29/2020 12:00:00 AM,Unauthorized Access,,,"Spire Hospitality, LLC",,516,Business,Hospitality,Name,2021,500-999,Unknown
10327,07/10/2020 12:00:00 AM,09/29/2020 12:00:00 AM,Unauthorized Access,,,"Spire Hospitality, LLC",,516,Business,Hospitality,Social Security Number,2021,500-999,Unknown
10327,07/10/2020 12:00:00 AM,09/29/2020 12:00:00 AM,Unauthorized Access,,,"Spire Hospitality, LLC",,516,Business,Hospitality,Full Date of Birth,2021,500-999,Unknown
10327,07/10/2020 12:00:00 AM,09/29/2020 12:00:00 AM,Unauthorized Access,,,"Spire Hospitality, LLC",,516,Business,Hospitality,Unique Private Key (e.g. used to authenticate or sign an electronic record),2021,500-999,Unknown
10327,07/10/2020 12:00:00 AM,09/29/2020 12:00:00 AM,Unauthorized Access,,,"Spire Hospitality, LLC",,516,Business,Hospitality,Other,2021,500-999,Unknown
10328,,09/30/2020 12:00:00 AM,Cyberattack,2020-02-01T00:00:00,2020-08-31T00:00:00,Made in Oregon,,537,Business,Retail,Name,2021,500-999,Unknown
10328,,09/30/2020 12:00:00 AM,Cyberattack,2020-02-01T00:00:00,2020-08-31T00:00:00,Made in Oregon,,537,Business,Retail,Financial & Banking Information,2021,500-999,Unknown
10328,,09/30/2020 12:00:00 AM,Cyberattack,2020-02-01T00:00:00,2020-08-31T00:00:00,Made in Oregon,,537,Business,Retail,Other,2021,500-999,Unknown
10329,05/01/2020 12:00:00 AM,09/30/2020 12:00:00 AM,Cyberattack,,,"Northwest Eye Surgeons, P.C. and Sight Partners LLC",Ransomware,6809,Health,,Name,2021,"1,000-9,999",Unknown
10329,05/01/2020 12:00:00 AM,09/30/2020 12:00:00 AM,Cyberattack,,,"Northwest Eye Surgeons, P.C. and Sight Partners LLC",Ransomware,6809,Health,,Social Security Number,2021,"1,000-9,999",Unknown
10329,05/01/2020 12:00:00 AM,09/30/2020 12:00:00 AM,Cyberattack,,,"Northwest Eye Surgeons, P.C. and Sight Partners LLC",Ransomware,6809,Health,,Driver's License or Washington ID Card Number,2021,"1,000-9,999",Unknown
10329,05/01/2020 12:00:00 AM,09/30/2020 12:00:00 AM,Cyberattack,,,"Northwest Eye Surgeons, P.C. and Sight Partners LLC",Ransomware,6809,Health,,Full Date of Birth,2021,"1,000-9,999",Unknown
10329,05/01/2020 12:00:00 AM,09/30/2020 12:00:00 AM,Cyberattack,,,"Northwest Eye Surgeons, P.C. and Sight Partners LLC",Ransomware,6809,Health,,Medical Information,2021,"1,000-9,999",Unknown
10330,09/08/2020 12:00:00 AM,09/30/2020 12:00:00 AM,Cyberattack,2020-02-07T00:00:00,2020-05-20T00:00:00,World Relief,Ransomware,734,Non-Profit/Charity,,Name,2021,500-999,200-299
10330,09/08/2020 12:00:00 AM,09/30/2020 12:00:00 AM,Cyberattack,2020-02-07T00:00:00,2020-05-20T00:00:00,World Relief,Ransomware,734,Non-Profit/Charity,,Full Date of Birth,2021,500-999,200-299
10331,,10/01/2020 12:00:00 AM,Cyberattack,2020-02-07T00:00:00,2020-05-20T00:00:00,Gallaudet University,Ransomware,1195,Education,,Name,2021,"1,000-9,999",Unknown
10331,,10/01/2020 12:00:00 AM,Cyberattack,2020-02-07T00:00:00,2020-05-20T00:00:00,Gallaudet University,Ransomware,1195,Education,,Full Date of Birth,2021,"1,000-9,999",Unknown
10331,,10/01/2020 12:00:00 AM,Cyberattack,2020-02-07T00:00:00,2020-05-20T00:00:00,Gallaudet University,Ransomware,1195,Education,,Other,2021,"1,000-9,999",Unknown
10332,08/28/2020 12:00:00 AM,10/02/2020 12:00:00 AM,Cyberattack,2020-02-07T00:00:00,2020-05-20T00:00:00,"Farm Sanctuary, Inc.",Ransomware,1065,Non-Profit/Charity,,Name,2021,"1,000-9,999",200-299
10332,08/28/2020 12:00:00 AM,10/02/2020 12:00:00 AM,Cyberattack,2020-02-07T00:00:00,2020-05-20T00:00:00,"Farm Sanctuary, Inc.",Ransomware,1065,Non-Profit/Charity,,Full Date of Birth,2021,"1,000-9,999",200-299
10333,09/18/2020 12:00:00 AM,10/06/2020 12:00:00 AM,Unauthorized Access,,,Gymshark Limited,,59769,Business,Clothing,Name,2021,"50,000-999,999",Unknown
10333,09/18/2020 12:00:00 AM,10/06/2020 12:00:00 AM,Unauthorized Access,,,Gymshark Limited,,59769,Business,Clothing,Full Date of Birth,2021,"50,000-999,999",Unknown
10333,09/18/2020 12:00:00 AM,10/06/2020 12:00:00 AM,Unauthorized Access,,,Gymshark Limited,,59769,Business,Clothing,Other,2021,"50,000-999,999",Unknown
10334,09/24/2020 12:00:00 AM,10/12/2020 12:00:00 AM,Cyberattack,2020-09-14T00:00:00,2020-09-24T00:00:00,Evergreen Public Schools,,3585,Education,,Name,2021,"1,000-9,999",1-99
10334,09/24/2020 12:00:00 AM,10/12/2020 12:00:00 AM,Cyberattack,2020-09-14T00:00:00,2020-09-24T00:00:00,Evergreen Public Schools,,3585,Education,,Social Security Number,2021,"1,000-9,999",1-99
10335,09/14/2020 12:00:00 AM,10/12/2020 12:00:00 AM,Cyberattack,2020-02-07T00:00:00,2020-05-20T00:00:00,ZERO - The End of Prostate Cancer,Ransomware,1139,Non-Profit/Charity,,Medical Information,2021,"1,000-9,999",200-299
10335,09/14/2020 12:00:00 AM,10/12/2020 12:00:00 AM,Cyberattack,2020-02-07T00:00:00,2020-05-20T00:00:00,ZERO - The End of Prostate Cancer,Ransomware,1139,Non-Profit/Charity,,Other,2021,"1,000-9,999",200-299
10335,09/14/2020 12:00:00 AM,10/12/2020 12:00:00 AM,Cyberattack,2020-02-07T00:00:00,2020-05-20T00:00:00,ZERO - The End of Prostate Cancer,Ransomware,1139,Non-Profit/Charity,,Name,2021,"1,000-9,999",200-299
10335,09/14/2020 12:00:00 AM,10/12/2020 12:00:00 AM,Cyberattack,2020-02-07T00:00:00,2020-05-20T00:00:00,ZERO - The End of Prostate Cancer,Ransomware,1139,Non-Profit/Charity,,Full Date of Birth,2021,"1,000-9,999",200-299
10536,05/31/2019 12:00:00 AM,03/02/2020 12:00:00 AM,Unauthorized Access,2019-04-11T00:00:00,2019-07-23T00:00:00,Carnival Corporation & PLC,,11346,Business,Transportation,Name,2020,"10,000-49,999",100-199
10536,05/31/2019 12:00:00 AM,03/02/2020 12:00:00 AM,Unauthorized Access,2019-04-11T00:00:00,2019-07-23T00:00:00,Carnival Corporation & PLC,,11346,Business,Transportation,Social Security Number,2020,"10,000-49,999",100-199
10536,05/31/2019 12:00:00 AM,03/02/2020 12:00:00 AM,Unauthorized Access,2019-04-11T00:00:00,2019-07-23T00:00:00,Carnival Corporation & PLC,,11346,Business,Transportation,Driver's License or Washington ID Card Number,2020,"10,000-49,999",100-199
10536,05/31/2019 12:00:00 AM,03/02/2020 12:00:00 AM,Unauthorized Access,2019-04-11T00:00:00,2019-07-23T00:00:00,Carnival Corporation & PLC,,11346,Business,Transportation,Financial & Banking Information,2020,"10,000-49,999",100-199
10536,05/31/2019 12:00:00 AM,03/02/2020 12:00:00 AM,Unauthorized Access,2019-04-11T00:00:00,2019-07-23T00:00:00,Carnival Corporation & PLC,,11346,Business,Transportation,Passport Number,2020,"10,000-49,999",100-199
10536,05/31/2019 12:00:00 AM,03/02/2020 12:00:00 AM,Unauthorized Access,2019-04-11T00:00:00,2019-07-23T00:00:00,Carnival Corporation & PLC,,11346,Business,Transportation,Medical Information,2020,"10,000-49,999",100-199
10536,05/31/2019 12:00:00 AM,03/02/2020 12:00:00 AM,Unauthorized Access,2019-04-11T00:00:00,2019-07-23T00:00:00,Carnival Corporation & PLC,,11346,Business,Transportation,Other,2020,"10,000-49,999",100-199
10338,07/01/2020 12:00:00 AM,10/12/2020 12:00:00 AM,Cyberattack,2020-06-24T00:00:00,2020-07-01T00:00:00,EyeMed Vision Care LLC,Phishing,19625,Health,,Name,2021,"10,000-49,999",1-99
10338,07/01/2020 12:00:00 AM,10/12/2020 12:00:00 AM,Cyberattack,2020-06-24T00:00:00,2020-07-01T00:00:00,EyeMed Vision Care LLC,Phishing,19625,Health,,Social Security Number,2021,"10,000-49,999",1-99
10338,07/01/2020 12:00:00 AM,10/12/2020 12:00:00 AM,Cyberattack,2020-06-24T00:00:00,2020-07-01T00:00:00,EyeMed Vision Care LLC,Phishing,19625,Health,,Driver's License or Washington ID Card Number,2021,"10,000-49,999",1-99
10338,07/01/2020 12:00:00 AM,10/12/2020 12:00:00 AM,Cyberattack,2020-06-24T00:00:00,2020-07-01T00:00:00,EyeMed Vision Care LLC,Phishing,19625,Health,,Financial & Banking Information,2021,"10,000-49,999",1-99
10338,07/01/2020 12:00:00 AM,10/12/2020 12:00:00 AM,Cyberattack,2020-06-24T00:00:00,2020-07-01T00:00:00,EyeMed Vision Care LLC,Phishing,19625,Health,,Full Date of Birth,2021,"10,000-49,999",1-99
10338,07/01/2020 12:00:00 AM,10/12/2020 12:00:00 AM,Cyberattack,2020-06-24T00:00:00,2020-07-01T00:00:00,EyeMed Vision Care LLC,Phishing,19625,Health,,Passport Number,2021,"10,000-49,999",1-99
10338,07/01/2020 12:00:00 AM,10/12/2020 12:00:00 AM,Cyberattack,2020-06-24T00:00:00,2020-07-01T00:00:00,EyeMed Vision Care LLC,Phishing,19625,Health,,Health Insurance Policy or ID Number,2021,"10,000-49,999",1-99
10338,07/01/2020 12:00:00 AM,10/12/2020 12:00:00 AM,Cyberattack,2020-06-24T00:00:00,2020-07-01T00:00:00,EyeMed Vision Care LLC,Phishing,19625,Health,,Medical Information,2021,"10,000-49,999",1-99
10338,07/01/2020 12:00:00 AM,10/12/2020 12:00:00 AM,Cyberattack,2020-06-24T00:00:00,2020-07-01T00:00:00,EyeMed Vision Care LLC,Phishing,19625,Health,,Other,2021,"10,000-49,999",1-99
10339,07/16/2020 12:00:00 AM,10/13/2020 12:00:00 AM,Cyberattack,2020-02-07T00:00:00,2020-05-20T00:00:00,Forest Ridge School of the Sacred Heart,Ransomware,555,Education,,Name,2021,500-999,100-199
10339,07/16/2020 12:00:00 AM,10/13/2020 12:00:00 AM,Cyberattack,2020-02-07T00:00:00,2020-05-20T00:00:00,Forest Ridge School of the Sacred Heart,Ransomware,555,Education,,Social Security Number,2021,500-999,100-199
10339,07/16/2020 12:00:00 AM,10/13/2020 12:00:00 AM,Cyberattack,2020-02-07T00:00:00,2020-05-20T00:00:00,Forest Ridge School of the Sacred Heart,Ransomware,555,Education,,Full Date of Birth,2021,500-999,100-199
10339,07/16/2020 12:00:00 AM,10/13/2020 12:00:00 AM,Cyberattack,2020-02-07T00:00:00,2020-05-20T00:00:00,Forest Ridge School of the Sacred Heart,Ransomware,555,Education,,Other,2021,500-999,100-199
10340,09/14/2020 12:00:00 AM,10/15/2020 12:00:00 AM,Cyberattack,2020-02-07T00:00:00,2020-05-20T00:00:00,"University of Nevada, Reno",Ransomware,3361,Education,,Name,2021,"1,000-9,999",200-299
10340,09/14/2020 12:00:00 AM,10/15/2020 12:00:00 AM,Cyberattack,2020-02-07T00:00:00,2020-05-20T00:00:00,"University of Nevada, Reno",Ransomware,3361,Education,,Full Date of Birth,2021,"1,000-9,999",200-299
10341,08/31/2020 12:00:00 AM,10/16/2020 12:00:00 AM,Theft or Mistake,2020-08-29T00:00:00,2020-08-30T00:00:00,The Health & Wellness Clinic,,889,Health,,Name,2021,500-999,1-99
10341,08/31/2020 12:00:00 AM,10/16/2020 12:00:00 AM,Theft or Mistake,2020-08-29T00:00:00,2020-08-30T00:00:00,The Health & Wellness Clinic,,889,Health,,Social Security Number,2021,500-999,1-99
10341,08/31/2020 12:00:00 AM,10/16/2020 12:00:00 AM,Theft or Mistake,2020-08-29T00:00:00,2020-08-30T00:00:00,The Health & Wellness Clinic,,889,Health,,Driver's License or Washington ID Card Number,2021,500-999,1-99
10341,08/31/2020 12:00:00 AM,10/16/2020 12:00:00 AM,Theft or Mistake,2020-08-29T00:00:00,2020-08-30T00:00:00,The Health & Wellness Clinic,,889,Health,,Full Date of Birth,2021,500-999,1-99
10341,08/31/2020 12:00:00 AM,10/16/2020 12:00:00 AM,Theft or Mistake,2020-08-29T00:00:00,2020-08-30T00:00:00,The Health & Wellness Clinic,,889,Health,,Medical Information,2021,500-999,1-99
10341,08/31/2020 12:00:00 AM,10/16/2020 12:00:00 AM,Theft or Mistake,2020-08-29T00:00:00,2020-08-30T00:00:00,The Health & Wellness Clinic,,889,Health,,Other,2021,500-999,1-99
10342,09/18/2020 12:00:00 AM,10/16/2020 12:00:00 AM,Theft or Mistake,2020-09-18T00:00:00,2020-09-18T00:00:00,"Wyndham Capital Mortgage, Inc.",,569,Finance,,Name,2021,500-999,0
10342,09/18/2020 12:00:00 AM,10/16/2020 12:00:00 AM,Theft or Mistake,2020-09-18T00:00:00,2020-09-18T00:00:00,"Wyndham Capital Mortgage, Inc.",,569,Finance,,Social Security Number,2021,500-999,0
10342,09/18/2020 12:00:00 AM,10/16/2020 12:00:00 AM,Theft or Mistake,2020-09-18T00:00:00,2020-09-18T00:00:00,"Wyndham Capital Mortgage, Inc.",,569,Finance,,Other,2021,500-999,0
10343,07/16/2020 12:00:00 AM,10/21/2020 12:00:00 AM,Cyberattack,2020-02-07T00:00:00,2020-05-20T00:00:00,Carroll College,Ransomware,2166,Education,,Name,2021,"1,000-9,999",100-199
10343,07/16/2020 12:00:00 AM,10/21/2020 12:00:00 AM,Cyberattack,2020-02-07T00:00:00,2020-05-20T00:00:00,Carroll College,Ransomware,2166,Education,,Full Date of Birth,2021,"1,000-9,999",100-199
10343,07/16/2020 12:00:00 AM,10/21/2020 12:00:00 AM,Cyberattack,2020-02-07T00:00:00,2020-05-20T00:00:00,Carroll College,Ransomware,2166,Education,,Other,2021,"1,000-9,999",100-199
10344,09/24/2020 12:00:00 AM,10/21/2020 12:00:00 AM,Cyberattack,,2020-09-24T00:00:00,Sam's Club,Other,771,Business,Retail,Name,2021,500-999,Unknown
10344,09/24/2020 12:00:00 AM,10/21/2020 12:00:00 AM,Cyberattack,,2020-09-24T00:00:00,Sam's Club,Other,771,Business,Retail,Email Address and Password/Security Question Answers,2021,500-999,Unknown
10344,09/24/2020 12:00:00 AM,10/21/2020 12:00:00 AM,Cyberattack,,2020-09-24T00:00:00,Sam's Club,Other,771,Business,Retail,Other,2021,500-999,Unknown
10345,09/10/2020 12:00:00 AM,10/22/2020 12:00:00 AM,Cyberattack,2020-02-07T00:00:00,2020-05-20T00:00:00,"University of Nevada, Las Vegas Foundation",Ransomware,2563,Non-Profit/Charity,,Name,2021,"1,000-9,999",200-299
10345,09/10/2020 12:00:00 AM,10/22/2020 12:00:00 AM,Cyberattack,2020-02-07T00:00:00,2020-05-20T00:00:00,"University of Nevada, Las Vegas Foundation",Ransomware,2563,Non-Profit/Charity,,Full Date of Birth,2021,"1,000-9,999",200-299
10345,09/10/2020 12:00:00 AM,10/22/2020 12:00:00 AM,Cyberattack,2020-02-07T00:00:00,2020-05-20T00:00:00,"University of Nevada, Las Vegas Foundation",Ransomware,2563,Non-Profit/Charity,,Student ID Number,2021,"1,000-9,999",200-299
10346,09/27/2020 12:00:00 AM,10/25/2020 12:00:00 AM,Theft or Mistake,2020-09-27T00:00:00,,"Hi-Line Ranch, Harris Farms, Cherry River Farms",,852,Business,Other,Name,2021,500-999,Unknown
10346,09/27/2020 12:00:00 AM,10/25/2020 12:00:00 AM,Theft or Mistake,2020-09-27T00:00:00,,"Hi-Line Ranch, Harris Farms, Cherry River Farms",,852,Business,Other,Social Security Number,2021,500-999,Unknown
10347,05/31/2020 12:00:00 AM,10/27/2020 12:00:00 AM,Cyberattack,,,"Ascend Clinical, LLC",Phishing,1959,Health,,Name,2021,"1,000-9,999",Unknown
10347,05/31/2020 12:00:00 AM,10/27/2020 12:00:00 AM,Cyberattack,,,"Ascend Clinical, LLC",Phishing,1959,Health,,Social Security Number,2021,"1,000-9,999",Unknown
10347,05/31/2020 12:00:00 AM,10/27/2020 12:00:00 AM,Cyberattack,,,"Ascend Clinical, LLC",Phishing,1959,Health,,Medical Information,2021,"1,000-9,999",Unknown
10347,05/31/2020 12:00:00 AM,10/27/2020 12:00:00 AM,Cyberattack,,,"Ascend Clinical, LLC",Phishing,1959,Health,,Other,2021,"1,000-9,999",Unknown
10348,08/28/2020 12:00:00 AM,10/27/2020 12:00:00 AM,Cyberattack,2020-08-09T00:00:00,2020-08-09T00:00:00,Luxottica of America Inc.,,12166,Business,Accessories,Name,2021,"10,000-49,999",1-99
10348,08/28/2020 12:00:00 AM,10/27/2020 12:00:00 AM,Cyberattack,2020-08-09T00:00:00,2020-08-09T00:00:00,Luxottica of America Inc.,,12166,Business,Accessories,Social Security Number,2021,"10,000-49,999",1-99
10348,08/28/2020 12:00:00 AM,10/27/2020 12:00:00 AM,Cyberattack,2020-08-09T00:00:00,2020-08-09T00:00:00,Luxottica of America Inc.,,12166,Business,Accessories,Full Date of Birth,2021,"10,000-49,999",1-99
10348,08/28/2020 12:00:00 AM,10/27/2020 12:00:00 AM,Cyberattack,2020-08-09T00:00:00,2020-08-09T00:00:00,Luxottica of America Inc.,,12166,Business,Accessories,Health Insurance Policy or ID Number,2021,"10,000-49,999",1-99
10348,08/28/2020 12:00:00 AM,10/27/2020 12:00:00 AM,Cyberattack,2020-08-09T00:00:00,2020-08-09T00:00:00,Luxottica of America Inc.,,12166,Business,Accessories,Medical Information,2021,"10,000-49,999",1-99
10349,07/28/2020 12:00:00 AM,10/27/2020 12:00:00 AM,Unauthorized Access,2020-02-21T00:00:00,2020-07-28T00:00:00,"TrueFire, LLC",,2633,Business,Manufacturing,Name,2021,"1,000-9,999",100-199
10349,07/28/2020 12:00:00 AM,10/27/2020 12:00:00 AM,Unauthorized Access,2020-02-21T00:00:00,2020-07-28T00:00:00,"TrueFire, LLC",,2633,Business,Manufacturing,Full Date of Birth,2021,"1,000-9,999",100-199
10349,07/28/2020 12:00:00 AM,10/27/2020 12:00:00 AM,Unauthorized Access,2020-02-21T00:00:00,2020-07-28T00:00:00,"TrueFire, LLC",,2633,Business,Manufacturing,Username and Password/Security Question Answers,2021,"1,000-9,999",100-199
10349,07/28/2020 12:00:00 AM,10/27/2020 12:00:00 AM,Unauthorized Access,2020-02-21T00:00:00,2020-07-28T00:00:00,"TrueFire, LLC",,2633,Business,Manufacturing,Other,2021,"1,000-9,999",100-199
10350,07/06/2020 12:00:00 AM,10/28/2020 12:00:00 AM,Cyberattack,2020-01-01T00:00:00,2020-07-17T00:00:00,"JM Bullion, Inc.",Malware,882,Business,Retail,Name,2021,500-999,100-199
10350,07/06/2020 12:00:00 AM,10/28/2020 12:00:00 AM,Cyberattack,2020-01-01T00:00:00,2020-07-17T00:00:00,"JM Bullion, Inc.",Malware,882,Business,Retail,Financial & Banking Information,2021,500-999,100-199
10350,07/06/2020 12:00:00 AM,10/28/2020 12:00:00 AM,Cyberattack,2020-01-01T00:00:00,2020-07-17T00:00:00,"JM Bullion, Inc.",Malware,882,Business,Retail,Other,2021,500-999,100-199
10351,07/16/2020 12:00:00 AM,10/29/2020 12:00:00 AM,Cyberattack,2020-02-07T00:00:00,2020-05-20T00:00:00,Feed the Children,Ransomware,21257,Non-Profit/Charity,,Name,2021,"10,000-49,999",100-199
10351,07/16/2020 12:00:00 AM,10/29/2020 12:00:00 AM,Cyberattack,2020-02-07T00:00:00,2020-05-20T00:00:00,Feed the Children,Ransomware,21257,Non-Profit/Charity,,Full Date of Birth,2021,"10,000-49,999",100-199
10351,07/16/2020 12:00:00 AM,10/29/2020 12:00:00 AM,Cyberattack,2020-02-07T00:00:00,2020-05-20T00:00:00,Feed the Children,Ransomware,21257,Non-Profit/Charity,,Other,2021,"10,000-49,999",100-199
10353,08/30/2020 12:00:00 AM,10/29/2020 12:00:00 AM,Cyberattack,,,MK Periodontics and Implants,Ransomware,8000,Health,,Other,2021,"1,000-9,999",Unknown
10353,08/30/2020 12:00:00 AM,10/29/2020 12:00:00 AM,Cyberattack,,,MK Periodontics and Implants,Ransomware,8000,Health,,Name,2021,"1,000-9,999",Unknown
10353,08/30/2020 12:00:00 AM,10/29/2020 12:00:00 AM,Cyberattack,,,MK Periodontics and Implants,Ransomware,8000,Health,,Social Security Number,2021,"1,000-9,999",Unknown
10353,08/30/2020 12:00:00 AM,10/29/2020 12:00:00 AM,Cyberattack,,,MK Periodontics and Implants,Ransomware,8000,Health,,Financial & Banking Information,2021,"1,000-9,999",Unknown
10353,08/30/2020 12:00:00 AM,10/29/2020 12:00:00 AM,Cyberattack,,,MK Periodontics and Implants,Ransomware,8000,Health,,Full Date of Birth,2021,"1,000-9,999",Unknown
10353,08/30/2020 12:00:00 AM,10/29/2020 12:00:00 AM,Cyberattack,,,MK Periodontics and Implants,Ransomware,8000,Health,,Medical Information,2021,"1,000-9,999",Unknown
10354,07/24/2020 12:00:00 AM,11/04/2020 12:00:00 AM,Unauthorized Access,,,Amtrak,,1208,Business,Transportation,Username and Password/Security Question Answers,2021,"1,000-9,999",Unknown
10354,07/24/2020 12:00:00 AM,11/04/2020 12:00:00 AM,Unauthorized Access,,,Amtrak,,1208,Business,Transportation,Other,2021,"1,000-9,999",Unknown
10355,09/16/2020 12:00:00 AM,11/05/2020 12:00:00 AM,Cyberattack,2020-02-07T00:00:00,2020-05-20T00:00:00,Green America,Ransomware,1127,Non-Profit/Charity,,Name,2021,"1,000-9,999",200-299
10355,09/16/2020 12:00:00 AM,11/05/2020 12:00:00 AM,Cyberattack,2020-02-07T00:00:00,2020-05-20T00:00:00,Green America,Ransomware,1127,Non-Profit/Charity,,Full Date of Birth,2021,"1,000-9,999",200-299
10355,09/16/2020 12:00:00 AM,11/05/2020 12:00:00 AM,Cyberattack,2020-02-07T00:00:00,2020-05-20T00:00:00,Green America,Ransomware,1127,Non-Profit/Charity,,Other,2021,"1,000-9,999",200-299
10356,11/29/2020 12:00:00 AM,01/29/2021 12:00:00 AM,Cyberattack,2019-05-06T00:00:00,2019-05-15T00:00:00,Grays Harbor Community Hospital,Ransomware,4984,Health,,Name,2021,"1,000-9,999",500+
10356,11/29/2020 12:00:00 AM,01/29/2021 12:00:00 AM,Cyberattack,2019-05-06T00:00:00,2019-05-15T00:00:00,Grays Harbor Community Hospital,Ransomware,4984,Health,,Full Date of Birth,2021,"1,000-9,999",500+
10356,11/29/2020 12:00:00 AM,01/29/2021 12:00:00 AM,Cyberattack,2019-05-06T00:00:00,2019-05-15T00:00:00,Grays Harbor Community Hospital,Ransomware,4984,Health,,Medical Information,2021,"1,000-9,999",500+
10504,06/15/2019 12:00:00 AM,08/14/2019 12:00:00 AM,Cyberattack,2019-06-15T00:00:00,,Grays Harbor Community Hospital,Ransomware,88000,Health,,Name,2020,"50,000-999,999",Unknown
10504,06/15/2019 12:00:00 AM,08/14/2019 12:00:00 AM,Cyberattack,2019-06-15T00:00:00,,Grays Harbor Community Hospital,Ransomware,88000,Health,,Social Security Number,2020,"50,000-999,999",Unknown
10504,06/15/2019 12:00:00 AM,08/14/2019 12:00:00 AM,Cyberattack,2019-06-15T00:00:00,,Grays Harbor Community Hospital,Ransomware,88000,Health,,Full Date of Birth,2020,"50,000-999,999",Unknown
10504,06/15/2019 12:00:00 AM,08/14/2019 12:00:00 AM,Cyberattack,2019-06-15T00:00:00,,Grays Harbor Community Hospital,Ransomware,88000,Health,,Medical Information,2020,"50,000-999,999",Unknown
10504,06/15/2019 12:00:00 AM,08/14/2019 12:00:00 AM,Cyberattack,2019-06-15T00:00:00,,Grays Harbor Community Hospital,Ransomware,88000,Health,,Other,2020,"50,000-999,999",Unknown
10357,08/19/2020 12:00:00 AM,02/01/2021 12:00:00 AM,Cyberattack,2020-08-06T00:00:00,,Gonzaga University,Phishing,8041,Education,,Name,2021,"1,000-9,999",Unknown
10357,08/19/2020 12:00:00 AM,02/01/2021 12:00:00 AM,Cyberattack,2020-08-06T00:00:00,,Gonzaga University,Phishing,8041,Education,,Social Security Number,2021,"1,000-9,999",Unknown
10357,08/19/2020 12:00:00 AM,02/01/2021 12:00:00 AM,Cyberattack,2020-08-06T00:00:00,,Gonzaga University,Phishing,8041,Education,,Driver's License or Washington ID Card Number,2021,"1,000-9,999",Unknown
10357,08/19/2020 12:00:00 AM,02/01/2021 12:00:00 AM,Cyberattack,2020-08-06T00:00:00,,Gonzaga University,Phishing,8041,Education,,Username and Password/Security Question Answers,2021,"1,000-9,999",Unknown
10357,08/19/2020 12:00:00 AM,02/01/2021 12:00:00 AM,Cyberattack,2020-08-06T00:00:00,,Gonzaga University,Phishing,8041,Education,,Financial & Banking Information,2021,"1,000-9,999",Unknown
10357,08/19/2020 12:00:00 AM,02/01/2021 12:00:00 AM,Cyberattack,2020-08-06T00:00:00,,Gonzaga University,Phishing,8041,Education,,Full Date of Birth,2021,"1,000-9,999",Unknown
10357,08/19/2020 12:00:00 AM,02/01/2021 12:00:00 AM,Cyberattack,2020-08-06T00:00:00,,Gonzaga University,Phishing,8041,Education,,Student ID Number,2021,"1,000-9,999",Unknown
10357,08/19/2020 12:00:00 AM,02/01/2021 12:00:00 AM,Cyberattack,2020-08-06T00:00:00,,Gonzaga University,Phishing,8041,Education,,Passport Number,2021,"1,000-9,999",Unknown
10357,08/19/2020 12:00:00 AM,02/01/2021 12:00:00 AM,Cyberattack,2020-08-06T00:00:00,,Gonzaga University,Phishing,8041,Education,,Health Insurance Policy or ID Number,2021,"1,000-9,999",Unknown
10357,08/19/2020 12:00:00 AM,02/01/2021 12:00:00 AM,Cyberattack,2020-08-06T00:00:00,,Gonzaga University,Phishing,8041,Education,,Medical Information,2021,"1,000-9,999",Unknown
10359,05/01/2020 12:00:00 AM,11/10/2020 12:00:00 AM,Unauthorized Access,2020-03-02T00:00:00,2020-03-03T00:00:00,Woodruff Sawyer & Co.,,2393,Finance,,Name,2021,"1,000-9,999",1-99
10359,05/01/2020 12:00:00 AM,11/10/2020 12:00:00 AM,Unauthorized Access,2020-03-02T00:00:00,2020-03-03T00:00:00,Woodruff Sawyer & Co.,,2393,Finance,,Full Date of Birth,2021,"1,000-9,999",1-99
10359,05/01/2020 12:00:00 AM,11/10/2020 12:00:00 AM,Unauthorized Access,2020-03-02T00:00:00,2020-03-03T00:00:00,Woodruff Sawyer & Co.,,2393,Finance,,Medical Information,2021,"1,000-9,999",1-99
10360,07/24/2020 12:00:00 AM,11/13/2020 12:00:00 AM,Cyberattack,2020-02-07T00:00:00,2020-05-20T00:00:00,Georgia Southern University,Ransomware,552,Education,,Name,2021,500-999,100-199
10360,07/24/2020 12:00:00 AM,11/13/2020 12:00:00 AM,Cyberattack,2020-02-07T00:00:00,2020-05-20T00:00:00,Georgia Southern University,Ransomware,552,Education,,Social Security Number,2021,500-999,100-199
10360,07/24/2020 12:00:00 AM,11/13/2020 12:00:00 AM,Cyberattack,2020-02-07T00:00:00,2020-05-20T00:00:00,Georgia Southern University,Ransomware,552,Education,,Full Date of Birth,2021,500-999,100-199
10360,07/24/2020 12:00:00 AM,11/13/2020 12:00:00 AM,Cyberattack,2020-02-07T00:00:00,2020-05-20T00:00:00,Georgia Southern University,Ransomware,552,Education,,Other,2021,500-999,100-199
10361,08/23/2020 12:00:00 AM,11/18/2020 12:00:00 AM,Cyberattack,2020-07-11T00:00:00,2020-08-23T00:00:00,"Windstream Holdings II, LLC",,643,Business,Telecommunications,Name,2021,500-999,1-99
10361,08/23/2020 12:00:00 AM,11/18/2020 12:00:00 AM,Cyberattack,2020-07-11T00:00:00,2020-08-23T00:00:00,"Windstream Holdings II, LLC",,643,Business,Telecommunications,Social Security Number,2021,500-999,1-99
10361,08/23/2020 12:00:00 AM,11/18/2020 12:00:00 AM,Cyberattack,2020-07-11T00:00:00,2020-08-23T00:00:00,"Windstream Holdings II, LLC",,643,Business,Telecommunications,Driver's License or Washington ID Card Number,2021,500-999,1-99
10361,08/23/2020 12:00:00 AM,11/18/2020 12:00:00 AM,Cyberattack,2020-07-11T00:00:00,2020-08-23T00:00:00,"Windstream Holdings II, LLC",,643,Business,Telecommunications,Full Date of Birth,2021,500-999,1-99
10361,08/23/2020 12:00:00 AM,11/18/2020 12:00:00 AM,Cyberattack,2020-07-11T00:00:00,2020-08-23T00:00:00,"Windstream Holdings II, LLC",,643,Business,Telecommunications,Medical Information,2021,500-999,1-99
10362,10/24/2020 12:00:00 AM,11/20/2020 12:00:00 AM,Cyberattack,2020-10-21T00:00:00,2020-10-25T00:00:00,"Senior Operations, LLC (Senior Aerospace AMT & Damar AeroSystems)",Ransomware,2543,Business,Manufacturing,Name,2021,"1,000-9,999",1-99
10362,10/24/2020 12:00:00 AM,11/20/2020 12:00:00 AM,Cyberattack,2020-10-21T00:00:00,2020-10-25T00:00:00,"Senior Operations, LLC (Senior Aerospace AMT & Damar AeroSystems)",Ransomware,2543,Business,Manufacturing,Social Security Number,2021,"1,000-9,999",1-99
10362,10/24/2020 12:00:00 AM,11/20/2020 12:00:00 AM,Cyberattack,2020-10-21T00:00:00,2020-10-25T00:00:00,"Senior Operations, LLC (Senior Aerospace AMT & Damar AeroSystems)",Ransomware,2543,Business,Manufacturing,Financial & Banking Information,2021,"1,000-9,999",1-99
10362,10/24/2020 12:00:00 AM,11/20/2020 12:00:00 AM,Cyberattack,2020-10-21T00:00:00,2020-10-25T00:00:00,"Senior Operations, LLC (Senior Aerospace AMT & Damar AeroSystems)",Ransomware,2543,Business,Manufacturing,Full Date of Birth,2021,"1,000-9,999",1-99
10362,10/24/2020 12:00:00 AM,11/20/2020 12:00:00 AM,Cyberattack,2020-10-21T00:00:00,2020-10-25T00:00:00,"Senior Operations, LLC (Senior Aerospace AMT & Damar AeroSystems)",Ransomware,2543,Business,Manufacturing,Passport Number,2021,"1,000-9,999",1-99
10362,10/24/2020 12:00:00 AM,11/20/2020 12:00:00 AM,Cyberattack,2020-10-21T00:00:00,2020-10-25T00:00:00,"Senior Operations, LLC (Senior Aerospace AMT & Damar AeroSystems)",Ransomware,2543,Business,Manufacturing,Other,2021,"1,000-9,999",1-99
10363,10/14/2020 12:00:00 AM,12/01/2020 12:00:00 AM,Cyberattack,,,Matson Navigation Company,,2991,Business,Shipping,Name,2021,"1,000-9,999",Unknown
10363,10/14/2020 12:00:00 AM,12/01/2020 12:00:00 AM,Cyberattack,,,Matson Navigation Company,,2991,Business,Shipping,Social Security Number,2021,"1,000-9,999",Unknown
10363,10/14/2020 12:00:00 AM,12/01/2020 12:00:00 AM,Cyberattack,,,Matson Navigation Company,,2991,Business,Shipping,Full Date of Birth,2021,"1,000-9,999",Unknown
10363,10/14/2020 12:00:00 AM,12/01/2020 12:00:00 AM,Cyberattack,,,Matson Navigation Company,,2991,Business,Shipping,Health Insurance Policy or ID Number,2021,"1,000-9,999",Unknown
10363,10/14/2020 12:00:00 AM,12/01/2020 12:00:00 AM,Cyberattack,,,Matson Navigation Company,,2991,Business,Shipping,Other,2021,"1,000-9,999",Unknown
10364,11/11/2020 12:00:00 AM,12/01/2020 12:00:00 AM,Cyberattack,2020-11-04T00:00:00,2020-11-19T00:00:00,Stride Inc.,Ransomware,742,Business,Other,Name,2021,500-999,1-99
10364,11/11/2020 12:00:00 AM,12/01/2020 12:00:00 AM,Cyberattack,2020-11-04T00:00:00,2020-11-19T00:00:00,Stride Inc.,Ransomware,742,Business,Other,Social Security Number,2021,500-999,1-99
10364,11/11/2020 12:00:00 AM,12/01/2020 12:00:00 AM,Cyberattack,2020-11-04T00:00:00,2020-11-19T00:00:00,Stride Inc.,Ransomware,742,Business,Other,Passport Number,2021,500-999,1-99
10365,10/25/2020 12:00:00 AM,12/04/2020 12:00:00 AM,Cyberattack,2020-09-28T00:00:00,2020-10-25T00:00:00,"USNR, LLC",Ransomware,1368,Business,Manufacturing,Name,2021,"1,000-9,999",1-99
10365,10/25/2020 12:00:00 AM,12/04/2020 12:00:00 AM,Cyberattack,2020-09-28T00:00:00,2020-10-25T00:00:00,"USNR, LLC",Ransomware,1368,Business,Manufacturing,Social Security Number,2021,"1,000-9,999",1-99
10365,10/25/2020 12:00:00 AM,12/04/2020 12:00:00 AM,Cyberattack,2020-09-28T00:00:00,2020-10-25T00:00:00,"USNR, LLC",Ransomware,1368,Business,Manufacturing,Financial & Banking Information,2021,"1,000-9,999",1-99
10365,10/25/2020 12:00:00 AM,12/04/2020 12:00:00 AM,Cyberattack,2020-09-28T00:00:00,2020-10-25T00:00:00,"USNR, LLC",Ransomware,1368,Business,Manufacturing,Full Date of Birth,2021,"1,000-9,999",1-99
10365,10/25/2020 12:00:00 AM,12/04/2020 12:00:00 AM,Cyberattack,2020-09-28T00:00:00,2020-10-25T00:00:00,"USNR, LLC",Ransomware,1368,Business,Manufacturing,Other,2021,"1,000-9,999",1-99
10366,05/01/2020 12:00:00 AM,12/09/2020 12:00:00 AM,Cyberattack,,,City University of Seattle,,1097,Education,,Name,2021,"1,000-9,999",Unknown
10366,05/01/2020 12:00:00 AM,12/09/2020 12:00:00 AM,Cyberattack,,,City University of Seattle,,1097,Education,,Driver's License or Washington ID Card Number,2021,"1,000-9,999",Unknown
10366,05/01/2020 12:00:00 AM,12/09/2020 12:00:00 AM,Cyberattack,,,City University of Seattle,,1097,Education,,Student ID Number,2021,"1,000-9,999",Unknown
10366,05/01/2020 12:00:00 AM,12/09/2020 12:00:00 AM,Cyberattack,,,City University of Seattle,,1097,Education,,Military ID Number,2021,"1,000-9,999",Unknown
10366,05/01/2020 12:00:00 AM,12/09/2020 12:00:00 AM,Cyberattack,,,City University of Seattle,,1097,Education,,Passport Number,2021,"1,000-9,999",Unknown
10366,05/01/2020 12:00:00 AM,12/09/2020 12:00:00 AM,Cyberattack,,,City University of Seattle,,1097,Education,,Health Insurance Policy or ID Number,2021,"1,000-9,999",Unknown
10366,05/01/2020 12:00:00 AM,12/09/2020 12:00:00 AM,Cyberattack,,,City University of Seattle,,1097,Education,,Medical Information,2021,"1,000-9,999",Unknown
10366,05/01/2020 12:00:00 AM,12/09/2020 12:00:00 AM,Cyberattack,,,City University of Seattle,,1097,Education,,Other,2021,"1,000-9,999",Unknown
10367,07/16/2020 12:00:00 AM,12/10/2020 12:00:00 AM,Cyberattack,2020-02-07T00:00:00,2020-05-20T00:00:00,Oklahoma State University Foundation,Ransomware,1334,Non-Profit/Charity,,Name,2021,"1,000-9,999",100-199
10367,07/16/2020 12:00:00 AM,12/10/2020 12:00:00 AM,Cyberattack,2020-02-07T00:00:00,2020-05-20T00:00:00,Oklahoma State University Foundation,Ransomware,1334,Non-Profit/Charity,,Full Date of Birth,2021,"1,000-9,999",100-199
10367,07/16/2020 12:00:00 AM,12/10/2020 12:00:00 AM,Cyberattack,2020-02-07T00:00:00,2020-05-20T00:00:00,Oklahoma State University Foundation,Ransomware,1334,Non-Profit/Charity,,Other,2021,"1,000-9,999",100-199
10368,11/12/2020 12:00:00 AM,12/11/2020 12:00:00 AM,Cyberattack,2020-02-07T00:00:00,2020-05-20T00:00:00,Fairfield University,Ransomware,505,Education,,Name,2021,500-999,200-299
10368,11/12/2020 12:00:00 AM,12/11/2020 12:00:00 AM,Cyberattack,2020-02-07T00:00:00,2020-05-20T00:00:00,Fairfield University,Ransomware,505,Education,,Full Date of Birth,2021,500-999,200-299
10369,09/28/2020 12:00:00 AM,12/16/2020 12:00:00 AM,Cyberattack,2020-02-07T00:00:00,2020-05-20T00:00:00,Kappa Delta Foundation,Ransomware,1508,Non-Profit/Charity,,Name,2021,"1,000-9,999",200-299
10369,09/28/2020 12:00:00 AM,12/16/2020 12:00:00 AM,Cyberattack,2020-02-07T00:00:00,2020-05-20T00:00:00,Kappa Delta Foundation,Ransomware,1508,Non-Profit/Charity,,Full Date of Birth,2021,"1,000-9,999",200-299
10369,09/28/2020 12:00:00 AM,12/16/2020 12:00:00 AM,Cyberattack,2020-02-07T00:00:00,2020-05-20T00:00:00,Kappa Delta Foundation,Ransomware,1508,Non-Profit/Charity,,Other,2021,"1,000-9,999",200-299
10370,06/19/2020 12:00:00 AM,12/16/2020 12:00:00 AM,Cyberattack,2020-06-17T00:00:00,2020-06-22T00:00:00,"MEDNAX Services, Inc.",Phishing,29861,Health,,Name,2021,"10,000-49,999",1-99
10370,06/19/2020 12:00:00 AM,12/16/2020 12:00:00 AM,Cyberattack,2020-06-17T00:00:00,2020-06-22T00:00:00,"MEDNAX Services, Inc.",Phishing,29861,Health,,Social Security Number,2021,"10,000-49,999",1-99
10370,06/19/2020 12:00:00 AM,12/16/2020 12:00:00 AM,Cyberattack,2020-06-17T00:00:00,2020-06-22T00:00:00,"MEDNAX Services, Inc.",Phishing,29861,Health,,Driver's License or Washington ID Card Number,2021,"10,000-49,999",1-99
10370,06/19/2020 12:00:00 AM,12/16/2020 12:00:00 AM,Cyberattack,2020-06-17T00:00:00,2020-06-22T00:00:00,"MEDNAX Services, Inc.",Phishing,29861,Health,,Financial & Banking Information,2021,"10,000-49,999",1-99
10370,06/19/2020 12:00:00 AM,12/16/2020 12:00:00 AM,Cyberattack,2020-06-17T00:00:00,2020-06-22T00:00:00,"MEDNAX Services, Inc.",Phishing,29861,Health,,Full Date of Birth,2021,"10,000-49,999",1-99
10370,06/19/2020 12:00:00 AM,12/16/2020 12:00:00 AM,Cyberattack,2020-06-17T00:00:00,2020-06-22T00:00:00,"MEDNAX Services, Inc.",Phishing,29861,Health,,Health Insurance Policy or ID Number,2021,"10,000-49,999",1-99
10370,06/19/2020 12:00:00 AM,12/16/2020 12:00:00 AM,Cyberattack,2020-06-17T00:00:00,2020-06-22T00:00:00,"MEDNAX Services, Inc.",Phishing,29861,Health,,Medical Information,2021,"10,000-49,999",1-99
10370,06/19/2020 12:00:00 AM,12/16/2020 12:00:00 AM,Cyberattack,2020-06-17T00:00:00,2020-06-22T00:00:00,"MEDNAX Services, Inc.",Phishing,29861,Health,,Other,2021,"10,000-49,999",1-99
10371,11/06/2020 12:00:00 AM,12/16/2020 12:00:00 AM,Cyberattack,2018-05-13T00:00:00,2020-11-24T00:00:00,Paysafe Group Holdings Limited,,1877,Business,Other,Name,2021,"1,000-9,999",500+
10371,11/06/2020 12:00:00 AM,12/16/2020 12:00:00 AM,Cyberattack,2018-05-13T00:00:00,2020-11-24T00:00:00,Paysafe Group Holdings Limited,,1877,Business,Other,Social Security Number,2021,"1,000-9,999",500+
10371,11/06/2020 12:00:00 AM,12/16/2020 12:00:00 AM,Cyberattack,2018-05-13T00:00:00,2020-11-24T00:00:00,Paysafe Group Holdings Limited,,1877,Business,Other,Financial & Banking Information,2021,"1,000-9,999",500+
10371,11/06/2020 12:00:00 AM,12/16/2020 12:00:00 AM,Cyberattack,2018-05-13T00:00:00,2020-11-24T00:00:00,Paysafe Group Holdings Limited,,1877,Business,Other,Other,2021,"1,000-9,999",500+
10372,09/14/2020 12:00:00 AM,12/18/2020 12:00:00 AM,Unauthorized Access,2019-11-11T00:00:00,2019-12-09T00:00:00,Benton County of Washington,,820,Government,,Name,2021,500-999,300-399
10372,09/14/2020 12:00:00 AM,12/18/2020 12:00:00 AM,Unauthorized Access,2019-11-11T00:00:00,2019-12-09T00:00:00,Benton County of Washington,,820,Government,,Social Security Number,2021,500-999,300-399
10372,09/14/2020 12:00:00 AM,12/18/2020 12:00:00 AM,Unauthorized Access,2019-11-11T00:00:00,2019-12-09T00:00:00,Benton County of Washington,,820,Government,,Driver's License or Washington ID Card Number,2021,500-999,300-399
10372,09/14/2020 12:00:00 AM,12/18/2020 12:00:00 AM,Unauthorized Access,2019-11-11T00:00:00,2019-12-09T00:00:00,Benton County of Washington,,820,Government,,Financial & Banking Information,2021,500-999,300-399
10372,09/14/2020 12:00:00 AM,12/18/2020 12:00:00 AM,Unauthorized Access,2019-11-11T00:00:00,2019-12-09T00:00:00,Benton County of Washington,,820,Government,,Full Date of Birth,2021,500-999,300-399
10372,09/14/2020 12:00:00 AM,12/18/2020 12:00:00 AM,Unauthorized Access,2019-11-11T00:00:00,2019-12-09T00:00:00,Benton County of Washington,,820,Government,,Student ID Number,2021,500-999,300-399
10372,09/14/2020 12:00:00 AM,12/18/2020 12:00:00 AM,Unauthorized Access,2019-11-11T00:00:00,2019-12-09T00:00:00,Benton County of Washington,,820,Government,,Health Insurance Policy or ID Number,2021,500-999,300-399
10372,09/14/2020 12:00:00 AM,12/18/2020 12:00:00 AM,Unauthorized Access,2019-11-11T00:00:00,2019-12-09T00:00:00,Benton County of Washington,,820,Government,,Medical Information,2021,500-999,300-399
10372,09/14/2020 12:00:00 AM,12/18/2020 12:00:00 AM,Unauthorized Access,2019-11-11T00:00:00,2019-12-09T00:00:00,Benton County of Washington,,820,Government,,Other,2021,500-999,300-399
10373,11/12/2020 12:00:00 AM,12/18/2020 12:00:00 AM,Cyberattack,2020-03-10T00:00:00,2020-11-12T00:00:00,Washington State Bar Association,Malware,4051,Government,,Name,2021,"1,000-9,999",200-299
10373,11/12/2020 12:00:00 AM,12/18/2020 12:00:00 AM,Cyberattack,2020-03-10T00:00:00,2020-11-12T00:00:00,Washington State Bar Association,Malware,4051,Government,,Financial & Banking Information,2021,"1,000-9,999",200-299
10374,11/23/2020 12:00:00 AM,12/22/2020 12:00:00 AM,Cyberattack,2020-02-07T00:00:00,2020-05-20T00:00:00,Cedarville University,Ransomware,1706,Education,,Name,2021,"1,000-9,999",200-299
10374,11/23/2020 12:00:00 AM,12/22/2020 12:00:00 AM,Cyberattack,2020-02-07T00:00:00,2020-05-20T00:00:00,Cedarville University,Ransomware,1706,Education,,Full Date of Birth,2021,"1,000-9,999",200-299
10374,11/23/2020 12:00:00 AM,12/22/2020 12:00:00 AM,Cyberattack,2020-02-07T00:00:00,2020-05-20T00:00:00,Cedarville University,Ransomware,1706,Education,,Student ID Number,2021,"1,000-9,999",200-299
10374,11/23/2020 12:00:00 AM,12/22/2020 12:00:00 AM,Cyberattack,2020-02-07T00:00:00,2020-05-20T00:00:00,Cedarville University,Ransomware,1706,Education,,Other,2021,"1,000-9,999",200-299
10375,12/02/2020 12:00:00 AM,12/23/2020 12:00:00 AM,Cyberattack,2020-02-07T00:00:00,2020-05-20T00:00:00,Bucknell University,Ransomware,710,Education,,Name,2021,500-999,200-299
10375,12/02/2020 12:00:00 AM,12/23/2020 12:00:00 AM,Cyberattack,2020-02-07T00:00:00,2020-05-20T00:00:00,Bucknell University,Ransomware,710,Education,,Full Date of Birth,2021,500-999,200-299
10375,12/02/2020 12:00:00 AM,12/23/2020 12:00:00 AM,Cyberattack,2020-02-07T00:00:00,2020-05-20T00:00:00,Bucknell University,Ransomware,710,Education,,Student ID Number,2021,500-999,200-299
10375,12/02/2020 12:00:00 AM,12/23/2020 12:00:00 AM,Cyberattack,2020-02-07T00:00:00,2020-05-20T00:00:00,Bucknell University,Ransomware,710,Education,,Other,2021,500-999,200-299
10376,09/29/2020 12:00:00 AM,12/23/2020 12:00:00 AM,Cyberattack,2019-10-01T00:00:00,2020-08-20T00:00:00,"Metabolic Maintenance Products, Inc.",Malware,709,Business,Consumable,Name,2021,500-999,300-399
10376,09/29/2020 12:00:00 AM,12/23/2020 12:00:00 AM,Cyberattack,2019-10-01T00:00:00,2020-08-20T00:00:00,"Metabolic Maintenance Products, Inc.",Malware,709,Business,Consumable,Financial & Banking Information,2021,500-999,300-399
10377,11/11/2020 12:00:00 AM,12/23/2020 12:00:00 AM,Cyberattack,,,"Tree Top, Inc.",Ransomware,9721,Business,Consumable,Name,2021,"1,000-9,999",Unknown
10377,11/11/2020 12:00:00 AM,12/23/2020 12:00:00 AM,Cyberattack,,,"Tree Top, Inc.",Ransomware,9721,Business,Consumable,Social Security Number,2021,"1,000-9,999",Unknown
10377,11/11/2020 12:00:00 AM,12/23/2020 12:00:00 AM,Cyberattack,,,"Tree Top, Inc.",Ransomware,9721,Business,Consumable,Financial & Banking Information,2021,"1,000-9,999",Unknown
10377,11/11/2020 12:00:00 AM,12/23/2020 12:00:00 AM,Cyberattack,,,"Tree Top, Inc.",Ransomware,9721,Business,Consumable,Full Date of Birth,2021,"1,000-9,999",Unknown
10377,11/11/2020 12:00:00 AM,12/23/2020 12:00:00 AM,Cyberattack,,,"Tree Top, Inc.",Ransomware,9721,Business,Consumable,Health Insurance Policy or ID Number,2021,"1,000-9,999",Unknown
10377,11/11/2020 12:00:00 AM,12/23/2020 12:00:00 AM,Cyberattack,,,"Tree Top, Inc.",Ransomware,9721,Business,Consumable,Medical Information,2021,"1,000-9,999",Unknown
10377,11/11/2020 12:00:00 AM,12/23/2020 12:00:00 AM,Cyberattack,,,"Tree Top, Inc.",Ransomware,9721,Business,Consumable,Other,2021,"1,000-9,999",Unknown
10378,12/02/2020 12:00:00 AM,12/28/2020 12:00:00 AM,Theft or Mistake,2020-11-30T00:00:00,,Prime Therapeutics,,897,Health,,Name,2021,500-999,Unknown
10378,12/02/2020 12:00:00 AM,12/28/2020 12:00:00 AM,Theft or Mistake,2020-11-30T00:00:00,,Prime Therapeutics,,897,Health,,Medical Information,2021,500-999,Unknown
10379,07/16/2020 12:00:00 AM,12/28/2020 12:00:00 AM,Cyberattack,2020-02-07T00:00:00,2020-05-20T00:00:00,"Pulmonary Hypertension Association, Inc.",Ransomware,722,Non-Profit/Charity,,Name,2021,500-999,100-199
10379,07/16/2020 12:00:00 AM,12/28/2020 12:00:00 AM,Cyberattack,2020-02-07T00:00:00,2020-05-20T00:00:00,"Pulmonary Hypertension Association, Inc.",Ransomware,722,Non-Profit/Charity,,Full Date of Birth,2021,500-999,100-199
10380,10/20/2020 12:00:00 AM,12/31/2020 12:00:00 AM,Cyberattack,2020-10-20T00:00:00,,"Life Quotes, Inc.",Ransomware,626,Finance,,Name,2021,500-999,Unknown
10380,10/20/2020 12:00:00 AM,12/31/2020 12:00:00 AM,Cyberattack,2020-10-20T00:00:00,,"Life Quotes, Inc.",Ransomware,626,Finance,,Social Security Number,2021,500-999,Unknown
10380,10/20/2020 12:00:00 AM,12/31/2020 12:00:00 AM,Cyberattack,2020-10-20T00:00:00,,"Life Quotes, Inc.",Ransomware,626,Finance,,Driver's License or Washington ID Card Number,2021,500-999,Unknown
10380,10/20/2020 12:00:00 AM,12/31/2020 12:00:00 AM,Cyberattack,2020-10-20T00:00:00,,"Life Quotes, Inc.",Ransomware,626,Finance,,Financial & Banking Information,2021,500-999,Unknown
10380,10/20/2020 12:00:00 AM,12/31/2020 12:00:00 AM,Cyberattack,2020-10-20T00:00:00,,"Life Quotes, Inc.",Ransomware,626,Finance,,Full Date of Birth,2021,500-999,Unknown
10380,10/20/2020 12:00:00 AM,12/31/2020 12:00:00 AM,Cyberattack,2020-10-20T00:00:00,,"Life Quotes, Inc.",Ransomware,626,Finance,,Medical Information,2021,500-999,Unknown
10380,10/20/2020 12:00:00 AM,12/31/2020 12:00:00 AM,Cyberattack,2020-10-20T00:00:00,,"Life Quotes, Inc.",Ransomware,626,Finance,,Other,2021,500-999,Unknown
10381,12/12/2020 12:00:00 AM,01/04/2021 12:00:00 AM,Cyberattack,2020-12-12T00:00:00,2020-12-26T00:00:00,"Peter Pan Seafoods, Inc.",Ransomware,1661,Business,Consumable,Name,2021,"1,000-9,999",1-99
10381,12/12/2020 12:00:00 AM,01/04/2021 12:00:00 AM,Cyberattack,2020-12-12T00:00:00,2020-12-26T00:00:00,"Peter Pan Seafoods, Inc.",Ransomware,1661,Business,Consumable,Social Security Number,2021,"1,000-9,999",1-99
10381,12/12/2020 12:00:00 AM,01/04/2021 12:00:00 AM,Cyberattack,2020-12-12T00:00:00,2020-12-26T00:00:00,"Peter Pan Seafoods, Inc.",Ransomware,1661,Business,Consumable,Full Date of Birth,2021,"1,000-9,999",1-99
10381,12/12/2020 12:00:00 AM,01/04/2021 12:00:00 AM,Cyberattack,2020-12-12T00:00:00,2020-12-26T00:00:00,"Peter Pan Seafoods, Inc.",Ransomware,1661,Business,Consumable,Other,2021,"1,000-9,999",1-99
10382,09/29/2020 12:00:00 AM,01/05/2021 12:00:00 AM,Cyberattack,2020-02-07T00:00:00,2020-05-20T00:00:00,Grinnell College,Ransomware,2465,Education,,Name,2021,"1,000-9,999",200-299
10382,09/29/2020 12:00:00 AM,01/05/2021 12:00:00 AM,Cyberattack,2020-02-07T00:00:00,2020-05-20T00:00:00,Grinnell College,Ransomware,2465,Education,,Full Date of Birth,2021,"1,000-9,999",200-299
10382,09/29/2020 12:00:00 AM,01/05/2021 12:00:00 AM,Cyberattack,2020-02-07T00:00:00,2020-05-20T00:00:00,Grinnell College,Ransomware,2465,Education,,Student ID Number,2021,"1,000-9,999",200-299
10383,12/09/2020 12:00:00 AM,01/08/2021 12:00:00 AM,Cyberattack,2020-02-07T00:00:00,2020-05-20T00:00:00,Convoy of Hope,Ransomware,1017,Non-Profit/Charity,,Name,2021,"1,000-9,999",300-399
10383,12/09/2020 12:00:00 AM,01/08/2021 12:00:00 AM,Cyberattack,2020-02-07T00:00:00,2020-05-20T00:00:00,Convoy of Hope,Ransomware,1017,Non-Profit/Charity,,Full Date of Birth,2021,"1,000-9,999",300-399
10384,07/16/2020 12:00:00 AM,01/08/2021 12:00:00 AM,Cyberattack,2020-06-17T00:00:00,2020-06-22T00:00:00,North American Partners in Anesthesia,Phishing,505,Health,,Driver's License or Washington ID Card Number,2021,500-999,1-99
10384,07/16/2020 12:00:00 AM,01/08/2021 12:00:00 AM,Cyberattack,2020-06-17T00:00:00,2020-06-22T00:00:00,North American Partners in Anesthesia,Phishing,505,Health,,Health Insurance Policy or ID Number,2021,500-999,1-99
10384,07/16/2020 12:00:00 AM,01/08/2021 12:00:00 AM,Cyberattack,2020-06-17T00:00:00,2020-06-22T00:00:00,North American Partners in Anesthesia,Phishing,505,Health,,Medical Information,2021,500-999,1-99
10384,07/16/2020 12:00:00 AM,01/08/2021 12:00:00 AM,Cyberattack,2020-06-17T00:00:00,2020-06-22T00:00:00,North American Partners in Anesthesia,Phishing,505,Health,,Other,2021,500-999,1-99
10384,07/16/2020 12:00:00 AM,01/08/2021 12:00:00 AM,Cyberattack,2020-06-17T00:00:00,2020-06-22T00:00:00,North American Partners in Anesthesia,Phishing,505,Health,,Name,2021,500-999,1-99
10384,07/16/2020 12:00:00 AM,01/08/2021 12:00:00 AM,Cyberattack,2020-06-17T00:00:00,2020-06-22T00:00:00,North American Partners in Anesthesia,Phishing,505,Health,,Social Security Number,2021,500-999,1-99
10385,12/04/2020 12:00:00 AM,01/08/2021 12:00:00 AM,Cyberattack,2020-08-12T00:00:00,2020-09-14T00:00:00,"US Fertility, LLC (Seattle Reproductive Medicine)",Ransomware,47952,Health,,Name,2021,"10,000-49,999",100-199
10385,12/04/2020 12:00:00 AM,01/08/2021 12:00:00 AM,Cyberattack,2020-08-12T00:00:00,2020-09-14T00:00:00,"US Fertility, LLC (Seattle Reproductive Medicine)",Ransomware,47952,Health,,Social Security Number,2021,"10,000-49,999",100-199
10385,12/04/2020 12:00:00 AM,01/08/2021 12:00:00 AM,Cyberattack,2020-08-12T00:00:00,2020-09-14T00:00:00,"US Fertility, LLC (Seattle Reproductive Medicine)",Ransomware,47952,Health,,Driver's License or Washington ID Card Number,2021,"10,000-49,999",100-199
10385,12/04/2020 12:00:00 AM,01/08/2021 12:00:00 AM,Cyberattack,2020-08-12T00:00:00,2020-09-14T00:00:00,"US Fertility, LLC (Seattle Reproductive Medicine)",Ransomware,47952,Health,,Financial & Banking Information,2021,"10,000-49,999",100-199
10385,12/04/2020 12:00:00 AM,01/08/2021 12:00:00 AM,Cyberattack,2020-08-12T00:00:00,2020-09-14T00:00:00,"US Fertility, LLC (Seattle Reproductive Medicine)",Ransomware,47952,Health,,Passport Number,2021,"10,000-49,999",100-199
10385,12/04/2020 12:00:00 AM,01/08/2021 12:00:00 AM,Cyberattack,2020-08-12T00:00:00,2020-09-14T00:00:00,"US Fertility, LLC (Seattle Reproductive Medicine)",Ransomware,47952,Health,,Health Insurance Policy or ID Number,2021,"10,000-49,999",100-199
10385,12/04/2020 12:00:00 AM,01/08/2021 12:00:00 AM,Cyberattack,2020-08-12T00:00:00,2020-09-14T00:00:00,"US Fertility, LLC (Seattle Reproductive Medicine)",Ransomware,47952,Health,,Medical Information,2021,"10,000-49,999",100-199
10385,12/04/2020 12:00:00 AM,01/08/2021 12:00:00 AM,Cyberattack,2020-08-12T00:00:00,2020-09-14T00:00:00,"US Fertility, LLC (Seattle Reproductive Medicine)",Ransomware,47952,Health,,Other,2021,"10,000-49,999",100-199
10386,12/16/2020 12:00:00 AM,01/11/2021 12:00:00 AM,Cyberattack,2020-04-01T00:00:00,2020-06-30T00:00:00,"ALE Solutions, Inc.",Ransomware,736,Business,Other,Name,2021,500-999,200-299
10386,12/16/2020 12:00:00 AM,01/11/2021 12:00:00 AM,Cyberattack,2020-04-01T00:00:00,2020-06-30T00:00:00,"ALE Solutions, Inc.",Ransomware,736,Business,Other,Social Security Number,2021,500-999,200-299
10387,11/12/2020 12:00:00 AM,01/11/2021 12:00:00 AM,Cyberattack,2020-11-09T00:00:00,2020-11-12T00:00:00,Jefferson Healthcare,Phishing,2496,Health,,Name,2021,"1,000-9,999",1-99
10387,11/12/2020 12:00:00 AM,01/11/2021 12:00:00 AM,Cyberattack,2020-11-09T00:00:00,2020-11-12T00:00:00,Jefferson Healthcare,Phishing,2496,Health,,Social Security Number,2021,"1,000-9,999",1-99
10387,11/12/2020 12:00:00 AM,01/11/2021 12:00:00 AM,Cyberattack,2020-11-09T00:00:00,2020-11-12T00:00:00,Jefferson Healthcare,Phishing,2496,Health,,Driver's License or Washington ID Card Number,2021,"1,000-9,999",1-99
10387,11/12/2020 12:00:00 AM,01/11/2021 12:00:00 AM,Cyberattack,2020-11-09T00:00:00,2020-11-12T00:00:00,Jefferson Healthcare,Phishing,2496,Health,,Full Date of Birth,2021,"1,000-9,999",1-99
10387,11/12/2020 12:00:00 AM,01/11/2021 12:00:00 AM,Cyberattack,2020-11-09T00:00:00,2020-11-12T00:00:00,Jefferson Healthcare,Phishing,2496,Health,,Health Insurance Policy or ID Number,2021,"1,000-9,999",1-99
10387,11/12/2020 12:00:00 AM,01/11/2021 12:00:00 AM,Cyberattack,2020-11-09T00:00:00,2020-11-12T00:00:00,Jefferson Healthcare,Phishing,2496,Health,,Medical Information,2021,"1,000-9,999",1-99
10387,11/12/2020 12:00:00 AM,01/11/2021 12:00:00 AM,Cyberattack,2020-11-09T00:00:00,2020-11-12T00:00:00,Jefferson Healthcare,Phishing,2496,Health,,Other,2021,"1,000-9,999",1-99
10388,09/07/2020 12:00:00 AM,01/12/2021 12:00:00 AM,Cyberattack,2020-08-31T00:00:00,2020-09-07T00:00:00,"National Board for Certified Counselors, Inc.",Malware,9898,Non-Profit/Charity,,Name,2021,"1,000-9,999",1-99
10388,09/07/2020 12:00:00 AM,01/12/2021 12:00:00 AM,Cyberattack,2020-08-31T00:00:00,2020-09-07T00:00:00,"National Board for Certified Counselors, Inc.",Malware,9898,Non-Profit/Charity,,Social Security Number,2021,"1,000-9,999",1-99
10388,09/07/2020 12:00:00 AM,01/12/2021 12:00:00 AM,Cyberattack,2020-08-31T00:00:00,2020-09-07T00:00:00,"National Board for Certified Counselors, Inc.",Malware,9898,Non-Profit/Charity,,Full Date of Birth,2021,"1,000-9,999",1-99
10388,09/07/2020 12:00:00 AM,01/12/2021 12:00:00 AM,Cyberattack,2020-08-31T00:00:00,2020-09-07T00:00:00,"National Board for Certified Counselors, Inc.",Malware,9898,Non-Profit/Charity,,Other,2021,"1,000-9,999",1-99
10389,07/16/2020 12:00:00 AM,01/13/2021 12:00:00 AM,Cyberattack,2020-02-07T00:00:00,2020-05-20T00:00:00,North Park University,Ransomware,1239,Education,,Name,2021,"1,000-9,999",100-199
10389,07/16/2020 12:00:00 AM,01/13/2021 12:00:00 AM,Cyberattack,2020-02-07T00:00:00,2020-05-20T00:00:00,North Park University,Ransomware,1239,Education,,Full Date of Birth,2021,"1,000-9,999",100-199
10389,07/16/2020 12:00:00 AM,01/13/2021 12:00:00 AM,Cyberattack,2020-02-07T00:00:00,2020-05-20T00:00:00,North Park University,Ransomware,1239,Education,,Other,2021,"1,000-9,999",100-199
10390,12/10/2020 12:00:00 AM,01/13/2021 12:00:00 AM,Cyberattack,2019-12-05T00:00:00,2020-05-15T00:00:00,Waters & Kraus LLP,Phishing,522,Business,Legal,Name,2021,500-999,300-399
10390,12/10/2020 12:00:00 AM,01/13/2021 12:00:00 AM,Cyberattack,2019-12-05T00:00:00,2020-05-15T00:00:00,Waters & Kraus LLP,Phishing,522,Business,Legal,Social Security Number,2021,500-999,300-399
10390,12/10/2020 12:00:00 AM,01/13/2021 12:00:00 AM,Cyberattack,2019-12-05T00:00:00,2020-05-15T00:00:00,Waters & Kraus LLP,Phishing,522,Business,Legal,Driver's License or Washington ID Card Number,2021,500-999,300-399
10390,12/10/2020 12:00:00 AM,01/13/2021 12:00:00 AM,Cyberattack,2019-12-05T00:00:00,2020-05-15T00:00:00,Waters & Kraus LLP,Phishing,522,Business,Legal,Medical Information,2021,500-999,300-399
10391,10/14/2020 12:00:00 AM,01/15/2021 12:00:00 AM,Cyberattack,,,"Walla Walla County, WA",,577,Government,,Username and Password/Security Question Answers,2021,500-999,Unknown
10392,12/22/2020 12:00:00 AM,01/19/2021 12:00:00 AM,Cyberattack,2020-02-07T00:00:00,2020-05-20T00:00:00,Helen Keller International,Ransomware,534,Non-Profit/Charity,,Name,2021,500-999,300-399
10392,12/22/2020 12:00:00 AM,01/19/2021 12:00:00 AM,Cyberattack,2020-02-07T00:00:00,2020-05-20T00:00:00,Helen Keller International,Ransomware,534,Non-Profit/Charity,,Full Date of Birth,2021,500-999,300-399
10393,12/14/2020 12:00:00 AM,01/21/2021 12:00:00 AM,Cyberattack,2020-11-08T00:00:00,2020-11-09T00:00:00,Cardinal Financial Company,,925,Finance,,Name,2021,500-999,1-99
10393,12/14/2020 12:00:00 AM,01/21/2021 12:00:00 AM,Cyberattack,2020-11-08T00:00:00,2020-11-09T00:00:00,Cardinal Financial Company,,925,Finance,,Full Date of Birth,2021,500-999,1-99
10393,12/14/2020 12:00:00 AM,01/21/2021 12:00:00 AM,Cyberattack,2020-11-08T00:00:00,2020-11-09T00:00:00,Cardinal Financial Company,,925,Finance,,Other,2021,500-999,1-99
10394,08/01/2020 12:00:00 AM,01/25/2021 12:00:00 AM,Cyberattack,,,American Frame Corporation,Ransomware,954,Business,Retail,Name,2021,500-999,Unknown
10394,08/01/2020 12:00:00 AM,01/25/2021 12:00:00 AM,Cyberattack,,,American Frame Corporation,Ransomware,954,Business,Retail,Social Security Number,2021,500-999,Unknown
10394,08/01/2020 12:00:00 AM,01/25/2021 12:00:00 AM,Cyberattack,,,American Frame Corporation,Ransomware,954,Business,Retail,Financial & Banking Information,2021,500-999,Unknown
10394,08/01/2020 12:00:00 AM,01/25/2021 12:00:00 AM,Cyberattack,,,American Frame Corporation,Ransomware,954,Business,Retail,Other,2021,500-999,Unknown
10395,08/10/2020 12:00:00 AM,01/25/2021 12:00:00 AM,Cyberattack,2020-08-05T00:00:00,2020-08-17T00:00:00,Einstein Healthcare Network,Phishing,1197,Health,,Name,2021,"1,000-9,999",1-99
10395,08/10/2020 12:00:00 AM,01/25/2021 12:00:00 AM,Cyberattack,2020-08-05T00:00:00,2020-08-17T00:00:00,Einstein Healthcare Network,Phishing,1197,Health,,Social Security Number,2021,"1,000-9,999",1-99
10395,08/10/2020 12:00:00 AM,01/25/2021 12:00:00 AM,Cyberattack,2020-08-05T00:00:00,2020-08-17T00:00:00,Einstein Healthcare Network,Phishing,1197,Health,,Full Date of Birth,2021,"1,000-9,999",1-99
10395,08/10/2020 12:00:00 AM,01/25/2021 12:00:00 AM,Cyberattack,2020-08-05T00:00:00,2020-08-17T00:00:00,Einstein Healthcare Network,Phishing,1197,Health,,Health Insurance Policy or ID Number,2021,"1,000-9,999",1-99
10395,08/10/2020 12:00:00 AM,01/25/2021 12:00:00 AM,Cyberattack,2020-08-05T00:00:00,2020-08-17T00:00:00,Einstein Healthcare Network,Phishing,1197,Health,,Medical Information,2021,"1,000-9,999",1-99
10396,08/17/2020 12:00:00 AM,01/26/2021 12:00:00 AM,Cyberattack,,,"Bosley, Inc.",Ransomware,1936,Business,Other,Name,2021,"1,000-9,999",Unknown
10396,08/17/2020 12:00:00 AM,01/26/2021 12:00:00 AM,Cyberattack,,,"Bosley, Inc.",Ransomware,1936,Business,Other,Social Security Number,2021,"1,000-9,999",Unknown
10396,08/17/2020 12:00:00 AM,01/26/2021 12:00:00 AM,Cyberattack,,,"Bosley, Inc.",Ransomware,1936,Business,Other,Driver's License or Washington ID Card Number,2021,"1,000-9,999",Unknown
10396,08/17/2020 12:00:00 AM,01/26/2021 12:00:00 AM,Cyberattack,,,"Bosley, Inc.",Ransomware,1936,Business,Other,Financial & Banking Information,2021,"1,000-9,999",Unknown
10397,07/25/2020 12:00:00 AM,01/26/2021 12:00:00 AM,Cyberattack,2020-04-05T00:00:00,2020-08-06T00:00:00,Puget Sound Educational Service District,Phishing,32419,Education,,Name,2021,"10,000-49,999",100-199
10397,07/25/2020 12:00:00 AM,01/26/2021 12:00:00 AM,Cyberattack,2020-04-05T00:00:00,2020-08-06T00:00:00,Puget Sound Educational Service District,Phishing,32419,Education,,Social Security Number,2021,"10,000-49,999",100-199
10397,07/25/2020 12:00:00 AM,01/26/2021 12:00:00 AM,Cyberattack,2020-04-05T00:00:00,2020-08-06T00:00:00,Puget Sound Educational Service District,Phishing,32419,Education,,Financial & Banking Information,2021,"10,000-49,999",100-199
10397,07/25/2020 12:00:00 AM,01/26/2021 12:00:00 AM,Cyberattack,2020-04-05T00:00:00,2020-08-06T00:00:00,Puget Sound Educational Service District,Phishing,32419,Education,,Full Date of Birth,2021,"10,000-49,999",100-199
10397,07/25/2020 12:00:00 AM,01/26/2021 12:00:00 AM,Cyberattack,2020-04-05T00:00:00,2020-08-06T00:00:00,Puget Sound Educational Service District,Phishing,32419,Education,,Unique Private Key (e.g. used to authenticate or sign an electronic record),2021,"10,000-49,999",100-199
10397,07/25/2020 12:00:00 AM,01/26/2021 12:00:00 AM,Cyberattack,2020-04-05T00:00:00,2020-08-06T00:00:00,Puget Sound Educational Service District,Phishing,32419,Education,,Health Insurance Policy or ID Number,2021,"10,000-49,999",100-199
10397,07/25/2020 12:00:00 AM,01/26/2021 12:00:00 AM,Cyberattack,2020-04-05T00:00:00,2020-08-06T00:00:00,Puget Sound Educational Service District,Phishing,32419,Education,,Medical Information,2021,"10,000-49,999",100-199
10397,07/25/2020 12:00:00 AM,01/26/2021 12:00:00 AM,Cyberattack,2020-04-05T00:00:00,2020-08-06T00:00:00,Puget Sound Educational Service District,Phishing,32419,Education,,Username and Password/Security Question Answers,2021,"10,000-49,999",100-199
10397,07/25/2020 12:00:00 AM,01/26/2021 12:00:00 AM,Cyberattack,2020-04-05T00:00:00,2020-08-06T00:00:00,Puget Sound Educational Service District,Phishing,32419,Education,,Other,2021,"10,000-49,999",100-199
10398,08/31/2020 12:00:00 AM,01/27/2021 12:00:00 AM,Cyberattack,2020-08-28T00:00:00,2020-08-29T00:00:00,Absher Construction Company,Malware,1527,Business,Construction,Name,2021,"1,000-9,999",1-99
10398,08/31/2020 12:00:00 AM,01/27/2021 12:00:00 AM,Cyberattack,2020-08-28T00:00:00,2020-08-29T00:00:00,Absher Construction Company,Malware,1527,Business,Construction,Social Security Number,2021,"1,000-9,999",1-99
10398,08/31/2020 12:00:00 AM,01/27/2021 12:00:00 AM,Cyberattack,2020-08-28T00:00:00,2020-08-29T00:00:00,Absher Construction Company,Malware,1527,Business,Construction,Driver's License or Washington ID Card Number,2021,"1,000-9,999",1-99
10398,08/31/2020 12:00:00 AM,01/27/2021 12:00:00 AM,Cyberattack,2020-08-28T00:00:00,2020-08-29T00:00:00,Absher Construction Company,Malware,1527,Business,Construction,Financial & Banking Information,2021,"1,000-9,999",1-99
10398,08/31/2020 12:00:00 AM,01/27/2021 12:00:00 AM,Cyberattack,2020-08-28T00:00:00,2020-08-29T00:00:00,Absher Construction Company,Malware,1527,Business,Construction,Full Date of Birth,2021,"1,000-9,999",1-99
10399,12/28/2020 12:00:00 AM,01/26/2021 12:00:00 AM,Cyberattack,2020-12-28T00:00:00,2020-12-28T00:00:00,thyssenkrupp Materials,Ransomware,1250,Business,Manufacturing,Name,2021,"1,000-9,999",0
10399,12/28/2020 12:00:00 AM,01/26/2021 12:00:00 AM,Cyberattack,2020-12-28T00:00:00,2020-12-28T00:00:00,thyssenkrupp Materials,Ransomware,1250,Business,Manufacturing,Social Security Number,2021,"1,000-9,999",0
10399,12/28/2020 12:00:00 AM,01/26/2021 12:00:00 AM,Cyberattack,2020-12-28T00:00:00,2020-12-28T00:00:00,thyssenkrupp Materials,Ransomware,1250,Business,Manufacturing,Financial & Banking Information,2021,"1,000-9,999",0
10399,12/28/2020 12:00:00 AM,01/26/2021 12:00:00 AM,Cyberattack,2020-12-28T00:00:00,2020-12-28T00:00:00,thyssenkrupp Materials,Ransomware,1250,Business,Manufacturing,Full Date of Birth,2021,"1,000-9,999",0
10399,12/28/2020 12:00:00 AM,01/26/2021 12:00:00 AM,Cyberattack,2020-12-28T00:00:00,2020-12-28T00:00:00,thyssenkrupp Materials,Ransomware,1250,Business,Manufacturing,Medical Information,2021,"1,000-9,999",0
10399,12/28/2020 12:00:00 AM,01/26/2021 12:00:00 AM,Cyberattack,2020-12-28T00:00:00,2020-12-28T00:00:00,thyssenkrupp Materials,Ransomware,1250,Business,Manufacturing,Other,2021,"1,000-9,999",0
10400,01/03/2021 12:00:00 AM,02/02/2021 12:00:00 AM,Cyberattack,2021-01-03T00:00:00,,The Brotherhood's Relief & Compensation Fund,Ransomware,1563,Non-Profit/Charity,,Financial & Banking Information,2021,"1,000-9,999",Unknown
10400,01/03/2021 12:00:00 AM,02/02/2021 12:00:00 AM,Cyberattack,2021-01-03T00:00:00,,The Brotherhood's Relief & Compensation Fund,Ransomware,1563,Non-Profit/Charity,,Full Date of Birth,2021,"1,000-9,999",Unknown
10400,01/03/2021 12:00:00 AM,02/02/2021 12:00:00 AM,Cyberattack,2021-01-03T00:00:00,,The Brotherhood's Relief & Compensation Fund,Ransomware,1563,Non-Profit/Charity,,Other,2021,"1,000-9,999",Unknown
10400,01/03/2021 12:00:00 AM,02/02/2021 12:00:00 AM,Cyberattack,2021-01-03T00:00:00,,The Brotherhood's Relief & Compensation Fund,Ransomware,1563,Non-Profit/Charity,,Name,2021,"1,000-9,999",Unknown
10400,01/03/2021 12:00:00 AM,02/02/2021 12:00:00 AM,Cyberattack,2021-01-03T00:00:00,,The Brotherhood's Relief & Compensation Fund,Ransomware,1563,Non-Profit/Charity,,Social Security Number,2021,"1,000-9,999",Unknown
10401,01/12/2021 12:00:00 AM,02/12/2021 12:00:00 AM,Cyberattack,,,Washington State Auditor's Office,Malware,1420520,Government,,Name,2021,"1,000,000+",Unknown
10401,01/12/2021 12:00:00 AM,02/12/2021 12:00:00 AM,Cyberattack,,,Washington State Auditor's Office,Malware,1420520,Government,,Social Security Number,2021,"1,000,000+",Unknown
10401,01/12/2021 12:00:00 AM,02/12/2021 12:00:00 AM,Cyberattack,,,Washington State Auditor's Office,Malware,1420520,Government,,Financial & Banking Information,2021,"1,000,000+",Unknown
10401,01/12/2021 12:00:00 AM,02/12/2021 12:00:00 AM,Cyberattack,,,Washington State Auditor's Office,Malware,1420520,Government,,Full Date of Birth,2021,"1,000,000+",Unknown
10401,01/12/2021 12:00:00 AM,02/12/2021 12:00:00 AM,Cyberattack,,,Washington State Auditor's Office,Malware,1420520,Government,,Student ID Number,2021,"1,000,000+",Unknown
10401,01/12/2021 12:00:00 AM,02/12/2021 12:00:00 AM,Cyberattack,,,Washington State Auditor's Office,Malware,1420520,Government,,Health Insurance Policy or ID Number,2021,"1,000,000+",Unknown
10401,01/12/2021 12:00:00 AM,02/12/2021 12:00:00 AM,Cyberattack,,,Washington State Auditor's Office,Malware,1420520,Government,,Other,2021,"1,000,000+",Unknown
10402,01/14/2021 12:00:00 AM,02/17/2021 12:00:00 AM,Cyberattack,2020-12-03T00:00:00,2021-01-14T00:00:00,"Woodcreek Provider Services, LLC",Ransomware,25917,Health,,Name,2021,"10,000-49,999",1-99
10402,01/14/2021 12:00:00 AM,02/17/2021 12:00:00 AM,Cyberattack,2020-12-03T00:00:00,2021-01-14T00:00:00,"Woodcreek Provider Services, LLC",Ransomware,25917,Health,,Social Security Number,2021,"10,000-49,999",1-99
10402,01/14/2021 12:00:00 AM,02/17/2021 12:00:00 AM,Cyberattack,2020-12-03T00:00:00,2021-01-14T00:00:00,"Woodcreek Provider Services, LLC",Ransomware,25917,Health,,Financial & Banking Information,2021,"10,000-49,999",1-99
10402,01/14/2021 12:00:00 AM,02/17/2021 12:00:00 AM,Cyberattack,2020-12-03T00:00:00,2021-01-14T00:00:00,"Woodcreek Provider Services, LLC",Ransomware,25917,Health,,Full Date of Birth,2021,"10,000-49,999",1-99
10402,01/14/2021 12:00:00 AM,02/17/2021 12:00:00 AM,Cyberattack,2020-12-03T00:00:00,2021-01-14T00:00:00,"Woodcreek Provider Services, LLC",Ransomware,25917,Health,,Student ID Number,2021,"10,000-49,999",1-99
10402,01/14/2021 12:00:00 AM,02/17/2021 12:00:00 AM,Cyberattack,2020-12-03T00:00:00,2021-01-14T00:00:00,"Woodcreek Provider Services, LLC",Ransomware,25917,Health,,Health Insurance Policy or ID Number,2021,"10,000-49,999",1-99
10402,01/14/2021 12:00:00 AM,02/17/2021 12:00:00 AM,Cyberattack,2020-12-03T00:00:00,2021-01-14T00:00:00,"Woodcreek Provider Services, LLC",Ransomware,25917,Health,,Medical Information,2021,"10,000-49,999",1-99
10402,01/14/2021 12:00:00 AM,02/17/2021 12:00:00 AM,Cyberattack,2020-12-03T00:00:00,2021-01-14T00:00:00,"Woodcreek Provider Services, LLC",Ransomware,25917,Health,,Other,2021,"10,000-49,999",1-99
10405,01/23/2021 12:00:00 AM,02/19/2021 12:00:00 AM,Cyberattack,2020-12-24T00:00:00,2020-12-29T00:00:00,The Kroger Co.,Malware,153800,Business,Retail,Name,2021,"50,000-999,999",1-99
10405,01/23/2021 12:00:00 AM,02/19/2021 12:00:00 AM,Cyberattack,2020-12-24T00:00:00,2020-12-29T00:00:00,The Kroger Co.,Malware,153800,Business,Retail,Social Security Number,2021,"50,000-999,999",1-99
10405,01/23/2021 12:00:00 AM,02/19/2021 12:00:00 AM,Cyberattack,2020-12-24T00:00:00,2020-12-29T00:00:00,The Kroger Co.,Malware,153800,Business,Retail,Full Date of Birth,2021,"50,000-999,999",1-99
10405,01/23/2021 12:00:00 AM,02/19/2021 12:00:00 AM,Cyberattack,2020-12-24T00:00:00,2020-12-29T00:00:00,The Kroger Co.,Malware,153800,Business,Retail,Medical Information,2021,"50,000-999,999",1-99
10405,01/23/2021 12:00:00 AM,02/19/2021 12:00:00 AM,Cyberattack,2020-12-24T00:00:00,2020-12-29T00:00:00,The Kroger Co.,Malware,153800,Business,Retail,Other,2021,"50,000-999,999",1-99
10406,12/22/2020 12:00:00 AM,02/23/2021 12:00:00 AM,Theft or Mistake,2020-10-12T00:00:00,2020-12-16T00:00:00,Humana,,675,Health,,Name,2021,500-999,1-99
10406,12/22/2020 12:00:00 AM,02/23/2021 12:00:00 AM,Theft or Mistake,2020-10-12T00:00:00,2020-12-16T00:00:00,Humana,,675,Health,,Social Security Number,2021,500-999,1-99
10406,12/22/2020 12:00:00 AM,02/23/2021 12:00:00 AM,Theft or Mistake,2020-10-12T00:00:00,2020-12-16T00:00:00,Humana,,675,Health,,Full Date of Birth,2021,500-999,1-99
10406,12/22/2020 12:00:00 AM,02/23/2021 12:00:00 AM,Theft or Mistake,2020-10-12T00:00:00,2020-12-16T00:00:00,Humana,,675,Health,,Medical Information,2021,500-999,1-99
10406,12/22/2020 12:00:00 AM,02/23/2021 12:00:00 AM,Theft or Mistake,2020-10-12T00:00:00,2020-12-16T00:00:00,Humana,,675,Health,,Other,2021,500-999,1-99
10407,02/11/2021 12:00:00 AM,02/23/2021 12:00:00 AM,Cyberattack,2021-02-03T00:00:00,,Lakewood Water District,Ransomware,14877,Government,,Name,2021,"10,000-49,999",Unknown
10407,02/11/2021 12:00:00 AM,02/23/2021 12:00:00 AM,Cyberattack,2021-02-03T00:00:00,,Lakewood Water District,Ransomware,14877,Government,,Financial & Banking Information,2021,"10,000-49,999",Unknown
10407,02/11/2021 12:00:00 AM,02/23/2021 12:00:00 AM,Cyberattack,2021-02-03T00:00:00,,Lakewood Water District,Ransomware,14877,Government,,Other,2021,"10,000-49,999",Unknown
10408,01/04/2021 12:00:00 AM,02/23/2021 12:00:00 AM,Cyberattack,,,Washington Education Association & Seattle Education Association,Ransomware,17415,Education,,Name,2021,"10,000-49,999",Unknown
10408,01/04/2021 12:00:00 AM,02/23/2021 12:00:00 AM,Cyberattack,,,Washington Education Association & Seattle Education Association,Ransomware,17415,Education,,Social Security Number,2021,"10,000-49,999",Unknown
10408,01/04/2021 12:00:00 AM,02/23/2021 12:00:00 AM,Cyberattack,,,Washington Education Association & Seattle Education Association,Ransomware,17415,Education,,Full Date of Birth,2021,"10,000-49,999",Unknown
10408,01/04/2021 12:00:00 AM,02/23/2021 12:00:00 AM,Cyberattack,,,Washington Education Association & Seattle Education Association,Ransomware,17415,Education,,Other,2021,"10,000-49,999",Unknown
10409,02/02/2021 12:00:00 AM,02/26/2021 12:00:00 AM,Cyberattack,,,"BSN Sports, LLC",Malware,523,Business,Accessories,Name,2021,500-999,Unknown
10409,02/02/2021 12:00:00 AM,02/26/2021 12:00:00 AM,Cyberattack,,,"BSN Sports, LLC",Malware,523,Business,Accessories,Financial & Banking Information,2021,500-999,Unknown
10410,01/28/2021 12:00:00 AM,02/27/2021 12:00:00 AM,Cyberattack,2020-07-01T00:00:00,2020-10-31T00:00:00,"Casemaker, LLC and Lawriter, LLC",Malware,1690,Business,Legal,Other,2021,"1,000-9,999",200-299
10410,01/28/2021 12:00:00 AM,02/27/2021 12:00:00 AM,Cyberattack,2020-07-01T00:00:00,2020-10-31T00:00:00,"Casemaker, LLC and Lawriter, LLC",Malware,1690,Business,Legal,Name,2021,"1,000-9,999",200-299
10410,01/28/2021 12:00:00 AM,02/27/2021 12:00:00 AM,Cyberattack,2020-07-01T00:00:00,2020-10-31T00:00:00,"Casemaker, LLC and Lawriter, LLC",Malware,1690,Business,Legal,Email Address and Password/Security Question Answers,2021,"1,000-9,999",200-299
10411,10/20/2020 12:00:00 AM,03/02/2021 12:00:00 AM,Cyberattack,,,Cardinal Logistics Management Corp.,Ransomware,1308,Business,Shipping,Name,2021,"1,000-9,999",Unknown
10411,10/20/2020 12:00:00 AM,03/02/2021 12:00:00 AM,Cyberattack,,,Cardinal Logistics Management Corp.,Ransomware,1308,Business,Shipping,Social Security Number,2021,"1,000-9,999",Unknown
10411,10/20/2020 12:00:00 AM,03/02/2021 12:00:00 AM,Cyberattack,,,Cardinal Logistics Management Corp.,Ransomware,1308,Business,Shipping,Financial & Banking Information,2021,"1,000-9,999",Unknown
10411,10/20/2020 12:00:00 AM,03/02/2021 12:00:00 AM,Cyberattack,,,Cardinal Logistics Management Corp.,Ransomware,1308,Business,Shipping,Full Date of Birth,2021,"1,000-9,999",Unknown
10411,10/20/2020 12:00:00 AM,03/02/2021 12:00:00 AM,Cyberattack,,,Cardinal Logistics Management Corp.,Ransomware,1308,Business,Shipping,Health Insurance Policy or ID Number,2021,"1,000-9,999",Unknown
10411,10/20/2020 12:00:00 AM,03/02/2021 12:00:00 AM,Cyberattack,,,Cardinal Logistics Management Corp.,Ransomware,1308,Business,Shipping,Medical Information,2021,"1,000-9,999",Unknown
10411,10/20/2020 12:00:00 AM,03/02/2021 12:00:00 AM,Cyberattack,,,Cardinal Logistics Management Corp.,Ransomware,1308,Business,Shipping,Other,2021,"1,000-9,999",Unknown
10412,02/09/2021 12:00:00 AM,03/02/2021 12:00:00 AM,Cyberattack,,,Northshore Utility District,Ransomware,4900,Government,,Name,2021,"1,000-9,999",Unknown
10412,02/09/2021 12:00:00 AM,03/02/2021 12:00:00 AM,Cyberattack,,,Northshore Utility District,Ransomware,4900,Government,,Financial & Banking Information,2021,"1,000-9,999",Unknown
10412,02/09/2021 12:00:00 AM,03/02/2021 12:00:00 AM,Cyberattack,,,Northshore Utility District,Ransomware,4900,Government,,Other,2021,"1,000-9,999",Unknown
10413,11/16/2020 12:00:00 AM,03/04/2021 12:00:00 AM,Cyberattack,,,Americold Realty Trust,Ransomware,3337,Business,Real Estate,Unique Private Key (e.g. used to authenticate or sign an electronic record),2021,"1,000-9,999",Unknown
10413,11/16/2020 12:00:00 AM,03/04/2021 12:00:00 AM,Cyberattack,,,Americold Realty Trust,Ransomware,3337,Business,Real Estate,Health Insurance Policy or ID Number,2021,"1,000-9,999",Unknown
10413,11/16/2020 12:00:00 AM,03/04/2021 12:00:00 AM,Cyberattack,,,Americold Realty Trust,Ransomware,3337,Business,Real Estate,Medical Information,2021,"1,000-9,999",Unknown
10413,11/16/2020 12:00:00 AM,03/04/2021 12:00:00 AM,Cyberattack,,,Americold Realty Trust,Ransomware,3337,Business,Real Estate,Biometric Data,2021,"1,000-9,999",Unknown
10413,11/16/2020 12:00:00 AM,03/04/2021 12:00:00 AM,Cyberattack,,,Americold Realty Trust,Ransomware,3337,Business,Real Estate,Username and Password/Security Question Answers,2021,"1,000-9,999",Unknown
10413,11/16/2020 12:00:00 AM,03/04/2021 12:00:00 AM,Cyberattack,,,Americold Realty Trust,Ransomware,3337,Business,Real Estate,Other,2021,"1,000-9,999",Unknown
10413,11/16/2020 12:00:00 AM,03/04/2021 12:00:00 AM,Cyberattack,,,Americold Realty Trust,Ransomware,3337,Business,Real Estate,Name,2021,"1,000-9,999",Unknown
10413,11/16/2020 12:00:00 AM,03/04/2021 12:00:00 AM,Cyberattack,,,Americold Realty Trust,Ransomware,3337,Business,Real Estate,Social Security Number,2021,"1,000-9,999",Unknown
10413,11/16/2020 12:00:00 AM,03/04/2021 12:00:00 AM,Cyberattack,,,Americold Realty Trust,Ransomware,3337,Business,Real Estate,Driver's License or Washington ID Card Number,2021,"1,000-9,999",Unknown
10413,11/16/2020 12:00:00 AM,03/04/2021 12:00:00 AM,Cyberattack,,,Americold Realty Trust,Ransomware,3337,Business,Real Estate,Financial & Banking Information,2021,"1,000-9,999",Unknown
10413,11/16/2020 12:00:00 AM,03/04/2021 12:00:00 AM,Cyberattack,,,Americold Realty Trust,Ransomware,3337,Business,Real Estate,Full Date of Birth,2021,"1,000-9,999",Unknown
10414,01/29/2021 12:00:00 AM,03/05/2021 12:00:00 AM,Cyberattack,2021-01-28T00:00:00,2021-01-31T00:00:00,American Armed Forces Mutual Aid Association,,4318,Non-Profit/Charity,,Name,2021,"1,000-9,999",1-99
10414,01/29/2021 12:00:00 AM,03/05/2021 12:00:00 AM,Cyberattack,2021-01-28T00:00:00,2021-01-31T00:00:00,American Armed Forces Mutual Aid Association,,4318,Non-Profit/Charity,,Social Security Number,2021,"1,000-9,999",1-99
10414,01/29/2021 12:00:00 AM,03/05/2021 12:00:00 AM,Cyberattack,2021-01-28T00:00:00,2021-01-31T00:00:00,American Armed Forces Mutual Aid Association,,4318,Non-Profit/Charity,,Financial & Banking Information,2021,"1,000-9,999",1-99
10414,01/29/2021 12:00:00 AM,03/05/2021 12:00:00 AM,Cyberattack,2021-01-28T00:00:00,2021-01-31T00:00:00,American Armed Forces Mutual Aid Association,,4318,Non-Profit/Charity,,Full Date of Birth,2021,"1,000-9,999",1-99
10414,01/29/2021 12:00:00 AM,03/05/2021 12:00:00 AM,Cyberattack,2021-01-28T00:00:00,2021-01-31T00:00:00,American Armed Forces Mutual Aid Association,,4318,Non-Profit/Charity,,Other,2021,"1,000-9,999",1-99
10415,10/15/2020 12:00:00 AM,04/04/2021 12:00:00 AM,Cyberattack,2020-10-06T00:00:00,2020-10-15T00:00:00,"RXLTC, PLLC & Prescription Pharmacy, PLLC",Phishing,560,Health,,Name,2021,500-999,1-99
10415,10/15/2020 12:00:00 AM,04/04/2021 12:00:00 AM,Cyberattack,2020-10-06T00:00:00,2020-10-15T00:00:00,"RXLTC, PLLC & Prescription Pharmacy, PLLC",Phishing,560,Health,,Social Security Number,2021,500-999,1-99
10415,10/15/2020 12:00:00 AM,04/04/2021 12:00:00 AM,Cyberattack,2020-10-06T00:00:00,2020-10-15T00:00:00,"RXLTC, PLLC & Prescription Pharmacy, PLLC",Phishing,560,Health,,Driver's License or Washington ID Card Number,2021,500-999,1-99
10415,10/15/2020 12:00:00 AM,04/04/2021 12:00:00 AM,Cyberattack,2020-10-06T00:00:00,2020-10-15T00:00:00,"RXLTC, PLLC & Prescription Pharmacy, PLLC",Phishing,560,Health,,Financial & Banking Information,2021,500-999,1-99
10415,10/15/2020 12:00:00 AM,04/04/2021 12:00:00 AM,Cyberattack,2020-10-06T00:00:00,2020-10-15T00:00:00,"RXLTC, PLLC & Prescription Pharmacy, PLLC",Phishing,560,Health,,Full Date of Birth,2021,500-999,1-99
10415,10/15/2020 12:00:00 AM,04/04/2021 12:00:00 AM,Cyberattack,2020-10-06T00:00:00,2020-10-15T00:00:00,"RXLTC, PLLC & Prescription Pharmacy, PLLC",Phishing,560,Health,,Medical Information,2021,500-999,1-99
10415,10/15/2020 12:00:00 AM,04/04/2021 12:00:00 AM,Cyberattack,2020-10-06T00:00:00,2020-10-15T00:00:00,"RXLTC, PLLC & Prescription Pharmacy, PLLC",Phishing,560,Health,,Other,2021,500-999,1-99
10416,10/16/2019 12:00:00 AM,11/14/2019 12:00:00 AM,Unauthorized Access,2019-07-09T00:00:00,2019-10-09T00:00:00,"Green Roads of Florida, LLC",,540,Business,Consumable,Name,2020,500-999,1-99
10416,10/16/2019 12:00:00 AM,11/14/2019 12:00:00 AM,Unauthorized Access,2019-07-09T00:00:00,2019-10-09T00:00:00,"Green Roads of Florida, LLC",,540,Business,Consumable,Financial & Banking Information,2020,500-999,1-99
10418,01/19/2021 12:00:00 AM,03/05/2021 12:00:00 AM,Cyberattack,2020-12-01T00:00:00,2021-01-20T00:00:00,Metromile Insurance Company,Malware,1400,Finance,,Name,2021,"1,000-9,999",1-99
10418,01/19/2021 12:00:00 AM,03/05/2021 12:00:00 AM,Cyberattack,2020-12-01T00:00:00,2021-01-20T00:00:00,Metromile Insurance Company,Malware,1400,Finance,,Driver's License or Washington ID Card Number,2021,"1,000-9,999",1-99
10418,01/19/2021 12:00:00 AM,03/05/2021 12:00:00 AM,Cyberattack,2020-12-01T00:00:00,2021-01-20T00:00:00,Metromile Insurance Company,Malware,1400,Finance,,Full Date of Birth,2021,"1,000-9,999",1-99
10419,11/20/2020 12:00:00 AM,03/10/2021 12:00:00 AM,Unauthorized Access,2020-11-07T00:00:00,2020-11-08T00:00:00,"Mead Johnson & Company, LLC",,2828,Business,Consumable,Name,2021,"1,000-9,999",1-99
10419,11/20/2020 12:00:00 AM,03/10/2021 12:00:00 AM,Unauthorized Access,2020-11-07T00:00:00,2020-11-08T00:00:00,"Mead Johnson & Company, LLC",,2828,Business,Consumable,Full Date of Birth,2021,"1,000-9,999",1-99
10420,02/04/2021 12:00:00 AM,03/10/2021 12:00:00 AM,Cyberattack,,,Public Utility District No. 1 of Skagit County,Ransomware,23935,Government,,Name,2021,"10,000-49,999",Unknown
10420,02/04/2021 12:00:00 AM,03/10/2021 12:00:00 AM,Cyberattack,,,Public Utility District No. 1 of Skagit County,Ransomware,23935,Government,,Financial & Banking Information,2021,"10,000-49,999",Unknown
10420,02/04/2021 12:00:00 AM,03/10/2021 12:00:00 AM,Cyberattack,,,Public Utility District No. 1 of Skagit County,Ransomware,23935,Government,,Other,2021,"10,000-49,999",Unknown
10421,03/09/2021 12:00:00 AM,03/11/2021 12:00:00 AM,Cyberattack,,,Pan-American Life Insurance Group,Phishing,599,Finance,,Name,2021,500-999,Unknown
10421,03/09/2021 12:00:00 AM,03/11/2021 12:00:00 AM,Cyberattack,,,Pan-American Life Insurance Group,Phishing,599,Finance,,Social Security Number,2021,500-999,Unknown
10421,03/09/2021 12:00:00 AM,03/11/2021 12:00:00 AM,Cyberattack,,,Pan-American Life Insurance Group,Phishing,599,Finance,,Driver's License or Washington ID Card Number,2021,500-999,Unknown
10421,03/09/2021 12:00:00 AM,03/11/2021 12:00:00 AM,Cyberattack,,,Pan-American Life Insurance Group,Phishing,599,Finance,,Financial & Banking Information,2021,500-999,Unknown
10421,03/09/2021 12:00:00 AM,03/11/2021 12:00:00 AM,Cyberattack,,,Pan-American Life Insurance Group,Phishing,599,Finance,,Full Date of Birth,2021,500-999,Unknown
10421,03/09/2021 12:00:00 AM,03/11/2021 12:00:00 AM,Cyberattack,,,Pan-American Life Insurance Group,Phishing,599,Finance,,Passport Number,2021,500-999,Unknown
10421,03/09/2021 12:00:00 AM,03/11/2021 12:00:00 AM,Cyberattack,,,Pan-American Life Insurance Group,Phishing,599,Finance,,Medical Information,2021,500-999,Unknown
10421,03/09/2021 12:00:00 AM,03/11/2021 12:00:00 AM,Cyberattack,,,Pan-American Life Insurance Group,Phishing,599,Finance,,Other,2021,500-999,Unknown
10422,12/03/2020 12:00:00 AM,03/11/2021 12:00:00 AM,Cyberattack,2020-11-08T00:00:00,2020-12-03T00:00:00,Perkins & Co,Ransomware,41871,Finance,,Name,2021,"10,000-49,999",1-99
10422,12/03/2020 12:00:00 AM,03/11/2021 12:00:00 AM,Cyberattack,2020-11-08T00:00:00,2020-12-03T00:00:00,Perkins & Co,Ransomware,41871,Finance,,Social Security Number,2021,"10,000-49,999",1-99
10422,12/03/2020 12:00:00 AM,03/11/2021 12:00:00 AM,Cyberattack,2020-11-08T00:00:00,2020-12-03T00:00:00,Perkins & Co,Ransomware,41871,Finance,,Driver's License or Washington ID Card Number,2021,"10,000-49,999",1-99
10422,12/03/2020 12:00:00 AM,03/11/2021 12:00:00 AM,Cyberattack,2020-11-08T00:00:00,2020-12-03T00:00:00,Perkins & Co,Ransomware,41871,Finance,,Financial & Banking Information,2021,"10,000-49,999",1-99
10422,12/03/2020 12:00:00 AM,03/11/2021 12:00:00 AM,Cyberattack,2020-11-08T00:00:00,2020-12-03T00:00:00,Perkins & Co,Ransomware,41871,Finance,,Full Date of Birth,2021,"10,000-49,999",1-99
10422,12/03/2020 12:00:00 AM,03/11/2021 12:00:00 AM,Cyberattack,2020-11-08T00:00:00,2020-12-03T00:00:00,Perkins & Co,Ransomware,41871,Finance,,Passport Number,2021,"10,000-49,999",1-99
10422,12/03/2020 12:00:00 AM,03/11/2021 12:00:00 AM,Cyberattack,2020-11-08T00:00:00,2020-12-03T00:00:00,Perkins & Co,Ransomware,41871,Finance,,Other,2021,"10,000-49,999",1-99
10423,06/01/2020 12:00:00 AM,03/11/2021 12:00:00 AM,Cyberattack,,,Security Industry Specialists,Ransomware,2264,Business,Other,Name,2021,"1,000-9,999",Unknown
10423,06/01/2020 12:00:00 AM,03/11/2021 12:00:00 AM,Cyberattack,,,Security Industry Specialists,Ransomware,2264,Business,Other,Financial & Banking Information,2021,"1,000-9,999",Unknown
10424,11/29/2020 12:00:00 AM,03/15/2021 12:00:00 AM,Cyberattack,,,American Health Care Academy,Malware,1211,Health,,Name,2021,"1,000-9,999",Unknown
10424,11/29/2020 12:00:00 AM,03/15/2021 12:00:00 AM,Cyberattack,,,American Health Care Academy,Malware,1211,Health,,Financial & Banking Information,2021,"1,000-9,999",Unknown
10425,01/24/2021 12:00:00 AM,03/15/2021 12:00:00 AM,Cyberattack,,,"Flagstar Bank, FSB",Malware,61006,Finance,,Name,2021,"50,000-999,999",Unknown
10425,01/24/2021 12:00:00 AM,03/15/2021 12:00:00 AM,Cyberattack,,,"Flagstar Bank, FSB",Malware,61006,Finance,,Social Security Number,2021,"50,000-999,999",Unknown
10425,01/24/2021 12:00:00 AM,03/15/2021 12:00:00 AM,Cyberattack,,,"Flagstar Bank, FSB",Malware,61006,Finance,,Full Date of Birth,2021,"50,000-999,999",Unknown
10425,01/24/2021 12:00:00 AM,03/15/2021 12:00:00 AM,Cyberattack,,,"Flagstar Bank, FSB",Malware,61006,Finance,,Other,2021,"50,000-999,999",Unknown
10426,12/26/2020 12:00:00 AM,03/16/2021 12:00:00 AM,Unauthorized Access,,2020-12-26T00:00:00,Infinity Insurance Company,,606,Finance,,Name,2021,500-999,Unknown
10426,12/26/2020 12:00:00 AM,03/16/2021 12:00:00 AM,Unauthorized Access,,2020-12-26T00:00:00,Infinity Insurance Company,,606,Finance,,Social Security Number,2021,500-999,Unknown
10426,12/26/2020 12:00:00 AM,03/16/2021 12:00:00 AM,Unauthorized Access,,2020-12-26T00:00:00,Infinity Insurance Company,,606,Finance,,Driver's License or Washington ID Card Number,2021,500-999,Unknown
10469,04/25/2021 12:00:00 AM,05/25/2021 12:00:00 AM,Cyberattack,2021-01-07T00:00:00,2021-04-04T00:00:00,Infinity Insurance Company,Other,639,Finance,,Name,2021,500-999,100-199
10469,04/25/2021 12:00:00 AM,05/25/2021 12:00:00 AM,Cyberattack,2021-01-07T00:00:00,2021-04-04T00:00:00,Infinity Insurance Company,Other,639,Finance,,Driver's License or Washington ID Card Number,2021,500-999,100-199
10427,02/04/2021 12:00:00 AM,03/17/2021 12:00:00 AM,Cyberattack,2021-02-04T00:00:00,2021-02-08T00:00:00,Automatic Funds Transfer Services Inc.,Ransomware,695,Finance,,Name,2021,500-999,1-99
10427,02/04/2021 12:00:00 AM,03/17/2021 12:00:00 AM,Cyberattack,2021-02-04T00:00:00,2021-02-08T00:00:00,Automatic Funds Transfer Services Inc.,Ransomware,695,Finance,,Financial & Banking Information,2021,500-999,1-99
10427,02/04/2021 12:00:00 AM,03/17/2021 12:00:00 AM,Cyberattack,2021-02-04T00:00:00,2021-02-08T00:00:00,Automatic Funds Transfer Services Inc.,Ransomware,695,Finance,,Other,2021,500-999,1-99
10428,12/20/2019 12:00:00 AM,03/17/2021 12:00:00 AM,Cyberattack,,,PCS Revenue Control Systems,Phishing,11807,Business,Professional Services,Name,2021,"10,000-49,999",Unknown
10428,12/20/2019 12:00:00 AM,03/17/2021 12:00:00 AM,Cyberattack,,,PCS Revenue Control Systems,Phishing,11807,Business,Professional Services,Social Security Number,2021,"10,000-49,999",Unknown
10428,12/20/2019 12:00:00 AM,03/17/2021 12:00:00 AM,Cyberattack,,,PCS Revenue Control Systems,Phishing,11807,Business,Professional Services,Full Date of Birth,2021,"10,000-49,999",Unknown
10428,12/20/2019 12:00:00 AM,03/17/2021 12:00:00 AM,Cyberattack,,,PCS Revenue Control Systems,Phishing,11807,Business,Professional Services,Student ID Number,2021,"10,000-49,999",Unknown
10429,02/22/2021 12:00:00 AM,03/17/2021 12:00:00 AM,Cyberattack,2020-12-24T00:00:00,2020-12-29T00:00:00,Western Union Retail Money Transfer Partner,Malware,1555,Finance,,Name,2021,"1,000-9,999",1-99
10429,02/22/2021 12:00:00 AM,03/17/2021 12:00:00 AM,Cyberattack,2020-12-24T00:00:00,2020-12-29T00:00:00,Western Union Retail Money Transfer Partner,Malware,1555,Finance,,Social Security Number,2021,"1,000-9,999",1-99
10429,02/22/2021 12:00:00 AM,03/17/2021 12:00:00 AM,Cyberattack,2020-12-24T00:00:00,2020-12-29T00:00:00,Western Union Retail Money Transfer Partner,Malware,1555,Finance,,Driver's License or Washington ID Card Number,2021,"1,000-9,999",1-99
10429,02/22/2021 12:00:00 AM,03/17/2021 12:00:00 AM,Cyberattack,2020-12-24T00:00:00,2020-12-29T00:00:00,Western Union Retail Money Transfer Partner,Malware,1555,Finance,,Full Date of Birth,2021,"1,000-9,999",1-99
10429,02/22/2021 12:00:00 AM,03/17/2021 12:00:00 AM,Cyberattack,2020-12-24T00:00:00,2020-12-29T00:00:00,Western Union Retail Money Transfer Partner,Malware,1555,Finance,,Other,2021,"1,000-9,999",1-99
10430,05/24/2020 12:00:00 AM,03/18/2021 12:00:00 AM,Cyberattack,2020-05-24T00:00:00,,Manson Counstruction Co.,,1049,Business,Construction,Name,2021,"1,000-9,999",Unknown
10430,05/24/2020 12:00:00 AM,03/18/2021 12:00:00 AM,Cyberattack,2020-05-24T00:00:00,,Manson Counstruction Co.,,1049,Business,Construction,Social Security Number,2021,"1,000-9,999",Unknown
10430,05/24/2020 12:00:00 AM,03/18/2021 12:00:00 AM,Cyberattack,2020-05-24T00:00:00,,Manson Counstruction Co.,,1049,Business,Construction,Full Date of Birth,2021,"1,000-9,999",Unknown
10430,05/24/2020 12:00:00 AM,03/18/2021 12:00:00 AM,Cyberattack,2020-05-24T00:00:00,,Manson Counstruction Co.,,1049,Business,Construction,Other,2021,"1,000-9,999",Unknown
10431,01/18/2021 12:00:00 AM,03/19/2021 12:00:00 AM,Cyberattack,2021-01-12T00:00:00,2021-01-18T00:00:00,Cancer Treatment Centers of America,Phishing,579,Health,,Name,2021,500-999,1-99
10431,01/18/2021 12:00:00 AM,03/19/2021 12:00:00 AM,Cyberattack,2021-01-12T00:00:00,2021-01-18T00:00:00,Cancer Treatment Centers of America,Phishing,579,Health,,Health Insurance Policy or ID Number,2021,500-999,1-99
10431,01/18/2021 12:00:00 AM,03/19/2021 12:00:00 AM,Cyberattack,2021-01-12T00:00:00,2021-01-18T00:00:00,Cancer Treatment Centers of America,Phishing,579,Health,,Medical Information,2021,500-999,1-99
10431,01/18/2021 12:00:00 AM,03/19/2021 12:00:00 AM,Cyberattack,2021-01-12T00:00:00,2021-01-18T00:00:00,Cancer Treatment Centers of America,Phishing,579,Health,,Other,2021,500-999,1-99
10432,11/29/2020 12:00:00 AM,03/19/2021 12:00:00 AM,Cyberattack,2020-11-18T00:00:00,2020-11-29T00:00:00,"Citywide Home Loans, LLC",Ransomware,2407,Finance,,Name,2021,"1,000-9,999",1-99
10432,11/29/2020 12:00:00 AM,03/19/2021 12:00:00 AM,Cyberattack,2020-11-18T00:00:00,2020-11-29T00:00:00,"Citywide Home Loans, LLC",Ransomware,2407,Finance,,Social Security Number,2021,"1,000-9,999",1-99
10432,11/29/2020 12:00:00 AM,03/19/2021 12:00:00 AM,Cyberattack,2020-11-18T00:00:00,2020-11-29T00:00:00,"Citywide Home Loans, LLC",Ransomware,2407,Finance,,Driver's License or Washington ID Card Number,2021,"1,000-9,999",1-99
10432,11/29/2020 12:00:00 AM,03/19/2021 12:00:00 AM,Cyberattack,2020-11-18T00:00:00,2020-11-29T00:00:00,"Citywide Home Loans, LLC",Ransomware,2407,Finance,,Financial & Banking Information,2021,"1,000-9,999",1-99
10432,11/29/2020 12:00:00 AM,03/19/2021 12:00:00 AM,Cyberattack,2020-11-18T00:00:00,2020-11-29T00:00:00,"Citywide Home Loans, LLC",Ransomware,2407,Finance,,Full Date of Birth,2021,"1,000-9,999",1-99
10432,11/29/2020 12:00:00 AM,03/19/2021 12:00:00 AM,Cyberattack,2020-11-18T00:00:00,2020-11-29T00:00:00,"Citywide Home Loans, LLC",Ransomware,2407,Finance,,Passport Number,2021,"1,000-9,999",1-99
10432,11/29/2020 12:00:00 AM,03/19/2021 12:00:00 AM,Cyberattack,2020-11-18T00:00:00,2020-11-29T00:00:00,"Citywide Home Loans, LLC",Ransomware,2407,Finance,,Health Insurance Policy or ID Number,2021,"1,000-9,999",1-99
10432,11/29/2020 12:00:00 AM,03/19/2021 12:00:00 AM,Cyberattack,2020-11-18T00:00:00,2020-11-29T00:00:00,"Citywide Home Loans, LLC",Ransomware,2407,Finance,,Other,2021,"1,000-9,999",1-99
10433,02/24/2021 12:00:00 AM,03/22/2021 12:00:00 AM,Theft or Mistake,2021-02-22T00:00:00,2021-02-24T00:00:00,"On Q Fiancial, Inc.",,18066,Finance,,Name,2021,"10,000-49,999",1-99
10433,02/24/2021 12:00:00 AM,03/22/2021 12:00:00 AM,Theft or Mistake,2021-02-22T00:00:00,2021-02-24T00:00:00,"On Q Fiancial, Inc.",,18066,Finance,,Social Security Number,2021,"10,000-49,999",1-99
10433,02/24/2021 12:00:00 AM,03/22/2021 12:00:00 AM,Theft or Mistake,2021-02-22T00:00:00,2021-02-24T00:00:00,"On Q Fiancial, Inc.",,18066,Finance,,Other,2021,"10,000-49,999",1-99
10434,12/04/2020 12:00:00 AM,03/24/2021 12:00:00 AM,Cyberattack,2019-02-06T00:00:00,2020-12-10T00:00:00,National Wildlife Federation,Malware,3311,Non-Profit/Charity,,Name,2021,"1,000-9,999",500+
10434,12/04/2020 12:00:00 AM,03/24/2021 12:00:00 AM,Cyberattack,2019-02-06T00:00:00,2020-12-10T00:00:00,National Wildlife Federation,Malware,3311,Non-Profit/Charity,,Financial & Banking Information,2021,"1,000-9,999",500+
10434,12/04/2020 12:00:00 AM,03/24/2021 12:00:00 AM,Cyberattack,2019-02-06T00:00:00,2020-12-10T00:00:00,National Wildlife Federation,Malware,3311,Non-Profit/Charity,,Other,2021,"1,000-9,999",500+
10633,04/25/2019 12:00:00 AM,05/24/2019 12:00:00 AM,Unauthorized Access,2019-01-03T00:00:00,2019-01-03T00:00:00,National Wildlife Federation,,1564,Non-Profit/Charity,,Name,2019,"1,000-9,999",100-199
10633,04/25/2019 12:00:00 AM,05/24/2019 12:00:00 AM,Unauthorized Access,2019-01-03T00:00:00,2019-01-03T00:00:00,National Wildlife Federation,,1564,Non-Profit/Charity,,Financial & Banking Information,2019,"1,000-9,999",100-199
10633,04/25/2019 12:00:00 AM,05/24/2019 12:00:00 AM,Unauthorized Access,2019-01-03T00:00:00,2019-01-03T00:00:00,National Wildlife Federation,,1564,Non-Profit/Charity,,Other,2019,"1,000-9,999",100-199
10435,03/02/2021 12:00:00 AM,04/01/2021 12:00:00 AM,Cyberattack,2021-02-01T00:00:00,,"MHNext, LLC",,7714,Business,Software,Username and Password/Security Question Answers,2021,"1,000-9,999",Unknown
10435,03/02/2021 12:00:00 AM,04/01/2021 12:00:00 AM,Cyberattack,2021-02-01T00:00:00,,"MHNext, LLC",,7714,Business,Software,Email Address and Password/Security Question Answers,2021,"1,000-9,999",Unknown
10436,08/14/2020 12:00:00 AM,04/02/2021 12:00:00 AM,Cyberattack,,,FPI Management,,1022,Business,Real Estate,Name,2021,"1,000-9,999",Unknown
10436,08/14/2020 12:00:00 AM,04/02/2021 12:00:00 AM,Cyberattack,,,FPI Management,,1022,Business,Real Estate,Social Security Number,2021,"1,000-9,999",Unknown
10436,08/14/2020 12:00:00 AM,04/02/2021 12:00:00 AM,Cyberattack,,,FPI Management,,1022,Business,Real Estate,Driver's License or Washington ID Card Number,2021,"1,000-9,999",Unknown
10436,08/14/2020 12:00:00 AM,04/02/2021 12:00:00 AM,Cyberattack,,,FPI Management,,1022,Business,Real Estate,Financial & Banking Information,2021,"1,000-9,999",Unknown
10436,08/14/2020 12:00:00 AM,04/02/2021 12:00:00 AM,Cyberattack,,,FPI Management,,1022,Business,Real Estate,Full Date of Birth,2021,"1,000-9,999",Unknown
10436,08/14/2020 12:00:00 AM,04/02/2021 12:00:00 AM,Cyberattack,,,FPI Management,,1022,Business,Real Estate,Unique Private Key (e.g. used to authenticate or sign an electronic record),2021,"1,000-9,999",Unknown
10436,08/14/2020 12:00:00 AM,04/02/2021 12:00:00 AM,Cyberattack,,,FPI Management,,1022,Business,Real Estate,Medical Information,2021,"1,000-9,999",Unknown
10436,08/14/2020 12:00:00 AM,04/02/2021 12:00:00 AM,Cyberattack,,,FPI Management,,1022,Business,Real Estate,Username and Password/Security Question Answers,2021,"1,000-9,999",Unknown
10436,08/14/2020 12:00:00 AM,04/02/2021 12:00:00 AM,Cyberattack,,,FPI Management,,1022,Business,Real Estate,Other,2021,"1,000-9,999",Unknown
10437,01/07/2021 12:00:00 AM,04/02/2021 12:00:00 AM,Cyberattack,2020-03-01T00:00:00,2021-01-07T00:00:00,"Slate & Tell, LLC",Malware,624,Business,Accessories,Name,2021,500-999,300-399
10437,01/07/2021 12:00:00 AM,04/02/2021 12:00:00 AM,Cyberattack,2020-03-01T00:00:00,2021-01-07T00:00:00,"Slate & Tell, LLC",Malware,624,Business,Accessories,Financial & Banking Information,2021,500-999,300-399
10437,01/07/2021 12:00:00 AM,04/02/2021 12:00:00 AM,Cyberattack,2020-03-01T00:00:00,2021-01-07T00:00:00,"Slate & Tell, LLC",Malware,624,Business,Accessories,Other,2021,500-999,300-399
10438,01/27/2021 12:00:00 AM,04/06/2021 12:00:00 AM,Cyberattack,2020-02-07T00:00:00,2020-05-20T00:00:00,Marines' Memorial Association & Foundation,Ransomware,2625,Non-Profit/Charity,,Full Date of Birth,2021,"1,000-9,999",300-399
10438,01/27/2021 12:00:00 AM,04/06/2021 12:00:00 AM,Cyberattack,2020-02-07T00:00:00,2020-05-20T00:00:00,Marines' Memorial Association & Foundation,Ransomware,2625,Non-Profit/Charity,,Military ID Number,2021,"1,000-9,999",300-399
10438,01/27/2021 12:00:00 AM,04/06/2021 12:00:00 AM,Cyberattack,2020-02-07T00:00:00,2020-05-20T00:00:00,Marines' Memorial Association & Foundation,Ransomware,2625,Non-Profit/Charity,,Health Insurance Policy or ID Number,2021,"1,000-9,999",300-399
10438,01/27/2021 12:00:00 AM,04/06/2021 12:00:00 AM,Cyberattack,2020-02-07T00:00:00,2020-05-20T00:00:00,Marines' Memorial Association & Foundation,Ransomware,2625,Non-Profit/Charity,,Medical Information,2021,"1,000-9,999",300-399
10438,01/27/2021 12:00:00 AM,04/06/2021 12:00:00 AM,Cyberattack,2020-02-07T00:00:00,2020-05-20T00:00:00,Marines' Memorial Association & Foundation,Ransomware,2625,Non-Profit/Charity,,Biometric Data,2021,"1,000-9,999",300-399
10438,01/27/2021 12:00:00 AM,04/06/2021 12:00:00 AM,Cyberattack,2020-02-07T00:00:00,2020-05-20T00:00:00,Marines' Memorial Association & Foundation,Ransomware,2625,Non-Profit/Charity,,Other,2021,"1,000-9,999",300-399
10438,01/27/2021 12:00:00 AM,04/06/2021 12:00:00 AM,Cyberattack,2020-02-07T00:00:00,2020-05-20T00:00:00,Marines' Memorial Association & Foundation,Ransomware,2625,Non-Profit/Charity,,Name,2021,"1,000-9,999",300-399
10438,01/27/2021 12:00:00 AM,04/06/2021 12:00:00 AM,Cyberattack,2020-02-07T00:00:00,2020-05-20T00:00:00,Marines' Memorial Association & Foundation,Ransomware,2625,Non-Profit/Charity,,Social Security Number,2021,"1,000-9,999",300-399
10438,01/27/2021 12:00:00 AM,04/06/2021 12:00:00 AM,Cyberattack,2020-02-07T00:00:00,2020-05-20T00:00:00,Marines' Memorial Association & Foundation,Ransomware,2625,Non-Profit/Charity,,Financial & Banking Information,2021,"1,000-9,999",300-399
10439,12/29/2020 12:00:00 AM,04/06/2021 12:00:00 AM,Cyberattack,2020-11-25T00:00:00,2020-12-25T00:00:00,"Minnetonka Moccasin Company, Inc.",Malware,821,Business,Accessories,Name,2021,500-999,1-99
10439,12/29/2020 12:00:00 AM,04/06/2021 12:00:00 AM,Cyberattack,2020-11-25T00:00:00,2020-12-25T00:00:00,"Minnetonka Moccasin Company, Inc.",Malware,821,Business,Accessories,Financial & Banking Information,2021,500-999,1-99
10440,07/01/2020 12:00:00 AM,04/06/2021 12:00:00 AM,Cyberattack,2020-05-26T00:00:00,2020-07-01T00:00:00,Portland State University Foundation,Phishing,4216,Non-Profit/Charity,,Name,2021,"1,000-9,999",1-99
10440,07/01/2020 12:00:00 AM,04/06/2021 12:00:00 AM,Cyberattack,2020-05-26T00:00:00,2020-07-01T00:00:00,Portland State University Foundation,Phishing,4216,Non-Profit/Charity,,Social Security Number,2021,"1,000-9,999",1-99
10440,07/01/2020 12:00:00 AM,04/06/2021 12:00:00 AM,Cyberattack,2020-05-26T00:00:00,2020-07-01T00:00:00,Portland State University Foundation,Phishing,4216,Non-Profit/Charity,,Full Date of Birth,2021,"1,000-9,999",1-99
10440,07/01/2020 12:00:00 AM,04/06/2021 12:00:00 AM,Cyberattack,2020-05-26T00:00:00,2020-07-01T00:00:00,Portland State University Foundation,Phishing,4216,Non-Profit/Charity,,Student ID Number,2021,"1,000-9,999",1-99
10440,07/01/2020 12:00:00 AM,04/06/2021 12:00:00 AM,Cyberattack,2020-05-26T00:00:00,2020-07-01T00:00:00,Portland State University Foundation,Phishing,4216,Non-Profit/Charity,,Other,2021,"1,000-9,999",1-99
10441,03/11/2021 12:00:00 AM,04/07/2021 12:00:00 AM,Cyberattack,2020-03-30T00:00:00,2020-11-06T00:00:00,American Society for Clinical Pathology,Malware,703,Health,,Name,2021,500-999,300-399
10441,03/11/2021 12:00:00 AM,04/07/2021 12:00:00 AM,Cyberattack,2020-03-30T00:00:00,2020-11-06T00:00:00,American Society for Clinical Pathology,Malware,703,Health,,Financial & Banking Information,2021,500-999,300-399
10442,11/24/2020 12:00:00 AM,04/08/2021 12:00:00 AM,Cyberattack,,,MailMyPrescriptions.com,Phishing,507,Health,,Name,2021,500-999,Unknown
10442,11/24/2020 12:00:00 AM,04/08/2021 12:00:00 AM,Cyberattack,,,MailMyPrescriptions.com,Phishing,507,Health,,Full Date of Birth,2021,500-999,Unknown
10442,11/24/2020 12:00:00 AM,04/08/2021 12:00:00 AM,Cyberattack,,,MailMyPrescriptions.com,Phishing,507,Health,,Health Insurance Policy or ID Number,2021,500-999,Unknown
10442,11/24/2020 12:00:00 AM,04/08/2021 12:00:00 AM,Cyberattack,,,MailMyPrescriptions.com,Phishing,507,Health,,Medical Information,2021,500-999,Unknown
10442,11/24/2020 12:00:00 AM,04/08/2021 12:00:00 AM,Cyberattack,,,MailMyPrescriptions.com,Phishing,507,Health,,Other,2021,500-999,Unknown
10443,11/08/2020 12:00:00 AM,04/08/2021 12:00:00 AM,Cyberattack,,,Nexelis Group,Ransomware,957,Health,,Name,2021,500-999,Unknown
10443,11/08/2020 12:00:00 AM,04/08/2021 12:00:00 AM,Cyberattack,,,Nexelis Group,Ransomware,957,Health,,Social Security Number,2021,500-999,Unknown
10443,11/08/2020 12:00:00 AM,04/08/2021 12:00:00 AM,Cyberattack,,,Nexelis Group,Ransomware,957,Health,,Driver's License or Washington ID Card Number,2021,500-999,Unknown
10443,11/08/2020 12:00:00 AM,04/08/2021 12:00:00 AM,Cyberattack,,,Nexelis Group,Ransomware,957,Health,,Email Address and Password/Security Question Answers,2021,500-999,Unknown
10443,11/08/2020 12:00:00 AM,04/08/2021 12:00:00 AM,Cyberattack,,,Nexelis Group,Ransomware,957,Health,,Financial & Banking Information,2021,500-999,Unknown
10443,11/08/2020 12:00:00 AM,04/08/2021 12:00:00 AM,Cyberattack,,,Nexelis Group,Ransomware,957,Health,,Full Date of Birth,2021,500-999,Unknown
10443,11/08/2020 12:00:00 AM,04/08/2021 12:00:00 AM,Cyberattack,,,Nexelis Group,Ransomware,957,Health,,Unique Private Key (e.g. used to authenticate or sign an electronic record),2021,500-999,Unknown
10443,11/08/2020 12:00:00 AM,04/08/2021 12:00:00 AM,Cyberattack,,,Nexelis Group,Ransomware,957,Health,,Passport Number,2021,500-999,Unknown
10443,11/08/2020 12:00:00 AM,04/08/2021 12:00:00 AM,Cyberattack,,,Nexelis Group,Ransomware,957,Health,,Health Insurance Policy or ID Number,2021,500-999,Unknown
10443,11/08/2020 12:00:00 AM,04/08/2021 12:00:00 AM,Cyberattack,,,Nexelis Group,Ransomware,957,Health,,Medical Information,2021,500-999,Unknown
10444,09/07/2020 12:00:00 AM,04/09/2021 12:00:00 AM,Cyberattack,2020-04-08T00:00:00,2020-09-21T00:00:00,American College of Emergency Physicians,,4148,Health,,Name,2021,"1,000-9,999",100-199
10444,09/07/2020 12:00:00 AM,04/09/2021 12:00:00 AM,Cyberattack,2020-04-08T00:00:00,2020-09-21T00:00:00,American College of Emergency Physicians,,4148,Health,,Social Security Number,2021,"1,000-9,999",100-199
10444,09/07/2020 12:00:00 AM,04/09/2021 12:00:00 AM,Cyberattack,2020-04-08T00:00:00,2020-09-21T00:00:00,American College of Emergency Physicians,,4148,Health,,Financial & Banking Information,2021,"1,000-9,999",100-199
10444,09/07/2020 12:00:00 AM,04/09/2021 12:00:00 AM,Cyberattack,2020-04-08T00:00:00,2020-09-21T00:00:00,American College of Emergency Physicians,,4148,Health,,Full Date of Birth,2021,"1,000-9,999",100-199
10444,09/07/2020 12:00:00 AM,04/09/2021 12:00:00 AM,Cyberattack,2020-04-08T00:00:00,2020-09-21T00:00:00,American College of Emergency Physicians,,4148,Health,,Username and Password/Security Question Answers,2021,"1,000-9,999",100-199
10444,09/07/2020 12:00:00 AM,04/09/2021 12:00:00 AM,Cyberattack,2020-04-08T00:00:00,2020-09-21T00:00:00,American College of Emergency Physicians,,4148,Health,,Email Address and Password/Security Question Answers,2021,"1,000-9,999",100-199
10444,09/07/2020 12:00:00 AM,04/09/2021 12:00:00 AM,Cyberattack,2020-04-08T00:00:00,2020-09-21T00:00:00,American College of Emergency Physicians,,4148,Health,,Other,2021,"1,000-9,999",100-199
10445,01/11/2021 12:00:00 AM,04/09/2021 12:00:00 AM,Cyberattack,,,"McDougall & Sons, Inc.",Ransomware,5885,Business,Other,Name,2021,"1,000-9,999",Unknown
10445,01/11/2021 12:00:00 AM,04/09/2021 12:00:00 AM,Cyberattack,,,"McDougall & Sons, Inc.",Ransomware,5885,Business,Other,Social Security Number,2021,"1,000-9,999",Unknown
10445,01/11/2021 12:00:00 AM,04/09/2021 12:00:00 AM,Cyberattack,,,"McDougall & Sons, Inc.",Ransomware,5885,Business,Other,Full Date of Birth,2021,"1,000-9,999",Unknown
10446,02/11/2021 12:00:00 AM,04/13/2021 12:00:00 AM,Cyberattack,,,FloForm Industries LLC,Ransomware,970,Business,Home,Name,2021,500-999,Unknown
10446,02/11/2021 12:00:00 AM,04/13/2021 12:00:00 AM,Cyberattack,,,FloForm Industries LLC,Ransomware,970,Business,Home,Social Security Number,2021,500-999,Unknown
10446,02/11/2021 12:00:00 AM,04/13/2021 12:00:00 AM,Cyberattack,,,FloForm Industries LLC,Ransomware,970,Business,Home,Other,2021,500-999,Unknown
10447,01/25/2021 12:00:00 AM,04/13/2021 12:00:00 AM,Cyberattack,2021-01-06T00:00:00,2021-01-25T00:00:00,University of Colorado,Malware,3511,Education,,Name,2021,"1,000-9,999",1-99
10447,01/25/2021 12:00:00 AM,04/13/2021 12:00:00 AM,Cyberattack,2021-01-06T00:00:00,2021-01-25T00:00:00,University of Colorado,Malware,3511,Education,,Full Date of Birth,2021,"1,000-9,999",1-99
10447,01/25/2021 12:00:00 AM,04/13/2021 12:00:00 AM,Cyberattack,2021-01-06T00:00:00,2021-01-25T00:00:00,University of Colorado,Malware,3511,Education,,Student ID Number,2021,"1,000-9,999",1-99
10447,01/25/2021 12:00:00 AM,04/13/2021 12:00:00 AM,Cyberattack,2021-01-06T00:00:00,2021-01-25T00:00:00,University of Colorado,Malware,3511,Education,,Health Insurance Policy or ID Number,2021,"1,000-9,999",1-99
10447,01/25/2021 12:00:00 AM,04/13/2021 12:00:00 AM,Cyberattack,2021-01-06T00:00:00,2021-01-25T00:00:00,University of Colorado,Malware,3511,Education,,Medical Information,2021,"1,000-9,999",1-99
10448,04/12/2021 12:00:00 AM,04/15/2021 12:00:00 AM,Cyberattack,2020-12-02T00:00:00,2020-12-10T00:00:00,"AmeriFirst Financial, Inc.",,757,Finance,,Name,2021,500-999,100-199
10448,04/12/2021 12:00:00 AM,04/15/2021 12:00:00 AM,Cyberattack,2020-12-02T00:00:00,2020-12-10T00:00:00,"AmeriFirst Financial, Inc.",,757,Finance,,Social Security Number,2021,500-999,100-199
10448,04/12/2021 12:00:00 AM,04/15/2021 12:00:00 AM,Cyberattack,2020-12-02T00:00:00,2020-12-10T00:00:00,"AmeriFirst Financial, Inc.",,757,Finance,,Driver's License or Washington ID Card Number,2021,500-999,100-199
10448,04/12/2021 12:00:00 AM,04/15/2021 12:00:00 AM,Cyberattack,2020-12-02T00:00:00,2020-12-10T00:00:00,"AmeriFirst Financial, Inc.",,757,Finance,,Financial & Banking Information,2021,500-999,100-199
10448,04/12/2021 12:00:00 AM,04/15/2021 12:00:00 AM,Cyberattack,2020-12-02T00:00:00,2020-12-10T00:00:00,"AmeriFirst Financial, Inc.",,757,Finance,,Full Date of Birth,2021,500-999,100-199
10448,04/12/2021 12:00:00 AM,04/15/2021 12:00:00 AM,Cyberattack,2020-12-02T00:00:00,2020-12-10T00:00:00,"AmeriFirst Financial, Inc.",,757,Finance,,Passport Number,2021,500-999,100-199
10449,03/18/2021 12:00:00 AM,04/19/2021 12:00:00 AM,Cyberattack,2021-01-07T00:00:00,2021-04-11T00:00:00,"Blade HQ, LLC",Malware,3090,Business,Retail,Name,2021,"1,000-9,999",1-99
10449,03/18/2021 12:00:00 AM,04/19/2021 12:00:00 AM,Cyberattack,2021-01-07T00:00:00,2021-04-11T00:00:00,"Blade HQ, LLC",Malware,3090,Business,Retail,Financial & Banking Information,2021,"1,000-9,999",1-99
10449,03/18/2021 12:00:00 AM,04/19/2021 12:00:00 AM,Cyberattack,2021-01-07T00:00:00,2021-04-11T00:00:00,"Blade HQ, LLC",Malware,3090,Business,Retail,Other,2021,"1,000-9,999",1-99
10450,03/30/2021 12:00:00 AM,04/26/2021 12:00:00 AM,Cyberattack,2021-03-06T00:00:00,2021-03-30T00:00:00,Seattle Police Officers' Guild,Malware,1297,Non-Profit/Charity,,Name,2021,"1,000-9,999",1-99
10450,03/30/2021 12:00:00 AM,04/26/2021 12:00:00 AM,Cyberattack,2021-03-06T00:00:00,2021-03-30T00:00:00,Seattle Police Officers' Guild,Malware,1297,Non-Profit/Charity,,Social Security Number,2021,"1,000-9,999",1-99
10450,03/30/2021 12:00:00 AM,04/26/2021 12:00:00 AM,Cyberattack,2021-03-06T00:00:00,2021-03-30T00:00:00,Seattle Police Officers' Guild,Malware,1297,Non-Profit/Charity,,Full Date of Birth,2021,"1,000-9,999",1-99
10450,03/30/2021 12:00:00 AM,04/26/2021 12:00:00 AM,Cyberattack,2021-03-06T00:00:00,2021-03-30T00:00:00,Seattle Police Officers' Guild,Malware,1297,Non-Profit/Charity,,Other,2021,"1,000-9,999",1-99
10451,04/17/2021 12:00:00 AM,04/28/2021 12:00:00 AM,Unauthorized Access,2015-09-17T00:00:00,2021-04-17T00:00:00,"ClearVoice Research.com, LLC",,21564,Business,Professional Services,Name,2021,"10,000-49,999",500+
10451,04/17/2021 12:00:00 AM,04/28/2021 12:00:00 AM,Unauthorized Access,2015-09-17T00:00:00,2021-04-17T00:00:00,"ClearVoice Research.com, LLC",,21564,Business,Professional Services,Full Date of Birth,2021,"10,000-49,999",500+
10451,04/17/2021 12:00:00 AM,04/28/2021 12:00:00 AM,Unauthorized Access,2015-09-17T00:00:00,2021-04-17T00:00:00,"ClearVoice Research.com, LLC",,21564,Business,Professional Services,Email Address and Password/Security Question Answers,2021,"10,000-49,999",500+
10451,04/17/2021 12:00:00 AM,04/28/2021 12:00:00 AM,Unauthorized Access,2015-09-17T00:00:00,2021-04-17T00:00:00,"ClearVoice Research.com, LLC",,21564,Business,Professional Services,Other,2021,"10,000-49,999",500+
10452,04/05/2021 12:00:00 AM,04/28/2021 12:00:00 AM,Cyberattack,2020-02-07T00:00:00,2020-05-20T00:00:00,Direct Relief,Ransomware,926,Non-Profit/Charity,,Name,2021,500-999,400-499
10452,04/05/2021 12:00:00 AM,04/28/2021 12:00:00 AM,Cyberattack,2020-02-07T00:00:00,2020-05-20T00:00:00,Direct Relief,Ransomware,926,Non-Profit/Charity,,Financial & Banking Information,2021,500-999,400-499
10452,04/05/2021 12:00:00 AM,04/28/2021 12:00:00 AM,Cyberattack,2020-02-07T00:00:00,2020-05-20T00:00:00,Direct Relief,Ransomware,926,Non-Profit/Charity,,Full Date of Birth,2021,500-999,400-499
10452,04/05/2021 12:00:00 AM,04/28/2021 12:00:00 AM,Cyberattack,2020-02-07T00:00:00,2020-05-20T00:00:00,Direct Relief,Ransomware,926,Non-Profit/Charity,,Other,2021,500-999,400-499
10453,02/27/2021 12:00:00 AM,04/29/2021 12:00:00 AM,Unauthorized Access,2021-02-27T00:00:00,,Insurance Technologies Corporation,,3925,Business,Software,Name,2021,"1,000-9,999",Unknown
10453,02/27/2021 12:00:00 AM,04/29/2021 12:00:00 AM,Unauthorized Access,2021-02-27T00:00:00,,Insurance Technologies Corporation,,3925,Business,Software,Social Security Number,2021,"1,000-9,999",Unknown
10453,02/27/2021 12:00:00 AM,04/29/2021 12:00:00 AM,Unauthorized Access,2021-02-27T00:00:00,,Insurance Technologies Corporation,,3925,Business,Software,Driver's License or Washington ID Card Number,2021,"1,000-9,999",Unknown
10453,02/27/2021 12:00:00 AM,04/29/2021 12:00:00 AM,Unauthorized Access,2021-02-27T00:00:00,,Insurance Technologies Corporation,,3925,Business,Software,Full Date of Birth,2021,"1,000-9,999",Unknown
10453,02/27/2021 12:00:00 AM,04/29/2021 12:00:00 AM,Unauthorized Access,2021-02-27T00:00:00,,Insurance Technologies Corporation,,3925,Business,Software,Username and Password/Security Question Answers,2021,"1,000-9,999",Unknown
10454,01/07/2021 12:00:00 AM,04/30/2021 12:00:00 AM,Cyberattack,2020-11-03T00:00:00,2020-12-07T00:00:00,Kettle Cuisine,Ransomware,950,Business,Consumable,Driver's License or Washington ID Card Number,2021,500-999,1-99
10454,01/07/2021 12:00:00 AM,04/30/2021 12:00:00 AM,Cyberattack,2020-11-03T00:00:00,2020-12-07T00:00:00,Kettle Cuisine,Ransomware,950,Business,Consumable,Full Date of Birth,2021,500-999,1-99
10454,01/07/2021 12:00:00 AM,04/30/2021 12:00:00 AM,Cyberattack,2020-11-03T00:00:00,2020-12-07T00:00:00,Kettle Cuisine,Ransomware,950,Business,Consumable,Health Insurance Policy or ID Number,2021,500-999,1-99
10454,01/07/2021 12:00:00 AM,04/30/2021 12:00:00 AM,Cyberattack,2020-11-03T00:00:00,2020-12-07T00:00:00,Kettle Cuisine,Ransomware,950,Business,Consumable,Name,2021,500-999,1-99
10454,01/07/2021 12:00:00 AM,04/30/2021 12:00:00 AM,Cyberattack,2020-11-03T00:00:00,2020-12-07T00:00:00,Kettle Cuisine,Ransomware,950,Business,Consumable,Social Security Number,2021,500-999,1-99
10456,02/03/2021 12:00:00 AM,05/04/2021 12:00:00 AM,Cyberattack,2021-01-27T00:00:00,2021-02-03T00:00:00,Inventors Hall of Fame,Phishing,685,Non-Profit/Charity,,Name,2021,500-999,1-99
10456,02/03/2021 12:00:00 AM,05/04/2021 12:00:00 AM,Cyberattack,2021-01-27T00:00:00,2021-02-03T00:00:00,Inventors Hall of Fame,Phishing,685,Non-Profit/Charity,,Social Security Number,2021,500-999,1-99
10456,02/03/2021 12:00:00 AM,05/04/2021 12:00:00 AM,Cyberattack,2021-01-27T00:00:00,2021-02-03T00:00:00,Inventors Hall of Fame,Phishing,685,Non-Profit/Charity,,Driver's License or Washington ID Card Number,2021,500-999,1-99
10456,02/03/2021 12:00:00 AM,05/04/2021 12:00:00 AM,Cyberattack,2021-01-27T00:00:00,2021-02-03T00:00:00,Inventors Hall of Fame,Phishing,685,Non-Profit/Charity,,Financial & Banking Information,2021,500-999,1-99
10456,02/03/2021 12:00:00 AM,05/04/2021 12:00:00 AM,Cyberattack,2021-01-27T00:00:00,2021-02-03T00:00:00,Inventors Hall of Fame,Phishing,685,Non-Profit/Charity,,Full Date of Birth,2021,500-999,1-99
10457,02/19/2021 12:00:00 AM,05/05/2021 12:00:00 AM,Unauthorized Access,2021-02-06T00:00:00,2021-02-06T00:00:00,NEC Networks dba CaptureRx,,126193,Health,,Name,2021,"50,000-999,999",1-99
10457,02/19/2021 12:00:00 AM,05/05/2021 12:00:00 AM,Unauthorized Access,2021-02-06T00:00:00,2021-02-06T00:00:00,NEC Networks dba CaptureRx,,126193,Health,,Full Date of Birth,2021,"50,000-999,999",1-99
10457,02/19/2021 12:00:00 AM,05/05/2021 12:00:00 AM,Unauthorized Access,2021-02-06T00:00:00,2021-02-06T00:00:00,NEC Networks dba CaptureRx,,126193,Health,,Medical Information,2021,"50,000-999,999",1-99
10458,01/20/2021 12:00:00 AM,05/05/2021 12:00:00 AM,Cyberattack,2020-08-21T00:00:00,2021-01-25T00:00:00,Timberland Regional Library,Phishing,26209,Government,,Name,2021,"10,000-49,999",100-199
10458,01/20/2021 12:00:00 AM,05/05/2021 12:00:00 AM,Cyberattack,2020-08-21T00:00:00,2021-01-25T00:00:00,Timberland Regional Library,Phishing,26209,Government,,Social Security Number,2021,"10,000-49,999",100-199
10458,01/20/2021 12:00:00 AM,05/05/2021 12:00:00 AM,Cyberattack,2020-08-21T00:00:00,2021-01-25T00:00:00,Timberland Regional Library,Phishing,26209,Government,,Driver's License or Washington ID Card Number,2021,"10,000-49,999",100-199
10458,01/20/2021 12:00:00 AM,05/05/2021 12:00:00 AM,Cyberattack,2020-08-21T00:00:00,2021-01-25T00:00:00,Timberland Regional Library,Phishing,26209,Government,,Full Date of Birth,2021,"10,000-49,999",100-199
10458,01/20/2021 12:00:00 AM,05/05/2021 12:00:00 AM,Cyberattack,2020-08-21T00:00:00,2021-01-25T00:00:00,Timberland Regional Library,Phishing,26209,Government,,Medical Information,2021,"10,000-49,999",100-199
10459,03/22/2021 12:00:00 AM,05/07/2021 12:00:00 AM,Cyberattack,2021-03-04T00:00:00,2021-03-22T00:00:00,"JHT Holdings, Inc.",Ransomware,511,Business,Transportation,Name,2021,500-999,1-99
10459,03/22/2021 12:00:00 AM,05/07/2021 12:00:00 AM,Cyberattack,2021-03-04T00:00:00,2021-03-22T00:00:00,"JHT Holdings, Inc.",Ransomware,511,Business,Transportation,Social Security Number,2021,500-999,1-99
10459,03/22/2021 12:00:00 AM,05/07/2021 12:00:00 AM,Cyberattack,2021-03-04T00:00:00,2021-03-22T00:00:00,"JHT Holdings, Inc.",Ransomware,511,Business,Transportation,Other,2021,500-999,1-99
10460,04/04/2021 12:00:00 AM,05/05/2021 12:00:00 AM,Unauthorized Access,2021-04-04T00:00:00,2021-04-04T00:00:00,SEIU 775 Benefits Group,,124760,Non-Profit/Charity,,Name,2021,"50,000-999,999",0
10460,04/04/2021 12:00:00 AM,05/05/2021 12:00:00 AM,Unauthorized Access,2021-04-04T00:00:00,2021-04-04T00:00:00,SEIU 775 Benefits Group,,124760,Non-Profit/Charity,,Social Security Number,2021,"50,000-999,999",0
10460,04/04/2021 12:00:00 AM,05/05/2021 12:00:00 AM,Unauthorized Access,2021-04-04T00:00:00,2021-04-04T00:00:00,SEIU 775 Benefits Group,,124760,Non-Profit/Charity,,Other,2021,"50,000-999,999",0
10462,08/13/2020 12:00:00 AM,05/07/2021 12:00:00 AM,Theft or Mistake,,,"Telmate, LLC",,4257,Business,Telecommunications,Name,2021,"1,000-9,999",Unknown
10462,08/13/2020 12:00:00 AM,05/07/2021 12:00:00 AM,Theft or Mistake,,,"Telmate, LLC",,4257,Business,Telecommunications,Username and Password/Security Question Answers,2021,"1,000-9,999",Unknown
10462,08/13/2020 12:00:00 AM,05/07/2021 12:00:00 AM,Theft or Mistake,,,"Telmate, LLC",,4257,Business,Telecommunications,Email Address and Password/Security Question Answers,2021,"1,000-9,999",Unknown
10462,08/13/2020 12:00:00 AM,05/07/2021 12:00:00 AM,Theft or Mistake,,,"Telmate, LLC",,4257,Business,Telecommunications,Social Security Number,2021,"1,000-9,999",Unknown
10462,08/13/2020 12:00:00 AM,05/07/2021 12:00:00 AM,Theft or Mistake,,,"Telmate, LLC",,4257,Business,Telecommunications,Driver's License or Washington ID Card Number,2021,"1,000-9,999",Unknown
10462,08/13/2020 12:00:00 AM,05/07/2021 12:00:00 AM,Theft or Mistake,,,"Telmate, LLC",,4257,Business,Telecommunications,Financial & Banking Information,2021,"1,000-9,999",Unknown
10462,08/13/2020 12:00:00 AM,05/07/2021 12:00:00 AM,Theft or Mistake,,,"Telmate, LLC",,4257,Business,Telecommunications,Full Date of Birth,2021,"1,000-9,999",Unknown
10462,08/13/2020 12:00:00 AM,05/07/2021 12:00:00 AM,Theft or Mistake,,,"Telmate, LLC",,4257,Business,Telecommunications,Health Insurance Policy or ID Number,2021,"1,000-9,999",Unknown
10462,08/13/2020 12:00:00 AM,05/07/2021 12:00:00 AM,Theft or Mistake,,,"Telmate, LLC",,4257,Business,Telecommunications,Medical Information,2021,"1,000-9,999",Unknown
10463,12/13/2020 12:00:00 AM,05/10/2021 12:00:00 AM,Cyberattack,2020-12-13T00:00:00,2020-12-13T00:00:00,"Aspen Education Group, Inc.",Malware,1958,Business,Other,Name,2021,"1,000-9,999",0
10463,12/13/2020 12:00:00 AM,05/10/2021 12:00:00 AM,Cyberattack,2020-12-13T00:00:00,2020-12-13T00:00:00,"Aspen Education Group, Inc.",Malware,1958,Business,Other,Social Security Number,2021,"1,000-9,999",0
10463,12/13/2020 12:00:00 AM,05/10/2021 12:00:00 AM,Cyberattack,2020-12-13T00:00:00,2020-12-13T00:00:00,"Aspen Education Group, Inc.",Malware,1958,Business,Other,Full Date of Birth,2021,"1,000-9,999",0
10463,12/13/2020 12:00:00 AM,05/10/2021 12:00:00 AM,Cyberattack,2020-12-13T00:00:00,2020-12-13T00:00:00,"Aspen Education Group, Inc.",Malware,1958,Business,Other,Health Insurance Policy or ID Number,2021,"1,000-9,999",0
10463,12/13/2020 12:00:00 AM,05/10/2021 12:00:00 AM,Cyberattack,2020-12-13T00:00:00,2020-12-13T00:00:00,"Aspen Education Group, Inc.",Malware,1958,Business,Other,Other,2021,"1,000-9,999",0
10464,01/28/2021 12:00:00 AM,05/10/2021 12:00:00 AM,Cyberattack,2020-11-01T00:00:00,2021-02-01T00:00:00,"Cougar Den, Inc.",Phishing,757,Business,Other,Name,2021,500-999,1-99
10464,01/28/2021 12:00:00 AM,05/10/2021 12:00:00 AM,Cyberattack,2020-11-01T00:00:00,2021-02-01T00:00:00,"Cougar Den, Inc.",Phishing,757,Business,Other,Social Security Number,2021,500-999,1-99
10464,01/28/2021 12:00:00 AM,05/10/2021 12:00:00 AM,Cyberattack,2020-11-01T00:00:00,2021-02-01T00:00:00,"Cougar Den, Inc.",Phishing,757,Business,Other,Driver's License or Washington ID Card Number,2021,500-999,1-99
10464,01/28/2021 12:00:00 AM,05/10/2021 12:00:00 AM,Cyberattack,2020-11-01T00:00:00,2021-02-01T00:00:00,"Cougar Den, Inc.",Phishing,757,Business,Other,Financial & Banking Information,2021,500-999,1-99
10464,01/28/2021 12:00:00 AM,05/10/2021 12:00:00 AM,Cyberattack,2020-11-01T00:00:00,2021-02-01T00:00:00,"Cougar Den, Inc.",Phishing,757,Business,Other,Full Date of Birth,2021,500-999,1-99
10464,01/28/2021 12:00:00 AM,05/10/2021 12:00:00 AM,Cyberattack,2020-11-01T00:00:00,2021-02-01T00:00:00,"Cougar Den, Inc.",Phishing,757,Business,Other,Passport Number,2021,500-999,1-99
10464,01/28/2021 12:00:00 AM,05/10/2021 12:00:00 AM,Cyberattack,2020-11-01T00:00:00,2021-02-01T00:00:00,"Cougar Den, Inc.",Phishing,757,Business,Other,Medical Information,2021,500-999,1-99
10464,01/28/2021 12:00:00 AM,05/10/2021 12:00:00 AM,Cyberattack,2020-11-01T00:00:00,2021-02-01T00:00:00,"Cougar Den, Inc.",Phishing,757,Business,Other,Biometric Data,2021,500-999,1-99
10464,01/28/2021 12:00:00 AM,05/10/2021 12:00:00 AM,Cyberattack,2020-11-01T00:00:00,2021-02-01T00:00:00,"Cougar Den, Inc.",Phishing,757,Business,Other,Username and Password/Security Question Answers,2021,500-999,1-99
10465,03/18/2021 12:00:00 AM,05/13/2021 12:00:00 AM,Cyberattack,2021-02-06T00:00:00,2021-03-19T00:00:00,"American Family Mutual Insurance Company, S.I.",Other,5246,Finance,,Name,2021,"1,000-9,999",1-99
10465,03/18/2021 12:00:00 AM,05/13/2021 12:00:00 AM,Cyberattack,2021-02-06T00:00:00,2021-03-19T00:00:00,"American Family Mutual Insurance Company, S.I.",Other,5246,Finance,,Driver's License or Washington ID Card Number,2021,"1,000-9,999",1-99
10467,02/16/2021 12:00:00 AM,05/19/2021 12:00:00 AM,Unauthorized Access,2021-01-21T00:00:00,2021-02-05T00:00:00,Rehoboth McKinley Christian Health Care Services,,1186,Health,,Name,2021,"1,000-9,999",1-99
10467,02/16/2021 12:00:00 AM,05/19/2021 12:00:00 AM,Unauthorized Access,2021-01-21T00:00:00,2021-02-05T00:00:00,Rehoboth McKinley Christian Health Care Services,,1186,Health,,Social Security Number,2021,"1,000-9,999",1-99
10467,02/16/2021 12:00:00 AM,05/19/2021 12:00:00 AM,Unauthorized Access,2021-01-21T00:00:00,2021-02-05T00:00:00,Rehoboth McKinley Christian Health Care Services,,1186,Health,,Driver's License or Washington ID Card Number,2021,"1,000-9,999",1-99
10467,02/16/2021 12:00:00 AM,05/19/2021 12:00:00 AM,Unauthorized Access,2021-01-21T00:00:00,2021-02-05T00:00:00,Rehoboth McKinley Christian Health Care Services,,1186,Health,,Financial & Banking Information,2021,"1,000-9,999",1-99
10467,02/16/2021 12:00:00 AM,05/19/2021 12:00:00 AM,Unauthorized Access,2021-01-21T00:00:00,2021-02-05T00:00:00,Rehoboth McKinley Christian Health Care Services,,1186,Health,,Full Date of Birth,2021,"1,000-9,999",1-99
10467,02/16/2021 12:00:00 AM,05/19/2021 12:00:00 AM,Unauthorized Access,2021-01-21T00:00:00,2021-02-05T00:00:00,Rehoboth McKinley Christian Health Care Services,,1186,Health,,Passport Number,2021,"1,000-9,999",1-99
10467,02/16/2021 12:00:00 AM,05/19/2021 12:00:00 AM,Unauthorized Access,2021-01-21T00:00:00,2021-02-05T00:00:00,Rehoboth McKinley Christian Health Care Services,,1186,Health,,Health Insurance Policy or ID Number,2021,"1,000-9,999",1-99
10467,02/16/2021 12:00:00 AM,05/19/2021 12:00:00 AM,Unauthorized Access,2021-01-21T00:00:00,2021-02-05T00:00:00,Rehoboth McKinley Christian Health Care Services,,1186,Health,,Medical Information,2021,"1,000-9,999",1-99
10467,02/16/2021 12:00:00 AM,05/19/2021 12:00:00 AM,Unauthorized Access,2021-01-21T00:00:00,2021-02-05T00:00:00,Rehoboth McKinley Christian Health Care Services,,1186,Health,,Other,2021,"1,000-9,999",1-99
10468,04/15/2021 12:00:00 AM,05/21/2021 12:00:00 AM,Cyberattack,,,"Defender Industries, Inc.",Malware,1208,Business,Retail,Name,2021,"1,000-9,999",Unknown
10468,04/15/2021 12:00:00 AM,05/21/2021 12:00:00 AM,Cyberattack,,,"Defender Industries, Inc.",Malware,1208,Business,Retail,Financial & Banking Information,2021,"1,000-9,999",Unknown
10468,04/15/2021 12:00:00 AM,05/21/2021 12:00:00 AM,Cyberattack,,,"Defender Industries, Inc.",Malware,1208,Business,Retail,Other,2021,"1,000-9,999",Unknown
10470,01/15/2021 12:00:00 AM,05/25/2021 12:00:00 AM,Cyberattack,2019-11-01T00:00:00,2020-09-03T00:00:00,"Sugarfina USA, LLC",Malware,1019,Business,Consumable,Name,2021,"1,000-9,999",400-499
10470,01/15/2021 12:00:00 AM,05/25/2021 12:00:00 AM,Cyberattack,2019-11-01T00:00:00,2020-09-03T00:00:00,"Sugarfina USA, LLC",Malware,1019,Business,Consumable,Financial & Banking Information,2021,"1,000-9,999",400-499
10470,01/15/2021 12:00:00 AM,05/25/2021 12:00:00 AM,Cyberattack,2019-11-01T00:00:00,2020-09-03T00:00:00,"Sugarfina USA, LLC",Malware,1019,Business,Consumable,Username and Password/Security Question Answers,2021,"1,000-9,999",400-499
10470,01/15/2021 12:00:00 AM,05/25/2021 12:00:00 AM,Cyberattack,2019-11-01T00:00:00,2020-09-03T00:00:00,"Sugarfina USA, LLC",Malware,1019,Business,Consumable,Other,2021,"1,000-9,999",400-499
10471,12/16/2020 12:00:00 AM,05/27/2021 12:00:00 AM,Cyberattack,2020-05-25T00:00:00,2020-12-16T00:00:00,Accucom Corporation,Malware,6829,Business,Professional Services,Name,2021,"1,000-9,999",200-299
10471,12/16/2020 12:00:00 AM,05/27/2021 12:00:00 AM,Cyberattack,2020-05-25T00:00:00,2020-12-16T00:00:00,Accucom Corporation,Malware,6829,Business,Professional Services,Financial & Banking Information,2021,"1,000-9,999",200-299
10471,12/16/2020 12:00:00 AM,05/27/2021 12:00:00 AM,Cyberattack,2020-05-25T00:00:00,2020-12-16T00:00:00,Accucom Corporation,Malware,6829,Business,Professional Services,Other,2021,"1,000-9,999",200-299
10472,01/11/2021 12:00:00 AM,05/28/2021 12:00:00 AM,Cyberattack,2021-01-11T00:00:00,2021-01-11T00:00:00,"20/20 Eye Care Network, Inc.",,690,Health,,Other,2021,500-999,0
10472,01/11/2021 12:00:00 AM,05/28/2021 12:00:00 AM,Cyberattack,2021-01-11T00:00:00,2021-01-11T00:00:00,"20/20 Eye Care Network, Inc.",,690,Health,,Name,2021,500-999,0
10472,01/11/2021 12:00:00 AM,05/28/2021 12:00:00 AM,Cyberattack,2021-01-11T00:00:00,2021-01-11T00:00:00,"20/20 Eye Care Network, Inc.",,690,Health,,Social Security Number,2021,500-999,0
10472,01/11/2021 12:00:00 AM,05/28/2021 12:00:00 AM,Cyberattack,2021-01-11T00:00:00,2021-01-11T00:00:00,"20/20 Eye Care Network, Inc.",,690,Health,,Full Date of Birth,2021,500-999,0
10472,01/11/2021 12:00:00 AM,05/28/2021 12:00:00 AM,Cyberattack,2021-01-11T00:00:00,2021-01-11T00:00:00,"20/20 Eye Care Network, Inc.",,690,Health,,Health Insurance Policy or ID Number,2021,500-999,0
10473,01/21/2021 12:00:00 AM,05/28/2021 12:00:00 AM,Unauthorized Access,2021-01-21T00:00:00,2021-01-23T00:00:00,"USA Waste-Management Resources, LLC",,6225,Business,Cleaning,Name,2021,"1,000-9,999",1-99
10473,01/21/2021 12:00:00 AM,05/28/2021 12:00:00 AM,Unauthorized Access,2021-01-21T00:00:00,2021-01-23T00:00:00,"USA Waste-Management Resources, LLC",,6225,Business,Cleaning,Social Security Number,2021,"1,000-9,999",1-99
10473,01/21/2021 12:00:00 AM,05/28/2021 12:00:00 AM,Unauthorized Access,2021-01-21T00:00:00,2021-01-23T00:00:00,"USA Waste-Management Resources, LLC",,6225,Business,Cleaning,Driver's License or Washington ID Card Number,2021,"1,000-9,999",1-99
10473,01/21/2021 12:00:00 AM,05/28/2021 12:00:00 AM,Unauthorized Access,2021-01-21T00:00:00,2021-01-23T00:00:00,"USA Waste-Management Resources, LLC",,6225,Business,Cleaning,Full Date of Birth,2021,"1,000-9,999",1-99
10473,01/21/2021 12:00:00 AM,05/28/2021 12:00:00 AM,Unauthorized Access,2021-01-21T00:00:00,2021-01-23T00:00:00,"USA Waste-Management Resources, LLC",,6225,Business,Cleaning,Other,2021,"1,000-9,999",1-99
10475,06/09/2021 12:00:00 AM,07/06/2021 12:00:00 AM,Theft or Mistake,2021-06-09T00:00:00,,UniBank,,11276,Finance,,Name,2021,"10,000-49,999",Unknown
10475,06/09/2021 12:00:00 AM,07/06/2021 12:00:00 AM,Theft or Mistake,2021-06-09T00:00:00,,UniBank,,11276,Finance,,Social Security Number,2021,"10,000-49,999",Unknown
10475,06/09/2021 12:00:00 AM,07/06/2021 12:00:00 AM,Theft or Mistake,2021-06-09T00:00:00,,UniBank,,11276,Finance,,Driver's License or Washington ID Card Number,2021,"10,000-49,999",Unknown
10476,03/21/2021 12:00:00 AM,07/08/2021 12:00:00 AM,Cyberattack,2021-03-05T00:00:00,2021-03-21T00:00:00,CNA Financial Corporation,Ransomware,823,Finance,,Name,2021,500-999,1-99
10476,03/21/2021 12:00:00 AM,07/08/2021 12:00:00 AM,Cyberattack,2021-03-05T00:00:00,2021-03-21T00:00:00,CNA Financial Corporation,Ransomware,823,Finance,,Social Security Number,2021,500-999,1-99
10476,03/21/2021 12:00:00 AM,07/08/2021 12:00:00 AM,Cyberattack,2021-03-05T00:00:00,2021-03-21T00:00:00,CNA Financial Corporation,Ransomware,823,Finance,,Full Date of Birth,2021,500-999,1-99
10476,03/21/2021 12:00:00 AM,07/08/2021 12:00:00 AM,Cyberattack,2021-03-05T00:00:00,2021-03-21T00:00:00,CNA Financial Corporation,Ransomware,823,Finance,,Medical Information,2021,500-999,1-99
10476,03/21/2021 12:00:00 AM,07/08/2021 12:00:00 AM,Cyberattack,2021-03-05T00:00:00,2021-03-21T00:00:00,CNA Financial Corporation,Ransomware,823,Finance,,Other,2021,500-999,1-99
10478,03/01/2021 12:00:00 AM,06/02/2021 12:00:00 AM,Cyberattack,2021-03-01T00:00:00,2021-03-01T00:00:00,"Asarco, LLC",Ransomware,670,Business,Other,Name,2021,500-999,0
10478,03/01/2021 12:00:00 AM,06/02/2021 12:00:00 AM,Cyberattack,2021-03-01T00:00:00,2021-03-01T00:00:00,"Asarco, LLC",Ransomware,670,Business,Other,Social Security Number,2021,500-999,0
10478,03/01/2021 12:00:00 AM,06/02/2021 12:00:00 AM,Cyberattack,2021-03-01T00:00:00,2021-03-01T00:00:00,"Asarco, LLC",Ransomware,670,Business,Other,Driver's License or Washington ID Card Number,2021,500-999,0
10478,03/01/2021 12:00:00 AM,06/02/2021 12:00:00 AM,Cyberattack,2021-03-01T00:00:00,2021-03-01T00:00:00,"Asarco, LLC",Ransomware,670,Business,Other,Financial & Banking Information,2021,500-999,0
10478,03/01/2021 12:00:00 AM,06/02/2021 12:00:00 AM,Cyberattack,2021-03-01T00:00:00,2021-03-01T00:00:00,"Asarco, LLC",Ransomware,670,Business,Other,Full Date of Birth,2021,500-999,0
10478,03/01/2021 12:00:00 AM,06/02/2021 12:00:00 AM,Cyberattack,2021-03-01T00:00:00,2021-03-01T00:00:00,"Asarco, LLC",Ransomware,670,Business,Other,Health Insurance Policy or ID Number,2021,500-999,0
10478,03/01/2021 12:00:00 AM,06/02/2021 12:00:00 AM,Cyberattack,2021-03-01T00:00:00,2021-03-01T00:00:00,"Asarco, LLC",Ransomware,670,Business,Other,Other,2021,500-999,0
10479,04/25/2021 12:00:00 AM,06/03/2021 12:00:00 AM,Cyberattack,2021-03-22T00:00:00,2021-04-21T00:00:00,Supplemental Income 401(k) Plan,Phishing,1085,Finance,,Name,2021,"1,000-9,999",1-99
10479,04/25/2021 12:00:00 AM,06/03/2021 12:00:00 AM,Cyberattack,2021-03-22T00:00:00,2021-04-21T00:00:00,Supplemental Income 401(k) Plan,Phishing,1085,Finance,,Social Security Number,2021,"1,000-9,999",1-99
10479,04/25/2021 12:00:00 AM,06/03/2021 12:00:00 AM,Cyberattack,2021-03-22T00:00:00,2021-04-21T00:00:00,Supplemental Income 401(k) Plan,Phishing,1085,Finance,,Full Date of Birth,2021,"1,000-9,999",1-99
10479,04/25/2021 12:00:00 AM,06/03/2021 12:00:00 AM,Cyberattack,2021-03-22T00:00:00,2021-04-21T00:00:00,Supplemental Income 401(k) Plan,Phishing,1085,Finance,,Other,2021,"1,000-9,999",1-99
10480,05/07/2021 12:00:00 AM,06/04/2021 12:00:00 AM,Theft or Mistake,2021-05-07T00:00:00,,"Pediatrix Cardiology of Washington, P.C. d/b/a NorthWest Congenital Heart Care",,1136,Health,,Name,2021,"1,000-9,999",Unknown
10480,05/07/2021 12:00:00 AM,06/04/2021 12:00:00 AM,Theft or Mistake,2021-05-07T00:00:00,,"Pediatrix Cardiology of Washington, P.C. d/b/a NorthWest Congenital Heart Care",,1136,Health,,Full Date of Birth,2021,"1,000-9,999",Unknown
10480,05/07/2021 12:00:00 AM,06/04/2021 12:00:00 AM,Theft or Mistake,2021-05-07T00:00:00,,"Pediatrix Cardiology of Washington, P.C. d/b/a NorthWest Congenital Heart Care",,1136,Health,,Health Insurance Policy or ID Number,2021,"1,000-9,999",Unknown
10480,05/07/2021 12:00:00 AM,06/04/2021 12:00:00 AM,Theft or Mistake,2021-05-07T00:00:00,,"Pediatrix Cardiology of Washington, P.C. d/b/a NorthWest Congenital Heart Care",,1136,Health,,Medical Information,2021,"1,000-9,999",Unknown
10480,05/07/2021 12:00:00 AM,06/04/2021 12:00:00 AM,Theft or Mistake,2021-05-07T00:00:00,,"Pediatrix Cardiology of Washington, P.C. d/b/a NorthWest Congenital Heart Care",,1136,Health,,Other,2021,"1,000-9,999",Unknown
10490,06/04/2021 12:00:00 AM,06/24/2021 12:00:00 AM,Cyberattack,,,Washington State Department of Labor & Industries,,16466,Government,,Name,2021,"10,000-49,999",Unknown
10490,06/04/2021 12:00:00 AM,06/24/2021 12:00:00 AM,Cyberattack,,,Washington State Department of Labor & Industries,,16466,Government,,Full Date of Birth,2021,"10,000-49,999",Unknown
10490,06/04/2021 12:00:00 AM,06/24/2021 12:00:00 AM,Cyberattack,,,Washington State Department of Labor & Industries,,16466,Government,,Other,2021,"10,000-49,999",Unknown
10484,05/20/2021 12:00:00 AM,06/16/2021 12:00:00 AM,Cyberattack,2020-02-07T00:00:00,2020-05-20T00:00:00,Buffalo State College Foundation,Ransomware,536,Non-Profit/Charity,,Name,2021,500-999,400-499
10484,05/20/2021 12:00:00 AM,06/16/2021 12:00:00 AM,Cyberattack,2020-02-07T00:00:00,2020-05-20T00:00:00,Buffalo State College Foundation,Ransomware,536,Non-Profit/Charity,,Full Date of Birth,2021,500-999,400-499
10485,04/07/2021 12:00:00 AM,06/18/2021 12:00:00 AM,Cyberattack,2020-08-16T00:00:00,2021-04-29T00:00:00,"Herff Jones, LLC",Malware,17316,Business,Retail,Name,2021,"10,000-49,999",200-299
10485,04/07/2021 12:00:00 AM,06/18/2021 12:00:00 AM,Cyberattack,2020-08-16T00:00:00,2021-04-29T00:00:00,"Herff Jones, LLC",Malware,17316,Business,Retail,Financial & Banking Information,2021,"10,000-49,999",200-299
10485,04/07/2021 12:00:00 AM,06/18/2021 12:00:00 AM,Cyberattack,2020-08-16T00:00:00,2021-04-29T00:00:00,"Herff Jones, LLC",Malware,17316,Business,Retail,Other,2021,"10,000-49,999",200-299
10486,05/19/2021 12:00:00 AM,06/18/2021 12:00:00 AM,Unauthorized Access,2021-05-17T00:00:00,2021-05-19T00:00:00,"Maximus, Inc.",,2560,Business,Professional Services,Name,2021,"1,000-9,999",1-99
10486,05/19/2021 12:00:00 AM,06/18/2021 12:00:00 AM,Unauthorized Access,2021-05-17T00:00:00,2021-05-19T00:00:00,"Maximus, Inc.",,2560,Business,Professional Services,Social Security Number,2021,"1,000-9,999",1-99
10486,05/19/2021 12:00:00 AM,06/18/2021 12:00:00 AM,Unauthorized Access,2021-05-17T00:00:00,2021-05-19T00:00:00,"Maximus, Inc.",,2560,Business,Professional Services,Full Date of Birth,2021,"1,000-9,999",1-99
10486,05/19/2021 12:00:00 AM,06/18/2021 12:00:00 AM,Unauthorized Access,2021-05-17T00:00:00,2021-05-19T00:00:00,"Maximus, Inc.",,2560,Business,Professional Services,Other,2021,"1,000-9,999",1-99
10488,02/12/2021 12:00:00 AM,06/22/2021 12:00:00 AM,Cyberattack,,,Royal Caribbean Group,Phishing,502,Business,Hospitality,Other,2021,500-999,Unknown
10488,02/12/2021 12:00:00 AM,06/22/2021 12:00:00 AM,Cyberattack,,,Royal Caribbean Group,Phishing,502,Business,Hospitality,Name,2021,500-999,Unknown
10488,02/12/2021 12:00:00 AM,06/22/2021 12:00:00 AM,Cyberattack,,,Royal Caribbean Group,Phishing,502,Business,Hospitality,Driver's License or Washington ID Card Number,2021,500-999,Unknown
10488,02/12/2021 12:00:00 AM,06/22/2021 12:00:00 AM,Cyberattack,,,Royal Caribbean Group,Phishing,502,Business,Hospitality,Financial & Banking Information,2021,500-999,Unknown
10488,02/12/2021 12:00:00 AM,06/22/2021 12:00:00 AM,Cyberattack,,,Royal Caribbean Group,Phishing,502,Business,Hospitality,Full Date of Birth,2021,500-999,Unknown
10488,02/12/2021 12:00:00 AM,06/22/2021 12:00:00 AM,Cyberattack,,,Royal Caribbean Group,Phishing,502,Business,Hospitality,Passport Number,2021,500-999,Unknown
10489,05/03/2021 12:00:00 AM,06/23/2021 12:00:00 AM,Cyberattack,2020-05-21T00:00:00,2021-05-03T00:00:00,"Asset Marketing Services, LLC d/b/a GovMint.com",Malware,1332,Business,Retail,Name,2021,"1,000-9,999",300-399
10489,05/03/2021 12:00:00 AM,06/23/2021 12:00:00 AM,Cyberattack,2020-05-21T00:00:00,2021-05-03T00:00:00,"Asset Marketing Services, LLC d/b/a GovMint.com",Malware,1332,Business,Retail,Financial & Banking Information,2021,"1,000-9,999",300-399
10489,05/03/2021 12:00:00 AM,06/23/2021 12:00:00 AM,Cyberattack,2020-05-21T00:00:00,2021-05-03T00:00:00,"Asset Marketing Services, LLC d/b/a GovMint.com",Malware,1332,Business,Retail,Other,2021,"1,000-9,999",300-399
10491,04/26/2021 12:00:00 AM,06/28/2021 12:00:00 AM,Cyberattack,2021-04-25T00:00:00,,"Ankle and Foot Physicians and Surgeons, PLLC",Ransomware,4996,Health,,Name,2021,"1,000-9,999",Unknown
10491,04/26/2021 12:00:00 AM,06/28/2021 12:00:00 AM,Cyberattack,2021-04-25T00:00:00,,"Ankle and Foot Physicians and Surgeons, PLLC",Ransomware,4996,Health,,Social Security Number,2021,"1,000-9,999",Unknown
10491,04/26/2021 12:00:00 AM,06/28/2021 12:00:00 AM,Cyberattack,2021-04-25T00:00:00,,"Ankle and Foot Physicians and Surgeons, PLLC",Ransomware,4996,Health,,Full Date of Birth,2021,"1,000-9,999",Unknown
10491,04/26/2021 12:00:00 AM,06/28/2021 12:00:00 AM,Cyberattack,2021-04-25T00:00:00,,"Ankle and Foot Physicians and Surgeons, PLLC",Ransomware,4996,Health,,Other,2021,"1,000-9,999",Unknown
10492,04/26/2021 12:00:00 AM,06/30/2021 12:00:00 AM,Cyberattack,2021-04-22T00:00:00,2021-04-30T00:00:00,Marsh McLennan,Other,2550,Finance,,Name,2021,"1,000-9,999",1-99
10492,04/26/2021 12:00:00 AM,06/30/2021 12:00:00 AM,Cyberattack,2021-04-22T00:00:00,2021-04-30T00:00:00,Marsh McLennan,Other,2550,Finance,,Social Security Number,2021,"1,000-9,999",1-99
10492,04/26/2021 12:00:00 AM,06/30/2021 12:00:00 AM,Cyberattack,2021-04-22T00:00:00,2021-04-30T00:00:00,Marsh McLennan,Other,2550,Finance,,Driver's License or Washington ID Card Number,2021,"1,000-9,999",1-99
10492,04/26/2021 12:00:00 AM,06/30/2021 12:00:00 AM,Cyberattack,2021-04-22T00:00:00,2021-04-30T00:00:00,Marsh McLennan,Other,2550,Finance,,Passport Number,2021,"1,000-9,999",1-99
10492,04/26/2021 12:00:00 AM,06/30/2021 12:00:00 AM,Cyberattack,2021-04-22T00:00:00,2021-04-30T00:00:00,Marsh McLennan,Other,2550,Finance,,Health Insurance Policy or ID Number,2021,"1,000-9,999",1-99
10492,04/26/2021 12:00:00 AM,06/30/2021 12:00:00 AM,Cyberattack,2021-04-22T00:00:00,2021-04-30T00:00:00,Marsh McLennan,Other,2550,Finance,,Other,2021,"1,000-9,999",1-99
10493,01/01/2021 12:00:00 AM,07/01/2021 12:00:00 AM,Cyberattack,,2021-01-16T00:00:00,"Nevada Restaurant Services, Inc.",Malware,3241,Business,Professional Services,Name,2021,"1,000-9,999",Unknown
10493,01/01/2021 12:00:00 AM,07/01/2021 12:00:00 AM,Cyberattack,,2021-01-16T00:00:00,"Nevada Restaurant Services, Inc.",Malware,3241,Business,Professional Services,Social Security Number,2021,"1,000-9,999",Unknown
10493,01/01/2021 12:00:00 AM,07/01/2021 12:00:00 AM,Cyberattack,,2021-01-16T00:00:00,"Nevada Restaurant Services, Inc.",Malware,3241,Business,Professional Services,Driver's License or Washington ID Card Number,2021,"1,000-9,999",Unknown
10493,01/01/2021 12:00:00 AM,07/01/2021 12:00:00 AM,Cyberattack,,2021-01-16T00:00:00,"Nevada Restaurant Services, Inc.",Malware,3241,Business,Professional Services,Full Date of Birth,2021,"1,000-9,999",Unknown
10493,01/01/2021 12:00:00 AM,07/01/2021 12:00:00 AM,Cyberattack,,2021-01-16T00:00:00,"Nevada Restaurant Services, Inc.",Malware,3241,Business,Professional Services,Passport Number,2021,"1,000-9,999",Unknown
10493,01/01/2021 12:00:00 AM,07/01/2021 12:00:00 AM,Cyberattack,,2021-01-16T00:00:00,"Nevada Restaurant Services, Inc.",Malware,3241,Business,Professional Services,Health Insurance Policy or ID Number,2021,"1,000-9,999",Unknown
10494,05/20/2021 12:00:00 AM,07/02/2021 12:00:00 AM,Cyberattack,,,Morgan Stanley,Malware,2080,Finance,,Name,2021,"1,000-9,999",Unknown
10494,05/20/2021 12:00:00 AM,07/02/2021 12:00:00 AM,Cyberattack,,,Morgan Stanley,Malware,2080,Finance,,Social Security Number,2021,"1,000-9,999",Unknown
10494,05/20/2021 12:00:00 AM,07/02/2021 12:00:00 AM,Cyberattack,,,Morgan Stanley,Malware,2080,Finance,,Full Date of Birth,2021,"1,000-9,999",Unknown
10494,05/20/2021 12:00:00 AM,07/02/2021 12:00:00 AM,Cyberattack,,,Morgan Stanley,Malware,2080,Finance,,Other,2021,"1,000-9,999",Unknown
10570,,07/10/2020 12:00:00 AM,Unauthorized Access,,,Morgan Stanley,,401246,Finance,,Name,2020,"50,000-999,999",Unknown
10570,,07/10/2020 12:00:00 AM,Unauthorized Access,,,Morgan Stanley,,401246,Finance,,Social Security Number,2020,"50,000-999,999",Unknown
10570,,07/10/2020 12:00:00 AM,Unauthorized Access,,,Morgan Stanley,,401246,Finance,,Full Date of Birth,2020,"50,000-999,999",Unknown
10570,,07/10/2020 12:00:00 AM,Unauthorized Access,,,Morgan Stanley,,401246,Finance,,Passport Number,2020,"50,000-999,999",Unknown
10570,,07/10/2020 12:00:00 AM,Unauthorized Access,,,Morgan Stanley,,401246,Finance,,Other,2020,"50,000-999,999",Unknown
10495,10/12/2020 12:00:00 AM,07/02/2021 12:00:00 AM,Cyberattack,2020-10-08T00:00:00,2020-10-13T00:00:00,"The Paradies Shops, LLC",Ransomware,657,Business,Hospitality,Name,2021,500-999,1-99
10495,10/12/2020 12:00:00 AM,07/02/2021 12:00:00 AM,Cyberattack,2020-10-08T00:00:00,2020-10-13T00:00:00,"The Paradies Shops, LLC",Ransomware,657,Business,Hospitality,Financial & Banking Information,2021,500-999,1-99
10496,04/26/2021 12:00:00 AM,07/09/2021 12:00:00 AM,Cyberattack,2021-03-08T00:00:00,2021-04-26T00:00:00,"CSI Financial Services, LLC",Phishing,4255,Finance,,Name,2021,"1,000-9,999",1-99
10496,04/26/2021 12:00:00 AM,07/09/2021 12:00:00 AM,Cyberattack,2021-03-08T00:00:00,2021-04-26T00:00:00,"CSI Financial Services, LLC",Phishing,4255,Finance,,Social Security Number,2021,"1,000-9,999",1-99
10496,04/26/2021 12:00:00 AM,07/09/2021 12:00:00 AM,Cyberattack,2021-03-08T00:00:00,2021-04-26T00:00:00,"CSI Financial Services, LLC",Phishing,4255,Finance,,Driver's License or Washington ID Card Number,2021,"1,000-9,999",1-99
10496,04/26/2021 12:00:00 AM,07/09/2021 12:00:00 AM,Cyberattack,2021-03-08T00:00:00,2021-04-26T00:00:00,"CSI Financial Services, LLC",Phishing,4255,Finance,,Financial & Banking Information,2021,"1,000-9,999",1-99
10496,04/26/2021 12:00:00 AM,07/09/2021 12:00:00 AM,Cyberattack,2021-03-08T00:00:00,2021-04-26T00:00:00,"CSI Financial Services, LLC",Phishing,4255,Finance,,Full Date of Birth,2021,"1,000-9,999",1-99
10496,04/26/2021 12:00:00 AM,07/09/2021 12:00:00 AM,Cyberattack,2021-03-08T00:00:00,2021-04-26T00:00:00,"CSI Financial Services, LLC",Phishing,4255,Finance,,Health Insurance Policy or ID Number,2021,"1,000-9,999",1-99
10496,04/26/2021 12:00:00 AM,07/09/2021 12:00:00 AM,Cyberattack,2021-03-08T00:00:00,2021-04-26T00:00:00,"CSI Financial Services, LLC",Phishing,4255,Finance,,Other,2021,"1,000-9,999",1-99
10497,09/26/2020 12:00:00 AM,07/13/2021 12:00:00 AM,Cyberattack,2020-06-03T00:00:00,2020-09-26T00:00:00,Arthur J. Gallagher & Co.,Ransomware,72378,Finance,,Name,2021,"50,000-999,999",100-199
10497,09/26/2020 12:00:00 AM,07/13/2021 12:00:00 AM,Cyberattack,2020-06-03T00:00:00,2020-09-26T00:00:00,Arthur J. Gallagher & Co.,Ransomware,72378,Finance,,Social Security Number,2021,"50,000-999,999",100-199
10497,09/26/2020 12:00:00 AM,07/13/2021 12:00:00 AM,Cyberattack,2020-06-03T00:00:00,2020-09-26T00:00:00,Arthur J. Gallagher & Co.,Ransomware,72378,Finance,,Driver's License or Washington ID Card Number,2021,"50,000-999,999",100-199
10497,09/26/2020 12:00:00 AM,07/13/2021 12:00:00 AM,Cyberattack,2020-06-03T00:00:00,2020-09-26T00:00:00,Arthur J. Gallagher & Co.,Ransomware,72378,Finance,,Financial & Banking Information,2021,"50,000-999,999",100-199
10497,09/26/2020 12:00:00 AM,07/13/2021 12:00:00 AM,Cyberattack,2020-06-03T00:00:00,2020-09-26T00:00:00,Arthur J. Gallagher & Co.,Ransomware,72378,Finance,,Full Date of Birth,2021,"50,000-999,999",100-199
10497,09/26/2020 12:00:00 AM,07/13/2021 12:00:00 AM,Cyberattack,2020-06-03T00:00:00,2020-09-26T00:00:00,Arthur J. Gallagher & Co.,Ransomware,72378,Finance,,Health Insurance Policy or ID Number,2021,"50,000-999,999",100-199
10497,09/26/2020 12:00:00 AM,07/13/2021 12:00:00 AM,Cyberattack,2020-06-03T00:00:00,2020-09-26T00:00:00,Arthur J. Gallagher & Co.,Ransomware,72378,Finance,,Medical Information,2021,"50,000-999,999",100-199
10498,06/06/2017 12:00:00 AM,10/16/2017 12:00:00 AM,Cyberattack,2017-03-10T00:00:00,2017-06-07T00:00:00,Capital One Merchants (Spark Pay Online),Malware,1352,Business,Web Services,Name,2018,"1,000-9,999",1-99
10498,06/06/2017 12:00:00 AM,10/16/2017 12:00:00 AM,Cyberattack,2017-03-10T00:00:00,2017-06-07T00:00:00,Capital One Merchants (Spark Pay Online),Malware,1352,Business,Web Services,Financial & Banking Information,2018,"1,000-9,999",1-99
10498,06/06/2017 12:00:00 AM,10/16/2017 12:00:00 AM,Cyberattack,2017-03-10T00:00:00,2017-06-07T00:00:00,Capital One Merchants (Spark Pay Online),Malware,1352,Business,Web Services,Other,2018,"1,000-9,999",1-99
10500,05/15/2019 12:00:00 AM,07/24/2019 12:00:00 AM,Cyberattack,2019-03-21T00:00:00,,"Laboratory Medicine Consultants, LTD",,684,Health,,Name,2020,500-999,Unknown
10500,05/15/2019 12:00:00 AM,07/24/2019 12:00:00 AM,Cyberattack,2019-03-21T00:00:00,,"Laboratory Medicine Consultants, LTD",,684,Health,,Full Date of Birth,2020,500-999,Unknown
10500,05/15/2019 12:00:00 AM,07/24/2019 12:00:00 AM,Cyberattack,2019-03-21T00:00:00,,"Laboratory Medicine Consultants, LTD",,684,Health,,Medical Information,2020,500-999,Unknown
10500,05/15/2019 12:00:00 AM,07/24/2019 12:00:00 AM,Cyberattack,2019-03-21T00:00:00,,"Laboratory Medicine Consultants, LTD",,684,Health,,Other,2020,500-999,Unknown
10501,05/26/2019 12:00:00 AM,07/26/2019 12:00:00 AM,Cyberattack,2018-09-23T00:00:00,2019-07-16T00:00:00,Sark Technologies LLC,Malware,762,Business,Software,Name,2020,500-999,200-299
10501,05/26/2019 12:00:00 AM,07/26/2019 12:00:00 AM,Cyberattack,2018-09-23T00:00:00,2019-07-16T00:00:00,Sark Technologies LLC,Malware,762,Business,Software,Financial & Banking Information,2020,500-999,200-299
10501,05/26/2019 12:00:00 AM,07/26/2019 12:00:00 AM,Cyberattack,2018-09-23T00:00:00,2019-07-16T00:00:00,Sark Technologies LLC,Malware,762,Business,Software,Other,2020,500-999,200-299
10502,03/12/2019 12:00:00 AM,07/27/2019 12:00:00 AM,Cyberattack,2019-03-12T00:00:00,2019-05-29T00:00:00,Community Psychiatric Clinic,Other,6600,Health,,Medical Information,2020,"1,000-9,999",1-99
10502,03/12/2019 12:00:00 AM,07/27/2019 12:00:00 AM,Cyberattack,2019-03-12T00:00:00,2019-05-29T00:00:00,Community Psychiatric Clinic,Other,6600,Health,,Name,2020,"1,000-9,999",1-99
10502,03/12/2019 12:00:00 AM,07/27/2019 12:00:00 AM,Cyberattack,2019-03-12T00:00:00,2019-05-29T00:00:00,Community Psychiatric Clinic,Other,6600,Health,,Social Security Number,2020,"1,000-9,999",1-99
10502,03/12/2019 12:00:00 AM,07/27/2019 12:00:00 AM,Cyberattack,2019-03-12T00:00:00,2019-05-29T00:00:00,Community Psychiatric Clinic,Other,6600,Health,,Financial & Banking Information,2020,"1,000-9,999",1-99
10502,03/12/2019 12:00:00 AM,07/27/2019 12:00:00 AM,Cyberattack,2019-03-12T00:00:00,2019-05-29T00:00:00,Community Psychiatric Clinic,Other,6600,Health,,Full Date of Birth,2020,"1,000-9,999",1-99
10502,03/12/2019 12:00:00 AM,07/27/2019 12:00:00 AM,Cyberattack,2019-03-12T00:00:00,2019-05-29T00:00:00,Community Psychiatric Clinic,Other,6600,Health,,Health Insurance Policy or ID Number,2020,"1,000-9,999",1-99
10503,06/25/2019 12:00:00 AM,07/29/2019 12:00:00 AM,Cyberattack,2019-03-24T00:00:00,2019-06-27T00:00:00,"Trusted Tours & Attractions, LLC",Malware,706,Business,Entertainment,Name,2020,500-999,1-99
10503,06/25/2019 12:00:00 AM,07/29/2019 12:00:00 AM,Cyberattack,2019-03-24T00:00:00,2019-06-27T00:00:00,"Trusted Tours & Attractions, LLC",Malware,706,Business,Entertainment,Financial & Banking Information,2020,500-999,1-99
10503,06/25/2019 12:00:00 AM,07/29/2019 12:00:00 AM,Cyberattack,2019-03-24T00:00:00,2019-06-27T00:00:00,"Trusted Tours & Attractions, LLC",Malware,706,Business,Entertainment,Email Address and Password/Security Question Answers,2020,500-999,1-99
10503,06/25/2019 12:00:00 AM,07/29/2019 12:00:00 AM,Cyberattack,2019-03-24T00:00:00,2019-06-27T00:00:00,"Trusted Tours & Attractions, LLC",Malware,706,Business,Entertainment,Other,2020,500-999,1-99
10505,07/26/2019 12:00:00 AM,08/16/2019 12:00:00 AM,Theft or Mistake,2019-07-25T00:00:00,,Regence,,642,Health,,Name,2020,500-999,Unknown
10505,07/26/2019 12:00:00 AM,08/16/2019 12:00:00 AM,Theft or Mistake,2019-07-25T00:00:00,,Regence,,642,Health,,Social Security Number,2020,500-999,Unknown
10506,03/18/2019 12:00:00 AM,08/26/2019 12:00:00 AM,Cyberattack,2018-02-01T00:00:00,2018-10-10T00:00:00,"Creation Entertainment, Inc.",Malware,2467,Business,Entertainment,Name,2020,"1,000-9,999",400-499
10506,03/18/2019 12:00:00 AM,08/26/2019 12:00:00 AM,Cyberattack,2018-02-01T00:00:00,2018-10-10T00:00:00,"Creation Entertainment, Inc.",Malware,2467,Business,Entertainment,Financial & Banking Information,2020,"1,000-9,999",400-499
10507,08/06/2019 12:00:00 AM,09/04/2019 12:00:00 AM,Unauthorized Access,2019-02-19T00:00:00,2019-02-19T00:00:00,"CafePress, Inc.",,5863,Business,Accessories,Name,2020,"1,000-9,999",100-199
10507,08/06/2019 12:00:00 AM,09/04/2019 12:00:00 AM,Unauthorized Access,2019-02-19T00:00:00,2019-02-19T00:00:00,"CafePress, Inc.",,5863,Business,Accessories,Social Security Number,2020,"1,000-9,999",100-199
10507,08/06/2019 12:00:00 AM,09/04/2019 12:00:00 AM,Unauthorized Access,2019-02-19T00:00:00,2019-02-19T00:00:00,"CafePress, Inc.",,5863,Business,Accessories,Email Address and Password/Security Question Answers,2020,"1,000-9,999",100-199
10507,08/06/2019 12:00:00 AM,09/04/2019 12:00:00 AM,Unauthorized Access,2019-02-19T00:00:00,2019-02-19T00:00:00,"CafePress, Inc.",,5863,Business,Accessories,Other,2020,"1,000-9,999",100-199
10508,04/23/2019 12:00:00 AM,09/12/2019 12:00:00 AM,Cyberattack,2019-04-22T00:00:00,2019-04-23T00:00:00,Peoples Injury Network Northwest,Ransomware,12502,Health,,Name,2020,"10,000-49,999",1-99
10508,04/23/2019 12:00:00 AM,09/12/2019 12:00:00 AM,Cyberattack,2019-04-22T00:00:00,2019-04-23T00:00:00,Peoples Injury Network Northwest,Ransomware,12502,Health,,Driver's License or Washington ID Card Number,2020,"10,000-49,999",1-99
10508,04/23/2019 12:00:00 AM,09/12/2019 12:00:00 AM,Cyberattack,2019-04-22T00:00:00,2019-04-23T00:00:00,Peoples Injury Network Northwest,Ransomware,12502,Health,,Full Date of Birth,2020,"10,000-49,999",1-99
10508,04/23/2019 12:00:00 AM,09/12/2019 12:00:00 AM,Cyberattack,2019-04-22T00:00:00,2019-04-23T00:00:00,Peoples Injury Network Northwest,Ransomware,12502,Health,,Medical Information,2020,"10,000-49,999",1-99
10508,04/23/2019 12:00:00 AM,09/12/2019 12:00:00 AM,Cyberattack,2019-04-22T00:00:00,2019-04-23T00:00:00,Peoples Injury Network Northwest,Ransomware,12502,Health,,Other,2020,"10,000-49,999",1-99
10509,08/02/2019 12:00:00 AM,09/13/2019 12:00:00 AM,Cyberattack,2018-10-01T00:00:00,2019-07-02T00:00:00,Amateur Athletic Union,Malware,12200,Non-Profit/Charity,,Name,2020,"10,000-49,999",300-399
10509,08/02/2019 12:00:00 AM,09/13/2019 12:00:00 AM,Cyberattack,2018-10-01T00:00:00,2019-07-02T00:00:00,Amateur Athletic Union,Malware,12200,Non-Profit/Charity,,Financial & Banking Information,2020,"10,000-49,999",300-399
10509,08/02/2019 12:00:00 AM,09/13/2019 12:00:00 AM,Cyberattack,2018-10-01T00:00:00,2019-07-02T00:00:00,Amateur Athletic Union,Malware,12200,Non-Profit/Charity,,Other,2020,"10,000-49,999",300-399
10510,07/24/2019 12:00:00 AM,09/24/2019 12:00:00 AM,Cyberattack,,2019-07-24T00:00:00,"Majoris Health Systems, Inc.",Malware,516,Health,,Name,2020,500-999,Unknown
10510,07/24/2019 12:00:00 AM,09/24/2019 12:00:00 AM,Cyberattack,,2019-07-24T00:00:00,"Majoris Health Systems, Inc.",Malware,516,Health,,Social Security Number,2020,500-999,Unknown
10510,07/24/2019 12:00:00 AM,09/24/2019 12:00:00 AM,Cyberattack,,2019-07-24T00:00:00,"Majoris Health Systems, Inc.",Malware,516,Health,,Full Date of Birth,2020,500-999,Unknown
10510,07/24/2019 12:00:00 AM,09/24/2019 12:00:00 AM,Cyberattack,,2019-07-24T00:00:00,"Majoris Health Systems, Inc.",Malware,516,Health,,Other,2020,500-999,Unknown
10511,09/05/2019 12:00:00 AM,09/26/2019 12:00:00 AM,Unauthorized Access,2019-05-04T00:00:00,2019-05-04T00:00:00,DoorDash Inc,,2243,Business,Transportation,Name,2020,"1,000-9,999",100-199
10511,09/05/2019 12:00:00 AM,09/26/2019 12:00:00 AM,Unauthorized Access,2019-05-04T00:00:00,2019-05-04T00:00:00,DoorDash Inc,,2243,Business,Transportation,Driver's License or Washington ID Card Number,2020,"1,000-9,999",100-199
10511,09/05/2019 12:00:00 AM,09/26/2019 12:00:00 AM,Unauthorized Access,2019-05-04T00:00:00,2019-05-04T00:00:00,DoorDash Inc,,2243,Business,Transportation,Email Address and Password/Security Question Answers,2020,"1,000-9,999",100-199
10511,09/05/2019 12:00:00 AM,09/26/2019 12:00:00 AM,Unauthorized Access,2019-05-04T00:00:00,2019-05-04T00:00:00,DoorDash Inc,,2243,Business,Transportation,Other,2020,"1,000-9,999",100-199
10513,04/16/2019 12:00:00 AM,10/10/2019 12:00:00 AM,Cyberattack,2019-03-11T00:00:00,2019-05-07T00:00:00,Calibre CPA Group,,983,Finance,,Name,2020,500-999,1-99
10513,04/16/2019 12:00:00 AM,10/10/2019 12:00:00 AM,Cyberattack,2019-03-11T00:00:00,2019-05-07T00:00:00,Calibre CPA Group,,983,Finance,,Social Security Number,2020,500-999,1-99
10513,04/16/2019 12:00:00 AM,10/10/2019 12:00:00 AM,Cyberattack,2019-03-11T00:00:00,2019-05-07T00:00:00,Calibre CPA Group,,983,Finance,,Financial & Banking Information,2020,500-999,1-99
10514,06/01/2019 12:00:00 AM,10/15/2019 12:00:00 AM,Cyberattack,2018-09-01T00:00:00,2019-09-28T00:00:00,"Eye Buy Direct, Inc.",,17031,Business,Retail,Name,2020,"10,000-49,999",300-399
10514,06/01/2019 12:00:00 AM,10/15/2019 12:00:00 AM,Cyberattack,2018-09-01T00:00:00,2019-09-28T00:00:00,"Eye Buy Direct, Inc.",,17031,Business,Retail,Financial & Banking Information,2020,"10,000-49,999",300-399
10514,06/01/2019 12:00:00 AM,10/15/2019 12:00:00 AM,Cyberattack,2018-09-01T00:00:00,2019-09-28T00:00:00,"Eye Buy Direct, Inc.",,17031,Business,Retail,Medical Information,2020,"10,000-49,999",300-399
10514,06/01/2019 12:00:00 AM,10/15/2019 12:00:00 AM,Cyberattack,2018-09-01T00:00:00,2019-09-28T00:00:00,"Eye Buy Direct, Inc.",,17031,Business,Retail,Email Address and Password/Security Question Answers,2020,"10,000-49,999",300-399
10514,06/01/2019 12:00:00 AM,10/15/2019 12:00:00 AM,Cyberattack,2018-09-01T00:00:00,2019-09-28T00:00:00,"Eye Buy Direct, Inc.",,17031,Business,Retail,Other,2020,"10,000-49,999",300-399
10515,09/11/2019 12:00:00 AM,10/16/2019 12:00:00 AM,Cyberattack,,,"Neutraceutical Wellness, Inc",,518,Business,Cosmetic,Name,2020,500-999,Unknown
10515,09/11/2019 12:00:00 AM,10/16/2019 12:00:00 AM,Cyberattack,,,"Neutraceutical Wellness, Inc",,518,Business,Cosmetic,Financial & Banking Information,2020,500-999,Unknown
10515,09/11/2019 12:00:00 AM,10/16/2019 12:00:00 AM,Cyberattack,,,"Neutraceutical Wellness, Inc",,518,Business,Cosmetic,Other,2020,500-999,Unknown
10516,08/21/2019 12:00:00 AM,11/08/2019 12:00:00 AM,Cyberattack,2019-04-15T00:00:00,2019-10-25T00:00:00,First Aid Beauty Limited,Malware,663,Business,Cosmetic,Name,2020,500-999,100-199
10516,08/21/2019 12:00:00 AM,11/08/2019 12:00:00 AM,Cyberattack,2019-04-15T00:00:00,2019-10-25T00:00:00,First Aid Beauty Limited,Malware,663,Business,Cosmetic,Financial & Banking Information,2020,500-999,100-199
10516,08/21/2019 12:00:00 AM,11/08/2019 12:00:00 AM,Cyberattack,2019-04-15T00:00:00,2019-10-25T00:00:00,First Aid Beauty Limited,Malware,663,Business,Cosmetic,Email Address and Password/Security Question Answers,2020,500-999,100-199
10516,08/21/2019 12:00:00 AM,11/08/2019 12:00:00 AM,Cyberattack,2019-04-15T00:00:00,2019-10-25T00:00:00,First Aid Beauty Limited,Malware,663,Business,Cosmetic,Other,2020,500-999,100-199
10517,10/15/2019 12:00:00 AM,11/14/2019 12:00:00 AM,Cyberattack,2019-10-07T00:00:00,2019-10-15T00:00:00,Macy's Inc.,Malware,3810,Business,Retail,Name,2020,"1,000-9,999",1-99
10517,10/15/2019 12:00:00 AM,11/14/2019 12:00:00 AM,Cyberattack,2019-10-07T00:00:00,2019-10-15T00:00:00,Macy's Inc.,Malware,3810,Business,Retail,Financial & Banking Information,2020,"1,000-9,999",1-99
10517,10/15/2019 12:00:00 AM,11/14/2019 12:00:00 AM,Cyberattack,2019-10-07T00:00:00,2019-10-15T00:00:00,Macy's Inc.,Malware,3810,Business,Retail,Email Address and Password/Security Question Answers,2020,"1,000-9,999",1-99
10517,10/15/2019 12:00:00 AM,11/14/2019 12:00:00 AM,Cyberattack,2019-10-07T00:00:00,2019-10-15T00:00:00,Macy's Inc.,Malware,3810,Business,Retail,Other,2020,"1,000-9,999",1-99
10518,10/24/2019 12:00:00 AM,11/15/2019 12:00:00 AM,Cyberattack,2019-08-27T00:00:00,2019-10-28T00:00:00,City of Lacey,Malware,6209,Government,,Name,2020,"1,000-9,999",1-99
10518,10/24/2019 12:00:00 AM,11/15/2019 12:00:00 AM,Cyberattack,2019-08-27T00:00:00,2019-10-28T00:00:00,City of Lacey,Malware,6209,Government,,Financial & Banking Information,2020,"1,000-9,999",1-99
10530,12/18/2019 12:00:00 AM,01/20/2020 12:00:00 AM,Cyberattack,2019-09-29T00:00:00,2020-01-13T00:00:00,"The UPS Store, Inc.",Phishing,963,Business,Shipping,Social Security Number,2020,500-999,100-199
10530,12/18/2019 12:00:00 AM,01/20/2020 12:00:00 AM,Cyberattack,2019-09-29T00:00:00,2020-01-13T00:00:00,"The UPS Store, Inc.",Phishing,963,Business,Shipping,Driver's License or Washington ID Card Number,2020,500-999,100-199
10530,12/18/2019 12:00:00 AM,01/20/2020 12:00:00 AM,Cyberattack,2019-09-29T00:00:00,2020-01-13T00:00:00,"The UPS Store, Inc.",Phishing,963,Business,Shipping,Financial & Banking Information,2020,500-999,100-199
10530,12/18/2019 12:00:00 AM,01/20/2020 12:00:00 AM,Cyberattack,2019-09-29T00:00:00,2020-01-13T00:00:00,"The UPS Store, Inc.",Phishing,963,Business,Shipping,Medical Information,2020,500-999,100-199
10530,12/18/2019 12:00:00 AM,01/20/2020 12:00:00 AM,Cyberattack,2019-09-29T00:00:00,2020-01-13T00:00:00,"The UPS Store, Inc.",Phishing,963,Business,Shipping,Username and Password/Security Question Answers,2020,500-999,100-199
10530,12/18/2019 12:00:00 AM,01/20/2020 12:00:00 AM,Cyberattack,2019-09-29T00:00:00,2020-01-13T00:00:00,"The UPS Store, Inc.",Phishing,963,Business,Shipping,Email Address and Password/Security Question Answers,2020,500-999,100-199
10521,10/18/2019 12:00:00 AM,11/26/2019 12:00:00 AM,Cyberattack,2019-10-11T00:00:00,2019-10-22T00:00:00,"The UPS Store, Inc.",Phishing,506,Business,Shipping,Name,2020,500-999,1-99
10521,10/18/2019 12:00:00 AM,11/26/2019 12:00:00 AM,Cyberattack,2019-10-11T00:00:00,2019-10-22T00:00:00,"The UPS Store, Inc.",Phishing,506,Business,Shipping,Social Security Number,2020,500-999,1-99
10521,10/18/2019 12:00:00 AM,11/26/2019 12:00:00 AM,Cyberattack,2019-10-11T00:00:00,2019-10-22T00:00:00,"The UPS Store, Inc.",Phishing,506,Business,Shipping,Driver's License or Washington ID Card Number,2020,500-999,1-99
10521,10/18/2019 12:00:00 AM,11/26/2019 12:00:00 AM,Cyberattack,2019-10-11T00:00:00,2019-10-22T00:00:00,"The UPS Store, Inc.",Phishing,506,Business,Shipping,Financial & Banking Information,2020,500-999,1-99
10530,12/18/2019 12:00:00 AM,01/20/2020 12:00:00 AM,Cyberattack,2019-09-29T00:00:00,2020-01-13T00:00:00,"The UPS Store, Inc.",Phishing,963,Business,Shipping,Name,2020,500-999,100-199
10597,11/05/2018 12:00:00 AM,11/16/2018 12:00:00 AM,Cyberattack,2018-10-01T00:00:00,2018-10-31T00:00:00,Washington State Employees Credit Union,Skimmers,2560,Finance,,Name,2019,"1,000-9,999",1-99
10597,11/05/2018 12:00:00 AM,11/16/2018 12:00:00 AM,Cyberattack,2018-10-01T00:00:00,2018-10-31T00:00:00,Washington State Employees Credit Union,Skimmers,2560,Finance,,Financial & Banking Information,2019,"1,000-9,999",1-99
10523,11/12/2019 12:00:00 AM,11/29/2019 12:00:00 AM,Theft or Mistake,2015-06-01T00:00:00,2019-11-12T00:00:00,Choice Hotels International Inc.,,1684,Business,Hospitality,Name,2020,"1,000-9,999",500+
10523,11/12/2019 12:00:00 AM,11/29/2019 12:00:00 AM,Theft or Mistake,2015-06-01T00:00:00,2019-11-12T00:00:00,Choice Hotels International Inc.,,1684,Business,Hospitality,Financial & Banking Information,2020,"1,000-9,999",500+
10523,11/12/2019 12:00:00 AM,11/29/2019 12:00:00 AM,Theft or Mistake,2015-06-01T00:00:00,2019-11-12T00:00:00,Choice Hotels International Inc.,,1684,Business,Hospitality,Email Address and Password/Security Question Answers,2020,"1,000-9,999",500+
10523,11/12/2019 12:00:00 AM,11/29/2019 12:00:00 AM,Theft or Mistake,2015-06-01T00:00:00,2019-11-12T00:00:00,Choice Hotels International Inc.,,1684,Business,Hospitality,Other,2020,"1,000-9,999",500+
10525,08/19/2019 12:00:00 AM,12/19/2019 12:00:00 AM,Cyberattack,2019-08-16T00:00:00,2019-08-21T00:00:00,Vimly Benefits Solution,Phishing,91807,Business,Software,Name,2020,"50,000-999,999",1-99
10525,08/19/2019 12:00:00 AM,12/19/2019 12:00:00 AM,Cyberattack,2019-08-16T00:00:00,2019-08-21T00:00:00,Vimly Benefits Solution,Phishing,91807,Business,Software,Social Security Number,2020,"50,000-999,999",1-99
10525,08/19/2019 12:00:00 AM,12/19/2019 12:00:00 AM,Cyberattack,2019-08-16T00:00:00,2019-08-21T00:00:00,Vimly Benefits Solution,Phishing,91807,Business,Software,Full Date of Birth,2020,"50,000-999,999",1-99
10525,08/19/2019 12:00:00 AM,12/19/2019 12:00:00 AM,Cyberattack,2019-08-16T00:00:00,2019-08-21T00:00:00,Vimly Benefits Solution,Phishing,91807,Business,Software,Other,2020,"50,000-999,999",1-99
10526,11/22/2019 12:00:00 AM,12/31/2019 12:00:00 AM,Cyberattack,2019-01-18T00:00:00,2019-10-17T00:00:00,Landry's Inc.,Malware,,Business,Hospitality,Name,2020,Unknown,300-399
10526,11/22/2019 12:00:00 AM,12/31/2019 12:00:00 AM,Cyberattack,2019-01-18T00:00:00,2019-10-17T00:00:00,Landry's Inc.,Malware,,Business,Hospitality,Financial & Banking Information,2020,Unknown,300-399
10527,12/03/2019 12:00:00 AM,12/31/2019 12:00:00 AM,Cyberattack,2019-11-08T00:00:00,2019-12-05T00:00:00,Evolucion Innovations Inc. (evo.com),Malware,4899,Business,Retail,Name,2020,"1,000-9,999",1-99
10527,12/03/2019 12:00:00 AM,12/31/2019 12:00:00 AM,Cyberattack,2019-11-08T00:00:00,2019-12-05T00:00:00,Evolucion Innovations Inc. (evo.com),Malware,4899,Business,Retail,Financial & Banking Information,2020,"1,000-9,999",1-99
10527,12/03/2019 12:00:00 AM,12/31/2019 12:00:00 AM,Cyberattack,2019-11-08T00:00:00,2019-12-05T00:00:00,Evolucion Innovations Inc. (evo.com),Malware,4899,Business,Retail,Email Address and Password/Security Question Answers,2020,"1,000-9,999",1-99
10527,12/03/2019 12:00:00 AM,12/31/2019 12:00:00 AM,Cyberattack,2019-11-08T00:00:00,2019-12-05T00:00:00,Evolucion Innovations Inc. (evo.com),Malware,4899,Business,Retail,Other,2020,"1,000-9,999",1-99
10528,12/05/2019 12:00:00 AM,01/15/2020 12:00:00 AM,Cyberattack,2019-09-16T00:00:00,2019-11-11T00:00:00,"Hanna Andersson, LLC",Malware,8816,Business,Clothing,Name,2020,"1,000-9,999",1-99
10528,12/05/2019 12:00:00 AM,01/15/2020 12:00:00 AM,Cyberattack,2019-09-16T00:00:00,2019-11-11T00:00:00,"Hanna Andersson, LLC",Malware,8816,Business,Clothing,Financial & Banking Information,2020,"1,000-9,999",1-99
10528,12/05/2019 12:00:00 AM,01/15/2020 12:00:00 AM,Cyberattack,2019-09-16T00:00:00,2019-11-11T00:00:00,"Hanna Andersson, LLC",Malware,8816,Business,Clothing,Other,2020,"1,000-9,999",1-99
10531,12/26/2019 12:00:00 AM,01/24/2020 12:00:00 AM,Cyberattack,2019-12-26T00:00:00,2019-12-26T00:00:00,"Oostra Rouw & Associates, Inc. (ORA, Inc.)",Ransomware,2376,Finance,,Name,2020,"1,000-9,999",0
10531,12/26/2019 12:00:00 AM,01/24/2020 12:00:00 AM,Cyberattack,2019-12-26T00:00:00,2019-12-26T00:00:00,"Oostra Rouw & Associates, Inc. (ORA, Inc.)",Ransomware,2376,Finance,,Social Security Number,2020,"1,000-9,999",0
10531,12/26/2019 12:00:00 AM,01/24/2020 12:00:00 AM,Cyberattack,2019-12-26T00:00:00,2019-12-26T00:00:00,"Oostra Rouw & Associates, Inc. (ORA, Inc.)",Ransomware,2376,Finance,,Other,2020,"1,000-9,999",0
10532,08/24/2019 12:00:00 AM,02/14/2020 12:00:00 AM,Cyberattack,2019-07-09T00:00:00,2019-08-24T00:00:00,Aveanna Healthcare,,2444,Health,,Name,2020,"1,000-9,999",1-99
10532,08/24/2019 12:00:00 AM,02/14/2020 12:00:00 AM,Cyberattack,2019-07-09T00:00:00,2019-08-24T00:00:00,Aveanna Healthcare,,2444,Health,,Social Security Number,2020,"1,000-9,999",1-99
10532,08/24/2019 12:00:00 AM,02/14/2020 12:00:00 AM,Cyberattack,2019-07-09T00:00:00,2019-08-24T00:00:00,Aveanna Healthcare,,2444,Health,,Driver's License or Washington ID Card Number,2020,"1,000-9,999",1-99
10532,08/24/2019 12:00:00 AM,02/14/2020 12:00:00 AM,Cyberattack,2019-07-09T00:00:00,2019-08-24T00:00:00,Aveanna Healthcare,,2444,Health,,Financial & Banking Information,2020,"1,000-9,999",1-99
10533,09/01/2019 12:00:00 AM,02/14/2020 12:00:00 AM,Cyberattack,2019-08-19T00:00:00,2019-09-20T00:00:00,Smile Surfers,,532,Health,,Name,2020,500-999,1-99
10533,09/01/2019 12:00:00 AM,02/14/2020 12:00:00 AM,Cyberattack,2019-08-19T00:00:00,2019-09-20T00:00:00,Smile Surfers,,532,Health,,Driver's License or Washington ID Card Number,2020,500-999,1-99
10533,09/01/2019 12:00:00 AM,02/14/2020 12:00:00 AM,Cyberattack,2019-08-19T00:00:00,2019-09-20T00:00:00,Smile Surfers,,532,Health,,Financial & Banking Information,2020,500-999,1-99
10533,09/01/2019 12:00:00 AM,02/14/2020 12:00:00 AM,Cyberattack,2019-08-19T00:00:00,2019-09-20T00:00:00,Smile Surfers,,532,Health,,Full Date of Birth,2020,500-999,1-99
10533,09/01/2019 12:00:00 AM,02/14/2020 12:00:00 AM,Cyberattack,2019-08-19T00:00:00,2019-09-20T00:00:00,Smile Surfers,,532,Health,,Medical Information,2020,500-999,1-99
10533,09/01/2019 12:00:00 AM,02/14/2020 12:00:00 AM,Cyberattack,2019-08-19T00:00:00,2019-09-20T00:00:00,Smile Surfers,,532,Health,,Other,2020,500-999,1-99
10534,10/28/2019 12:00:00 AM,02/25/2020 12:00:00 AM,Unauthorized Access,2019-10-24T00:00:00,2019-10-28T00:00:00,AFTRA Retirement Fund,,8803,Non-Profit/Charity,,Name,2020,"1,000-9,999",1-99
10534,10/28/2019 12:00:00 AM,02/25/2020 12:00:00 AM,Unauthorized Access,2019-10-24T00:00:00,2019-10-28T00:00:00,AFTRA Retirement Fund,,8803,Non-Profit/Charity,,Social Security Number,2020,"1,000-9,999",1-99
10534,10/28/2019 12:00:00 AM,02/25/2020 12:00:00 AM,Unauthorized Access,2019-10-24T00:00:00,2019-10-28T00:00:00,AFTRA Retirement Fund,,8803,Non-Profit/Charity,,Financial & Banking Information,2020,"1,000-9,999",1-99
10534,10/28/2019 12:00:00 AM,02/25/2020 12:00:00 AM,Unauthorized Access,2019-10-24T00:00:00,2019-10-28T00:00:00,AFTRA Retirement Fund,,8803,Non-Profit/Charity,,Full Date of Birth,2020,"1,000-9,999",1-99
10534,10/28/2019 12:00:00 AM,02/25/2020 12:00:00 AM,Unauthorized Access,2019-10-24T00:00:00,2019-10-28T00:00:00,AFTRA Retirement Fund,,8803,Non-Profit/Charity,,Other,2020,"1,000-9,999",1-99
10535,01/27/2020 12:00:00 AM,02/27/2020 12:00:00 AM,Cyberattack,,,Railworks Corporation,Ransomware,1286,Business,Construction,Name,2020,"1,000-9,999",Unknown
10535,01/27/2020 12:00:00 AM,02/27/2020 12:00:00 AM,Cyberattack,,,Railworks Corporation,Ransomware,1286,Business,Construction,Social Security Number,2020,"1,000-9,999",Unknown
10535,01/27/2020 12:00:00 AM,02/27/2020 12:00:00 AM,Cyberattack,,,Railworks Corporation,Ransomware,1286,Business,Construction,Driver's License or Washington ID Card Number,2020,"1,000-9,999",Unknown
10535,01/27/2020 12:00:00 AM,02/27/2020 12:00:00 AM,Cyberattack,,,Railworks Corporation,Ransomware,1286,Business,Construction,Full Date of Birth,2020,"1,000-9,999",Unknown
10535,01/27/2020 12:00:00 AM,02/27/2020 12:00:00 AM,Cyberattack,,,Railworks Corporation,Ransomware,1286,Business,Construction,Other,2020,"1,000-9,999",Unknown
10538,12/05/2019 12:00:00 AM,03/10/2020 12:00:00 AM,Unauthorized Access,2019-12-03T00:00:00,2019-12-05T00:00:00,Wichita State University,,2649,Education,,Name,2020,"1,000-9,999",1-99
10538,12/05/2019 12:00:00 AM,03/10/2020 12:00:00 AM,Unauthorized Access,2019-12-03T00:00:00,2019-12-05T00:00:00,Wichita State University,,2649,Education,,Social Security Number,2020,"1,000-9,999",1-99
10538,12/05/2019 12:00:00 AM,03/10/2020 12:00:00 AM,Unauthorized Access,2019-12-03T00:00:00,2019-12-05T00:00:00,Wichita State University,,2649,Education,,Full Date of Birth,2020,"1,000-9,999",1-99
10538,12/05/2019 12:00:00 AM,03/10/2020 12:00:00 AM,Unauthorized Access,2019-12-03T00:00:00,2019-12-05T00:00:00,Wichita State University,,2649,Education,,Email Address and Password/Security Question Answers,2020,"1,000-9,999",1-99
10539,07/09/2019 12:00:00 AM,03/16/2020 12:00:00 AM,Unauthorized Access,,,"Avalon Health Care Management, Inc.",,1861,Health,,Name,2020,"1,000-9,999",Unknown
10539,07/09/2019 12:00:00 AM,03/16/2020 12:00:00 AM,Unauthorized Access,,,"Avalon Health Care Management, Inc.",,1861,Health,,Social Security Number,2020,"1,000-9,999",Unknown
10539,07/09/2019 12:00:00 AM,03/16/2020 12:00:00 AM,Unauthorized Access,,,"Avalon Health Care Management, Inc.",,1861,Health,,Medical Information,2020,"1,000-9,999",Unknown
10602,10/14/2018 12:00:00 AM,11/27/2018 12:00:00 AM,Theft or Mistake,2018-10-14T00:00:00,2018-10-14T00:00:00,Washington State Patrol,,1171,Government,,Name,2019,"1,000-9,999",0
10602,10/14/2018 12:00:00 AM,11/27/2018 12:00:00 AM,Theft or Mistake,2018-10-14T00:00:00,2018-10-14T00:00:00,Washington State Patrol,,1171,Government,,Social Security Number,2019,"1,000-9,999",0
10602,10/14/2018 12:00:00 AM,11/27/2018 12:00:00 AM,Theft or Mistake,2018-10-14T00:00:00,2018-10-14T00:00:00,Washington State Patrol,,1171,Government,,Driver's License or Washington ID Card Number,2019,"1,000-9,999",0
10544,01/22/2020 12:00:00 AM,04/17/2020 12:00:00 AM,Cyberattack,2020-01-22T00:00:00,2020-01-24T00:00:00,Ambry Genetics Corporation,Phishing,2152,Health,,Name,2020,"1,000-9,999",1-99
10544,01/22/2020 12:00:00 AM,04/17/2020 12:00:00 AM,Cyberattack,2020-01-22T00:00:00,2020-01-24T00:00:00,Ambry Genetics Corporation,Phishing,2152,Health,,Social Security Number,2020,"1,000-9,999",1-99
10544,01/22/2020 12:00:00 AM,04/17/2020 12:00:00 AM,Cyberattack,2020-01-22T00:00:00,2020-01-24T00:00:00,Ambry Genetics Corporation,Phishing,2152,Health,,Medical Information,2020,"1,000-9,999",1-99
10545,01/01/2020 12:00:00 AM,04/20/2020 12:00:00 AM,Cyberattack,2019-03-07T00:00:00,2020-02-13T00:00:00,"Kandy Pens, Inc.",Malware,1112,Business,Retail,Name,2020,"1,000-9,999",300-399
10545,01/01/2020 12:00:00 AM,04/20/2020 12:00:00 AM,Cyberattack,2019-03-07T00:00:00,2020-02-13T00:00:00,"Kandy Pens, Inc.",Malware,1112,Business,Retail,Financial & Banking Information,2020,"1,000-9,999",300-399
10546,10/08/2019 12:00:00 AM,04/20/2020 12:00:00 AM,Cyberattack,2019-09-07T00:00:00,2019-10-08T00:00:00,"Volusion, LLC",Malware,14111,Business,Web Services,Name,2020,"10,000-49,999",1-99
10546,10/08/2019 12:00:00 AM,04/20/2020 12:00:00 AM,Cyberattack,2019-09-07T00:00:00,2019-10-08T00:00:00,"Volusion, LLC",Malware,14111,Business,Web Services,Financial & Banking Information,2020,"10,000-49,999",1-99
10546,10/08/2019 12:00:00 AM,04/20/2020 12:00:00 AM,Cyberattack,2019-09-07T00:00:00,2019-10-08T00:00:00,"Volusion, LLC",Malware,14111,Business,Web Services,Email Address and Password/Security Question Answers,2020,"10,000-49,999",1-99
10546,10/08/2019 12:00:00 AM,04/20/2020 12:00:00 AM,Cyberattack,2019-09-07T00:00:00,2019-10-08T00:00:00,"Volusion, LLC",Malware,14111,Business,Web Services,Other,2020,"10,000-49,999",1-99
10547,01/06/2020 12:00:00 AM,05/07/2020 12:00:00 AM,Theft or Mistake,2019-11-23T00:00:00,2020-01-06T00:00:00,"Principal Financial Services, Inc.",,583,Finance,,Name,2020,500-999,1-99
10547,01/06/2020 12:00:00 AM,05/07/2020 12:00:00 AM,Theft or Mistake,2019-11-23T00:00:00,2020-01-06T00:00:00,"Principal Financial Services, Inc.",,583,Finance,,Social Security Number,2020,500-999,1-99
10547,01/06/2020 12:00:00 AM,05/07/2020 12:00:00 AM,Theft or Mistake,2019-11-23T00:00:00,2020-01-06T00:00:00,"Principal Financial Services, Inc.",,583,Finance,,Full Date of Birth,2020,500-999,1-99
10548,03/26/2020 12:00:00 AM,05/07/2020 12:00:00 AM,Unauthorized Access,2019-12-03T00:00:00,,Atria Wealth Solutions,,574,Finance,,Name,2020,500-999,Unknown
10548,03/26/2020 12:00:00 AM,05/07/2020 12:00:00 AM,Unauthorized Access,2019-12-03T00:00:00,,Atria Wealth Solutions,,574,Finance,,Social Security Number,2020,500-999,Unknown
10548,03/26/2020 12:00:00 AM,05/07/2020 12:00:00 AM,Unauthorized Access,2019-12-03T00:00:00,,Atria Wealth Solutions,,574,Finance,,Full Date of Birth,2020,500-999,Unknown
10549,04/11/2020 12:00:00 AM,05/11/2020 12:00:00 AM,Cyberattack,2020-04-06T00:00:00,2020-04-12T00:00:00,Magellan Health Inc.,Ransomware,5119,Health,,Social Security Number,2020,"1,000-9,999",1-99
10549,04/11/2020 12:00:00 AM,05/11/2020 12:00:00 AM,Cyberattack,2020-04-06T00:00:00,2020-04-12T00:00:00,Magellan Health Inc.,Ransomware,5119,Health,,Username and Password/Security Question Answers,2020,"1,000-9,999",1-99
10549,04/11/2020 12:00:00 AM,05/11/2020 12:00:00 AM,Cyberattack,2020-04-06T00:00:00,2020-04-12T00:00:00,Magellan Health Inc.,Ransomware,5119,Health,,Other,2020,"1,000-9,999",1-99
10549,04/11/2020 12:00:00 AM,05/11/2020 12:00:00 AM,Cyberattack,2020-04-06T00:00:00,2020-04-12T00:00:00,Magellan Health Inc.,Ransomware,5119,Health,,Name,2020,"1,000-9,999",1-99
10550,02/24/2020 12:00:00 AM,05/21/2020 12:00:00 AM,Unauthorized Access,,,Capital Accounting & Tax,,1277,Finance,,Name,2020,"1,000-9,999",Unknown
10550,02/24/2020 12:00:00 AM,05/21/2020 12:00:00 AM,Unauthorized Access,,,Capital Accounting & Tax,,1277,Finance,,Social Security Number,2020,"1,000-9,999",Unknown
10550,02/24/2020 12:00:00 AM,05/21/2020 12:00:00 AM,Unauthorized Access,,,Capital Accounting & Tax,,1277,Finance,,Financial & Banking Information,2020,"1,000-9,999",Unknown
10550,02/24/2020 12:00:00 AM,05/21/2020 12:00:00 AM,Unauthorized Access,,,Capital Accounting & Tax,,1277,Finance,,Full Date of Birth,2020,"1,000-9,999",Unknown
10550,02/24/2020 12:00:00 AM,05/21/2020 12:00:00 AM,Unauthorized Access,,,Capital Accounting & Tax,,1277,Finance,,Other,2020,"1,000-9,999",Unknown
10551,05/15/2020 12:00:00 AM,05/22/2020 12:00:00 AM,Cyberattack,,,"Mathway, LLC",,,Business,Other,Email Address and Password/Security Question Answers,2020,Unknown,Unknown
10552,04/28/2020 12:00:00 AM,05/27/2020 12:00:00 AM,Unauthorized Access,2019-10-30T00:00:00,2020-01-14T00:00:00,"Car Wash Partners, Inc.",,805,Business,Cleaning,Name,2020,500-999,100-199
10552,04/28/2020 12:00:00 AM,05/27/2020 12:00:00 AM,Unauthorized Access,2019-10-30T00:00:00,2020-01-14T00:00:00,"Car Wash Partners, Inc.",,805,Business,Cleaning,Social Security Number,2020,500-999,100-199
10552,04/28/2020 12:00:00 AM,05/27/2020 12:00:00 AM,Unauthorized Access,2019-10-30T00:00:00,2020-01-14T00:00:00,"Car Wash Partners, Inc.",,805,Business,Cleaning,Driver's License or Washington ID Card Number,2020,500-999,100-199
10552,04/28/2020 12:00:00 AM,05/27/2020 12:00:00 AM,Unauthorized Access,2019-10-30T00:00:00,2020-01-14T00:00:00,"Car Wash Partners, Inc.",,805,Business,Cleaning,Full Date of Birth,2020,500-999,100-199
10553,05/15/2020 12:00:00 AM,05/27/2020 12:00:00 AM,Unauthorized Access,2020-05-06T00:00:00,,"Minted, LLC",,68900,Business,Retail,Other,2020,"50,000-999,999",Unknown
10553,05/15/2020 12:00:00 AM,05/27/2020 12:00:00 AM,Unauthorized Access,2020-05-06T00:00:00,,"Minted, LLC",,68900,Business,Retail,Name,2020,"50,000-999,999",Unknown
10553,05/15/2020 12:00:00 AM,05/27/2020 12:00:00 AM,Unauthorized Access,2020-05-06T00:00:00,,"Minted, LLC",,68900,Business,Retail,Full Date of Birth,2020,"50,000-999,999",Unknown
10553,05/15/2020 12:00:00 AM,05/27/2020 12:00:00 AM,Unauthorized Access,2020-05-06T00:00:00,,"Minted, LLC",,68900,Business,Retail,Username and Password/Security Question Answers,2020,"50,000-999,999",Unknown
10553,05/15/2020 12:00:00 AM,05/27/2020 12:00:00 AM,Unauthorized Access,2020-05-06T00:00:00,,"Minted, LLC",,68900,Business,Retail,Email Address and Password/Security Question Answers,2020,"50,000-999,999",Unknown
10554,01/15/2020 12:00:00 AM,05/29/2020 12:00:00 AM,Unauthorized Access,2019-12-18T00:00:00,2019-12-18T00:00:00,Swedish Health Services,,12573,Health,,Name,2020,"10,000-49,999",1-99
10554,01/15/2020 12:00:00 AM,05/29/2020 12:00:00 AM,Unauthorized Access,2019-12-18T00:00:00,2019-12-18T00:00:00,Swedish Health Services,,12573,Health,,Social Security Number,2020,"10,000-49,999",1-99
10554,01/15/2020 12:00:00 AM,05/29/2020 12:00:00 AM,Unauthorized Access,2019-12-18T00:00:00,2019-12-18T00:00:00,Swedish Health Services,,12573,Health,,Full Date of Birth,2020,"10,000-49,999",1-99
10554,01/15/2020 12:00:00 AM,05/29/2020 12:00:00 AM,Unauthorized Access,2019-12-18T00:00:00,2019-12-18T00:00:00,Swedish Health Services,,12573,Health,,Email Address and Password/Security Question Answers,2020,"10,000-49,999",1-99
10554,01/15/2020 12:00:00 AM,05/29/2020 12:00:00 AM,Unauthorized Access,2019-12-18T00:00:00,2019-12-18T00:00:00,Swedish Health Services,,12573,Health,,Other,2020,"10,000-49,999",1-99
10555,12/26/2018 12:00:00 AM,06/03/2020 12:00:00 AM,Cyberattack,2016-11-11T00:00:00,2017-02-16T00:00:00,Bombas LLC,Malware,2313,Business,Clothing,Name,2020,"1,000-9,999",500+
10555,12/26/2018 12:00:00 AM,06/03/2020 12:00:00 AM,Cyberattack,2016-11-11T00:00:00,2017-02-16T00:00:00,Bombas LLC,Malware,2313,Business,Clothing,Financial & Banking Information,2020,"1,000-9,999",500+
10555,12/26/2018 12:00:00 AM,06/03/2020 12:00:00 AM,Cyberattack,2016-11-11T00:00:00,2017-02-16T00:00:00,Bombas LLC,Malware,2313,Business,Clothing,Other,2020,"1,000-9,999",500+
10556,05/11/2020 12:00:00 AM,06/10/2020 12:00:00 AM,Unauthorized Access,2020-01-12T00:00:00,2020-01-12T00:00:00,"Zoosk, Inc.",,115158,Business,Software,Name,2020,"50,000-999,999",100-199
10556,05/11/2020 12:00:00 AM,06/10/2020 12:00:00 AM,Unauthorized Access,2020-01-12T00:00:00,2020-01-12T00:00:00,"Zoosk, Inc.",,115158,Business,Software,Full Date of Birth,2020,"50,000-999,999",100-199
10556,05/11/2020 12:00:00 AM,06/10/2020 12:00:00 AM,Unauthorized Access,2020-01-12T00:00:00,2020-01-12T00:00:00,"Zoosk, Inc.",,115158,Business,Software,Username and Password/Security Question Answers,2020,"50,000-999,999",100-199
10556,05/11/2020 12:00:00 AM,06/10/2020 12:00:00 AM,Unauthorized Access,2020-01-12T00:00:00,2020-01-12T00:00:00,"Zoosk, Inc.",,115158,Business,Software,Email Address and Password/Security Question Answers,2020,"50,000-999,999",100-199
10556,05/11/2020 12:00:00 AM,06/10/2020 12:00:00 AM,Unauthorized Access,2020-01-12T00:00:00,2020-01-12T00:00:00,"Zoosk, Inc.",,115158,Business,Software,Other,2020,"50,000-999,999",100-199
10558,10/30/2018 12:00:00 AM,11/30/2018 12:00:00 AM,Cyberattack,2014-08-15T00:00:00,2018-09-15T00:00:00,Ontario Inc.,,540,Business,Retail,Name,2019,500-999,500+
10558,10/30/2018 12:00:00 AM,11/30/2018 12:00:00 AM,Cyberattack,2014-08-15T00:00:00,2018-09-15T00:00:00,Ontario Inc.,,540,Business,Retail,Financial & Banking Information,2019,500-999,500+
10559,03/04/2019 12:00:00 AM,04/05/2019 12:00:00 AM,Cyberattack,2018-10-29T00:00:00,2019-03-04T00:00:00,AeroGrow International Inc.,Malware,667,Business,Manufacturing,Name,2019,500-999,100-199
10559,03/04/2019 12:00:00 AM,04/05/2019 12:00:00 AM,Cyberattack,2018-10-29T00:00:00,2019-03-04T00:00:00,AeroGrow International Inc.,Malware,667,Business,Manufacturing,Financial & Banking Information,2019,500-999,100-199
10560,03/13/2019 12:00:00 AM,04/15/2019 12:00:00 AM,Cyberattack,2019-03-13T00:00:00,2019-03-13T00:00:00,Housing Authority of Thurston County,Ransomware,25357,Non-Profit/Charity,,Name,2019,"10,000-49,999",0
10560,03/13/2019 12:00:00 AM,04/15/2019 12:00:00 AM,Cyberattack,2019-03-13T00:00:00,2019-03-13T00:00:00,Housing Authority of Thurston County,Ransomware,25357,Non-Profit/Charity,,Social Security Number,2019,"10,000-49,999",0
10561,04/17/2020 12:00:00 AM,06/16/2020 12:00:00 AM,Unauthorized Access,2019-05-01T00:00:00,2019-11-30T00:00:00,Providence Health Plan,,3324,Health,,Name,2020,"1,000-9,999",300-399
10561,04/17/2020 12:00:00 AM,06/16/2020 12:00:00 AM,Unauthorized Access,2019-05-01T00:00:00,2019-11-30T00:00:00,Providence Health Plan,,3324,Health,,Full Date of Birth,2020,"1,000-9,999",300-399
10561,04/17/2020 12:00:00 AM,06/16/2020 12:00:00 AM,Unauthorized Access,2019-05-01T00:00:00,2019-11-30T00:00:00,Providence Health Plan,,3324,Health,,Other,2020,"1,000-9,999",300-399
10563,05/14/2020 12:00:00 AM,06/25/2020 12:00:00 AM,Unauthorized Access,2020-05-14T00:00:00,2020-05-14T00:00:00,"BlockFi, Inc.",,696,Business,Cryptocurrency,Name,2020,500-999,0
10563,05/14/2020 12:00:00 AM,06/25/2020 12:00:00 AM,Unauthorized Access,2020-05-14T00:00:00,2020-05-14T00:00:00,"BlockFi, Inc.",,696,Business,Cryptocurrency,Full Date of Birth,2020,500-999,0
10563,05/14/2020 12:00:00 AM,06/25/2020 12:00:00 AM,Unauthorized Access,2020-05-14T00:00:00,2020-05-14T00:00:00,"BlockFi, Inc.",,696,Business,Cryptocurrency,Email Address and Password/Security Question Answers,2020,500-999,0
10563,05/14/2020 12:00:00 AM,06/25/2020 12:00:00 AM,Unauthorized Access,2020-05-14T00:00:00,2020-05-14T00:00:00,"BlockFi, Inc.",,696,Business,Cryptocurrency,Other,2020,500-999,0
10564,06/06/2020 12:00:00 AM,07/06/2020 12:00:00 AM,Unauthorized Access,2020-06-06T00:00:00,2020-06-06T00:00:00,AARP.org,,1456,Non-Profit/Charity,,Name,2020,"1,000-9,999",0
10564,06/06/2020 12:00:00 AM,07/06/2020 12:00:00 AM,Unauthorized Access,2020-06-06T00:00:00,2020-06-06T00:00:00,AARP.org,,1456,Non-Profit/Charity,,Full Date of Birth,2020,"1,000-9,999",0
10564,06/06/2020 12:00:00 AM,07/06/2020 12:00:00 AM,Unauthorized Access,2020-06-06T00:00:00,2020-06-06T00:00:00,AARP.org,,1456,Non-Profit/Charity,,Other,2020,"1,000-9,999",0
10565,05/20/2020 12:00:00 AM,07/07/2020 12:00:00 AM,Cyberattack,,,Federal Home Loan Mortgage Corporation (Freddie Mac),Ransomware,596,Government,,Name,2020,500-999,Unknown
10565,05/20/2020 12:00:00 AM,07/07/2020 12:00:00 AM,Cyberattack,,,Federal Home Loan Mortgage Corporation (Freddie Mac),Ransomware,596,Government,,Social Security Number,2020,500-999,Unknown
10565,05/20/2020 12:00:00 AM,07/07/2020 12:00:00 AM,Cyberattack,,,Federal Home Loan Mortgage Corporation (Freddie Mac),Ransomware,596,Government,,Financial & Banking Information,2020,500-999,Unknown
10565,05/20/2020 12:00:00 AM,07/07/2020 12:00:00 AM,Cyberattack,,,Federal Home Loan Mortgage Corporation (Freddie Mac),Ransomware,596,Government,,Full Date of Birth,2020,500-999,Unknown
10565,05/20/2020 12:00:00 AM,07/07/2020 12:00:00 AM,Cyberattack,,,Federal Home Loan Mortgage Corporation (Freddie Mac),Ransomware,596,Government,,Other,2020,500-999,Unknown
10566,06/11/2020 12:00:00 AM,07/08/2020 12:00:00 AM,Cyberattack,2020-04-07T00:00:00,2020-06-12T00:00:00,"Claire's Stores, Inc.",Malware,1166,Business,Retail,Name,2020,"1,000-9,999",1-99
10566,06/11/2020 12:00:00 AM,07/08/2020 12:00:00 AM,Cyberattack,2020-04-07T00:00:00,2020-06-12T00:00:00,"Claire's Stores, Inc.",Malware,1166,Business,Retail,Financial & Banking Information,2020,"1,000-9,999",1-99
10566,06/11/2020 12:00:00 AM,07/08/2020 12:00:00 AM,Cyberattack,2020-04-07T00:00:00,2020-06-12T00:00:00,"Claire's Stores, Inc.",Malware,1166,Business,Retail,Email Address and Password/Security Question Answers,2020,"1,000-9,999",1-99
10566,06/11/2020 12:00:00 AM,07/08/2020 12:00:00 AM,Cyberattack,2020-04-07T00:00:00,2020-06-12T00:00:00,"Claire's Stores, Inc.",Malware,1166,Business,Retail,Other,2020,"1,000-9,999",1-99
10567,04/01/2020 12:00:00 AM,07/09/2020 12:00:00 AM,Cyberattack,2020-04-01T00:00:00,2020-06-30T00:00:00,Boeing Emlpoyees' Credit Union,Skimmers,4883,Finance,,Name,2020,"1,000-9,999",1-99
10567,04/01/2020 12:00:00 AM,07/09/2020 12:00:00 AM,Cyberattack,2020-04-01T00:00:00,2020-06-30T00:00:00,Boeing Emlpoyees' Credit Union,Skimmers,4883,Finance,,Financial & Banking Information,2020,"1,000-9,999",1-99
10568,06/10/2020 12:00:00 AM,07/09/2020 12:00:00 AM,Cyberattack,2020-05-24T00:00:00,2020-06-08T00:00:00,"Collabera, Inc.",Ransomware,,Business,Professional Services,Name,2020,Unknown,1-99
10568,06/10/2020 12:00:00 AM,07/09/2020 12:00:00 AM,Cyberattack,2020-05-24T00:00:00,2020-06-08T00:00:00,"Collabera, Inc.",Ransomware,,Business,Professional Services,Social Security Number,2020,Unknown,1-99
10568,06/10/2020 12:00:00 AM,07/09/2020 12:00:00 AM,Cyberattack,2020-05-24T00:00:00,2020-06-08T00:00:00,"Collabera, Inc.",Ransomware,,Business,Professional Services,Full Date of Birth,2020,Unknown,1-99
10568,06/10/2020 12:00:00 AM,07/09/2020 12:00:00 AM,Cyberattack,2020-05-24T00:00:00,2020-06-08T00:00:00,"Collabera, Inc.",Ransomware,,Business,Professional Services,Passport Number,2020,Unknown,1-99
10568,06/10/2020 12:00:00 AM,07/09/2020 12:00:00 AM,Cyberattack,2020-05-24T00:00:00,2020-06-08T00:00:00,"Collabera, Inc.",Ransomware,,Business,Professional Services,Other,2020,Unknown,1-99
10569,06/09/2020 12:00:00 AM,07/10/2020 12:00:00 AM,Unauthorized Access,2020-06-06T00:00:00,2020-06-10T00:00:00,"Fetch Rewards, Inc.",,128598,Business,Retail,Name,2020,"50,000-999,999",1-99
10569,06/09/2020 12:00:00 AM,07/10/2020 12:00:00 AM,Unauthorized Access,2020-06-06T00:00:00,2020-06-10T00:00:00,"Fetch Rewards, Inc.",,128598,Business,Retail,Full Date of Birth,2020,"50,000-999,999",1-99
10569,06/09/2020 12:00:00 AM,07/10/2020 12:00:00 AM,Unauthorized Access,2020-06-06T00:00:00,2020-06-10T00:00:00,"Fetch Rewards, Inc.",,128598,Business,Retail,Email Address and Password/Security Question Answers,2020,"50,000-999,999",1-99
10569,06/09/2020 12:00:00 AM,07/10/2020 12:00:00 AM,Unauthorized Access,2020-06-06T00:00:00,2020-06-10T00:00:00,"Fetch Rewards, Inc.",,128598,Business,Retail,Other,2020,"50,000-999,999",1-99
10571,,07/14/2020 12:00:00 AM,Cyberattack,2017-02-16T00:00:00,2020-05-20T00:00:00,"Merani Hospitality, Inc.",Skimmers,,Business,Hospitality,Name,2020,Unknown,Unknown
10571,,07/14/2020 12:00:00 AM,Cyberattack,2017-02-16T00:00:00,2020-05-20T00:00:00,"Merani Hospitality, Inc.",Skimmers,,Business,Hospitality,Financial & Banking Information,2020,Unknown,Unknown
10572,06/16/2020 12:00:00 AM,07/16/2020 12:00:00 AM,Unauthorized Access,2020-05-28T00:00:00,2020-06-02T00:00:00,"Gonzales, Gonzales, & Gonzales Immigration Law Offices",,1098,Business,Legal,Name,2020,"1,000-9,999",1-99
10572,06/16/2020 12:00:00 AM,07/16/2020 12:00:00 AM,Unauthorized Access,2020-05-28T00:00:00,2020-06-02T00:00:00,"Gonzales, Gonzales, & Gonzales Immigration Law Offices",,1098,Business,Legal,Social Security Number,2020,"1,000-9,999",1-99
10572,06/16/2020 12:00:00 AM,07/16/2020 12:00:00 AM,Unauthorized Access,2020-05-28T00:00:00,2020-06-02T00:00:00,"Gonzales, Gonzales, & Gonzales Immigration Law Offices",,1098,Business,Legal,Financial & Banking Information,2020,"1,000-9,999",1-99
10572,06/16/2020 12:00:00 AM,07/16/2020 12:00:00 AM,Unauthorized Access,2020-05-28T00:00:00,2020-06-02T00:00:00,"Gonzales, Gonzales, & Gonzales Immigration Law Offices",,1098,Business,Legal,Passport Number,2020,"1,000-9,999",1-99
10572,06/16/2020 12:00:00 AM,07/16/2020 12:00:00 AM,Unauthorized Access,2020-05-28T00:00:00,2020-06-02T00:00:00,"Gonzales, Gonzales, & Gonzales Immigration Law Offices",,1098,Business,Legal,Other,2020,"1,000-9,999",1-99
10573,05/01/2020 12:00:00 AM,07/21/2020 12:00:00 AM,Cyberattack,2020-02-11T00:00:00,,City Ministries,Phishing,533,Non-Profit/Charity,,Name,2020,500-999,Unknown
10573,05/01/2020 12:00:00 AM,07/21/2020 12:00:00 AM,Cyberattack,2020-02-11T00:00:00,,City Ministries,Phishing,533,Non-Profit/Charity,,Social Security Number,2020,500-999,Unknown
10573,05/01/2020 12:00:00 AM,07/21/2020 12:00:00 AM,Cyberattack,2020-02-11T00:00:00,,City Ministries,Phishing,533,Non-Profit/Charity,,Driver's License or Washington ID Card Number,2020,500-999,Unknown
10573,05/01/2020 12:00:00 AM,07/21/2020 12:00:00 AM,Cyberattack,2020-02-11T00:00:00,,City Ministries,Phishing,533,Non-Profit/Charity,,Financial & Banking Information,2020,500-999,Unknown
10573,05/01/2020 12:00:00 AM,07/21/2020 12:00:00 AM,Cyberattack,2020-02-11T00:00:00,,City Ministries,Phishing,533,Non-Profit/Charity,,Full Date of Birth,2020,500-999,Unknown
10573,05/01/2020 12:00:00 AM,07/21/2020 12:00:00 AM,Cyberattack,2020-02-11T00:00:00,,City Ministries,Phishing,533,Non-Profit/Charity,,Email Address and Password/Security Question Answers,2020,500-999,Unknown
10575,06/16/2018 12:00:00 AM,07/27/2018 12:00:00 AM,Cyberattack,2008-04-01T00:00:00,2009-01-01T00:00:00,Yale University,,1742,Education,,Other,2019,"1,000-9,999",500+
10575,06/16/2018 12:00:00 AM,07/27/2018 12:00:00 AM,Cyberattack,2008-04-01T00:00:00,2009-01-01T00:00:00,Yale University,,1742,Education,,Name,2019,"1,000-9,999",500+
10575,06/16/2018 12:00:00 AM,07/27/2018 12:00:00 AM,Cyberattack,2008-04-01T00:00:00,2009-01-01T00:00:00,Yale University,,1742,Education,,Social Security Number,2019,"1,000-9,999",500+
10575,06/16/2018 12:00:00 AM,07/27/2018 12:00:00 AM,Cyberattack,2008-04-01T00:00:00,2009-01-01T00:00:00,Yale University,,1742,Education,,Full Date of Birth,2019,"1,000-9,999",500+
10576,06/14/2018 12:00:00 AM,08/03/2018 12:00:00 AM,Cyberattack,2018-03-28T00:00:00,2018-04-13T00:00:00,Colorado Bankers Life Insurance Company,Phishing,956,Finance,,Name,2019,500-999,1-99
10576,06/14/2018 12:00:00 AM,08/03/2018 12:00:00 AM,Cyberattack,2018-03-28T00:00:00,2018-04-13T00:00:00,Colorado Bankers Life Insurance Company,Phishing,956,Finance,,Social Security Number,2019,500-999,1-99
10576,06/14/2018 12:00:00 AM,08/03/2018 12:00:00 AM,Cyberattack,2018-03-28T00:00:00,2018-04-13T00:00:00,Colorado Bankers Life Insurance Company,Phishing,956,Finance,,Financial & Banking Information,2019,500-999,1-99
10577,08/16/2018 12:00:00 AM,08/22/2018 12:00:00 AM,Cyberattack,2017-11-03T00:00:00,2018-01-02T00:00:00,Cheddar's Scratch Kitchen,,,Business,Hospitality,Name,2019,Unknown,200-299
10577,08/16/2018 12:00:00 AM,08/22/2018 12:00:00 AM,Cyberattack,2017-11-03T00:00:00,2018-01-02T00:00:00,Cheddar's Scratch Kitchen,,,Business,Hospitality,Financial & Banking Information,2019,Unknown,200-299
10578,06/01/2018 12:00:00 AM,08/29/2018 12:00:00 AM,Cyberattack,2016-06-01T00:00:00,2018-07-09T00:00:00,LILLEbaby,Malware,1557,Business,Accessories,Name,2019,"1,000-9,999",500+
10578,06/01/2018 12:00:00 AM,08/29/2018 12:00:00 AM,Cyberattack,2016-06-01T00:00:00,2018-07-09T00:00:00,LILLEbaby,Malware,1557,Business,Accessories,Financial & Banking Information,2019,"1,000-9,999",500+
10579,06/12/2018 12:00:00 AM,09/12/2018 12:00:00 AM,Unauthorized Access,,2018-06-12T00:00:00,Skagit Bancorp Inc.,,519,Finance,,Name,2019,500-999,Unknown
10579,06/12/2018 12:00:00 AM,09/12/2018 12:00:00 AM,Unauthorized Access,,2018-06-12T00:00:00,Skagit Bancorp Inc.,,519,Finance,,Social Security Number,2019,500-999,Unknown
10579,06/12/2018 12:00:00 AM,09/12/2018 12:00:00 AM,Unauthorized Access,,2018-06-12T00:00:00,Skagit Bancorp Inc.,,519,Finance,,Driver's License or Washington ID Card Number,2019,500-999,Unknown
10579,06/12/2018 12:00:00 AM,09/12/2018 12:00:00 AM,Unauthorized Access,,2018-06-12T00:00:00,Skagit Bancorp Inc.,,519,Finance,,Financial & Banking Information,2019,500-999,Unknown
10579,06/12/2018 12:00:00 AM,09/12/2018 12:00:00 AM,Unauthorized Access,,2018-06-12T00:00:00,Skagit Bancorp Inc.,,519,Finance,,Full Date of Birth,2019,500-999,Unknown
10579,06/12/2018 12:00:00 AM,09/12/2018 12:00:00 AM,Unauthorized Access,,2018-06-12T00:00:00,Skagit Bancorp Inc.,,519,Finance,,Username and Password/Security Question Answers,2019,500-999,Unknown
10579,06/12/2018 12:00:00 AM,09/12/2018 12:00:00 AM,Unauthorized Access,,2018-06-12T00:00:00,Skagit Bancorp Inc.,,519,Finance,,Other,2019,500-999,Unknown
10580,05/22/2018 12:00:00 AM,10/05/2018 12:00:00 AM,Unauthorized Access,2018-05-22T00:00:00,,Rebound Orthopedics & Neurosurgery,,1607,Health,,Name,2019,"1,000-9,999",Unknown
10580,05/22/2018 12:00:00 AM,10/05/2018 12:00:00 AM,Unauthorized Access,2018-05-22T00:00:00,,Rebound Orthopedics & Neurosurgery,,1607,Health,,Social Security Number,2019,"1,000-9,999",Unknown
10580,05/22/2018 12:00:00 AM,10/05/2018 12:00:00 AM,Unauthorized Access,2018-05-22T00:00:00,,Rebound Orthopedics & Neurosurgery,,1607,Health,,Driver's License or Washington ID Card Number,2019,"1,000-9,999",Unknown
10580,05/22/2018 12:00:00 AM,10/05/2018 12:00:00 AM,Unauthorized Access,2018-05-22T00:00:00,,Rebound Orthopedics & Neurosurgery,,1607,Health,,Financial & Banking Information,2019,"1,000-9,999",Unknown
10580,05/22/2018 12:00:00 AM,10/05/2018 12:00:00 AM,Unauthorized Access,2018-05-22T00:00:00,,Rebound Orthopedics & Neurosurgery,,1607,Health,,Full Date of Birth,2019,"1,000-9,999",Unknown
10580,05/22/2018 12:00:00 AM,10/05/2018 12:00:00 AM,Unauthorized Access,2018-05-22T00:00:00,,Rebound Orthopedics & Neurosurgery,,1607,Health,,Medical Information,2019,"1,000-9,999",Unknown
10582,06/13/2018 12:00:00 AM,10/18/2018 12:00:00 AM,Cyberattack,2018-06-05T00:00:00,2018-06-13T00:00:00,Renaissance Philanthropic Solutions Group,Phishing,609,Business,Professional Services,Name,2019,500-999,1-99
10582,06/13/2018 12:00:00 AM,10/18/2018 12:00:00 AM,Cyberattack,2018-06-05T00:00:00,2018-06-13T00:00:00,Renaissance Philanthropic Solutions Group,Phishing,609,Business,Professional Services,Social Security Number,2019,500-999,1-99
10582,06/13/2018 12:00:00 AM,10/18/2018 12:00:00 AM,Cyberattack,2018-06-05T00:00:00,2018-06-13T00:00:00,Renaissance Philanthropic Solutions Group,Phishing,609,Business,Professional Services,Driver's License or Washington ID Card Number,2019,500-999,1-99
10582,06/13/2018 12:00:00 AM,10/18/2018 12:00:00 AM,Cyberattack,2018-06-05T00:00:00,2018-06-13T00:00:00,Renaissance Philanthropic Solutions Group,Phishing,609,Business,Professional Services,Financial & Banking Information,2019,500-999,1-99
10582,06/13/2018 12:00:00 AM,10/18/2018 12:00:00 AM,Cyberattack,2018-06-05T00:00:00,2018-06-13T00:00:00,Renaissance Philanthropic Solutions Group,Phishing,609,Business,Professional Services,Other,2019,500-999,1-99
10583,09/12/2018 12:00:00 AM,10/22/2018 12:00:00 AM,Cyberattack,2018-08-26T00:00:00,2018-08-29T00:00:00,Challenger Sports Inc.,,516,Business,Clothing,Name,2019,500-999,1-99
10583,09/12/2018 12:00:00 AM,10/22/2018 12:00:00 AM,Cyberattack,2018-08-26T00:00:00,2018-08-29T00:00:00,Challenger Sports Inc.,,516,Business,Clothing,Financial & Banking Information,2019,500-999,1-99
10583,09/12/2018 12:00:00 AM,10/22/2018 12:00:00 AM,Cyberattack,2018-08-26T00:00:00,2018-08-29T00:00:00,Challenger Sports Inc.,,516,Business,Clothing,Other,2019,500-999,1-99
10584,10/01/2018 12:00:00 AM,10/25/2018 12:00:00 AM,Cyberattack,2017-07-07T00:00:00,2018-10-02T00:00:00,GS1 US Inc.,,2384,Non-Profit/Charity,,Name,2019,"1,000-9,999",400-499
10584,10/01/2018 12:00:00 AM,10/25/2018 12:00:00 AM,Cyberattack,2017-07-07T00:00:00,2018-10-02T00:00:00,GS1 US Inc.,,2384,Non-Profit/Charity,,Financial & Banking Information,2019,"1,000-9,999",400-499
10584,10/01/2018 12:00:00 AM,10/25/2018 12:00:00 AM,Cyberattack,2017-07-07T00:00:00,2018-10-02T00:00:00,GS1 US Inc.,,2384,Non-Profit/Charity,,Other,2019,"1,000-9,999",400-499
10587,10/09/2018 12:00:00 AM,11/05/2018 12:00:00 AM,Theft or Mistake,2018-10-09T00:00:00,2018-10-09T00:00:00,Nordstrom Inc.,,13442,Business,Retail,Name,2019,"10,000-49,999",0
10587,10/09/2018 12:00:00 AM,11/05/2018 12:00:00 AM,Theft or Mistake,2018-10-09T00:00:00,2018-10-09T00:00:00,Nordstrom Inc.,,13442,Business,Retail,Social Security Number,2019,"10,000-49,999",0
10587,10/09/2018 12:00:00 AM,11/05/2018 12:00:00 AM,Theft or Mistake,2018-10-09T00:00:00,2018-10-09T00:00:00,Nordstrom Inc.,,13442,Business,Retail,Financial & Banking Information,2019,"10,000-49,999",0
10587,10/09/2018 12:00:00 AM,11/05/2018 12:00:00 AM,Theft or Mistake,2018-10-09T00:00:00,2018-10-09T00:00:00,Nordstrom Inc.,,13442,Business,Retail,Full Date of Birth,2019,"10,000-49,999",0
10587,10/09/2018 12:00:00 AM,11/05/2018 12:00:00 AM,Theft or Mistake,2018-10-09T00:00:00,2018-10-09T00:00:00,Nordstrom Inc.,,13442,Business,Retail,Other,2019,"10,000-49,999",0
10588,09/25/2018 12:00:00 AM,11/06/2018 12:00:00 AM,Cyberattack,2018-05-27T00:00:00,2018-08-13T00:00:00,"Southwest Washington Regional Surgery Center, LLC",Phishing,1690,Health,,Health Insurance Policy or ID Number,2019,"1,000-9,999",100-199
10588,09/25/2018 12:00:00 AM,11/06/2018 12:00:00 AM,Cyberattack,2018-05-27T00:00:00,2018-08-13T00:00:00,"Southwest Washington Regional Surgery Center, LLC",Phishing,1690,Health,,Medical Information,2019,"1,000-9,999",100-199
10588,09/25/2018 12:00:00 AM,11/06/2018 12:00:00 AM,Cyberattack,2018-05-27T00:00:00,2018-08-13T00:00:00,"Southwest Washington Regional Surgery Center, LLC",Phishing,1690,Health,,Name,2019,"1,000-9,999",100-199
10588,09/25/2018 12:00:00 AM,11/06/2018 12:00:00 AM,Cyberattack,2018-05-27T00:00:00,2018-08-13T00:00:00,"Southwest Washington Regional Surgery Center, LLC",Phishing,1690,Health,,Social Security Number,2019,"1,000-9,999",100-199
10588,09/25/2018 12:00:00 AM,11/06/2018 12:00:00 AM,Cyberattack,2018-05-27T00:00:00,2018-08-13T00:00:00,"Southwest Washington Regional Surgery Center, LLC",Phishing,1690,Health,,Driver's License or Washington ID Card Number,2019,"1,000-9,999",100-199
10588,09/25/2018 12:00:00 AM,11/06/2018 12:00:00 AM,Cyberattack,2018-05-27T00:00:00,2018-08-13T00:00:00,"Southwest Washington Regional Surgery Center, LLC",Phishing,1690,Health,,Financial & Banking Information,2019,"1,000-9,999",100-199
10588,09/25/2018 12:00:00 AM,11/06/2018 12:00:00 AM,Cyberattack,2018-05-27T00:00:00,2018-08-13T00:00:00,"Southwest Washington Regional Surgery Center, LLC",Phishing,1690,Health,,Full Date of Birth,2019,"1,000-9,999",100-199
10589,08/01/2018 12:00:00 AM,11/07/2018 12:00:00 AM,Unauthorized Access,2017-12-06T00:00:00,2018-02-25T00:00:00,"Unified Trust Company, N.A.",,1196,Finance,,Social Security Number,2019,"1,000-9,999",200-299
10589,08/01/2018 12:00:00 AM,11/07/2018 12:00:00 AM,Unauthorized Access,2017-12-06T00:00:00,2018-02-25T00:00:00,"Unified Trust Company, N.A.",,1196,Finance,,Financial & Banking Information,2019,"1,000-9,999",200-299
10589,08/01/2018 12:00:00 AM,11/07/2018 12:00:00 AM,Unauthorized Access,2017-12-06T00:00:00,2018-02-25T00:00:00,"Unified Trust Company, N.A.",,1196,Finance,,Other,2019,"1,000-9,999",200-299
10589,08/01/2018 12:00:00 AM,11/07/2018 12:00:00 AM,Unauthorized Access,2017-12-06T00:00:00,2018-02-25T00:00:00,"Unified Trust Company, N.A.",,1196,Finance,,Name,2019,"1,000-9,999",200-299
10590,09/20/2018 12:00:00 AM,11/09/2018 12:00:00 AM,Cyberattack,2017-12-06T00:00:00,2018-06-27T00:00:00,Thesy LLC,Malware,5907,Business,Retail,Name,2019,"1,000-9,999",200-299
10590,09/20/2018 12:00:00 AM,11/09/2018 12:00:00 AM,Cyberattack,2017-12-06T00:00:00,2018-06-27T00:00:00,Thesy LLC,Malware,5907,Business,Retail,Financial & Banking Information,2019,"1,000-9,999",200-299
10591,08/06/2018 12:00:00 AM,11/12/2018 12:00:00 AM,Cyberattack,2017-12-28T00:00:00,2018-07-09T00:00:00,"Title Nine Sports, Inc.",Malware,4837,Business,Clothing,Name,2019,"1,000-9,999",200-299
10591,08/06/2018 12:00:00 AM,11/12/2018 12:00:00 AM,Cyberattack,2017-12-28T00:00:00,2018-07-09T00:00:00,"Title Nine Sports, Inc.",Malware,4837,Business,Clothing,Financial & Banking Information,2019,"1,000-9,999",200-299
10591,08/06/2018 12:00:00 AM,11/12/2018 12:00:00 AM,Cyberattack,2017-12-28T00:00:00,2018-07-09T00:00:00,"Title Nine Sports, Inc.",Malware,4837,Business,Clothing,Other,2019,"1,000-9,999",200-299
10592,09/27/2018 12:00:00 AM,11/12/2018 12:00:00 AM,Unauthorized Access,,,Collier Heggerness & Bronk CPA's PS Inc.,,2194,Business,Professional Services,Name,2019,"1,000-9,999",Unknown
10592,09/27/2018 12:00:00 AM,11/12/2018 12:00:00 AM,Unauthorized Access,,,Collier Heggerness & Bronk CPA's PS Inc.,,2194,Business,Professional Services,Social Security Number,2019,"1,000-9,999",Unknown
10592,09/27/2018 12:00:00 AM,11/12/2018 12:00:00 AM,Unauthorized Access,,,Collier Heggerness & Bronk CPA's PS Inc.,,2194,Business,Professional Services,Driver's License or Washington ID Card Number,2019,"1,000-9,999",Unknown
10592,09/27/2018 12:00:00 AM,11/12/2018 12:00:00 AM,Unauthorized Access,,,Collier Heggerness & Bronk CPA's PS Inc.,,2194,Business,Professional Services,Financial & Banking Information,2019,"1,000-9,999",Unknown
10592,09/27/2018 12:00:00 AM,11/12/2018 12:00:00 AM,Unauthorized Access,,,Collier Heggerness & Bronk CPA's PS Inc.,,2194,Business,Professional Services,Other,2019,"1,000-9,999",Unknown
10593,08/06/2018 12:00:00 AM,11/13/2018 12:00:00 AM,Cyberattack,2017-12-28T00:00:00,2018-07-09T00:00:00,Stein Mart Inc.,Malware,680,Business,Retail,Name,2019,500-999,200-299
10593,08/06/2018 12:00:00 AM,11/13/2018 12:00:00 AM,Cyberattack,2017-12-28T00:00:00,2018-07-09T00:00:00,Stein Mart Inc.,Malware,680,Business,Retail,Financial & Banking Information,2019,500-999,200-299
10593,08/06/2018 12:00:00 AM,11/13/2018 12:00:00 AM,Cyberattack,2017-12-28T00:00:00,2018-07-09T00:00:00,Stein Mart Inc.,Malware,680,Business,Retail,Other,2019,500-999,200-299
10594,09/17/2018 12:00:00 AM,11/13/2018 12:00:00 AM,Unauthorized Access,2018-05-11T00:00:00,2018-07-06T00:00:00,"Pharmacy Times Office of Continuing Professional Education, LLC",,797,Education,,Name,2019,500-999,100-199
10594,09/17/2018 12:00:00 AM,11/13/2018 12:00:00 AM,Unauthorized Access,2018-05-11T00:00:00,2018-07-06T00:00:00,"Pharmacy Times Office of Continuing Professional Education, LLC",,797,Education,,Social Security Number,2019,500-999,100-199
10595,09/18/2018 12:00:00 AM,11/15/2018 12:00:00 AM,Cyberattack,2018-08-13T00:00:00,2018-09-19T00:00:00,Newegg Inc.,Malware,5931,Business,Retail,Name,2019,"1,000-9,999",1-99
10595,09/18/2018 12:00:00 AM,11/15/2018 12:00:00 AM,Cyberattack,2018-08-13T00:00:00,2018-09-19T00:00:00,Newegg Inc.,Malware,5931,Business,Retail,Financial & Banking Information,2019,"1,000-9,999",1-99
10595,09/18/2018 12:00:00 AM,11/15/2018 12:00:00 AM,Cyberattack,2018-08-13T00:00:00,2018-09-19T00:00:00,Newegg Inc.,Malware,5931,Business,Retail,Other,2019,"1,000-9,999",1-99
10596,10/05/2018 12:00:00 AM,11/15/2018 12:00:00 AM,Cyberattack,2018-09-04T00:00:00,2018-10-05T00:00:00,HealthEquity Inc.,Phishing,27175,Health,,Social Security Number,2019,"10,000-49,999",1-99
10596,10/05/2018 12:00:00 AM,11/15/2018 12:00:00 AM,Cyberattack,2018-09-04T00:00:00,2018-10-05T00:00:00,HealthEquity Inc.,Phishing,27175,Health,,Other,2019,"10,000-49,999",1-99
10596,10/05/2018 12:00:00 AM,11/15/2018 12:00:00 AM,Cyberattack,2018-09-04T00:00:00,2018-10-05T00:00:00,HealthEquity Inc.,Phishing,27175,Health,,Name,2019,"10,000-49,999",1-99
11099,08/05/2021 12:00:00 AM,09/30/2021 12:00:00 AM,Unauthorized Access,2021-07-26T00:00:00,2021-07-28T00:00:00,LPL Financial LLC,,992,Finance,,Medical Information,2022,500-999,1-99
11099,08/05/2021 12:00:00 AM,09/30/2021 12:00:00 AM,Unauthorized Access,2021-07-26T00:00:00,2021-07-28T00:00:00,LPL Financial LLC,,992,Finance,,Health Insurance Policy or ID Number,2022,500-999,1-99
11099,08/05/2021 12:00:00 AM,09/30/2021 12:00:00 AM,Unauthorized Access,2021-07-26T00:00:00,2021-07-28T00:00:00,LPL Financial LLC,,992,Finance,,Medical Information,2022,500-999,1-99
11099,08/05/2021 12:00:00 AM,09/30/2021 12:00:00 AM,Unauthorized Access,2021-07-26T00:00:00,2021-07-28T00:00:00,LPL Financial LLC,,992,Finance,,Name,2022,500-999,1-99
11099,08/05/2021 12:00:00 AM,09/30/2021 12:00:00 AM,Unauthorized Access,2021-07-26T00:00:00,2021-07-28T00:00:00,LPL Financial LLC,,992,Finance,,Social Security Number,2022,500-999,1-99
11099,08/05/2021 12:00:00 AM,09/30/2021 12:00:00 AM,Unauthorized Access,2021-07-26T00:00:00,2021-07-28T00:00:00,LPL Financial LLC,,992,Finance,,Financial & Banking Information,2022,500-999,1-99
11099,08/05/2021 12:00:00 AM,09/30/2021 12:00:00 AM,Unauthorized Access,2021-07-26T00:00:00,2021-07-28T00:00:00,LPL Financial LLC,,992,Finance,,Health Insurance Policy or ID Number,2022,500-999,1-99
10598,11/01/2018 12:00:00 AM,11/16/2018 12:00:00 AM,Cyberattack,2018-11-01T00:00:00,2018-11-01T00:00:00,LPL Financial LLC,,8127,Finance,,Name,2019,"1,000-9,999",0
10598,11/01/2018 12:00:00 AM,11/16/2018 12:00:00 AM,Cyberattack,2018-11-01T00:00:00,2018-11-01T00:00:00,LPL Financial LLC,,8127,Finance,,Social Security Number,2019,"1,000-9,999",0
10598,11/01/2018 12:00:00 AM,11/16/2018 12:00:00 AM,Cyberattack,2018-11-01T00:00:00,2018-11-01T00:00:00,LPL Financial LLC,,8127,Finance,,Other,2019,"1,000-9,999",0
11099,08/05/2021 12:00:00 AM,09/30/2021 12:00:00 AM,Unauthorized Access,2021-07-26T00:00:00,2021-07-28T00:00:00,LPL Financial LLC,,992,Finance,,Name,2022,500-999,1-99
11099,08/05/2021 12:00:00 AM,09/30/2021 12:00:00 AM,Unauthorized Access,2021-07-26T00:00:00,2021-07-28T00:00:00,LPL Financial LLC,,992,Finance,,Social Security Number,2022,500-999,1-99
11099,08/05/2021 12:00:00 AM,09/30/2021 12:00:00 AM,Unauthorized Access,2021-07-26T00:00:00,2021-07-28T00:00:00,LPL Financial LLC,,992,Finance,,Financial & Banking Information,2022,500-999,1-99
10599,11/08/2018 12:00:00 AM,11/19/2018 12:00:00 AM,Cyberattack,2017-12-28T00:00:00,2018-07-09T00:00:00,Francesca's Services Corporation,Malware,1148,Business,Retail,Name,2019,"1,000-9,999",300-399
10599,11/08/2018 12:00:00 AM,11/19/2018 12:00:00 AM,Cyberattack,2017-12-28T00:00:00,2018-07-09T00:00:00,Francesca's Services Corporation,Malware,1148,Business,Retail,Financial & Banking Information,2019,"1,000-9,999",300-399
10599,11/08/2018 12:00:00 AM,11/19/2018 12:00:00 AM,Cyberattack,2017-12-28T00:00:00,2018-07-09T00:00:00,Francesca's Services Corporation,Malware,1148,Business,Retail,Username and Password/Security Question Answers,2019,"1,000-9,999",300-399
10599,11/08/2018 12:00:00 AM,11/19/2018 12:00:00 AM,Cyberattack,2017-12-28T00:00:00,2018-07-09T00:00:00,Francesca's Services Corporation,Malware,1148,Business,Retail,Other,2019,"1,000-9,999",300-399
10600,09/05/2018 12:00:00 AM,11/21/2018 12:00:00 AM,Cyberattack,2018-08-21T00:00:00,2018-09-05T00:00:00,British Airways PLC,Malware,1588,Business,Transportation,Name,2019,"1,000-9,999",1-99
10600,09/05/2018 12:00:00 AM,11/21/2018 12:00:00 AM,Cyberattack,2018-08-21T00:00:00,2018-09-05T00:00:00,British Airways PLC,Malware,1588,Business,Transportation,Financial & Banking Information,2019,"1,000-9,999",1-99
10600,09/05/2018 12:00:00 AM,11/21/2018 12:00:00 AM,Cyberattack,2018-08-21T00:00:00,2018-09-05T00:00:00,British Airways PLC,Malware,1588,Business,Transportation,Other,2019,"1,000-9,999",1-99
10601,08/22/2018 12:00:00 AM,11/27/2018 12:00:00 AM,Cyberattack,2017-08-01T00:00:00,2018-09-30T00:00:00,Burgerville LLC,Malware,,Business,Hospitality,Name,2019,Unknown,400-499
10601,08/22/2018 12:00:00 AM,11/27/2018 12:00:00 AM,Cyberattack,2017-08-01T00:00:00,2018-09-30T00:00:00,Burgerville LLC,Malware,,Business,Hospitality,Financial & Banking Information,2019,Unknown,400-499
10604,08/10/2018 12:00:00 AM,12/05/2018 12:00:00 AM,Cyberattack,2018-02-05T00:00:00,2018-08-21T00:00:00,San Diego Hardware,Malware,604,Business,Home,Name,2019,500-999,100-199
10604,08/10/2018 12:00:00 AM,12/05/2018 12:00:00 AM,Cyberattack,2018-02-05T00:00:00,2018-08-21T00:00:00,San Diego Hardware,Malware,604,Business,Home,Financial & Banking Information,2019,500-999,100-199
10604,08/10/2018 12:00:00 AM,12/05/2018 12:00:00 AM,Cyberattack,2018-02-05T00:00:00,2018-08-21T00:00:00,San Diego Hardware,Malware,604,Business,Home,Other,2019,500-999,100-199
10605,05/02/2018 12:00:00 AM,12/07/2018 12:00:00 AM,Cyberattack,,,Titan Manufacturing and Distributing Inc.,Malware,1838,Business,Manufacturing,Name,2019,"1,000-9,999",Unknown
10605,05/02/2018 12:00:00 AM,12/07/2018 12:00:00 AM,Cyberattack,,,Titan Manufacturing and Distributing Inc.,Malware,1838,Business,Manufacturing,Financial & Banking Information,2019,"1,000-9,999",Unknown
10605,05/02/2018 12:00:00 AM,12/07/2018 12:00:00 AM,Cyberattack,,,Titan Manufacturing and Distributing Inc.,Malware,1838,Business,Manufacturing,Other,2019,"1,000-9,999",Unknown
10606,12/20/2018 12:00:00 AM,12/26/2018 12:00:00 AM,Cyberattack,2018-08-05T00:00:00,2018-11-16T00:00:00,Bel USA LLC,Malware,1553,Business,Retail,Name,2019,"1,000-9,999",100-199
10606,12/20/2018 12:00:00 AM,12/26/2018 12:00:00 AM,Cyberattack,2018-08-05T00:00:00,2018-11-16T00:00:00,Bel USA LLC,Malware,1553,Business,Retail,Financial & Banking Information,2019,"1,000-9,999",100-199
10607,09/14/2018 12:00:00 AM,12/31/2018 12:00:00 AM,Cyberattack,2018-06-07T00:00:00,2018-09-24T00:00:00,Aimbridge Hospitality Holdings LLC,Phishing,647,Business,Hospitality,Name,2019,500-999,100-199
10607,09/14/2018 12:00:00 AM,12/31/2018 12:00:00 AM,Cyberattack,2018-06-07T00:00:00,2018-09-24T00:00:00,Aimbridge Hospitality Holdings LLC,Phishing,647,Business,Hospitality,Social Security Number,2019,500-999,100-199
10607,09/14/2018 12:00:00 AM,12/31/2018 12:00:00 AM,Cyberattack,2018-06-07T00:00:00,2018-09-24T00:00:00,Aimbridge Hospitality Holdings LLC,Phishing,647,Business,Hospitality,Driver's License or Washington ID Card Number,2019,500-999,100-199
10607,09/14/2018 12:00:00 AM,12/31/2018 12:00:00 AM,Cyberattack,2018-06-07T00:00:00,2018-09-24T00:00:00,Aimbridge Hospitality Holdings LLC,Phishing,647,Business,Hospitality,Financial & Banking Information,2019,500-999,100-199
10609,08/17/2018 12:00:00 AM,01/09/2019 12:00:00 AM,Cyberattack,2017-08-15T00:00:00,2019-01-04T00:00:00,A&A Global Imports Inc.,Malware,2783,Business,Manufacturing,Name,2019,"1,000-9,999",500+
10609,08/17/2018 12:00:00 AM,01/09/2019 12:00:00 AM,Cyberattack,2017-08-15T00:00:00,2019-01-04T00:00:00,A&A Global Imports Inc.,Malware,2783,Business,Manufacturing,Financial & Banking Information,2019,"1,000-9,999",500+
10609,08/17/2018 12:00:00 AM,01/09/2019 12:00:00 AM,Cyberattack,2017-08-15T00:00:00,2019-01-04T00:00:00,A&A Global Imports Inc.,Malware,2783,Business,Manufacturing,Username and Password/Security Question Answers,2019,"1,000-9,999",500+
10609,08/17/2018 12:00:00 AM,01/09/2019 12:00:00 AM,Cyberattack,2017-08-15T00:00:00,2019-01-04T00:00:00,A&A Global Imports Inc.,Malware,2783,Business,Manufacturing,Other,2019,"1,000-9,999",500+
10611,12/19/2018 12:00:00 AM,01/18/2019 12:00:00 AM,Cyberattack,2018-07-19T00:00:00,2018-12-12T00:00:00,"Pharmaca Integrative Pharmacy, LLC",Malware,,Business,Cosmetic,Name,2019,Unknown,100-199
10611,12/19/2018 12:00:00 AM,01/18/2019 12:00:00 AM,Cyberattack,2018-07-19T00:00:00,2018-12-12T00:00:00,"Pharmaca Integrative Pharmacy, LLC",Malware,,Business,Cosmetic,Financial & Banking Information,2019,Unknown,100-199
10612,12/20/2018 12:00:00 AM,01/30/2019 12:00:00 AM,Unauthorized Access,2018-11-01T00:00:00,2018-11-15T00:00:00,Image-I-Nation Technologies Inc.,,3695,Business,Software,Name,2019,"1,000-9,999",1-99
10612,12/20/2018 12:00:00 AM,01/30/2019 12:00:00 AM,Unauthorized Access,2018-11-01T00:00:00,2018-11-15T00:00:00,Image-I-Nation Technologies Inc.,,3695,Business,Software,Social Security Number,2019,"1,000-9,999",1-99
10612,12/20/2018 12:00:00 AM,01/30/2019 12:00:00 AM,Unauthorized Access,2018-11-01T00:00:00,2018-11-15T00:00:00,Image-I-Nation Technologies Inc.,,3695,Business,Software,Full Date of Birth,2019,"1,000-9,999",1-99
10613,01/25/2019 12:00:00 AM,02/12/2019 12:00:00 AM,Cyberattack,2018-02-01T00:00:00,2019-01-01T00:00:00,Stanwich Mortgage Loan Trust,,702,Finance,,Name,2019,500-999,300-399
10613,01/25/2019 12:00:00 AM,02/12/2019 12:00:00 AM,Cyberattack,2018-02-01T00:00:00,2019-01-01T00:00:00,Stanwich Mortgage Loan Trust,,702,Finance,,Social Security Number,2019,500-999,300-399
10613,01/25/2019 12:00:00 AM,02/12/2019 12:00:00 AM,Cyberattack,2018-02-01T00:00:00,2019-01-01T00:00:00,Stanwich Mortgage Loan Trust,,702,Finance,,Driver's License or Washington ID Card Number,2019,500-999,300-399
10613,01/25/2019 12:00:00 AM,02/12/2019 12:00:00 AM,Cyberattack,2018-02-01T00:00:00,2019-01-01T00:00:00,Stanwich Mortgage Loan Trust,,702,Finance,,Financial & Banking Information,2019,500-999,300-399
10613,01/25/2019 12:00:00 AM,02/12/2019 12:00:00 AM,Cyberattack,2018-02-01T00:00:00,2019-01-01T00:00:00,Stanwich Mortgage Loan Trust,,702,Finance,,Full Date of Birth,2019,500-999,300-399
10613,01/25/2019 12:00:00 AM,02/12/2019 12:00:00 AM,Cyberattack,2018-02-01T00:00:00,2019-01-01T00:00:00,Stanwich Mortgage Loan Trust,,702,Finance,,Medical Information,2019,500-999,300-399
10613,01/25/2019 12:00:00 AM,02/12/2019 12:00:00 AM,Cyberattack,2018-02-01T00:00:00,2019-01-01T00:00:00,Stanwich Mortgage Loan Trust,,702,Finance,,Other,2019,500-999,300-399
10617,01/09/2019 12:00:00 AM,03/07/2019 12:00:00 AM,Cyberattack,2019-01-09T00:00:00,,Columbia Surgical Specialists,Ransomware,131260,Health,,Name,2019,"50,000-999,999",Unknown
10617,01/09/2019 12:00:00 AM,03/07/2019 12:00:00 AM,Cyberattack,2019-01-09T00:00:00,,Columbia Surgical Specialists,Ransomware,131260,Health,,Social Security Number,2019,"50,000-999,999",Unknown
10617,01/09/2019 12:00:00 AM,03/07/2019 12:00:00 AM,Cyberattack,2019-01-09T00:00:00,,Columbia Surgical Specialists,Ransomware,131260,Health,,Driver's License or Washington ID Card Number,2019,"50,000-999,999",Unknown
10617,01/09/2019 12:00:00 AM,03/07/2019 12:00:00 AM,Cyberattack,2019-01-09T00:00:00,,Columbia Surgical Specialists,Ransomware,131260,Health,,Medical Information,2019,"50,000-999,999",Unknown
10619,12/14/2018 12:00:00 AM,03/15/2019 12:00:00 AM,Cyberattack,2018-12-07T00:00:00,2018-12-07T00:00:00,flexPath Strategies LLC,Phishing,1398,Business,Professional Services,Name,2019,"1,000-9,999",1-99
10619,12/14/2018 12:00:00 AM,03/15/2019 12:00:00 AM,Cyberattack,2018-12-07T00:00:00,2018-12-07T00:00:00,flexPath Strategies LLC,Phishing,1398,Business,Professional Services,Social Security Number,2019,"1,000-9,999",1-99
10621,02/17/2019 12:00:00 AM,04/02/2019 12:00:00 AM,Unauthorized Access,2018-12-01T00:00:00,2018-12-31T00:00:00,New Bit Ventures Ltd. (Coinmama.com),,1221,Business,Cryptocurrency,Other,2019,"1,000-9,999",1-99
10621,02/17/2019 12:00:00 AM,04/02/2019 12:00:00 AM,Unauthorized Access,2018-12-01T00:00:00,2018-12-31T00:00:00,New Bit Ventures Ltd. (Coinmama.com),,1221,Business,Cryptocurrency,Name,2019,"1,000-9,999",1-99
10621,02/17/2019 12:00:00 AM,04/02/2019 12:00:00 AM,Unauthorized Access,2018-12-01T00:00:00,2018-12-31T00:00:00,New Bit Ventures Ltd. (Coinmama.com),,1221,Business,Cryptocurrency,Driver's License or Washington ID Card Number,2019,"1,000-9,999",1-99
10621,02/17/2019 12:00:00 AM,04/02/2019 12:00:00 AM,Unauthorized Access,2018-12-01T00:00:00,2018-12-31T00:00:00,New Bit Ventures Ltd. (Coinmama.com),,1221,Business,Cryptocurrency,Full Date of Birth,2019,"1,000-9,999",1-99
10622,02/20/2019 12:00:00 AM,04/05/2019 12:00:00 AM,Cyberattack,,,Archbright,Phishing,1568,Business,Human Resources,Name,2019,"1,000-9,999",Unknown
10622,02/20/2019 12:00:00 AM,04/05/2019 12:00:00 AM,Cyberattack,,,Archbright,Phishing,1568,Business,Human Resources,Social Security Number,2019,"1,000-9,999",Unknown
10622,02/20/2019 12:00:00 AM,04/05/2019 12:00:00 AM,Cyberattack,,,Archbright,Phishing,1568,Business,Human Resources,Driver's License or Washington ID Card Number,2019,"1,000-9,999",Unknown
10622,02/20/2019 12:00:00 AM,04/05/2019 12:00:00 AM,Cyberattack,,,Archbright,Phishing,1568,Business,Human Resources,Medical Information,2019,"1,000-9,999",Unknown
10622,02/20/2019 12:00:00 AM,04/05/2019 12:00:00 AM,Cyberattack,,,Archbright,Phishing,1568,Business,Human Resources,Other,2019,"1,000-9,999",Unknown
10624,08/21/2018 12:00:00 AM,04/03/2019 12:00:00 AM,Unauthorized Access,2018-05-08T00:00:00,2018-05-08T00:00:00,Jobscience Inc.,,1787,Business,Software,Name,2019,"1,000-9,999",100-199
10624,08/21/2018 12:00:00 AM,04/03/2019 12:00:00 AM,Unauthorized Access,2018-05-08T00:00:00,2018-05-08T00:00:00,Jobscience Inc.,,1787,Business,Software,Social Security Number,2019,"1,000-9,999",100-199
10624,08/21/2018 12:00:00 AM,04/03/2019 12:00:00 AM,Unauthorized Access,2018-05-08T00:00:00,2018-05-08T00:00:00,Jobscience Inc.,,1787,Business,Software,Driver's License or Washington ID Card Number,2019,"1,000-9,999",100-199
10624,08/21/2018 12:00:00 AM,04/03/2019 12:00:00 AM,Unauthorized Access,2018-05-08T00:00:00,2018-05-08T00:00:00,Jobscience Inc.,,1787,Business,Software,Username and Password/Security Question Answers,2019,"1,000-9,999",100-199
10624,08/21/2018 12:00:00 AM,04/03/2019 12:00:00 AM,Unauthorized Access,2018-05-08T00:00:00,2018-05-08T00:00:00,Jobscience Inc.,,1787,Business,Software,Other,2019,"1,000-9,999",100-199
10626,03/28/2019 12:00:00 AM,04/23/2019 12:00:00 AM,Theft or Mistake,2019-03-26T00:00:00,2019-03-26T00:00:00,Seattle University,,2064,Education,,Name,2019,"1,000-9,999",1-99
10626,03/28/2019 12:00:00 AM,04/23/2019 12:00:00 AM,Theft or Mistake,2019-03-26T00:00:00,2019-03-26T00:00:00,Seattle University,,2064,Education,,Social Security Number,2019,"1,000-9,999",1-99
10627,04/03/2019 12:00:00 AM,04/26/2019 12:00:00 AM,Cyberattack,2018-07-04T00:00:00,2019-02-16T00:00:00,"Lancaster Archery Supply, Inc.",,1151,Business,Fitness,Name,2019,"1,000-9,999",200-299
10627,04/03/2019 12:00:00 AM,04/26/2019 12:00:00 AM,Cyberattack,2018-07-04T00:00:00,2019-02-16T00:00:00,"Lancaster Archery Supply, Inc.",,1151,Business,Fitness,Financial & Banking Information,2019,"1,000-9,999",200-299
10628,08/06/2018 12:00:00 AM,04/26/2019 12:00:00 AM,Unauthorized Access,,,Port of Seattle,,3357,Government,,Name,2019,"1,000-9,999",Unknown
10628,08/06/2018 12:00:00 AM,04/26/2019 12:00:00 AM,Unauthorized Access,,,Port of Seattle,,3357,Government,,Social Security Number,2019,"1,000-9,999",Unknown
10628,08/06/2018 12:00:00 AM,04/26/2019 12:00:00 AM,Unauthorized Access,,,Port of Seattle,,3357,Government,,Driver's License or Washington ID Card Number,2019,"1,000-9,999",Unknown
10629,05/07/2019 12:00:00 AM,05/09/2019 12:00:00 AM,Cyberattack,2019-02-12T00:00:00,2019-03-26T00:00:00,Sage Advisors LLC,Phishing,1026,Business,Professional Services,Name,2019,"1,000-9,999",1-99
10629,05/07/2019 12:00:00 AM,05/09/2019 12:00:00 AM,Cyberattack,2019-02-12T00:00:00,2019-03-26T00:00:00,Sage Advisors LLC,Phishing,1026,Business,Professional Services,Social Security Number,2019,"1,000-9,999",1-99
10629,05/07/2019 12:00:00 AM,05/09/2019 12:00:00 AM,Cyberattack,2019-02-12T00:00:00,2019-03-26T00:00:00,Sage Advisors LLC,Phishing,1026,Business,Professional Services,Driver's License or Washington ID Card Number,2019,"1,000-9,999",1-99
10629,05/07/2019 12:00:00 AM,05/09/2019 12:00:00 AM,Cyberattack,2019-02-12T00:00:00,2019-03-26T00:00:00,Sage Advisors LLC,Phishing,1026,Business,Professional Services,Financial & Banking Information,2019,"1,000-9,999",1-99
10630,12/11/2018 12:00:00 AM,05/10/2019 12:00:00 AM,Unauthorized Access,,2018-12-11T00:00:00,Oklahoma Department of Securities,,2793,Government,,Name,2019,"1,000-9,999",Unknown
10630,12/11/2018 12:00:00 AM,05/10/2019 12:00:00 AM,Unauthorized Access,,2018-12-11T00:00:00,Oklahoma Department of Securities,,2793,Government,,Social Security Number,2019,"1,000-9,999",Unknown
10630,12/11/2018 12:00:00 AM,05/10/2019 12:00:00 AM,Unauthorized Access,,2018-12-11T00:00:00,Oklahoma Department of Securities,,2793,Government,,Driver's License or Washington ID Card Number,2019,"1,000-9,999",Unknown
10630,12/11/2018 12:00:00 AM,05/10/2019 12:00:00 AM,Unauthorized Access,,2018-12-11T00:00:00,Oklahoma Department of Securities,,2793,Government,,Financial & Banking Information,2019,"1,000-9,999",Unknown
10630,12/11/2018 12:00:00 AM,05/10/2019 12:00:00 AM,Unauthorized Access,,2018-12-11T00:00:00,Oklahoma Department of Securities,,2793,Government,,Full Date of Birth,2019,"1,000-9,999",Unknown
10630,12/11/2018 12:00:00 AM,05/10/2019 12:00:00 AM,Unauthorized Access,,2018-12-11T00:00:00,Oklahoma Department of Securities,,2793,Government,,Medical Information,2019,"1,000-9,999",Unknown
10631,05/14/2019 12:00:00 AM,05/21/2019 12:00:00 AM,Cyberattack,2019-05-14T00:00:00,2019-05-14T00:00:00,Service Linen Supply,,1210,Business,Cleaning,Name,2019,"1,000-9,999",0
10631,05/14/2019 12:00:00 AM,05/21/2019 12:00:00 AM,Cyberattack,2019-05-14T00:00:00,2019-05-14T00:00:00,Service Linen Supply,,1210,Business,Cleaning,Social Security Number,2019,"1,000-9,999",0
10631,05/14/2019 12:00:00 AM,05/21/2019 12:00:00 AM,Cyberattack,2019-05-14T00:00:00,2019-05-14T00:00:00,Service Linen Supply,,1210,Business,Cleaning,Driver's License or Washington ID Card Number,2019,"1,000-9,999",0
10631,05/14/2019 12:00:00 AM,05/21/2019 12:00:00 AM,Cyberattack,2019-05-14T00:00:00,2019-05-14T00:00:00,Service Linen Supply,,1210,Business,Cleaning,Financial & Banking Information,2019,"1,000-9,999",0
10631,05/14/2019 12:00:00 AM,05/21/2019 12:00:00 AM,Cyberattack,2019-05-14T00:00:00,2019-05-14T00:00:00,Service Linen Supply,,1210,Business,Cleaning,Full Date of Birth,2019,"1,000-9,999",0
10631,05/14/2019 12:00:00 AM,05/21/2019 12:00:00 AM,Cyberattack,2019-05-14T00:00:00,2019-05-14T00:00:00,Service Linen Supply,,1210,Business,Cleaning,Medical Information,2019,"1,000-9,999",0
10632,04/02/2019 12:00:00 AM,05/22/2019 12:00:00 AM,Cyberattack,2018-12-14T00:00:00,2019-03-22T00:00:00,Georgia Institute of Technology,Other,8577,Education,,Name,2019,"1,000-9,999",100-199
10632,04/02/2019 12:00:00 AM,05/22/2019 12:00:00 AM,Cyberattack,2018-12-14T00:00:00,2019-03-22T00:00:00,Georgia Institute of Technology,Other,8577,Education,,Social Security Number,2019,"1,000-9,999",100-199
10632,04/02/2019 12:00:00 AM,05/22/2019 12:00:00 AM,Cyberattack,2018-12-14T00:00:00,2019-03-22T00:00:00,Georgia Institute of Technology,Other,8577,Education,,Full Date of Birth,2019,"1,000-9,999",100-199
10632,04/02/2019 12:00:00 AM,05/22/2019 12:00:00 AM,Cyberattack,2018-12-14T00:00:00,2019-03-22T00:00:00,Georgia Institute of Technology,Other,8577,Education,,Other,2019,"1,000-9,999",100-199
10634,03/26/2019 12:00:00 AM,05/24/2019 12:00:00 AM,Cyberattack,2017-12-29T00:00:00,2019-03-13T00:00:00,"Drury Hotels Company, LLC",,,Business,Hospitality,Name,2019,Unknown,400-499
10634,03/26/2019 12:00:00 AM,05/24/2019 12:00:00 AM,Cyberattack,2017-12-29T00:00:00,2019-03-13T00:00:00,"Drury Hotels Company, LLC",,,Business,Hospitality,Financial & Banking Information,2019,Unknown,400-499
10634,03/26/2019 12:00:00 AM,05/24/2019 12:00:00 AM,Cyberattack,2017-12-29T00:00:00,2019-03-13T00:00:00,"Drury Hotels Company, LLC",,,Business,Hospitality,Other,2019,Unknown,400-499
10635,04/16/2019 12:00:00 AM,05/28/2019 12:00:00 AM,Cyberattack,2019-04-01T00:00:00,2019-04-01T00:00:00,Mediant Communications Inc.,Other,6306,Business,Telecommunications,Name,2019,"1,000-9,999",1-99
10635,04/16/2019 12:00:00 AM,05/28/2019 12:00:00 AM,Cyberattack,2019-04-01T00:00:00,2019-04-01T00:00:00,Mediant Communications Inc.,Other,6306,Business,Telecommunications,Social Security Number,2019,"1,000-9,999",1-99
10635,04/16/2019 12:00:00 AM,05/28/2019 12:00:00 AM,Cyberattack,2019-04-01T00:00:00,2019-04-01T00:00:00,Mediant Communications Inc.,Other,6306,Business,Telecommunications,Financial & Banking Information,2019,"1,000-9,999",1-99
10635,04/16/2019 12:00:00 AM,05/28/2019 12:00:00 AM,Cyberattack,2019-04-01T00:00:00,2019-04-01T00:00:00,Mediant Communications Inc.,Other,6306,Business,Telecommunications,Other,2019,"1,000-9,999",1-99
10636,03/20/2019 12:00:00 AM,06/03/2019 12:00:00 AM,Cyberattack,2018-08-01T00:00:00,2019-03-30T00:00:00,Retrieval Masters Creditors Bureau Inc.,,33480,Business,Professional Services,Name,2019,"10,000-49,999",200-299
10636,03/20/2019 12:00:00 AM,06/03/2019 12:00:00 AM,Cyberattack,2018-08-01T00:00:00,2019-03-30T00:00:00,Retrieval Masters Creditors Bureau Inc.,,33480,Business,Professional Services,Social Security Number,2019,"10,000-49,999",200-299
10636,03/20/2019 12:00:00 AM,06/03/2019 12:00:00 AM,Cyberattack,2018-08-01T00:00:00,2019-03-30T00:00:00,Retrieval Masters Creditors Bureau Inc.,,33480,Business,Professional Services,Financial & Banking Information,2019,"10,000-49,999",200-299
10636,03/20/2019 12:00:00 AM,06/03/2019 12:00:00 AM,Cyberattack,2018-08-01T00:00:00,2019-03-30T00:00:00,Retrieval Masters Creditors Bureau Inc.,,33480,Business,Professional Services,Full Date of Birth,2019,"10,000-49,999",200-299
10636,03/20/2019 12:00:00 AM,06/03/2019 12:00:00 AM,Cyberattack,2018-08-01T00:00:00,2019-03-30T00:00:00,Retrieval Masters Creditors Bureau Inc.,,33480,Business,Professional Services,Medical Information,2019,"10,000-49,999",200-299
10637,04/26/2019 12:00:00 AM,06/03/2019 12:00:00 AM,Theft or Mistake,,,Washington Department of Health,,1336,Government,,Name,2019,"1,000-9,999",Unknown
10637,04/26/2019 12:00:00 AM,06/03/2019 12:00:00 AM,Theft or Mistake,,,Washington Department of Health,,1336,Government,,Social Security Number,2019,"1,000-9,999",Unknown
10637,04/26/2019 12:00:00 AM,06/03/2019 12:00:00 AM,Theft or Mistake,,,Washington Department of Health,,1336,Government,,Medical Information,2019,"1,000-9,999",Unknown
10638,05/21/2019 12:00:00 AM,06/06/2019 12:00:00 AM,Unauthorized Access,,2019-04-03T00:00:00,Acrisure LLC,,1295,Business,Human Resources,Name,2019,"1,000-9,999",Unknown
10638,05/21/2019 12:00:00 AM,06/06/2019 12:00:00 AM,Unauthorized Access,,2019-04-03T00:00:00,Acrisure LLC,,1295,Business,Human Resources,Social Security Number,2019,"1,000-9,999",Unknown
10638,05/21/2019 12:00:00 AM,06/06/2019 12:00:00 AM,Unauthorized Access,,2019-04-03T00:00:00,Acrisure LLC,,1295,Business,Human Resources,Driver's License or Washington ID Card Number,2019,"1,000-9,999",Unknown
10639,04/24/2019 12:00:00 AM,06/07/2019 12:00:00 AM,Cyberattack,2018-11-01T00:00:00,2019-04-29T00:00:00,Princess Polly Group Pty Ltd,,2290,Business,Clothing,Name,2019,"1,000-9,999",100-199
10639,04/24/2019 12:00:00 AM,06/07/2019 12:00:00 AM,Cyberattack,2018-11-01T00:00:00,2019-04-29T00:00:00,Princess Polly Group Pty Ltd,,2290,Business,Clothing,Financial & Banking Information,2019,"1,000-9,999",100-199
10639,04/24/2019 12:00:00 AM,06/07/2019 12:00:00 AM,Cyberattack,2018-11-01T00:00:00,2019-04-29T00:00:00,Princess Polly Group Pty Ltd,,2290,Business,Clothing,Username and Password/Security Question Answers,2019,"1,000-9,999",100-199
10640,05/02/2019 12:00:00 AM,06/07/2019 12:00:00 AM,Cyberattack,2016-09-27T00:00:00,2019-03-16T00:00:00,Darwin's Natural Pet Products,,1787,Business,Consumable,Name,2019,"1,000-9,999",500+
10640,05/02/2019 12:00:00 AM,06/07/2019 12:00:00 AM,Cyberattack,2016-09-27T00:00:00,2019-03-16T00:00:00,Darwin's Natural Pet Products,,1787,Business,Consumable,Financial & Banking Information,2019,"1,000-9,999",500+
10641,04/24/2019 12:00:00 AM,06/21/2019 12:00:00 AM,Cyberattack,2010-08-25T00:00:00,,Dominion Dental Services Inc.,,34455,Health,,Name,2019,"10,000-49,999",Unknown
10641,04/24/2019 12:00:00 AM,06/21/2019 12:00:00 AM,Cyberattack,2010-08-25T00:00:00,,Dominion Dental Services Inc.,,34455,Health,,Social Security Number,2019,"10,000-49,999",Unknown
10641,04/24/2019 12:00:00 AM,06/21/2019 12:00:00 AM,Cyberattack,2010-08-25T00:00:00,,Dominion Dental Services Inc.,,34455,Health,,Financial & Banking Information,2019,"10,000-49,999",Unknown
10641,04/24/2019 12:00:00 AM,06/21/2019 12:00:00 AM,Cyberattack,2010-08-25T00:00:00,,Dominion Dental Services Inc.,,34455,Health,,Full Date of Birth,2019,"10,000-49,999",Unknown
10641,04/24/2019 12:00:00 AM,06/21/2019 12:00:00 AM,Cyberattack,2010-08-25T00:00:00,,Dominion Dental Services Inc.,,34455,Health,,Other,2019,"10,000-49,999",Unknown
10642,06/03/2019 12:00:00 AM,07/02/2019 12:00:00 AM,Cyberattack,,,Backcountry Edge,,566,Business,Retail,Name,2019,500-999,Unknown
10642,06/03/2019 12:00:00 AM,07/02/2019 12:00:00 AM,Cyberattack,,,Backcountry Edge,,566,Business,Retail,Financial & Banking Information,2019,500-999,Unknown
10642,06/03/2019 12:00:00 AM,07/02/2019 12:00:00 AM,Cyberattack,,,Backcountry Edge,,566,Business,Retail,Username and Password/Security Question Answers,2019,500-999,Unknown
10642,06/03/2019 12:00:00 AM,07/02/2019 12:00:00 AM,Cyberattack,,,Backcountry Edge,,566,Business,Retail,Other,2019,500-999,Unknown
10643,06/24/2019 12:00:00 AM,07/03/2019 12:00:00 AM,Cyberattack,2019-06-14T00:00:00,2019-06-17T00:00:00,Riggs Wealth Management,Phishing,1205,Finance,,Name,2019,"1,000-9,999",1-99
10643,06/24/2019 12:00:00 AM,07/03/2019 12:00:00 AM,Cyberattack,2019-06-14T00:00:00,2019-06-17T00:00:00,Riggs Wealth Management,Phishing,1205,Finance,,Social Security Number,2019,"1,000-9,999",1-99
10643,06/24/2019 12:00:00 AM,07/03/2019 12:00:00 AM,Cyberattack,2019-06-14T00:00:00,2019-06-17T00:00:00,Riggs Wealth Management,Phishing,1205,Finance,,Financial & Banking Information,2019,"1,000-9,999",1-99
10645,05/14/2019 12:00:00 AM,07/13/2019 12:00:00 AM,Cyberattack,2018-08-01T00:00:00,2019-03-30T00:00:00,Laboratory Corporation of America Holdings (LabCorp),,18330,Health,,Name,2019,"10,000-49,999",200-299
10645,05/14/2019 12:00:00 AM,07/13/2019 12:00:00 AM,Cyberattack,2018-08-01T00:00:00,2019-03-30T00:00:00,Laboratory Corporation of America Holdings (LabCorp),,18330,Health,,Social Security Number,2019,"10,000-49,999",200-299
10645,05/14/2019 12:00:00 AM,07/13/2019 12:00:00 AM,Cyberattack,2018-08-01T00:00:00,2019-03-30T00:00:00,Laboratory Corporation of America Holdings (LabCorp),,18330,Health,,Financial & Banking Information,2019,"10,000-49,999",200-299
10645,05/14/2019 12:00:00 AM,07/13/2019 12:00:00 AM,Cyberattack,2018-08-01T00:00:00,2019-03-30T00:00:00,Laboratory Corporation of America Holdings (LabCorp),,18330,Health,,Full Date of Birth,2019,"10,000-49,999",200-299
10645,05/14/2019 12:00:00 AM,07/13/2019 12:00:00 AM,Cyberattack,2018-08-01T00:00:00,2019-03-30T00:00:00,Laboratory Corporation of America Holdings (LabCorp),,18330,Health,,Health Insurance Policy or ID Number,2019,"10,000-49,999",200-299
10645,05/14/2019 12:00:00 AM,07/13/2019 12:00:00 AM,Cyberattack,2018-08-01T00:00:00,2019-03-30T00:00:00,Laboratory Corporation of America Holdings (LabCorp),,18330,Health,,Other,2019,"10,000-49,999",200-299
10646,05/06/2019 12:00:00 AM,07/15/2019 12:00:00 AM,Cyberattack,2019-05-03T00:00:00,2019-05-06T00:00:00,Northwood Inc.,Phishing,1185,Health,,Name,2019,"1,000-9,999",1-99
10646,05/06/2019 12:00:00 AM,07/15/2019 12:00:00 AM,Cyberattack,2019-05-03T00:00:00,2019-05-06T00:00:00,Northwood Inc.,Phishing,1185,Health,,Social Security Number,2019,"1,000-9,999",1-99
10647,05/15/2019 12:00:00 AM,07/15/2019 12:00:00 AM,Cyberattack,2019-03-21T00:00:00,,"Clinical Pathology Laboratories, Inc.",Malware,1155,Health,,Name,2019,"1,000-9,999",Unknown
10647,05/15/2019 12:00:00 AM,07/15/2019 12:00:00 AM,Cyberattack,2019-03-21T00:00:00,,"Clinical Pathology Laboratories, Inc.",Malware,1155,Health,,Full Date of Birth,2019,"1,000-9,999",Unknown
10647,05/15/2019 12:00:00 AM,07/15/2019 12:00:00 AM,Cyberattack,2019-03-21T00:00:00,,"Clinical Pathology Laboratories, Inc.",Malware,1155,Health,,Medical Information,2019,"1,000-9,999",Unknown
10647,05/15/2019 12:00:00 AM,07/15/2019 12:00:00 AM,Cyberattack,2019-03-21T00:00:00,,"Clinical Pathology Laboratories, Inc.",Malware,1155,Health,,Other,2019,"1,000-9,999",Unknown
10648,05/22/2018 12:00:00 AM,07/13/2018 12:00:00 AM,Cyberattack,2018-04-20T00:00:00,2018-05-22T00:00:00,"ComplyRight, Inc.",,29322,Business,Human Resources,Name,2018,"10,000-49,999",1-99
10648,05/22/2018 12:00:00 AM,07/13/2018 12:00:00 AM,Cyberattack,2018-04-20T00:00:00,2018-05-22T00:00:00,"ComplyRight, Inc.",,29322,Business,Human Resources,Social Security Number,2018,"10,000-49,999",1-99
10648,05/22/2018 12:00:00 AM,07/13/2018 12:00:00 AM,Cyberattack,2018-04-20T00:00:00,2018-05-22T00:00:00,"ComplyRight, Inc.",,29322,Business,Human Resources,Other,2018,"10,000-49,999",1-99
10656,08/28/2019 12:00:00 AM,09/09/2019 12:00:00 AM,Cyberattack,2019-04-01T00:00:00,,The Union Labor Life Insurance Company,Phishing,615,Finance,Other,Name,2020,500-999,Unknown
10656,08/28/2019 12:00:00 AM,09/09/2019 12:00:00 AM,Cyberattack,2019-04-01T00:00:00,,The Union Labor Life Insurance Company,Phishing,615,Finance,Other,Social Security Number,2020,500-999,Unknown
10656,08/28/2019 12:00:00 AM,09/09/2019 12:00:00 AM,Cyberattack,2019-04-01T00:00:00,,The Union Labor Life Insurance Company,Phishing,615,Finance,Other,Full Date of Birth,2020,500-999,Unknown
10656,08/28/2019 12:00:00 AM,09/09/2019 12:00:00 AM,Cyberattack,2019-04-01T00:00:00,,The Union Labor Life Insurance Company,Phishing,615,Finance,Other,Other,2020,500-999,Unknown
10682,08/07/2020 12:00:00 AM,10/02/2020 12:00:00 AM,Cyberattack,2020-02-26T00:00:00,2020-07-21T00:00:00,PupBox,Malware,1046,Business,Retail,Name,2021,"1,000-9,999",100-199
10682,08/07/2020 12:00:00 AM,10/02/2020 12:00:00 AM,Cyberattack,2020-02-26T00:00:00,2020-07-21T00:00:00,PupBox,Malware,1046,Business,Retail,Financial & Banking Information,2021,"1,000-9,999",100-199
10682,08/07/2020 12:00:00 AM,10/02/2020 12:00:00 AM,Cyberattack,2020-02-26T00:00:00,2020-07-21T00:00:00,PupBox,Malware,1046,Business,Retail,Unique Private Key (e.g. used to authenticate or sign an electronic record),2021,"1,000-9,999",100-199
10682,08/07/2020 12:00:00 AM,10/02/2020 12:00:00 AM,Cyberattack,2020-02-26T00:00:00,2020-07-21T00:00:00,PupBox,Malware,1046,Business,Retail,Email Address and Password/Security Question Answers,2021,"1,000-9,999",100-199
10691,05/17/2021 12:00:00 AM,07/12/2021 12:00:00 AM,Cyberattack,2021-05-12T00:00:00,2021-05-26T00:00:00,Clover Park School District,Ransomware,5872,Education,,Medical Information,2021,"1,000-9,999",1-99
10691,05/17/2021 12:00:00 AM,07/12/2021 12:00:00 AM,Cyberattack,2021-05-12T00:00:00,2021-05-26T00:00:00,Clover Park School District,Ransomware,5872,Education,,Other,2021,"1,000-9,999",1-99
10691,05/17/2021 12:00:00 AM,07/12/2021 12:00:00 AM,Cyberattack,2021-05-12T00:00:00,2021-05-26T00:00:00,Clover Park School District,Ransomware,5872,Education,,Name,2021,"1,000-9,999",1-99
10691,05/17/2021 12:00:00 AM,07/12/2021 12:00:00 AM,Cyberattack,2021-05-12T00:00:00,2021-05-26T00:00:00,Clover Park School District,Ransomware,5872,Education,,Social Security Number,2021,"1,000-9,999",1-99
10691,05/17/2021 12:00:00 AM,07/12/2021 12:00:00 AM,Cyberattack,2021-05-12T00:00:00,2021-05-26T00:00:00,Clover Park School District,Ransomware,5872,Education,,Driver's License or Washington ID Card Number,2021,"1,000-9,999",1-99
10691,05/17/2021 12:00:00 AM,07/12/2021 12:00:00 AM,Cyberattack,2021-05-12T00:00:00,2021-05-26T00:00:00,Clover Park School District,Ransomware,5872,Education,,Financial & Banking Information,2021,"1,000-9,999",1-99
10691,05/17/2021 12:00:00 AM,07/12/2021 12:00:00 AM,Cyberattack,2021-05-12T00:00:00,2021-05-26T00:00:00,Clover Park School District,Ransomware,5872,Education,,Full Date of Birth,2021,"1,000-9,999",1-99
10691,05/17/2021 12:00:00 AM,07/12/2021 12:00:00 AM,Cyberattack,2021-05-12T00:00:00,2021-05-26T00:00:00,Clover Park School District,Ransomware,5872,Education,,Health Insurance Policy or ID Number,2021,"1,000-9,999",1-99
10691,05/17/2021 12:00:00 AM,07/12/2021 12:00:00 AM,Cyberattack,2021-05-12T00:00:00,2021-05-26T00:00:00,Clover Park School District,Ransomware,5872,Education,,Driver's License or Washington ID Card Number,2021,"1,000-9,999",1-99
10691,05/17/2021 12:00:00 AM,07/12/2021 12:00:00 AM,Cyberattack,2021-05-12T00:00:00,2021-05-26T00:00:00,Clover Park School District,Ransomware,5872,Education,,Financial & Banking Information,2021,"1,000-9,999",1-99
10691,05/17/2021 12:00:00 AM,07/12/2021 12:00:00 AM,Cyberattack,2021-05-12T00:00:00,2021-05-26T00:00:00,Clover Park School District,Ransomware,5872,Education,,Full Date of Birth,2021,"1,000-9,999",1-99
10691,05/17/2021 12:00:00 AM,07/12/2021 12:00:00 AM,Cyberattack,2021-05-12T00:00:00,2021-05-26T00:00:00,Clover Park School District,Ransomware,5872,Education,,Health Insurance Policy or ID Number,2021,"1,000-9,999",1-99
10691,05/17/2021 12:00:00 AM,07/12/2021 12:00:00 AM,Cyberattack,2021-05-12T00:00:00,2021-05-26T00:00:00,Clover Park School District,Ransomware,5872,Education,,Medical Information,2021,"1,000-9,999",1-99
10691,05/17/2021 12:00:00 AM,07/12/2021 12:00:00 AM,Cyberattack,2021-05-12T00:00:00,2021-05-26T00:00:00,Clover Park School District,Ransomware,5872,Education,,Other,2021,"1,000-9,999",1-99
10691,05/17/2021 12:00:00 AM,07/12/2021 12:00:00 AM,Cyberattack,2021-05-12T00:00:00,2021-05-26T00:00:00,Clover Park School District,Ransomware,5872,Education,,Name,2021,"1,000-9,999",1-99
10691,05/17/2021 12:00:00 AM,07/12/2021 12:00:00 AM,Cyberattack,2021-05-12T00:00:00,2021-05-26T00:00:00,Clover Park School District,Ransomware,5872,Education,,Social Security Number,2021,"1,000-9,999",1-99
10696,06/14/2021 12:00:00 AM,07/14/2021 12:00:00 AM,Cyberattack,2021-02-22T00:00:00,2021-06-14T00:00:00,"Resort Data Processing, Inc.",Malware,1669,Business,Software,Name,2021,"1,000-9,999",100-199
10696,06/14/2021 12:00:00 AM,07/14/2021 12:00:00 AM,Cyberattack,2021-02-22T00:00:00,2021-06-14T00:00:00,"Resort Data Processing, Inc.",Malware,1669,Business,Software,Financial & Banking Information,2021,"1,000-9,999",100-199
10696,06/14/2021 12:00:00 AM,07/14/2021 12:00:00 AM,Cyberattack,2021-02-22T00:00:00,2021-06-14T00:00:00,"Resort Data Processing, Inc.",Malware,1669,Business,Software,Email Address and Password/Security Question Answers,2021,"1,000-9,999",100-199
10703,02/17/2021 12:00:00 AM,05/28/2021 12:00:00 AM,Cyberattack,2021-02-10T00:00:00,,Osborn Cancer Care,Malware,4305,Health,,Name,2021,"1,000-9,999",Unknown
10703,02/17/2021 12:00:00 AM,05/28/2021 12:00:00 AM,Cyberattack,2021-02-10T00:00:00,,Osborn Cancer Care,Malware,4305,Health,,Driver's License or Washington ID Card Number,2021,"1,000-9,999",Unknown
10703,02/17/2021 12:00:00 AM,05/28/2021 12:00:00 AM,Cyberattack,2021-02-10T00:00:00,,Osborn Cancer Care,Malware,4305,Health,,Full Date of Birth,2021,"1,000-9,999",Unknown
10703,02/17/2021 12:00:00 AM,05/28/2021 12:00:00 AM,Cyberattack,2021-02-10T00:00:00,,Osborn Cancer Care,Malware,4305,Health,,Medical Information,2021,"1,000-9,999",Unknown
10725,11/30/2020 12:00:00 AM,06/22/2021 12:00:00 AM,Unauthorized Access,2020-09-01T00:00:00,2021-02-28T00:00:00,Made In Oregon,,840,Business,Retail,Name,2021,500-999,100-199
10725,11/30/2020 12:00:00 AM,06/22/2021 12:00:00 AM,Unauthorized Access,2020-09-01T00:00:00,2021-02-28T00:00:00,Made In Oregon,,840,Business,Retail,Financial & Banking Information,2021,500-999,100-199
10725,11/30/2020 12:00:00 AM,06/22/2021 12:00:00 AM,Unauthorized Access,2020-09-01T00:00:00,2021-02-28T00:00:00,Made In Oregon,,840,Business,Retail,Email Address and Password/Security Question Answers,2021,500-999,100-199
10788,06/01/2021 12:00:00 AM,07/30/2021 12:00:00 AM,Cyberattack,,,Mandere Construction / Northwestern Building Components,Ransomware,781,Business,Construction,Name,2022,500-999,Unknown
10788,06/01/2021 12:00:00 AM,07/30/2021 12:00:00 AM,Cyberattack,,,Mandere Construction / Northwestern Building Components,Ransomware,781,Business,Construction,Social Security Number,2022,500-999,Unknown
10793,07/06/2021 12:00:00 AM,08/04/2021 12:00:00 AM,Unauthorized Access,2021-02-19T00:00:00,2021-03-31T00:00:00,Renton Regional Fire Authority,Phishing,1334,Government,,Name,2022,"1,000-9,999",100-199
10793,07/06/2021 12:00:00 AM,08/04/2021 12:00:00 AM,Unauthorized Access,2021-02-19T00:00:00,2021-03-31T00:00:00,Renton Regional Fire Authority,Phishing,1334,Government,,Social Security Number,2022,"1,000-9,999",100-199
10793,07/06/2021 12:00:00 AM,08/04/2021 12:00:00 AM,Unauthorized Access,2021-02-19T00:00:00,2021-03-31T00:00:00,Renton Regional Fire Authority,Phishing,1334,Government,,Driver's License or Washington ID Card Number,2022,"1,000-9,999",100-199
10793,07/06/2021 12:00:00 AM,08/04/2021 12:00:00 AM,Unauthorized Access,2021-02-19T00:00:00,2021-03-31T00:00:00,Renton Regional Fire Authority,Phishing,1334,Government,,Financial & Banking Information,2022,"1,000-9,999",100-199
10793,07/06/2021 12:00:00 AM,08/04/2021 12:00:00 AM,Unauthorized Access,2021-02-19T00:00:00,2021-03-31T00:00:00,Renton Regional Fire Authority,Phishing,1334,Government,,Full Date of Birth,2022,"1,000-9,999",100-199
10793,07/06/2021 12:00:00 AM,08/04/2021 12:00:00 AM,Unauthorized Access,2021-02-19T00:00:00,2021-03-31T00:00:00,Renton Regional Fire Authority,Phishing,1334,Government,,Medical Information,2022,"1,000-9,999",100-199
10806,06/19/2021 12:00:00 AM,07/30/2021 12:00:00 AM,Cyberattack,2021-06-19T00:00:00,2021-06-20T00:00:00,Motor Trend Group LLC,Unclear/unknown,1600,Business,Entertainment,Name,2022,"1,000-9,999",1-99
10806,06/19/2021 12:00:00 AM,07/30/2021 12:00:00 AM,Cyberattack,2021-06-19T00:00:00,2021-06-20T00:00:00,Motor Trend Group LLC,Unclear/unknown,1600,Business,Entertainment,Full Date of Birth,2022,"1,000-9,999",1-99
10806,06/19/2021 12:00:00 AM,07/30/2021 12:00:00 AM,Cyberattack,2021-06-19T00:00:00,2021-06-20T00:00:00,Motor Trend Group LLC,Unclear/unknown,1600,Business,Entertainment,Email Address and Password/Security Question Answers,2022,"1,000-9,999",1-99
10806,06/19/2021 12:00:00 AM,07/30/2021 12:00:00 AM,Cyberattack,2021-06-19T00:00:00,2021-06-20T00:00:00,Motor Trend Group LLC,Unclear/unknown,1600,Business,Entertainment,Other,2022,"1,000-9,999",1-99
10806,06/19/2021 12:00:00 AM,07/30/2021 12:00:00 AM,Cyberattack,2021-06-19T00:00:00,2021-06-20T00:00:00,Motor Trend Group LLC,Unclear/unknown,1600,Business,Entertainment,Username and Password/Security Question Answers,2022,"1,000-9,999",1-99
10806,06/19/2021 12:00:00 AM,07/30/2021 12:00:00 AM,Cyberattack,2021-06-19T00:00:00,2021-06-20T00:00:00,Motor Trend Group LLC,Unclear/unknown,1600,Business,Entertainment,Email Address and Password/Security Question Answers,2022,"1,000-9,999",1-99
10806,06/19/2021 12:00:00 AM,07/30/2021 12:00:00 AM,Cyberattack,2021-06-19T00:00:00,2021-06-20T00:00:00,Motor Trend Group LLC,Unclear/unknown,1600,Business,Entertainment,Other,2022,"1,000-9,999",1-99
10806,06/19/2021 12:00:00 AM,07/30/2021 12:00:00 AM,Cyberattack,2021-06-19T00:00:00,2021-06-20T00:00:00,Motor Trend Group LLC,Unclear/unknown,1600,Business,Entertainment,Name,2022,"1,000-9,999",1-99
10806,06/19/2021 12:00:00 AM,07/30/2021 12:00:00 AM,Cyberattack,2021-06-19T00:00:00,2021-06-20T00:00:00,Motor Trend Group LLC,Unclear/unknown,1600,Business,Entertainment,Full Date of Birth,2022,"1,000-9,999",1-99
10806,06/19/2021 12:00:00 AM,07/30/2021 12:00:00 AM,Cyberattack,2021-06-19T00:00:00,2021-06-20T00:00:00,Motor Trend Group LLC,Unclear/unknown,1600,Business,Entertainment,Username and Password/Security Question Answers,2022,"1,000-9,999",1-99
10807,07/12/2021 12:00:00 AM,08/17/2021 12:00:00 AM,Theft or Mistake,,,"BackNine Insurance and Financial Services, Inc.",,866,Finance,,Name,2022,500-999,Unknown
10807,07/12/2021 12:00:00 AM,08/17/2021 12:00:00 AM,Theft or Mistake,,,"BackNine Insurance and Financial Services, Inc.",,866,Finance,,Social Security Number,2022,500-999,Unknown
10807,07/12/2021 12:00:00 AM,08/17/2021 12:00:00 AM,Theft or Mistake,,,"BackNine Insurance and Financial Services, Inc.",,866,Finance,,Driver's License or Washington ID Card Number,2022,500-999,Unknown
10807,07/12/2021 12:00:00 AM,08/17/2021 12:00:00 AM,Theft or Mistake,,,"BackNine Insurance and Financial Services, Inc.",,866,Finance,,Full Date of Birth,2022,500-999,Unknown
10807,07/12/2021 12:00:00 AM,08/17/2021 12:00:00 AM,Theft or Mistake,,,"BackNine Insurance and Financial Services, Inc.",,866,Finance,,Medical Information,2022,500-999,Unknown
10807,07/12/2021 12:00:00 AM,08/17/2021 12:00:00 AM,Theft or Mistake,,,"BackNine Insurance and Financial Services, Inc.",,866,Finance,,Other,2022,500-999,Unknown
10808,06/04/2021 12:00:00 AM,07/08/2021 12:00:00 AM,Unauthorized Access,2021-05-28T00:00:00,2021-06-04T00:00:00,"Forefront Management, LLC and Forefront Dermatology, S.C.",,877,Health,,Name,2021,500-999,1-99
10808,06/04/2021 12:00:00 AM,07/08/2021 12:00:00 AM,Unauthorized Access,2021-05-28T00:00:00,2021-06-04T00:00:00,"Forefront Management, LLC and Forefront Dermatology, S.C.",,877,Health,,Social Security Number,2021,500-999,1-99
10808,06/04/2021 12:00:00 AM,07/08/2021 12:00:00 AM,Unauthorized Access,2021-05-28T00:00:00,2021-06-04T00:00:00,"Forefront Management, LLC and Forefront Dermatology, S.C.",,877,Health,,Full Date of Birth,2021,500-999,1-99
10808,06/04/2021 12:00:00 AM,07/08/2021 12:00:00 AM,Unauthorized Access,2021-05-28T00:00:00,2021-06-04T00:00:00,"Forefront Management, LLC and Forefront Dermatology, S.C.",,877,Health,,Health Insurance Policy or ID Number,2021,500-999,1-99
10808,06/04/2021 12:00:00 AM,07/08/2021 12:00:00 AM,Unauthorized Access,2021-05-28T00:00:00,2021-06-04T00:00:00,"Forefront Management, LLC and Forefront Dermatology, S.C.",,877,Health,,Medical Information,2021,500-999,1-99
10808,06/04/2021 12:00:00 AM,07/08/2021 12:00:00 AM,Unauthorized Access,2021-05-28T00:00:00,2021-06-04T00:00:00,"Forefront Management, LLC and Forefront Dermatology, S.C.",,877,Health,,Other,2021,500-999,1-99
10813,04/26/2021 12:00:00 AM,07/13/2021 12:00:00 AM,Cyberattack,,,King County Public Health Hospital District No. 2 Dba Evergreen Health,Malware,20215,Health,,Name,2021,"10,000-49,999",Unknown
10813,04/26/2021 12:00:00 AM,07/13/2021 12:00:00 AM,Cyberattack,,,King County Public Health Hospital District No. 2 Dba Evergreen Health,Malware,20215,Health,,Full Date of Birth,2021,"10,000-49,999",Unknown
10813,04/26/2021 12:00:00 AM,07/13/2021 12:00:00 AM,Cyberattack,,,King County Public Health Hospital District No. 2 Dba Evergreen Health,Malware,20215,Health,,Health Insurance Policy or ID Number,2021,"10,000-49,999",Unknown
10813,04/26/2021 12:00:00 AM,07/13/2021 12:00:00 AM,Cyberattack,,,King County Public Health Hospital District No. 2 Dba Evergreen Health,Malware,20215,Health,,Other,2021,"10,000-49,999",Unknown
10840,07/16/2020 12:00:00 AM,10/23/2020 12:00:00 AM,Unauthorized Access,2020-07-01T00:00:00,2020-07-16T00:00:00,"Fragomen, Del Rey, Bernsen & Loewy, LLP",,581,Business,Legal,Name,2021,500-999,1-99
10840,07/16/2020 12:00:00 AM,10/23/2020 12:00:00 AM,Unauthorized Access,2020-07-01T00:00:00,2020-07-16T00:00:00,"Fragomen, Del Rey, Bernsen & Loewy, LLP",,581,Business,Legal,Social Security Number,2021,500-999,1-99
10840,07/16/2020 12:00:00 AM,10/23/2020 12:00:00 AM,Unauthorized Access,2020-07-01T00:00:00,2020-07-16T00:00:00,"Fragomen, Del Rey, Bernsen & Loewy, LLP",,581,Business,Legal,Driver's License or Washington ID Card Number,2021,500-999,1-99
10840,07/16/2020 12:00:00 AM,10/23/2020 12:00:00 AM,Unauthorized Access,2020-07-01T00:00:00,2020-07-16T00:00:00,"Fragomen, Del Rey, Bernsen & Loewy, LLP",,581,Business,Legal,Full Date of Birth,2021,500-999,1-99
10840,07/16/2020 12:00:00 AM,10/23/2020 12:00:00 AM,Unauthorized Access,2020-07-01T00:00:00,2020-07-16T00:00:00,"Fragomen, Del Rey, Bernsen & Loewy, LLP",,581,Business,Legal,Passport Number,2021,500-999,1-99
10841,08/17/2020 12:00:00 AM,08/06/2021 12:00:00 AM,Cyberattack,2020-07-27T00:00:00,2020-08-17T00:00:00,"Ibex Global Solutions, Inc. (Ibex)",Ransomware,891,Business,Professional Services,Name,2022,500-999,1-99
10841,08/17/2020 12:00:00 AM,08/06/2021 12:00:00 AM,Cyberattack,2020-07-27T00:00:00,2020-08-17T00:00:00,"Ibex Global Solutions, Inc. (Ibex)",Ransomware,891,Business,Professional Services,Social Security Number,2022,500-999,1-99
10841,08/17/2020 12:00:00 AM,08/06/2021 12:00:00 AM,Cyberattack,2020-07-27T00:00:00,2020-08-17T00:00:00,"Ibex Global Solutions, Inc. (Ibex)",Ransomware,891,Business,Professional Services,Full Date of Birth,2022,500-999,1-99
10841,08/17/2020 12:00:00 AM,08/06/2021 12:00:00 AM,Cyberattack,2020-07-27T00:00:00,2020-08-17T00:00:00,"Ibex Global Solutions, Inc. (Ibex)",Ransomware,891,Business,Professional Services,Medical Information,2022,500-999,1-99
10841,08/17/2020 12:00:00 AM,08/06/2021 12:00:00 AM,Cyberattack,2020-07-27T00:00:00,2020-08-17T00:00:00,"Ibex Global Solutions, Inc. (Ibex)",Ransomware,891,Business,Professional Services,Name,2022,500-999,1-99
10841,08/17/2020 12:00:00 AM,08/06/2021 12:00:00 AM,Cyberattack,2020-07-27T00:00:00,2020-08-17T00:00:00,"Ibex Global Solutions, Inc. (Ibex)",Ransomware,891,Business,Professional Services,Social Security Number,2022,500-999,1-99
10841,08/17/2020 12:00:00 AM,08/06/2021 12:00:00 AM,Cyberattack,2020-07-27T00:00:00,2020-08-17T00:00:00,"Ibex Global Solutions, Inc. (Ibex)",Ransomware,891,Business,Professional Services,Full Date of Birth,2022,500-999,1-99
10841,08/17/2020 12:00:00 AM,08/06/2021 12:00:00 AM,Cyberattack,2020-07-27T00:00:00,2020-08-17T00:00:00,"Ibex Global Solutions, Inc. (Ibex)",Ransomware,891,Business,Professional Services,Medical Information,2022,500-999,1-99
10843,03/20/2021 12:00:00 AM,08/13/2021 12:00:00 AM,Cyberattack,2021-03-16T00:00:00,2021-04-13T00:00:00,Destination Maternity,Ransomware,2237,Business,Retail,Name,2022,"1,000-9,999",1-99
10843,03/20/2021 12:00:00 AM,08/13/2021 12:00:00 AM,Cyberattack,2021-03-16T00:00:00,2021-04-13T00:00:00,Destination Maternity,Ransomware,2237,Business,Retail,Social Security Number,2022,"1,000-9,999",1-99
10843,03/20/2021 12:00:00 AM,08/13/2021 12:00:00 AM,Cyberattack,2021-03-16T00:00:00,2021-04-13T00:00:00,Destination Maternity,Ransomware,2237,Business,Retail,Financial & Banking Information,2022,"1,000-9,999",1-99
10846,06/11/2021 12:00:00 AM,08/23/2021 12:00:00 AM,Cyberattack,2020-11-24T00:00:00,2020-12-09T00:00:00,"American Freight, LLC ",Malware,876,Business,Retail,Health Insurance Policy or ID Number,2022,500-999,100-199
10846,06/11/2021 12:00:00 AM,08/23/2021 12:00:00 AM,Cyberattack,2020-11-24T00:00:00,2020-12-09T00:00:00,"American Freight, LLC ",Malware,876,Business,Retail,Medical Information,2022,500-999,100-199
10846,06/11/2021 12:00:00 AM,08/23/2021 12:00:00 AM,Cyberattack,2020-11-24T00:00:00,2020-12-09T00:00:00,"American Freight, LLC ",Malware,876,Business,Retail,Name,2022,500-999,100-199
10846,06/11/2021 12:00:00 AM,08/23/2021 12:00:00 AM,Cyberattack,2020-11-24T00:00:00,2020-12-09T00:00:00,"American Freight, LLC ",Malware,876,Business,Retail,Social Security Number,2022,500-999,100-199
10846,06/11/2021 12:00:00 AM,08/23/2021 12:00:00 AM,Cyberattack,2020-11-24T00:00:00,2020-12-09T00:00:00,"American Freight, LLC ",Malware,876,Business,Retail,Driver's License or Washington ID Card Number,2022,500-999,100-199
10846,06/11/2021 12:00:00 AM,08/23/2021 12:00:00 AM,Cyberattack,2020-11-24T00:00:00,2020-12-09T00:00:00,"American Freight, LLC ",Malware,876,Business,Retail,Financial & Banking Information,2022,500-999,100-199
10856,08/17/2021 12:00:00 AM,08/24/2021 12:00:00 AM,Cyberattack,2021-07-22T00:00:00,,T-Mobile USA,Malware,2079648,Business,Telecommunications,Name,2022,"1,000,000+",Unknown
10856,08/17/2021 12:00:00 AM,08/24/2021 12:00:00 AM,Cyberattack,2021-07-22T00:00:00,,T-Mobile USA,Malware,2079648,Business,Telecommunications,Full Date of Birth,2022,"1,000,000+",Unknown
10856,08/17/2021 12:00:00 AM,08/24/2021 12:00:00 AM,Cyberattack,2021-07-22T00:00:00,,T-Mobile USA,Malware,2079648,Business,Telecommunications,Social Security Number,2022,"1,000,000+",Unknown
10856,08/17/2021 12:00:00 AM,08/24/2021 12:00:00 AM,Cyberattack,2021-07-22T00:00:00,,T-Mobile USA,Malware,2079648,Business,Telecommunications,Driver's License or Washington ID Card Number,2022,"1,000,000+",Unknown
10856,08/17/2021 12:00:00 AM,08/24/2021 12:00:00 AM,Cyberattack,2021-07-22T00:00:00,,T-Mobile USA,Malware,2079648,Business,Telecommunications,Full Date of Birth,2022,"1,000,000+",Unknown
10856,08/17/2021 12:00:00 AM,08/24/2021 12:00:00 AM,Cyberattack,2021-07-22T00:00:00,,T-Mobile USA,Malware,2079648,Business,Telecommunications,Name,2022,"1,000,000+",Unknown
10856,08/17/2021 12:00:00 AM,08/24/2021 12:00:00 AM,Cyberattack,2021-07-22T00:00:00,,T-Mobile USA,Malware,2079648,Business,Telecommunications,Social Security Number,2022,"1,000,000+",Unknown
10856,08/17/2021 12:00:00 AM,08/24/2021 12:00:00 AM,Cyberattack,2021-07-22T00:00:00,,T-Mobile USA,Malware,2079648,Business,Telecommunications,Driver's License or Washington ID Card Number,2022,"1,000,000+",Unknown
10863,12/18/2020 12:00:00 AM,08/24/2021 12:00:00 AM,Cyberattack,,,"SmartStart Employment Screening, Inc.",Malware,639,Business,Other,Name,2022,500-999,Unknown
10863,12/18/2020 12:00:00 AM,08/24/2021 12:00:00 AM,Cyberattack,,,"SmartStart Employment Screening, Inc.",Malware,639,Business,Other,Social Security Number,2022,500-999,Unknown
10864,06/29/2021 12:00:00 AM,08/27/2021 12:00:00 AM,Cyberattack,2021-06-18T00:00:00,2021-06-29T00:00:00,"CareATC, Inc.",Phishing,600,Health,,Name,2022,500-999,1-99
10864,06/29/2021 12:00:00 AM,08/27/2021 12:00:00 AM,Cyberattack,2021-06-18T00:00:00,2021-06-29T00:00:00,"CareATC, Inc.",Phishing,600,Health,,Full Date of Birth,2022,500-999,1-99
10864,06/29/2021 12:00:00 AM,08/27/2021 12:00:00 AM,Cyberattack,2021-06-18T00:00:00,2021-06-29T00:00:00,"CareATC, Inc.",Phishing,600,Health,,Health Insurance Policy or ID Number,2022,500-999,1-99
10864,06/29/2021 12:00:00 AM,08/27/2021 12:00:00 AM,Cyberattack,2021-06-18T00:00:00,2021-06-29T00:00:00,"CareATC, Inc.",Phishing,600,Health,,Medical Information,2022,500-999,1-99
10913,08/17/2020 12:00:00 AM,12/01/2020 12:00:00 AM,Unauthorized Access,2020-05-19T00:00:00,2020-08-17T00:00:00,Kitsap County Credit Union,,3268,Finance,,Name,2021,"1,000-9,999",1-99
10913,08/17/2020 12:00:00 AM,12/01/2020 12:00:00 AM,Unauthorized Access,2020-05-19T00:00:00,2020-08-17T00:00:00,Kitsap County Credit Union,,3268,Finance,,Social Security Number,2021,"1,000-9,999",1-99
10913,08/17/2020 12:00:00 AM,12/01/2020 12:00:00 AM,Unauthorized Access,2020-05-19T00:00:00,2020-08-17T00:00:00,Kitsap County Credit Union,,3268,Finance,,Financial & Banking Information,2021,"1,000-9,999",1-99
10913,08/17/2020 12:00:00 AM,12/01/2020 12:00:00 AM,Unauthorized Access,2020-05-19T00:00:00,2020-08-17T00:00:00,Kitsap County Credit Union,,3268,Finance,,Full Date of Birth,2021,"1,000-9,999",1-99
10913,08/17/2020 12:00:00 AM,12/01/2020 12:00:00 AM,Unauthorized Access,2020-05-19T00:00:00,2020-08-17T00:00:00,Kitsap County Credit Union,,3268,Finance,,Medical Information,2021,"1,000-9,999",1-99
10913,08/17/2020 12:00:00 AM,12/01/2020 12:00:00 AM,Unauthorized Access,2020-05-19T00:00:00,2020-08-17T00:00:00,Kitsap County Credit Union,,3268,Finance,,Other,2021,"1,000-9,999",1-99
10916,07/07/2021 12:00:00 AM,09/03/2021 12:00:00 AM,Cyberattack,2021-07-07T00:00:00,2021-07-07T00:00:00,Famous Smoke Shop,Ransomware,32950,Business,Retail,Name,2022,"10,000-49,999",0
10916,07/07/2021 12:00:00 AM,09/03/2021 12:00:00 AM,Cyberattack,2021-07-07T00:00:00,2021-07-07T00:00:00,Famous Smoke Shop,Ransomware,32950,Business,Retail,Full Date of Birth,2022,"10,000-49,999",0
10916,07/07/2021 12:00:00 AM,09/03/2021 12:00:00 AM,Cyberattack,2021-07-07T00:00:00,2021-07-07T00:00:00,Famous Smoke Shop,Ransomware,32950,Business,Retail,Email Address and Password/Security Question Answers,2022,"10,000-49,999",0
10916,07/07/2021 12:00:00 AM,09/03/2021 12:00:00 AM,Cyberattack,2021-07-07T00:00:00,2021-07-07T00:00:00,Famous Smoke Shop,Ransomware,32950,Business,Retail,Other,2022,"10,000-49,999",0
11011,09/15/2021 12:00:00 AM,09/22/2021 12:00:00 AM,Unauthorized Access,2021-09-13T00:00:00,,"Epik Holdings, Inc.",,2040,Business,Web Services,Name,2022,"1,000-9,999",Unknown
11011,09/15/2021 12:00:00 AM,09/22/2021 12:00:00 AM,Unauthorized Access,2021-09-13T00:00:00,,"Epik Holdings, Inc.",,2040,Business,Web Services,Financial & Banking Information,2022,"1,000-9,999",Unknown
11011,09/15/2021 12:00:00 AM,09/22/2021 12:00:00 AM,Unauthorized Access,2021-09-13T00:00:00,,"Epik Holdings, Inc.",,2040,Business,Web Services,Username and Password/Security Question Answers,2022,"1,000-9,999",Unknown
11011,09/15/2021 12:00:00 AM,09/22/2021 12:00:00 AM,Unauthorized Access,2021-09-13T00:00:00,,"Epik Holdings, Inc.",,2040,Business,Web Services,Email Address and Password/Security Question Answers,2022,"1,000-9,999",Unknown
11012,01/24/2021 12:00:00 AM,09/24/2021 12:00:00 AM,Cyberattack,2021-01-24T00:00:00,2021-01-24T00:00:00,Golden Entertainment,Ransomware,3223,Business,Entertainment,Military ID Number,2022,"1,000-9,999",0
11012,01/24/2021 12:00:00 AM,09/24/2021 12:00:00 AM,Cyberattack,2021-01-24T00:00:00,2021-01-24T00:00:00,Golden Entertainment,Ransomware,3223,Business,Entertainment,Name,2022,"1,000-9,999",0
11012,01/24/2021 12:00:00 AM,09/24/2021 12:00:00 AM,Cyberattack,2021-01-24T00:00:00,2021-01-24T00:00:00,Golden Entertainment,Ransomware,3223,Business,Entertainment,Social Security Number,2022,"1,000-9,999",0
11012,01/24/2021 12:00:00 AM,09/24/2021 12:00:00 AM,Cyberattack,2021-01-24T00:00:00,2021-01-24T00:00:00,Golden Entertainment,Ransomware,3223,Business,Entertainment,Driver's License or Washington ID Card Number,2022,"1,000-9,999",0
11012,01/24/2021 12:00:00 AM,09/24/2021 12:00:00 AM,Cyberattack,2021-01-24T00:00:00,2021-01-24T00:00:00,Golden Entertainment,Ransomware,3223,Business,Entertainment,Full Date of Birth,2022,"1,000-9,999",0
11029,07/02/2021 12:00:00 AM,08/09/2021 12:00:00 AM,Cyberattack,,,"Spreadshirt, Inc.",Ransomware,911,Business,Clothing,Name,2022,500-999,Unknown
11029,07/02/2021 12:00:00 AM,08/09/2021 12:00:00 AM,Cyberattack,,,"Spreadshirt, Inc.",Ransomware,911,Business,Clothing,Financial & Banking Information,2022,500-999,Unknown
11029,07/02/2021 12:00:00 AM,08/09/2021 12:00:00 AM,Cyberattack,,,"Spreadshirt, Inc.",Ransomware,911,Business,Clothing,Name,2022,500-999,Unknown
11029,07/02/2021 12:00:00 AM,08/09/2021 12:00:00 AM,Cyberattack,,,"Spreadshirt, Inc.",Ransomware,911,Business,Clothing,Financial & Banking Information,2022,500-999,Unknown
11033,09/14/2021 12:00:00 AM,09/24/2021 12:00:00 AM,Theft or Mistake,2021-09-09T00:00:00,2021-09-09T00:00:00,Zenith American Solutions,,1687,Health,,Name,2022,"1,000-9,999",1-99
11033,09/14/2021 12:00:00 AM,09/24/2021 12:00:00 AM,Theft or Mistake,2021-09-09T00:00:00,2021-09-09T00:00:00,Zenith American Solutions,,1687,Health,,Social Security Number,2022,"1,000-9,999",1-99
11035,03/15/2021 12:00:00 AM,08/30/2021 12:00:00 AM,Unauthorized Access,2021-03-13T00:00:00,,"Hyphen, LLC",,1331,Finance,,Name,2022,"1,000-9,999",Unknown
11035,03/15/2021 12:00:00 AM,08/30/2021 12:00:00 AM,Unauthorized Access,2021-03-13T00:00:00,,"Hyphen, LLC",,1331,Finance,,Social Security Number,2022,"1,000-9,999",Unknown
11035,03/15/2021 12:00:00 AM,08/30/2021 12:00:00 AM,Unauthorized Access,2021-03-13T00:00:00,,"Hyphen, LLC",,1331,Finance,,Financial & Banking Information,2022,"1,000-9,999",Unknown
11035,03/15/2021 12:00:00 AM,08/30/2021 12:00:00 AM,Unauthorized Access,2021-03-13T00:00:00,,"Hyphen, LLC",,1331,Finance,,Full Date of Birth,2022,"1,000-9,999",Unknown
11040,11/20/2020 12:00:00 AM,09/21/2021 12:00:00 AM,Cyberattack,2020-03-11T00:00:00,2020-12-15T00:00:00,"Dick Blick Holdings, Inc.",Malware,690,Business,Retail,Name,2022,500-999,200-299
11040,11/20/2020 12:00:00 AM,09/21/2021 12:00:00 AM,Cyberattack,2020-03-11T00:00:00,2020-12-15T00:00:00,"Dick Blick Holdings, Inc.",Malware,690,Business,Retail,Financial & Banking Information,2022,500-999,200-299
11041,03/30/2021 12:00:00 AM,09/24/2021 12:00:00 AM,Unauthorized Access,,2021-08-27T00:00:00,"Hattrup & Associates, P.S.",,2839,Finance,,Name,2022,"1,000-9,999",Unknown
11041,03/30/2021 12:00:00 AM,09/24/2021 12:00:00 AM,Unauthorized Access,,2021-08-27T00:00:00,"Hattrup & Associates, P.S.",,2839,Finance,,Social Security Number,2022,"1,000-9,999",Unknown
11041,03/30/2021 12:00:00 AM,09/24/2021 12:00:00 AM,Unauthorized Access,,2021-08-27T00:00:00,"Hattrup & Associates, P.S.",,2839,Finance,,Driver's License or Washington ID Card Number,2022,"1,000-9,999",Unknown
11041,03/30/2021 12:00:00 AM,09/24/2021 12:00:00 AM,Unauthorized Access,,2021-08-27T00:00:00,"Hattrup & Associates, P.S.",,2839,Finance,,Financial & Banking Information,2022,"1,000-9,999",Unknown
11041,03/30/2021 12:00:00 AM,09/24/2021 12:00:00 AM,Unauthorized Access,,2021-08-27T00:00:00,"Hattrup & Associates, P.S.",,2839,Finance,,Full Date of Birth,2022,"1,000-9,999",Unknown
11043,09/09/2021 12:00:00 AM,09/30/2021 12:00:00 AM,Unauthorized Access,2020-05-02T00:00:00,2020-05-17T00:00:00,"The Neiman Marcus Group, LLC (NMG or the Company)",,67410,Business,Retail,Name,2022,"50,000-999,999",400-499
11043,09/09/2021 12:00:00 AM,09/30/2021 12:00:00 AM,Unauthorized Access,2020-05-02T00:00:00,2020-05-17T00:00:00,"The Neiman Marcus Group, LLC (NMG or the Company)",,67410,Business,Retail,Financial & Banking Information,2022,"50,000-999,999",400-499
11043,09/09/2021 12:00:00 AM,09/30/2021 12:00:00 AM,Unauthorized Access,2020-05-02T00:00:00,2020-05-17T00:00:00,"The Neiman Marcus Group, LLC (NMG or the Company)",,67410,Business,Retail,Username and Password/Security Question Answers,2022,"50,000-999,999",400-499
11100,04/24/2021 12:00:00 AM,10/08/2021 12:00:00 AM,Cyberattack,2021-04-23T00:00:00,2021-04-24T00:00:00,Smile Brands Inc.,Ransomware,108927,Health,,Name,2022,"50,000-999,999",1-99
11100,04/24/2021 12:00:00 AM,10/08/2021 12:00:00 AM,Cyberattack,2021-04-23T00:00:00,2021-04-24T00:00:00,Smile Brands Inc.,Ransomware,108927,Health,,Social Security Number,2022,"50,000-999,999",1-99
11100,04/24/2021 12:00:00 AM,10/08/2021 12:00:00 AM,Cyberattack,2021-04-23T00:00:00,2021-04-24T00:00:00,Smile Brands Inc.,Ransomware,108927,Health,,Financial & Banking Information,2022,"50,000-999,999",1-99
11100,04/24/2021 12:00:00 AM,10/08/2021 12:00:00 AM,Cyberattack,2021-04-23T00:00:00,2021-04-24T00:00:00,Smile Brands Inc.,Ransomware,108927,Health,,Full Date of Birth,2022,"50,000-999,999",1-99
11100,04/24/2021 12:00:00 AM,10/08/2021 12:00:00 AM,Cyberattack,2021-04-23T00:00:00,2021-04-24T00:00:00,Smile Brands Inc.,Ransomware,108927,Health,,Health Insurance Policy or ID Number,2022,"50,000-999,999",1-99
11100,04/24/2021 12:00:00 AM,10/08/2021 12:00:00 AM,Cyberattack,2021-04-23T00:00:00,2021-04-24T00:00:00,Smile Brands Inc.,Ransomware,108927,Health,,Medical Information,2022,"50,000-999,999",1-99
11101,08/10/2021 12:00:00 AM,10/08/2021 12:00:00 AM,Cyberattack,2021-08-08T00:00:00,2021-08-10T00:00:00,"ReproSource Fertility Diagnostics, Inc.",Ransomware,7781,Health,,Financial & Banking Information,2022,"1,000-9,999",1-99
11101,08/10/2021 12:00:00 AM,10/08/2021 12:00:00 AM,Cyberattack,2021-08-08T00:00:00,2021-08-10T00:00:00,"ReproSource Fertility Diagnostics, Inc.",Ransomware,7781,Health,,Full Date of Birth,2022,"1,000-9,999",1-99
11101,08/10/2021 12:00:00 AM,10/08/2021 12:00:00 AM,Cyberattack,2021-08-08T00:00:00,2021-08-10T00:00:00,"ReproSource Fertility Diagnostics, Inc.",Ransomware,7781,Health,,Passport Number,2022,"1,000-9,999",1-99
11101,08/10/2021 12:00:00 AM,10/08/2021 12:00:00 AM,Cyberattack,2021-08-08T00:00:00,2021-08-10T00:00:00,"ReproSource Fertility Diagnostics, Inc.",Ransomware,7781,Health,,Health Insurance Policy or ID Number,2022,"1,000-9,999",1-99
11101,08/10/2021 12:00:00 AM,10/08/2021 12:00:00 AM,Cyberattack,2021-08-08T00:00:00,2021-08-10T00:00:00,"ReproSource Fertility Diagnostics, Inc.",Ransomware,7781,Health,,Medical Information,2022,"1,000-9,999",1-99
11101,08/10/2021 12:00:00 AM,10/08/2021 12:00:00 AM,Cyberattack,2021-08-08T00:00:00,2021-08-10T00:00:00,"ReproSource Fertility Diagnostics, Inc.",Ransomware,7781,Health,,Email Address and Password/Security Question Answers,2022,"1,000-9,999",1-99
11101,08/10/2021 12:00:00 AM,10/08/2021 12:00:00 AM,Cyberattack,2021-08-08T00:00:00,2021-08-10T00:00:00,"ReproSource Fertility Diagnostics, Inc.",Ransomware,7781,Health,,Name,2022,"1,000-9,999",1-99
11101,08/10/2021 12:00:00 AM,10/08/2021 12:00:00 AM,Cyberattack,2021-08-08T00:00:00,2021-08-10T00:00:00,"ReproSource Fertility Diagnostics, Inc.",Ransomware,7781,Health,,Social Security Number,2022,"1,000-9,999",1-99
11101,08/10/2021 12:00:00 AM,10/08/2021 12:00:00 AM,Cyberattack,2021-08-08T00:00:00,2021-08-10T00:00:00,"ReproSource Fertility Diagnostics, Inc.",Ransomware,7781,Health,,Driver's License or Washington ID Card Number,2022,"1,000-9,999",1-99
11106,07/03/2021 12:00:00 AM,10/04/2021 12:00:00 AM,Unauthorized Access,2021-07-01T00:00:00,2021-10-05T00:00:00,Royell Manufacturing,,1145,Business,Other,Name,2022,"1,000-9,999",1-99
11106,07/03/2021 12:00:00 AM,10/04/2021 12:00:00 AM,Unauthorized Access,2021-07-01T00:00:00,2021-10-05T00:00:00,Royell Manufacturing,,1145,Business,Other,Social Security Number,2022,"1,000-9,999",1-99
11106,07/03/2021 12:00:00 AM,10/04/2021 12:00:00 AM,Unauthorized Access,2021-07-01T00:00:00,2021-10-05T00:00:00,Royell Manufacturing,,1145,Business,Other,Financial & Banking Information,2022,"1,000-9,999",1-99
11113,06/14/2021 12:00:00 AM,10/11/2021 12:00:00 AM,Cyberattack,2021-06-14T00:00:00,2021-06-15T00:00:00,University Medical Center of Southern Nevada (UMC),Unclear/unknown,3572,Health,,Name,2022,"1,000-9,999",1-99
11113,06/14/2021 12:00:00 AM,10/11/2021 12:00:00 AM,Cyberattack,2021-06-14T00:00:00,2021-06-15T00:00:00,University Medical Center of Southern Nevada (UMC),Unclear/unknown,3572,Health,,Social Security Number,2022,"1,000-9,999",1-99
11113,06/14/2021 12:00:00 AM,10/11/2021 12:00:00 AM,Cyberattack,2021-06-14T00:00:00,2021-06-15T00:00:00,University Medical Center of Southern Nevada (UMC),Unclear/unknown,3572,Health,,Full Date of Birth,2022,"1,000-9,999",1-99
11113,06/14/2021 12:00:00 AM,10/11/2021 12:00:00 AM,Cyberattack,2021-06-14T00:00:00,2021-06-15T00:00:00,University Medical Center of Southern Nevada (UMC),Unclear/unknown,3572,Health,,Health Insurance Policy or ID Number,2022,"1,000-9,999",1-99
11113,06/14/2021 12:00:00 AM,10/11/2021 12:00:00 AM,Cyberattack,2021-06-14T00:00:00,2021-06-15T00:00:00,University Medical Center of Southern Nevada (UMC),Unclear/unknown,3572,Health,,Medical Information,2022,"1,000-9,999",1-99
11124,06/25/2020 12:00:00 AM,10/13/2021 12:00:00 AM,Cyberattack,2020-06-25T00:00:00,2020-06-25T00:00:00,American Osteopathic Association,Ransomware,4253,Non-Profit/Charity,,Social Security Number,2022,"1,000-9,999",0
11124,06/25/2020 12:00:00 AM,10/13/2021 12:00:00 AM,Cyberattack,2020-06-25T00:00:00,2020-06-25T00:00:00,American Osteopathic Association,Ransomware,4253,Non-Profit/Charity,,Financial & Banking Information,2022,"1,000-9,999",0
11124,06/25/2020 12:00:00 AM,10/13/2021 12:00:00 AM,Cyberattack,2020-06-25T00:00:00,2020-06-25T00:00:00,American Osteopathic Association,Ransomware,4253,Non-Profit/Charity,,Full Date of Birth,2022,"1,000-9,999",0
11124,06/25/2020 12:00:00 AM,10/13/2021 12:00:00 AM,Cyberattack,2020-06-25T00:00:00,2020-06-25T00:00:00,American Osteopathic Association,Ransomware,4253,Non-Profit/Charity,,Username and Password/Security Question Answers,2022,"1,000-9,999",0
11124,06/25/2020 12:00:00 AM,10/13/2021 12:00:00 AM,Cyberattack,2020-06-25T00:00:00,2020-06-25T00:00:00,American Osteopathic Association,Ransomware,4253,Non-Profit/Charity,,Email Address and Password/Security Question Answers,2022,"1,000-9,999",0
11125,09/11/2021 12:00:00 AM,10/14/2021 12:00:00 AM,Unauthorized Access,2021-09-11T00:00:00,2021-09-11T00:00:00,The Public School and Education Employees Retirement Systems,,532,Government,,Name,2022,500-999,0
11125,09/11/2021 12:00:00 AM,10/14/2021 12:00:00 AM,Unauthorized Access,2021-09-11T00:00:00,2021-09-11T00:00:00,The Public School and Education Employees Retirement Systems,,532,Government,,Social Security Number,2022,500-999,0
11125,09/11/2021 12:00:00 AM,10/14/2021 12:00:00 AM,Unauthorized Access,2021-09-11T00:00:00,2021-09-11T00:00:00,The Public School and Education Employees Retirement Systems,,532,Government,,Financial & Banking Information,2022,500-999,0
11125,09/11/2021 12:00:00 AM,10/14/2021 12:00:00 AM,Unauthorized Access,2021-09-11T00:00:00,2021-09-11T00:00:00,The Public School and Education Employees Retirement Systems,,532,Government,,Full Date of Birth,2022,500-999,0
11125,09/11/2021 12:00:00 AM,10/14/2021 12:00:00 AM,Unauthorized Access,2021-09-11T00:00:00,2021-09-11T00:00:00,The Public School and Education Employees Retirement Systems,,532,Government,,Other,2022,500-999,0
11126,11/18/2020 12:00:00 AM,10/14/2021 12:00:00 AM,Cyberattack,2020-07-21T00:00:00,2020-12-19T00:00:00,"Elevated Title, LLC",Phishing,685,Business,Other,Name,2022,500-999,100-199
11126,11/18/2020 12:00:00 AM,10/14/2021 12:00:00 AM,Cyberattack,2020-07-21T00:00:00,2020-12-19T00:00:00,"Elevated Title, LLC",Phishing,685,Business,Other,Social Security Number,2022,500-999,100-199
11126,11/18/2020 12:00:00 AM,10/14/2021 12:00:00 AM,Cyberattack,2020-07-21T00:00:00,2020-12-19T00:00:00,"Elevated Title, LLC",Phishing,685,Business,Other,Driver's License or Washington ID Card Number,2022,500-999,100-199
11126,11/18/2020 12:00:00 AM,10/14/2021 12:00:00 AM,Cyberattack,2020-07-21T00:00:00,2020-12-19T00:00:00,"Elevated Title, LLC",Phishing,685,Business,Other,Financial & Banking Information,2022,500-999,100-199
11126,11/18/2020 12:00:00 AM,10/14/2021 12:00:00 AM,Cyberattack,2020-07-21T00:00:00,2020-12-19T00:00:00,"Elevated Title, LLC",Phishing,685,Business,Other,Full Date of Birth,2022,500-999,100-199
11126,11/18/2020 12:00:00 AM,10/14/2021 12:00:00 AM,Cyberattack,2020-07-21T00:00:00,2020-12-19T00:00:00,"Elevated Title, LLC",Phishing,685,Business,Other,Military ID Number,2022,500-999,100-199
11126,11/18/2020 12:00:00 AM,10/14/2021 12:00:00 AM,Cyberattack,2020-07-21T00:00:00,2020-12-19T00:00:00,"Elevated Title, LLC",Phishing,685,Business,Other,Passport Number,2022,500-999,100-199
11126,11/18/2020 12:00:00 AM,10/14/2021 12:00:00 AM,Cyberattack,2020-07-21T00:00:00,2020-12-19T00:00:00,"Elevated Title, LLC",Phishing,685,Business,Other,Health Insurance Policy or ID Number,2022,500-999,100-199
11126,11/18/2020 12:00:00 AM,10/14/2021 12:00:00 AM,Cyberattack,2020-07-21T00:00:00,2020-12-19T00:00:00,"Elevated Title, LLC",Phishing,685,Business,Other,Medical Information,2022,500-999,100-199
11129,09/08/2021 12:00:00 AM,10/18/2021 12:00:00 AM,Cyberattack,2021-07-01T00:00:00,2021-07-07T00:00:00,World Travel Holdings,Ransomware,1692,Business,Hospitality,Full Date of Birth,2022,"1,000-9,999",1-99
11129,09/08/2021 12:00:00 AM,10/18/2021 12:00:00 AM,Cyberattack,2021-07-01T00:00:00,2021-07-07T00:00:00,World Travel Holdings,Ransomware,1692,Business,Hospitality,Passport Number,2022,"1,000-9,999",1-99
11129,09/08/2021 12:00:00 AM,10/18/2021 12:00:00 AM,Cyberattack,2021-07-01T00:00:00,2021-07-07T00:00:00,World Travel Holdings,Ransomware,1692,Business,Hospitality,Username and Password/Security Question Answers,2022,"1,000-9,999",1-99
11129,09/08/2021 12:00:00 AM,10/18/2021 12:00:00 AM,Cyberattack,2021-07-01T00:00:00,2021-07-07T00:00:00,World Travel Holdings,Ransomware,1692,Business,Hospitality,Name,2022,"1,000-9,999",1-99
11129,09/08/2021 12:00:00 AM,10/18/2021 12:00:00 AM,Cyberattack,2021-07-01T00:00:00,2021-07-07T00:00:00,World Travel Holdings,Ransomware,1692,Business,Hospitality,Social Security Number,2022,"1,000-9,999",1-99
11129,09/08/2021 12:00:00 AM,10/18/2021 12:00:00 AM,Cyberattack,2021-07-01T00:00:00,2021-07-07T00:00:00,World Travel Holdings,Ransomware,1692,Business,Hospitality,Driver's License or Washington ID Card Number,2022,"1,000-9,999",1-99
11129,09/08/2021 12:00:00 AM,10/18/2021 12:00:00 AM,Cyberattack,2021-07-01T00:00:00,2021-07-07T00:00:00,World Travel Holdings,Ransomware,1692,Business,Hospitality,Financial & Banking Information,2022,"1,000-9,999",1-99
11130,07/15/2021 12:00:00 AM,10/20/2021 12:00:00 AM,Cyberattack,2021-07-15T00:00:00,,Buddhist Tzu Chi Foundation,Ransomware,582,Non-Profit/Charity,,Name,2022,500-999,Unknown
11130,07/15/2021 12:00:00 AM,10/20/2021 12:00:00 AM,Cyberattack,2021-07-15T00:00:00,,Buddhist Tzu Chi Foundation,Ransomware,582,Non-Profit/Charity,,Social Security Number,2022,500-999,Unknown
11130,07/15/2021 12:00:00 AM,10/20/2021 12:00:00 AM,Cyberattack,2021-07-15T00:00:00,,Buddhist Tzu Chi Foundation,Ransomware,582,Non-Profit/Charity,,Email Address and Password/Security Question Answers,2022,500-999,Unknown
11131,08/05/2021 12:00:00 AM,10/21/2021 12:00:00 AM,Cyberattack,2021-08-02T00:00:00,2021-08-05T00:00:00,"Wallick & Volk, Inc.",Malware,1625,Finance,,Name,2022,"1,000-9,999",1-99
11131,08/05/2021 12:00:00 AM,10/21/2021 12:00:00 AM,Cyberattack,2021-08-02T00:00:00,2021-08-05T00:00:00,"Wallick & Volk, Inc.",Malware,1625,Finance,,Social Security Number,2022,"1,000-9,999",1-99
11131,08/05/2021 12:00:00 AM,10/21/2021 12:00:00 AM,Cyberattack,2021-08-02T00:00:00,2021-08-05T00:00:00,"Wallick & Volk, Inc.",Malware,1625,Finance,,Financial & Banking Information,2022,"1,000-9,999",1-99
11192,05/21/2021 12:00:00 AM,10/29/2021 12:00:00 AM,Cyberattack,2021-05-21T00:00:00,2021-05-21T00:00:00,"Goldwater Bank, N.A.",Ransomware,762,Finance,,Name,2022,500-999,0
11192,05/21/2021 12:00:00 AM,10/29/2021 12:00:00 AM,Cyberattack,2021-05-21T00:00:00,2021-05-21T00:00:00,"Goldwater Bank, N.A.",Ransomware,762,Finance,,Social Security Number,2022,500-999,0
11192,05/21/2021 12:00:00 AM,10/29/2021 12:00:00 AM,Cyberattack,2021-05-21T00:00:00,2021-05-21T00:00:00,"Goldwater Bank, N.A.",Ransomware,762,Finance,,Financial & Banking Information,2022,500-999,0
11207,03/16/2021 12:00:00 AM,10/21/2021 12:00:00 AM,Unauthorized Access,2021-02-03T00:00:00,2021-03-16T00:00:00,"SCUF Gaming International, LLC",,691,Business,Manufacturing,Name,2022,500-999,1-99
11207,03/16/2021 12:00:00 AM,10/21/2021 12:00:00 AM,Unauthorized Access,2021-02-03T00:00:00,2021-03-16T00:00:00,"SCUF Gaming International, LLC",,691,Business,Manufacturing,Financial & Banking Information,2022,500-999,1-99
11207,03/16/2021 12:00:00 AM,10/21/2021 12:00:00 AM,Unauthorized Access,2021-02-03T00:00:00,2021-03-16T00:00:00,"SCUF Gaming International, LLC",,691,Business,Manufacturing,Email Address and Password/Security Question Answers,2022,500-999,1-99
11218,06/24/2021 12:00:00 AM,11/15/2021 12:00:00 AM,Cyberattack,,,Sea Mar Community Health Centers,Unclear/unknown,628569,Health,,Name,2022,"50,000-999,999",Unknown
11218,06/24/2021 12:00:00 AM,11/15/2021 12:00:00 AM,Cyberattack,,,Sea Mar Community Health Centers,Unclear/unknown,628569,Health,,Social Security Number,2022,"50,000-999,999",Unknown
11218,06/24/2021 12:00:00 AM,11/15/2021 12:00:00 AM,Cyberattack,,,Sea Mar Community Health Centers,Unclear/unknown,628569,Health,,Full Date of Birth,2022,"50,000-999,999",Unknown
11218,06/24/2021 12:00:00 AM,11/15/2021 12:00:00 AM,Cyberattack,,,Sea Mar Community Health Centers,Unclear/unknown,628569,Health,,Health Insurance Policy or ID Number,2022,"50,000-999,999",Unknown
11218,06/24/2021 12:00:00 AM,11/15/2021 12:00:00 AM,Cyberattack,,,Sea Mar Community Health Centers,Unclear/unknown,628569,Health,,Medical Information,2022,"50,000-999,999",Unknown
11218,06/24/2021 12:00:00 AM,11/15/2021 12:00:00 AM,Cyberattack,,,Sea Mar Community Health Centers,Unclear/unknown,628569,Health,,Other,2022,"50,000-999,999",Unknown
11225,06/03/2021 12:00:00 AM,10/28/2021 12:00:00 AM,Cyberattack,2021-06-03T00:00:00,2021-06-03T00:00:00,"Terrier Media Buyer, Inc. dba Cox Media Group",Ransomware,693,Business,Telecommunications,Name,2022,500-999,0
11225,06/03/2021 12:00:00 AM,10/28/2021 12:00:00 AM,Cyberattack,2021-06-03T00:00:00,2021-06-03T00:00:00,"Terrier Media Buyer, Inc. dba Cox Media Group",Ransomware,693,Business,Telecommunications,Social Security Number,2022,500-999,0
11225,06/03/2021 12:00:00 AM,10/28/2021 12:00:00 AM,Cyberattack,2021-06-03T00:00:00,2021-06-03T00:00:00,"Terrier Media Buyer, Inc. dba Cox Media Group",Ransomware,693,Business,Telecommunications,Driver's License or Washington ID Card Number,2022,500-999,0
11225,06/03/2021 12:00:00 AM,10/28/2021 12:00:00 AM,Cyberattack,2021-06-03T00:00:00,2021-06-03T00:00:00,"Terrier Media Buyer, Inc. dba Cox Media Group",Ransomware,693,Business,Telecommunications,Email Address and Password/Security Question Answers,2022,500-999,0
11225,06/03/2021 12:00:00 AM,10/28/2021 12:00:00 AM,Cyberattack,2021-06-03T00:00:00,2021-06-03T00:00:00,"Terrier Media Buyer, Inc. dba Cox Media Group",Ransomware,693,Business,Telecommunications,Financial & Banking Information,2022,500-999,0
11225,06/03/2021 12:00:00 AM,10/28/2021 12:00:00 AM,Cyberattack,2021-06-03T00:00:00,2021-06-03T00:00:00,"Terrier Media Buyer, Inc. dba Cox Media Group",Ransomware,693,Business,Telecommunications,Full Date of Birth,2022,500-999,0
11225,06/03/2021 12:00:00 AM,10/28/2021 12:00:00 AM,Cyberattack,2021-06-03T00:00:00,2021-06-03T00:00:00,"Terrier Media Buyer, Inc. dba Cox Media Group",Ransomware,693,Business,Telecommunications,Passport Number,2022,500-999,0
11225,06/03/2021 12:00:00 AM,10/28/2021 12:00:00 AM,Cyberattack,2021-06-03T00:00:00,2021-06-03T00:00:00,"Terrier Media Buyer, Inc. dba Cox Media Group",Ransomware,693,Business,Telecommunications,Health Insurance Policy or ID Number,2022,500-999,0
11225,06/03/2021 12:00:00 AM,10/28/2021 12:00:00 AM,Cyberattack,2021-06-03T00:00:00,2021-06-03T00:00:00,"Terrier Media Buyer, Inc. dba Cox Media Group",Ransomware,693,Business,Telecommunications,Medical Information,2022,500-999,0
11225,06/03/2021 12:00:00 AM,10/28/2021 12:00:00 AM,Cyberattack,2021-06-03T00:00:00,2021-06-03T00:00:00,"Terrier Media Buyer, Inc. dba Cox Media Group",Ransomware,693,Business,Telecommunications,Username and Password/Security Question Answers,2022,500-999,0
11226,09/01/2021 12:00:00 AM,11/08/2021 12:00:00 AM,Unauthorized Access,,2021-09-12T00:00:00,"Insureon Holdings, LLC",,671,Finance,,Name,2022,500-999,Unknown
11226,09/01/2021 12:00:00 AM,11/08/2021 12:00:00 AM,Unauthorized Access,,2021-09-12T00:00:00,"Insureon Holdings, LLC",,671,Finance,,Social Security Number,2022,500-999,Unknown
11226,09/01/2021 12:00:00 AM,11/08/2021 12:00:00 AM,Unauthorized Access,,2021-09-12T00:00:00,"Insureon Holdings, LLC",,671,Finance,,Full Date of Birth,2022,500-999,Unknown
11232,08/03/2020 12:00:00 AM,11/09/2021 12:00:00 AM,Unauthorized Access,2020-07-31T00:00:00,2020-08-04T00:00:00,Hoffman Construction Company,,3078,Business,Construction,Name,2022,"1,000-9,999",1-99
11232,08/03/2020 12:00:00 AM,11/09/2021 12:00:00 AM,Unauthorized Access,2020-07-31T00:00:00,2020-08-04T00:00:00,Hoffman Construction Company,,3078,Business,Construction,Social Security Number,2022,"1,000-9,999",1-99
11232,08/03/2020 12:00:00 AM,11/09/2021 12:00:00 AM,Unauthorized Access,2020-07-31T00:00:00,2020-08-04T00:00:00,Hoffman Construction Company,,3078,Business,Construction,Financial & Banking Information,2022,"1,000-9,999",1-99
11232,08/03/2020 12:00:00 AM,11/09/2021 12:00:00 AM,Unauthorized Access,2020-07-31T00:00:00,2020-08-04T00:00:00,Hoffman Construction Company,,3078,Business,Construction,Full Date of Birth,2022,"1,000-9,999",1-99
11232,08/03/2020 12:00:00 AM,11/09/2021 12:00:00 AM,Unauthorized Access,2020-07-31T00:00:00,2020-08-04T00:00:00,Hoffman Construction Company,,3078,Business,Construction,Health Insurance Policy or ID Number,2022,"1,000-9,999",1-99
11232,08/03/2020 12:00:00 AM,11/09/2021 12:00:00 AM,Unauthorized Access,2020-07-31T00:00:00,2020-08-04T00:00:00,Hoffman Construction Company,,3078,Business,Construction,Medical Information,2022,"1,000-9,999",1-99
11233,12/24/2020 12:00:00 AM,11/10/2021 12:00:00 AM,Cyberattack,2020-12-24T00:00:00,2021-02-15T00:00:00,Christensen OConnor Johnson Kindness PLLC,Malware,815,Business,Legal,Name,2022,500-999,1-99
11233,12/24/2020 12:00:00 AM,11/10/2021 12:00:00 AM,Cyberattack,2020-12-24T00:00:00,2021-02-15T00:00:00,Christensen OConnor Johnson Kindness PLLC,Malware,815,Business,Legal,Social Security Number,2022,500-999,1-99
11233,12/24/2020 12:00:00 AM,11/10/2021 12:00:00 AM,Cyberattack,2020-12-24T00:00:00,2021-02-15T00:00:00,Christensen OConnor Johnson Kindness PLLC,Malware,815,Business,Legal,Financial & Banking Information,2022,500-999,1-99
11233,12/24/2020 12:00:00 AM,11/10/2021 12:00:00 AM,Cyberattack,2020-12-24T00:00:00,2021-02-15T00:00:00,Christensen OConnor Johnson Kindness PLLC,Malware,815,Business,Legal,Full Date of Birth,2022,500-999,1-99
11234,06/22/2021 12:00:00 AM,11/11/2021 12:00:00 AM,Unauthorized Access,2021-02-18T00:00:00,2021-06-29T00:00:00,Opportunity Council,,664,Non-Profit/Charity,,Full Date of Birth,2022,500-999,100-199
11234,06/22/2021 12:00:00 AM,11/11/2021 12:00:00 AM,Unauthorized Access,2021-02-18T00:00:00,2021-06-29T00:00:00,Opportunity Council,,664,Non-Profit/Charity,,Health Insurance Policy or ID Number,2022,500-999,100-199
11234,06/22/2021 12:00:00 AM,11/11/2021 12:00:00 AM,Unauthorized Access,2021-02-18T00:00:00,2021-06-29T00:00:00,Opportunity Council,,664,Non-Profit/Charity,,Name,2022,500-999,100-199
11234,06/22/2021 12:00:00 AM,11/11/2021 12:00:00 AM,Unauthorized Access,2021-02-18T00:00:00,2021-06-29T00:00:00,Opportunity Council,,664,Non-Profit/Charity,,Social Security Number,2022,500-999,100-199
11234,06/22/2021 12:00:00 AM,11/11/2021 12:00:00 AM,Unauthorized Access,2021-02-18T00:00:00,2021-06-29T00:00:00,Opportunity Council,,664,Non-Profit/Charity,,Driver's License or Washington ID Card Number,2022,500-999,100-199
11234,06/22/2021 12:00:00 AM,11/11/2021 12:00:00 AM,Unauthorized Access,2021-02-18T00:00:00,2021-06-29T00:00:00,Opportunity Council,,664,Non-Profit/Charity,,Financial & Banking Information,2022,500-999,100-199
11235,11/24/2020 12:00:00 AM,10/20/2021 12:00:00 AM,Cyberattack,,,Abeo Solutions Inc. d/b/a Crystal Practice Management,Ransomware,6141,Health,,Health Insurance Policy or ID Number,2022,"1,000-9,999",Unknown
11235,11/24/2020 12:00:00 AM,10/20/2021 12:00:00 AM,Cyberattack,,,Abeo Solutions Inc. d/b/a Crystal Practice Management,Ransomware,6141,Health,,Medical Information,2022,"1,000-9,999",Unknown
11235,11/24/2020 12:00:00 AM,10/20/2021 12:00:00 AM,Cyberattack,,,Abeo Solutions Inc. d/b/a Crystal Practice Management,Ransomware,6141,Health,,Biometric Data,2022,"1,000-9,999",Unknown
11235,11/24/2020 12:00:00 AM,10/20/2021 12:00:00 AM,Cyberattack,,,Abeo Solutions Inc. d/b/a Crystal Practice Management,Ransomware,6141,Health,,Name,2022,"1,000-9,999",Unknown
11235,11/24/2020 12:00:00 AM,10/20/2021 12:00:00 AM,Cyberattack,,,Abeo Solutions Inc. d/b/a Crystal Practice Management,Ransomware,6141,Health,,Social Security Number,2022,"1,000-9,999",Unknown
11235,11/24/2020 12:00:00 AM,10/20/2021 12:00:00 AM,Cyberattack,,,Abeo Solutions Inc. d/b/a Crystal Practice Management,Ransomware,6141,Health,,Full Date of Birth,2022,"1,000-9,999",Unknown
11236,07/02/2021 12:00:00 AM,10/20/2021 12:00:00 AM,Theft or Mistake,2020-08-17T00:00:00,2021-07-02T00:00:00,"J.B. Hunt Transport, Inc.",,3798,Business,Transportation,Name,2022,"1,000-9,999",300-399
11236,07/02/2021 12:00:00 AM,10/20/2021 12:00:00 AM,Theft or Mistake,2020-08-17T00:00:00,2021-07-02T00:00:00,"J.B. Hunt Transport, Inc.",,3798,Business,Transportation,Social Security Number,2022,"1,000-9,999",300-399
11237,08/08/2021 12:00:00 AM,10/27/2021 12:00:00 AM,Cyberattack,,,Primary Residential Mortgage,Malware,1712,Finance,,Social Security Number,2022,"1,000-9,999",Unknown
11237,08/08/2021 12:00:00 AM,10/27/2021 12:00:00 AM,Cyberattack,,,Primary Residential Mortgage,Malware,1712,Finance,,Driver's License or Washington ID Card Number,2022,"1,000-9,999",Unknown
11237,08/08/2021 12:00:00 AM,10/27/2021 12:00:00 AM,Cyberattack,,,Primary Residential Mortgage,Malware,1712,Finance,,Name,2022,"1,000-9,999",Unknown
11238,10/09/2021 12:00:00 AM,11/22/2021 12:00:00 AM,Cyberattack,2021-10-09T00:00:00,2021-10-15T00:00:00,Boeing Employees Credit Union,Skimmers,657,Finance,,Financial & Banking Information,2022,500-999,1-99
11238,10/09/2021 12:00:00 AM,11/22/2021 12:00:00 AM,Cyberattack,2021-10-09T00:00:00,2021-10-15T00:00:00,Boeing Employees Credit Union,Skimmers,657,Finance,,Other,2022,500-999,1-99
11238,10/09/2021 12:00:00 AM,11/22/2021 12:00:00 AM,Cyberattack,2021-10-09T00:00:00,2021-10-15T00:00:00,Boeing Employees Credit Union,Skimmers,657,Finance,,Name,2022,500-999,1-99
11251,09/15/2021 12:00:00 AM,11/15/2021 12:00:00 AM,Cyberattack,,2021-09-15T00:00:00,California Pizza Kitchen,Ransomware,1095,Business,Retail,Name,2022,"1,000-9,999",Unknown
11251,09/15/2021 12:00:00 AM,11/15/2021 12:00:00 AM,Cyberattack,,2021-09-15T00:00:00,California Pizza Kitchen,Ransomware,1095,Business,Retail,Social Security Number,2022,"1,000-9,999",Unknown
11251,09/15/2021 12:00:00 AM,11/15/2021 12:00:00 AM,Cyberattack,,2021-09-15T00:00:00,California Pizza Kitchen,Ransomware,1095,Business,Retail,Name,2022,"1,000-9,999",Unknown
11251,09/15/2021 12:00:00 AM,11/15/2021 12:00:00 AM,Cyberattack,,2021-09-15T00:00:00,California Pizza Kitchen,Ransomware,1095,Business,Retail,Social Security Number,2022,"1,000-9,999",Unknown
11256,10/22/2021 12:00:00 AM,11/16/2021 12:00:00 AM,Cyberattack,2020-09-26T00:00:00,2021-10-27T00:00:00,"Diode Dynamics, L.L.C.",Skimmers,1462,Business,Retail,Name,2022,"1,000-9,999",300-399
11256,10/22/2021 12:00:00 AM,11/16/2021 12:00:00 AM,Cyberattack,2020-09-26T00:00:00,2021-10-27T00:00:00,"Diode Dynamics, L.L.C.",Skimmers,1462,Business,Retail,Financial & Banking Information,2022,"1,000-9,999",300-399
11257,09/04/2021 12:00:00 AM,11/18/2021 12:00:00 AM,Cyberattack,2021-08-29T00:00:00,2021-09-04T00:00:00,"Utah Imaging Associates, Inc.",Ransomware,895,Health,,Other,2022,500-999,1-99
11257,09/04/2021 12:00:00 AM,11/18/2021 12:00:00 AM,Cyberattack,2021-08-29T00:00:00,2021-09-04T00:00:00,"Utah Imaging Associates, Inc.",Ransomware,895,Health,,Name,2022,500-999,1-99
11257,09/04/2021 12:00:00 AM,11/18/2021 12:00:00 AM,Cyberattack,2021-08-29T00:00:00,2021-09-04T00:00:00,"Utah Imaging Associates, Inc.",Ransomware,895,Health,,Social Security Number,2022,500-999,1-99
11257,09/04/2021 12:00:00 AM,11/18/2021 12:00:00 AM,Cyberattack,2021-08-29T00:00:00,2021-09-04T00:00:00,"Utah Imaging Associates, Inc.",Ransomware,895,Health,,Full Date of Birth,2022,500-999,1-99
11257,09/04/2021 12:00:00 AM,11/18/2021 12:00:00 AM,Cyberattack,2021-08-29T00:00:00,2021-09-04T00:00:00,"Utah Imaging Associates, Inc.",Ransomware,895,Health,,Health Insurance Policy or ID Number,2022,500-999,1-99
11257,09/04/2021 12:00:00 AM,11/18/2021 12:00:00 AM,Cyberattack,2021-08-29T00:00:00,2021-09-04T00:00:00,"Utah Imaging Associates, Inc.",Ransomware,895,Health,,Medical Information,2022,500-999,1-99
11259,04/19/2021 12:00:00 AM,11/22/2021 12:00:00 AM,Cyberattack,2021-04-19T00:00:00,2021-04-20T00:00:00,One Community Health,Ransomware,7945,Health,,Health Insurance Policy or ID Number,2022,"1,000-9,999",1-99
11259,04/19/2021 12:00:00 AM,11/22/2021 12:00:00 AM,Cyberattack,2021-04-19T00:00:00,2021-04-20T00:00:00,One Community Health,Ransomware,7945,Health,,Medical Information,2022,"1,000-9,999",1-99
11259,04/19/2021 12:00:00 AM,11/22/2021 12:00:00 AM,Cyberattack,2021-04-19T00:00:00,2021-04-20T00:00:00,One Community Health,Ransomware,7945,Health,,Name,2022,"1,000-9,999",1-99
11259,04/19/2021 12:00:00 AM,11/22/2021 12:00:00 AM,Cyberattack,2021-04-19T00:00:00,2021-04-20T00:00:00,One Community Health,Ransomware,7945,Health,,Social Security Number,2022,"1,000-9,999",1-99
11259,04/19/2021 12:00:00 AM,11/22/2021 12:00:00 AM,Cyberattack,2021-04-19T00:00:00,2021-04-20T00:00:00,One Community Health,Ransomware,7945,Health,,Driver's License or Washington ID Card Number,2022,"1,000-9,999",1-99
11259,04/19/2021 12:00:00 AM,11/22/2021 12:00:00 AM,Cyberattack,2021-04-19T00:00:00,2021-04-20T00:00:00,One Community Health,Ransomware,7945,Health,,Full Date of Birth,2022,"1,000-9,999",1-99
11260,02/08/2021 12:00:00 AM,11/22/2021 12:00:00 AM,Cyberattack,2021-01-19T00:00:00,2021-01-29T00:00:00,Astoria Company LLC,Other,22095,Business,Web Services,Name,2022,"10,000-49,999",1-99
11260,02/08/2021 12:00:00 AM,11/22/2021 12:00:00 AM,Cyberattack,2021-01-19T00:00:00,2021-01-29T00:00:00,Astoria Company LLC,Other,22095,Business,Web Services,Social Security Number,2022,"10,000-49,999",1-99
11260,02/08/2021 12:00:00 AM,11/22/2021 12:00:00 AM,Cyberattack,2021-01-19T00:00:00,2021-01-29T00:00:00,Astoria Company LLC,Other,22095,Business,Web Services,Driver's License or Washington ID Card Number,2022,"10,000-49,999",1-99
11260,02/08/2021 12:00:00 AM,11/22/2021 12:00:00 AM,Cyberattack,2021-01-19T00:00:00,2021-01-29T00:00:00,Astoria Company LLC,Other,22095,Business,Web Services,Full Date of Birth,2022,"10,000-49,999",1-99
11269,08/06/2021 12:00:00 AM,11/29/2021 12:00:00 AM,Cyberattack,2021-05-24T00:00:00,2021-07-28T00:00:00,"DNA Diagnostics Center, Inc.",Ransomware,4278,Business,Other,Financial & Banking Information,2022,"1,000-9,999",1-99
11269,08/06/2021 12:00:00 AM,11/29/2021 12:00:00 AM,Cyberattack,2021-05-24T00:00:00,2021-07-28T00:00:00,"DNA Diagnostics Center, Inc.",Ransomware,4278,Business,Other,Name,2022,"1,000-9,999",1-99
11269,08/06/2021 12:00:00 AM,11/29/2021 12:00:00 AM,Cyberattack,2021-05-24T00:00:00,2021-07-28T00:00:00,"DNA Diagnostics Center, Inc.",Ransomware,4278,Business,Other,Social Security Number,2022,"1,000-9,999",1-99
11271,09/07/2021 12:00:00 AM,11/30/2021 12:00:00 AM,Cyberattack,2021-08-08T00:00:00,2021-08-08T00:00:00,"Cedar Grove Composting, Inc.",Ransomware,1596,Business,Other,Health Insurance Policy or ID Number,2022,"1,000-9,999",1-99
11271,09/07/2021 12:00:00 AM,11/30/2021 12:00:00 AM,Cyberattack,2021-08-08T00:00:00,2021-08-08T00:00:00,"Cedar Grove Composting, Inc.",Ransomware,1596,Business,Other,Medical Information,2022,"1,000-9,999",1-99
11271,09/07/2021 12:00:00 AM,11/30/2021 12:00:00 AM,Cyberattack,2021-08-08T00:00:00,2021-08-08T00:00:00,"Cedar Grove Composting, Inc.",Ransomware,1596,Business,Other,Name,2022,"1,000-9,999",1-99
11271,09/07/2021 12:00:00 AM,11/30/2021 12:00:00 AM,Cyberattack,2021-08-08T00:00:00,2021-08-08T00:00:00,"Cedar Grove Composting, Inc.",Ransomware,1596,Business,Other,Social Security Number,2022,"1,000-9,999",1-99
11271,09/07/2021 12:00:00 AM,11/30/2021 12:00:00 AM,Cyberattack,2021-08-08T00:00:00,2021-08-08T00:00:00,"Cedar Grove Composting, Inc.",Ransomware,1596,Business,Other,Driver's License or Washington ID Card Number,2022,"1,000-9,999",1-99
11272,11/03/2021 12:00:00 AM,12/01/2021 12:00:00 AM,Cyberattack,2021-09-19T00:00:00,2021-09-22T00:00:00,"HealthCare, Inc. ",Unclear/unknown,625,Health,,Name,2022,500-999,1-99
11272,11/03/2021 12:00:00 AM,12/01/2021 12:00:00 AM,Cyberattack,2021-09-19T00:00:00,2021-09-22T00:00:00,"HealthCare, Inc. ",Unclear/unknown,625,Health,,Full Date of Birth,2022,500-999,1-99
11273,06/10/2021 12:00:00 AM,12/03/2021 12:00:00 AM,Cyberattack,2021-05-25T00:00:00,2021-06-10T00:00:00,American Council for International Studies ,Malware,3712,Business,Other,Name,2022,"1,000-9,999",1-99
11273,06/10/2021 12:00:00 AM,12/03/2021 12:00:00 AM,Cyberattack,2021-05-25T00:00:00,2021-06-10T00:00:00,American Council for International Studies ,Malware,3712,Business,Other,Social Security Number,2022,"1,000-9,999",1-99
11273,06/10/2021 12:00:00 AM,12/03/2021 12:00:00 AM,Cyberattack,2021-05-25T00:00:00,2021-06-10T00:00:00,American Council for International Studies ,Malware,3712,Business,Other,Full Date of Birth,2022,"1,000-9,999",1-99
11273,06/10/2021 12:00:00 AM,12/03/2021 12:00:00 AM,Cyberattack,2021-05-25T00:00:00,2021-06-10T00:00:00,American Council for International Studies ,Malware,3712,Business,Other,Passport Number,2022,"1,000-9,999",1-99
11274,07/16/2021 12:00:00 AM,12/09/2021 12:00:00 AM,Cyberattack,2021-07-13T00:00:00,2021-07-16T00:00:00,"Mor Furniture for Less, Inc.",Ransomware,731,Business,Other,Name,2022,500-999,1-99
11274,07/16/2021 12:00:00 AM,12/09/2021 12:00:00 AM,Cyberattack,2021-07-13T00:00:00,2021-07-16T00:00:00,"Mor Furniture for Less, Inc.",Ransomware,731,Business,Other,Social Security Number,2022,500-999,1-99
11274,07/16/2021 12:00:00 AM,12/09/2021 12:00:00 AM,Cyberattack,2021-07-13T00:00:00,2021-07-16T00:00:00,"Mor Furniture for Less, Inc.",Ransomware,731,Business,Other,Financial & Banking Information,2022,500-999,1-99
11275,11/11/2021 12:00:00 AM,12/10/2021 12:00:00 AM,Unauthorized Access,2021-10-25T00:00:00,2021-11-11T00:00:00,"BioPlus Specialty Pharmacy Services, LLC",,13357,Health,,Name,2022,"10,000-49,999",1-99
11275,11/11/2021 12:00:00 AM,12/10/2021 12:00:00 AM,Unauthorized Access,2021-10-25T00:00:00,2021-11-11T00:00:00,"BioPlus Specialty Pharmacy Services, LLC",,13357,Health,,Social Security Number,2022,"10,000-49,999",1-99
11275,11/11/2021 12:00:00 AM,12/10/2021 12:00:00 AM,Unauthorized Access,2021-10-25T00:00:00,2021-11-11T00:00:00,"BioPlus Specialty Pharmacy Services, LLC",,13357,Health,,Full Date of Birth,2022,"10,000-49,999",1-99
11275,11/11/2021 12:00:00 AM,12/10/2021 12:00:00 AM,Unauthorized Access,2021-10-25T00:00:00,2021-11-11T00:00:00,"BioPlus Specialty Pharmacy Services, LLC",,13357,Health,,Health Insurance Policy or ID Number,2022,"10,000-49,999",1-99
11275,11/11/2021 12:00:00 AM,12/10/2021 12:00:00 AM,Unauthorized Access,2021-10-25T00:00:00,2021-11-11T00:00:00,"BioPlus Specialty Pharmacy Services, LLC",,13357,Health,,Medical Information,2022,"10,000-49,999",1-99
11279,11/17/2021 12:00:00 AM,11/23/2021 12:00:00 AM,Cyberattack,2021-09-06T00:00:00,,"GoDaddy.com, LLC",Malware,9581,Business,Web Services,Unique Private Key (e.g. used to authenticate or sign an electronic record),2022,"1,000-9,999",Unknown
11279,11/17/2021 12:00:00 AM,11/23/2021 12:00:00 AM,Cyberattack,2021-09-06T00:00:00,,"GoDaddy.com, LLC",Malware,9581,Business,Web Services,Username and Password/Security Question Answers,2022,"1,000-9,999",Unknown
11279,11/17/2021 12:00:00 AM,11/23/2021 12:00:00 AM,Cyberattack,2021-09-06T00:00:00,,"GoDaddy.com, LLC",Malware,9581,Business,Web Services,Email Address and Password/Security Question Answers,2022,"1,000-9,999",Unknown
11281,08/27/2021 12:00:00 AM,11/30/2021 12:00:00 AM,Cyberattack,2021-08-25T00:00:00,2021-08-27T00:00:00,Seneca Family of Agencies,Malware,1313,Health,,Name,2022,"1,000-9,999",1-99
11281,08/27/2021 12:00:00 AM,11/30/2021 12:00:00 AM,Cyberattack,2021-08-25T00:00:00,2021-08-27T00:00:00,Seneca Family of Agencies,Malware,1313,Health,,Social Security Number,2022,"1,000-9,999",1-99
11281,08/27/2021 12:00:00 AM,11/30/2021 12:00:00 AM,Cyberattack,2021-08-25T00:00:00,2021-08-27T00:00:00,Seneca Family of Agencies,Malware,1313,Health,,Driver's License or Washington ID Card Number,2022,"1,000-9,999",1-99
11281,08/27/2021 12:00:00 AM,11/30/2021 12:00:00 AM,Cyberattack,2021-08-25T00:00:00,2021-08-27T00:00:00,Seneca Family of Agencies,Malware,1313,Health,,Financial & Banking Information,2022,"1,000-9,999",1-99
11281,08/27/2021 12:00:00 AM,11/30/2021 12:00:00 AM,Cyberattack,2021-08-25T00:00:00,2021-08-27T00:00:00,Seneca Family of Agencies,Malware,1313,Health,,Full Date of Birth,2022,"1,000-9,999",1-99
11281,08/27/2021 12:00:00 AM,11/30/2021 12:00:00 AM,Cyberattack,2021-08-25T00:00:00,2021-08-27T00:00:00,Seneca Family of Agencies,Malware,1313,Health,,Unique Private Key (e.g. used to authenticate or sign an electronic record),2022,"1,000-9,999",1-99
11281,08/27/2021 12:00:00 AM,11/30/2021 12:00:00 AM,Cyberattack,2021-08-25T00:00:00,2021-08-27T00:00:00,Seneca Family of Agencies,Malware,1313,Health,,Health Insurance Policy or ID Number,2022,"1,000-9,999",1-99
11281,08/27/2021 12:00:00 AM,11/30/2021 12:00:00 AM,Cyberattack,2021-08-25T00:00:00,2021-08-27T00:00:00,Seneca Family of Agencies,Malware,1313,Health,,Medical Information,2022,"1,000-9,999",1-99
11281,08/27/2021 12:00:00 AM,11/30/2021 12:00:00 AM,Cyberattack,2021-08-25T00:00:00,2021-08-27T00:00:00,Seneca Family of Agencies,Malware,1313,Health,,Other,2022,"1,000-9,999",1-99
11282,09/28/2021 12:00:00 AM,12/06/2021 12:00:00 AM,Cyberattack,2021-09-28T00:00:00,,"Pawn America Minnesota, LLC",Ransomware,748,Business,Retail,Name,2022,500-999,Unknown
11282,09/28/2021 12:00:00 AM,12/06/2021 12:00:00 AM,Cyberattack,2021-09-28T00:00:00,,"Pawn America Minnesota, LLC",Ransomware,748,Business,Retail,Social Security Number,2022,500-999,Unknown
11282,09/28/2021 12:00:00 AM,12/06/2021 12:00:00 AM,Cyberattack,2021-09-28T00:00:00,,"Pawn America Minnesota, LLC",Ransomware,748,Business,Retail,Driver's License or Washington ID Card Number,2022,500-999,Unknown
11282,09/28/2021 12:00:00 AM,12/06/2021 12:00:00 AM,Cyberattack,2021-09-28T00:00:00,,"Pawn America Minnesota, LLC",Ransomware,748,Business,Retail,Passport Number,2022,500-999,Unknown
11282,09/28/2021 12:00:00 AM,12/06/2021 12:00:00 AM,Cyberattack,2021-09-28T00:00:00,,"Pawn America Minnesota, LLC",Ransomware,748,Business,Retail,Email Address and Password/Security Question Answers,2022,500-999,Unknown
11285,11/12/2021 12:00:00 AM,12/16/2021 12:00:00 AM,Cyberattack,2021-11-11T00:00:00,2021-11-12T00:00:00,"Cirrus Asset Management, Inc.",Ransomware,568,Business,Other,Name,2022,500-999,1-99
11285,11/12/2021 12:00:00 AM,12/16/2021 12:00:00 AM,Cyberattack,2021-11-11T00:00:00,2021-11-12T00:00:00,"Cirrus Asset Management, Inc.",Ransomware,568,Business,Other,Social Security Number,2022,500-999,1-99
11286,10/15/2021 12:00:00 AM,12/17/2021 12:00:00 AM,Theft or Mistake,2021-10-01T00:00:00,,"Tennis Warehouse, LLC",,18228,Business,Retail,Financial & Banking Information,2022,"10,000-49,999",Unknown
11286,10/15/2021 12:00:00 AM,12/17/2021 12:00:00 AM,Theft or Mistake,2021-10-01T00:00:00,,"Tennis Warehouse, LLC",,18228,Business,Retail,Email Address and Password/Security Question Answers,2022,"10,000-49,999",Unknown
11287,10/15/2021 12:00:00 AM,12/17/2021 12:00:00 AM,Theft or Mistake,2021-10-01T00:00:00,,"Tackle Warehouse, LLC",,10942,Business,Retail,Financial & Banking Information,2022,"10,000-49,999",Unknown
11287,10/15/2021 12:00:00 AM,12/17/2021 12:00:00 AM,Theft or Mistake,2021-10-01T00:00:00,,"Tackle Warehouse, LLC",,10942,Business,Retail,Email Address and Password/Security Question Answers,2022,"10,000-49,999",Unknown
11288,10/15/2021 12:00:00 AM,12/17/2021 12:00:00 AM,Theft or Mistake,2021-10-01T00:00:00,,"Running Warehouse, LLC",,17556,Business,Retail,Financial & Banking Information,2022,"10,000-49,999",Unknown
11288,10/15/2021 12:00:00 AM,12/17/2021 12:00:00 AM,Theft or Mistake,2021-10-01T00:00:00,,"Running Warehouse, LLC",,17556,Business,Retail,Email Address and Password/Security Question Answers,2022,"10,000-49,999",Unknown
11289,10/15/2021 12:00:00 AM,12/17/2021 12:00:00 AM,Theft or Mistake,2021-10-01T00:00:00,,"Skate Warehouse, LLC",,8655,Business,Retail,Financial & Banking Information,2022,"1,000-9,999",Unknown
11289,10/15/2021 12:00:00 AM,12/17/2021 12:00:00 AM,Theft or Mistake,2021-10-01T00:00:00,,"Skate Warehouse, LLC",,8655,Business,Retail,Email Address and Password/Security Question Answers,2022,"1,000-9,999",Unknown
11299,08/12/2021 12:00:00 AM,12/17/2021 12:00:00 AM,Cyberattack,2021-02-12T00:00:00,2021-10-26T00:00:00,Heirloom Roses,Malware,3118,Business,Retail,Name,2022,"1,000-9,999",200-299
11299,08/12/2021 12:00:00 AM,12/17/2021 12:00:00 AM,Cyberattack,2021-02-12T00:00:00,2021-10-26T00:00:00,Heirloom Roses,Malware,3118,Business,Retail,Financial & Banking Information,2022,"1,000-9,999",200-299
11303,11/19/2021 12:00:00 AM,01/07/2022 12:00:00 AM,Cyberattack,2021-11-13T00:00:00,,"BearTooth Mapping, Inc.",Malware,4774,Business,Software,Username and Password/Security Question Answers,2022,"1,000-9,999",Unknown
11303,11/19/2021 12:00:00 AM,01/07/2022 12:00:00 AM,Cyberattack,2021-11-13T00:00:00,,"BearTooth Mapping, Inc.",Malware,4774,Business,Software,Email Address and Password/Security Question Answers,2022,"1,000-9,999",Unknown
11304,10/10/2021 12:00:00 AM,12/30/2021 12:00:00 AM,Cyberattack,2019-11-01T00:00:00,2021-08-31T00:00:00,Penn LLC d/b/a PulseTV,Malware,4302,Business,Retail,Name,2022,"1,000-9,999",500+
11304,10/10/2021 12:00:00 AM,12/30/2021 12:00:00 AM,Cyberattack,2019-11-01T00:00:00,2021-08-31T00:00:00,Penn LLC d/b/a PulseTV,Malware,4302,Business,Retail,Financial & Banking Information,2022,"1,000-9,999",500+
11304,10/10/2021 12:00:00 AM,12/30/2021 12:00:00 AM,Cyberattack,2019-11-01T00:00:00,2021-08-31T00:00:00,Penn LLC d/b/a PulseTV,Malware,4302,Business,Retail,Email Address and Password/Security Question Answers,2022,"1,000-9,999",500+
11305,11/16/2021 12:00:00 AM,12/20/2021 12:00:00 AM,Cyberattack,2021-08-17T00:00:00,2021-10-11T00:00:00,"J.C. Penney Corporation, Inc. Pension Plan",Ransomware,1147,Business,Retail,Name,2022,"1,000-9,999",1-99
11305,11/16/2021 12:00:00 AM,12/20/2021 12:00:00 AM,Cyberattack,2021-08-17T00:00:00,2021-10-11T00:00:00,"J.C. Penney Corporation, Inc. Pension Plan",Ransomware,1147,Business,Retail,Full Date of Birth,2022,"1,000-9,999",1-99
11305,11/16/2021 12:00:00 AM,12/20/2021 12:00:00 AM,Cyberattack,2021-08-17T00:00:00,2021-10-11T00:00:00,"J.C. Penney Corporation, Inc. Pension Plan",Ransomware,1147,Business,Retail,Other,2022,"1,000-9,999",1-99
11306,11/01/2021 12:00:00 AM,12/22/2021 12:00:00 AM,Cyberattack,2021-04-01T00:00:00,2021-11-01T00:00:00,Pro Wrestling Tees,Malware,581,Business,Clothing,Name,2022,500-999,200-299
11306,11/01/2021 12:00:00 AM,12/22/2021 12:00:00 AM,Cyberattack,2021-04-01T00:00:00,2021-11-01T00:00:00,Pro Wrestling Tees,Malware,581,Business,Clothing,Financial & Banking Information,2022,500-999,200-299
11321,12/12/2021 12:00:00 AM,12/30/2021 12:00:00 AM,Cyberattack,2021-12-07T00:00:00,2021-12-12T00:00:00,"McMenamins, Inc.",Ransomware,4693,Business,Hospitality,Name,2022,"1,000-9,999",1-99
11321,12/12/2021 12:00:00 AM,12/30/2021 12:00:00 AM,Cyberattack,2021-12-07T00:00:00,2021-12-12T00:00:00,"McMenamins, Inc.",Ransomware,4693,Business,Hospitality,Social Security Number,2022,"1,000-9,999",1-99
11321,12/12/2021 12:00:00 AM,12/30/2021 12:00:00 AM,Cyberattack,2021-12-07T00:00:00,2021-12-12T00:00:00,"McMenamins, Inc.",Ransomware,4693,Business,Hospitality,Full Date of Birth,2022,"1,000-9,999",1-99
11321,12/12/2021 12:00:00 AM,12/30/2021 12:00:00 AM,Cyberattack,2021-12-07T00:00:00,2021-12-12T00:00:00,"McMenamins, Inc.",Ransomware,4693,Business,Hospitality,Health Insurance Policy or ID Number,2022,"1,000-9,999",1-99
11321,12/12/2021 12:00:00 AM,12/30/2021 12:00:00 AM,Cyberattack,2021-12-07T00:00:00,2021-12-12T00:00:00,"McMenamins, Inc.",Ransomware,4693,Business,Hospitality,Medical Information,2022,"1,000-9,999",1-99
11321,12/12/2021 12:00:00 AM,12/30/2021 12:00:00 AM,Cyberattack,2021-12-07T00:00:00,2021-12-12T00:00:00,"McMenamins, Inc.",Ransomware,4693,Business,Hospitality,Email Address and Password/Security Question Answers,2022,"1,000-9,999",1-99
11321,12/12/2021 12:00:00 AM,12/30/2021 12:00:00 AM,Cyberattack,2021-12-07T00:00:00,2021-12-12T00:00:00,"McMenamins, Inc.",Ransomware,4693,Business,Hospitality,Other,2022,"1,000-9,999",1-99
11322,10/19/2021 12:00:00 AM,01/02/2022 12:00:00 AM,Cyberattack,2021-10-15T00:00:00,2021-10-19T00:00:00,North Broward Hospital District d/b/a Broward Health,Malware,1168,Health,,Driver's License or Washington ID Card Number,2022,"1,000-9,999",1-99
11322,10/19/2021 12:00:00 AM,01/02/2022 12:00:00 AM,Cyberattack,2021-10-15T00:00:00,2021-10-19T00:00:00,North Broward Hospital District d/b/a Broward Health,Malware,1168,Health,,Financial & Banking Information,2022,"1,000-9,999",1-99
11322,10/19/2021 12:00:00 AM,01/02/2022 12:00:00 AM,Cyberattack,2021-10-15T00:00:00,2021-10-19T00:00:00,North Broward Hospital District d/b/a Broward Health,Malware,1168,Health,,Full Date of Birth,2022,"1,000-9,999",1-99
11322,10/19/2021 12:00:00 AM,01/02/2022 12:00:00 AM,Cyberattack,2021-10-15T00:00:00,2021-10-19T00:00:00,North Broward Hospital District d/b/a Broward Health,Malware,1168,Health,,Health Insurance Policy or ID Number,2022,"1,000-9,999",1-99
11322,10/19/2021 12:00:00 AM,01/02/2022 12:00:00 AM,Cyberattack,2021-10-15T00:00:00,2021-10-19T00:00:00,North Broward Hospital District d/b/a Broward Health,Malware,1168,Health,,Medical Information,2022,"1,000-9,999",1-99
11322,10/19/2021 12:00:00 AM,01/02/2022 12:00:00 AM,Cyberattack,2021-10-15T00:00:00,2021-10-19T00:00:00,North Broward Hospital District d/b/a Broward Health,Malware,1168,Health,,Email Address and Password/Security Question Answers,2022,"1,000-9,999",1-99
11322,10/19/2021 12:00:00 AM,01/02/2022 12:00:00 AM,Cyberattack,2021-10-15T00:00:00,2021-10-19T00:00:00,North Broward Hospital District d/b/a Broward Health,Malware,1168,Health,,Name,2022,"1,000-9,999",1-99
11322,10/19/2021 12:00:00 AM,01/02/2022 12:00:00 AM,Cyberattack,2021-10-15T00:00:00,2021-10-19T00:00:00,North Broward Hospital District d/b/a Broward Health,Malware,1168,Health,,Social Security Number,2022,"1,000-9,999",1-99
11323,09/27/2021 12:00:00 AM,01/03/2022 12:00:00 AM,Cyberattack,,2021-09-27T00:00:00,Ravkoo,Other,5729,Health,,Name,2022,"1,000-9,999",Unknown
11323,09/27/2021 12:00:00 AM,01/03/2022 12:00:00 AM,Cyberattack,,2021-09-27T00:00:00,Ravkoo,Other,5729,Health,,Full Date of Birth,2022,"1,000-9,999",Unknown
11323,09/27/2021 12:00:00 AM,01/03/2022 12:00:00 AM,Cyberattack,,2021-09-27T00:00:00,Ravkoo,Other,5729,Health,,Medical Information,2022,"1,000-9,999",Unknown
11331,11/09/2021 12:00:00 AM,01/07/2022 12:00:00 AM,Cyberattack,2021-11-02T00:00:00,2021-11-09T00:00:00,Medical Review Institute of America,Malware,3225,Health,,Name,2022,"1,000-9,999",1-99
11331,11/09/2021 12:00:00 AM,01/07/2022 12:00:00 AM,Cyberattack,2021-11-02T00:00:00,2021-11-09T00:00:00,Medical Review Institute of America,Malware,3225,Health,,Social Security Number,2022,"1,000-9,999",1-99
11331,11/09/2021 12:00:00 AM,01/07/2022 12:00:00 AM,Cyberattack,2021-11-02T00:00:00,2021-11-09T00:00:00,Medical Review Institute of America,Malware,3225,Health,,Full Date of Birth,2022,"1,000-9,999",1-99
11331,11/09/2021 12:00:00 AM,01/07/2022 12:00:00 AM,Cyberattack,2021-11-02T00:00:00,2021-11-09T00:00:00,Medical Review Institute of America,Malware,3225,Health,,Health Insurance Policy or ID Number,2022,"1,000-9,999",1-99
11331,11/09/2021 12:00:00 AM,01/07/2022 12:00:00 AM,Cyberattack,2021-11-02T00:00:00,2021-11-09T00:00:00,Medical Review Institute of America,Malware,3225,Health,,Medical Information,2022,"1,000-9,999",1-99
11331,11/09/2021 12:00:00 AM,01/07/2022 12:00:00 AM,Cyberattack,2021-11-02T00:00:00,2021-11-09T00:00:00,Medical Review Institute of America,Malware,3225,Health,,Email Address and Password/Security Question Answers,2022,"1,000-9,999",1-99
11331,11/09/2021 12:00:00 AM,01/07/2022 12:00:00 AM,Cyberattack,2021-11-02T00:00:00,2021-11-09T00:00:00,Medical Review Institute of America,Malware,3225,Health,,Other,2022,"1,000-9,999",1-99
11332,12/21/2021 12:00:00 AM,01/19/2022 12:00:00 AM,Cyberattack,,2021-12-21T00:00:00,Spokane Regional Health District,Phishing,1058,Government,,Name,2022,"1,000-9,999",Unknown
11332,12/21/2021 12:00:00 AM,01/19/2022 12:00:00 AM,Cyberattack,,2021-12-21T00:00:00,Spokane Regional Health District,Phishing,1058,Government,,Full Date of Birth,2022,"1,000-9,999",Unknown
11332,12/21/2021 12:00:00 AM,01/19/2022 12:00:00 AM,Cyberattack,,2021-12-21T00:00:00,Spokane Regional Health District,Phishing,1058,Government,,Medical Information,2022,"1,000-9,999",Unknown
11332,12/21/2021 12:00:00 AM,01/19/2022 12:00:00 AM,Cyberattack,,2021-12-21T00:00:00,Spokane Regional Health District,Phishing,1058,Government,,Other,2022,"1,000-9,999",Unknown
11336,12/21/2021 12:00:00 AM,01/19/2022 12:00:00 AM,Cyberattack,2021-02-02T00:00:00,2021-03-22T00:00:00,"LendUS, LLC",Phishing,696,Finance,,Username and Password/Security Question Answers,2022,500-999,300-399
11336,12/21/2021 12:00:00 AM,01/19/2022 12:00:00 AM,Cyberattack,2021-02-02T00:00:00,2021-03-22T00:00:00,"LendUS, LLC",Phishing,696,Finance,,Social Security Number,2022,500-999,300-399
11336,12/21/2021 12:00:00 AM,01/19/2022 12:00:00 AM,Cyberattack,2021-02-02T00:00:00,2021-03-22T00:00:00,"LendUS, LLC",Phishing,696,Finance,,Driver's License or Washington ID Card Number,2022,500-999,300-399
11336,12/21/2021 12:00:00 AM,01/19/2022 12:00:00 AM,Cyberattack,2021-02-02T00:00:00,2021-03-22T00:00:00,"LendUS, LLC",Phishing,696,Finance,,Financial & Banking Information,2022,500-999,300-399
11336,12/21/2021 12:00:00 AM,01/19/2022 12:00:00 AM,Cyberattack,2021-02-02T00:00:00,2021-03-22T00:00:00,"LendUS, LLC",Phishing,696,Finance,,Passport Number,2022,500-999,300-399
11336,12/21/2021 12:00:00 AM,01/19/2022 12:00:00 AM,Cyberattack,2021-02-02T00:00:00,2021-03-22T00:00:00,"LendUS, LLC",Phishing,696,Finance,,Health Insurance Policy or ID Number,2022,500-999,300-399
11336,12/21/2021 12:00:00 AM,01/19/2022 12:00:00 AM,Cyberattack,2021-02-02T00:00:00,2021-03-22T00:00:00,"LendUS, LLC",Phishing,696,Finance,,Medical Information,2022,500-999,300-399
11336,12/21/2021 12:00:00 AM,01/19/2022 12:00:00 AM,Cyberattack,2021-02-02T00:00:00,2021-03-22T00:00:00,"LendUS, LLC",Phishing,696,Finance,,Name,2022,500-999,300-399
11337,12/30/2021 12:00:00 AM,01/21/2022 12:00:00 AM,Theft or Mistake,2021-12-27T00:00:00,,Boeing Employees' Credit Union,,2187,Finance,,Name,2022,"1,000-9,999",Unknown
11337,12/30/2021 12:00:00 AM,01/21/2022 12:00:00 AM,Theft or Mistake,2021-12-27T00:00:00,,Boeing Employees' Credit Union,,2187,Finance,,Financial & Banking Information,2022,"1,000-9,999",Unknown
11337,12/30/2021 12:00:00 AM,01/21/2022 12:00:00 AM,Theft or Mistake,2021-12-27T00:00:00,,Boeing Employees' Credit Union,,2187,Finance,,Other,2022,"1,000-9,999",Unknown
13646,04/30/2022 12:00:00 AM,05/26/2022 12:00:00 AM,Cyberattack,2022-03-26T00:00:00,2022-04-02T00:00:00,Boeing Employees' Credit Union,Skimmers,717,Finance,,Name,2022,500-999,1-99
13646,04/30/2022 12:00:00 AM,05/26/2022 12:00:00 AM,Cyberattack,2022-03-26T00:00:00,2022-04-02T00:00:00,Boeing Employees' Credit Union,Skimmers,717,Finance,,Financial & Banking Information,2022,500-999,1-99
13646,04/30/2022 12:00:00 AM,05/26/2022 12:00:00 AM,Cyberattack,2022-03-26T00:00:00,2022-04-02T00:00:00,Boeing Employees' Credit Union,Skimmers,717,Finance,,Other,2022,500-999,1-99
11374,12/07/2021 12:00:00 AM,01/21/2022 12:00:00 AM,Cyberattack,2020-03-26T00:00:00,2021-04-07T00:00:00,"Nuna Baby Essentials, Inc. ",Other,816,Business,Retail,Name,2022,500-999,500+
11374,12/07/2021 12:00:00 AM,01/21/2022 12:00:00 AM,Cyberattack,2020-03-26T00:00:00,2021-04-07T00:00:00,"Nuna Baby Essentials, Inc. ",Other,816,Business,Retail,Financial & Banking Information,2022,500-999,500+
11392,10/28/2021 12:00:00 AM,12/09/2021 12:00:00 AM,Cyberattack,2021-10-24T00:00:00,2021-11-24T00:00:00,Title Guaranty Company of Lewis County,Ransomware,1109,Business,Other,Email Address and Password/Security Question Answers,2022,"1,000-9,999",1-99
11392,10/28/2021 12:00:00 AM,12/09/2021 12:00:00 AM,Cyberattack,2021-10-24T00:00:00,2021-11-24T00:00:00,Title Guaranty Company of Lewis County,Ransomware,1109,Business,Other,Name,2022,"1,000-9,999",1-99
11392,10/28/2021 12:00:00 AM,12/09/2021 12:00:00 AM,Cyberattack,2021-10-24T00:00:00,2021-11-24T00:00:00,Title Guaranty Company of Lewis County,Ransomware,1109,Business,Other,Social Security Number,2022,"1,000-9,999",1-99
11392,10/28/2021 12:00:00 AM,12/09/2021 12:00:00 AM,Cyberattack,2021-10-24T00:00:00,2021-11-24T00:00:00,Title Guaranty Company of Lewis County,Ransomware,1109,Business,Other,Driver's License or Washington ID Card Number,2022,"1,000-9,999",1-99
11392,10/28/2021 12:00:00 AM,12/09/2021 12:00:00 AM,Cyberattack,2021-10-24T00:00:00,2021-11-24T00:00:00,Title Guaranty Company of Lewis County,Ransomware,1109,Business,Other,Financial & Banking Information,2022,"1,000-9,999",1-99
11392,10/28/2021 12:00:00 AM,12/09/2021 12:00:00 AM,Cyberattack,2021-10-24T00:00:00,2021-11-24T00:00:00,Title Guaranty Company of Lewis County,Ransomware,1109,Business,Other,Full Date of Birth,2022,"1,000-9,999",1-99
11392,10/28/2021 12:00:00 AM,12/09/2021 12:00:00 AM,Cyberattack,2021-10-24T00:00:00,2021-11-24T00:00:00,Title Guaranty Company of Lewis County,Ransomware,1109,Business,Other,Medical Information,2022,"1,000-9,999",1-99
11393,12/14/2021 12:00:00 AM,01/25/2022 12:00:00 AM,Cyberattack,2021-12-09T00:00:00,2021-12-10T00:00:00,Aditi Consulting,Other,918,Business,Professional Services,Name,2022,500-999,1-99
11393,12/14/2021 12:00:00 AM,01/25/2022 12:00:00 AM,Cyberattack,2021-12-09T00:00:00,2021-12-10T00:00:00,Aditi Consulting,Other,918,Business,Professional Services,Social Security Number,2022,500-999,1-99
11393,12/14/2021 12:00:00 AM,01/25/2022 12:00:00 AM,Cyberattack,2021-12-09T00:00:00,2021-12-10T00:00:00,Aditi Consulting,Other,918,Business,Professional Services,Full Date of Birth,2022,500-999,1-99
11394,08/16/2021 12:00:00 AM,01/28/2022 12:00:00 AM,Cyberattack,2021-08-16T00:00:00,2021-08-17T00:00:00,Accutech Systems Corporation,Ransomware,1376,Business,Software,Full Date of Birth,2022,"1,000-9,999",1-99
11394,08/16/2021 12:00:00 AM,01/28/2022 12:00:00 AM,Cyberattack,2021-08-16T00:00:00,2021-08-17T00:00:00,Accutech Systems Corporation,Ransomware,1376,Business,Software,Name,2022,"1,000-9,999",1-99
11394,08/16/2021 12:00:00 AM,01/28/2022 12:00:00 AM,Cyberattack,2021-08-16T00:00:00,2021-08-17T00:00:00,Accutech Systems Corporation,Ransomware,1376,Business,Software,Social Security Number,2022,"1,000-9,999",1-99
11394,08/16/2021 12:00:00 AM,01/28/2022 12:00:00 AM,Cyberattack,2021-08-16T00:00:00,2021-08-17T00:00:00,Accutech Systems Corporation,Ransomware,1376,Business,Software,Financial & Banking Information,2022,"1,000-9,999",1-99
11422,07/01/2021 12:00:00 AM,12/14/2021 12:00:00 AM,Cyberattack,2021-06-25T00:00:00,2021-08-10T00:00:00,"Cities Digital, Inc.",Malware,3000,Business,Professional Services,Name,2022,"1,000-9,999",1-99
11422,07/01/2021 12:00:00 AM,12/14/2021 12:00:00 AM,Cyberattack,2021-06-25T00:00:00,2021-08-10T00:00:00,"Cities Digital, Inc.",Malware,3000,Business,Professional Services,Full Date of Birth,2022,"1,000-9,999",1-99
11423,11/18/2021 12:00:00 AM,12/29/2021 12:00:00 AM,Cyberattack,2021-10-27T00:00:00,2021-10-30T00:00:00,"Innovations Group, Inc.",Malware,772,Health,,Name,2022,500-999,1-99
11423,11/18/2021 12:00:00 AM,12/29/2021 12:00:00 AM,Cyberattack,2021-10-27T00:00:00,2021-10-30T00:00:00,"Innovations Group, Inc.",Malware,772,Health,,Social Security Number,2022,500-999,1-99
11423,11/18/2021 12:00:00 AM,12/29/2021 12:00:00 AM,Cyberattack,2021-10-27T00:00:00,2021-10-30T00:00:00,"Innovations Group, Inc.",Malware,772,Health,,Driver's License or Washington ID Card Number,2022,500-999,1-99
11423,11/18/2021 12:00:00 AM,12/29/2021 12:00:00 AM,Cyberattack,2021-10-27T00:00:00,2021-10-30T00:00:00,"Innovations Group, Inc.",Malware,772,Health,,Financial & Banking Information,2022,500-999,1-99
11423,11/18/2021 12:00:00 AM,12/29/2021 12:00:00 AM,Cyberattack,2021-10-27T00:00:00,2021-10-30T00:00:00,"Innovations Group, Inc.",Malware,772,Health,,Full Date of Birth,2022,500-999,1-99
11423,11/18/2021 12:00:00 AM,12/29/2021 12:00:00 AM,Cyberattack,2021-10-27T00:00:00,2021-10-30T00:00:00,"Innovations Group, Inc.",Malware,772,Health,,Health Insurance Policy or ID Number,2022,500-999,1-99
11423,11/18/2021 12:00:00 AM,12/29/2021 12:00:00 AM,Cyberattack,2021-10-27T00:00:00,2021-10-30T00:00:00,"Innovations Group, Inc.",Malware,772,Health,,Medical Information,2022,500-999,1-99
11423,11/18/2021 12:00:00 AM,12/29/2021 12:00:00 AM,Cyberattack,2021-10-27T00:00:00,2021-10-30T00:00:00,"Innovations Group, Inc.",Malware,772,Health,,Other,2022,500-999,1-99
11424,11/18/2021 12:00:00 AM,01/28/2022 12:00:00 AM,Cyberattack,2021-11-22T00:00:00,2021-11-22T00:00:00,Keller Supply Company,Ransomware,2486,Business,Retail,Name,2022,"1,000-9,999",0
